response_id,gispropnum,omppropid,collected_date,time_of_day,year,month,month_text,week,group,location,ground_syringes,kiosk_syringes,total_syringes,kiosk_number,kiosk_type,precinct,borough,district,property_type,kiosk_site,created_date,source
X-4143.0,,,11/01/2022 12:00:00 AM,AM,2022,11,Nov,45,Parks,,86,,86,,,,,X-07,,false,2022-11-01 12:53:38.0000000,M&O MS Forms
X-4141.0,,,10/31/2022 12:00:00 AM,AM,2022,10,Oct,45,Parks,,66,,66,,,,,X-07,,false,2022-11-01 12:52:43.0000000,M&O MS Forms
X-4370.0,,,12/05/2022 12:00:00 AM,AM,2022,12,Dec,50,Parks,,12,,12,,,,,X-07,,false,2022-12-05 12:21:03.0000000,M&O MS Forms
X-4369.0,,,12/05/2022 12:00:00 AM,AM,2022,12,Dec,50,Parks,,56,,56,,,,,X-07,,false,2022-12-05 12:20:26.0000000,M&O MS Forms
X-4368.0,,,12/04/2022 12:00:00 AM,AM,2022,12,Dec,50,Parks,,32,,32,,,,,X-07,,false,2022-12-05 12:19:50.0000000,M&O MS Forms
X-4367.0,,,12/03/2022 12:00:00 AM,AM,2022,12,Dec,49,Parks,,43,,43,,,,,X-07,,false,2022-12-05 12:19:16.0000000,M&O MS Forms
X-4563.0,,,01/08/2023 12:00:00 AM,AM,2023,1,Jan,2,Parks,,53,,53,,,,,X-07,,false,2023-01-09 06:33:29.0000000,M&O MS Forms
X-2714.0,,,05/03/2022 12:00:00 AM,AM,2022,5,May,19,Parks,,25,,25,,,,,X-07,,false,2022-05-03 06:56:58.0000000,M&O MS Forms
X-2713.0,,,04/29/2022 12:00:00 AM,AM,2022,4,Apr,18,Parks,,15,,15,,,,,X-07,,false,2022-05-03 06:56:17.0000000,M&O MS Forms
X-3031.0,,,06/15/2022 12:00:00 AM,AM,2022,6,Jun,25,Parks,,65,,65,,,,,X-07,,false,2022-06-15 09:32:40.0000000,M&O MS Forms
X-3010.0,,,06/14/2022 12:00:00 AM,AM,2022,6,Jun,25,Parks,,70,,70,,,,,X-07,,false,2022-06-14 11:22:38.0000000,M&O MS Forms
X-2978.0,,,06/11/2022 12:00:00 AM,AM,2022,6,Jun,24,Parks,,46,,46,,,,,X-07,,false,2022-06-11 14:00:03.0000000,M&O MS Forms
X-2965.0,,,06/08/2022 12:00:00 AM,AM,2022,6,Jun,24,Parks,,100,,100,,,,,X-07,,false,2022-06-08 10:17:28.0000000,M&O MS Forms
X-2950.0,,,06/07/2022 12:00:00 AM,AM,2022,6,Jun,24,Parks,,30,,30,,,,,X-07,,false,2022-06-07 13:04:06.0000000,M&O MS Forms
X-3193.0,,,07/04/2022 12:00:00 AM,AM,2022,7,Jul,28,BBP,,24,,24,,,,,X-07,,false,2022-07-07 08:15:55.0000000,M&O MS Forms
X-3195.0,,,07/06/2022 12:00:00 AM,AM,2022,7,Jul,28,BBP,,9,,9,,,,,X-07,,false,2022-07-07 08:17:30.0000000,M&O MS Forms
X-3303.0,,,07/19/2022 12:00:00 AM,AM,2022,7,Jul,30,Parks,,56,,56,,,,,X-07,,false,2022-07-19 15:45:30.0000000,M&O MS Forms
X-3473.0,,,08/09/2022 12:00:00 AM,AM,2022,8,Aug,33,Parks,,67,,67,,,,,X-07,,false,2022-08-09 16:17:38.0000000,M&O MS Forms
X-2689.0,,,04/29/2022 12:00:00 AM,AM,2022,4,Apr,18,BBP,,7,,7,,,,,X-01,,false,2022-04-29 11:07:54.0000000,M&O MS Forms
X-2692.0,,,04/29/2022 12:00:00 AM,AM,2022,4,Apr,18,Parks,,5,,5,,,,,X-01,,false,2022-04-29 12:04:41.0000000,M&O MS Forms
X-2457.0,,,03/17/2022 12:00:00 AM,AM,2022,3,Mar,12,Parks,,4,,4,,,,,X-01,,false,2022-03-17 10:37:09.0000000,M&O MS Forms
X-2377.0,,,03/05/2022 12:00:00 AM,AM,2022,3,Mar,10,Parks,,4,,4,,,,,X-01,,false,2022-03-05 12:09:50.0000000,M&O MS Forms
X-2240.0,,,02/16/2022 12:00:00 AM,AM,2022,2,Feb,8,Parks,,4,,4,,,,,X-01,,false,2022-02-16 21:01:14.0000000,M&O MS Forms
X-2308.0,,,02/26/2022 12:00:00 AM,AM,2022,2,Feb,9,Parks,,5,,5,,,,,X-01,,false,2022-02-26 08:39:07.0000000,M&O MS Forms
X-4857.0,,,02/20/2023 12:00:00 AM,AM,2023,2,Feb,8,Parks,,4,,4,,,,,X-01,,false,2023-02-20 13:37:14.0000000,M&O MS Forms
X-4731.0,,,02/06/2023 12:00:00 AM,AM,2023,2,Feb,6,BBP,,20,,20,,,,,X-02,,false,2023-02-07 14:34:57.0000000,M&O MS Forms
X-5047.0,,,03/07/2023 12:00:00 AM,AM,2023,3,Mar,10,BBP,,10,,10,,,,,X-02,,false,2023-03-12 14:53:31.0000000,M&O MS Forms
X-0654.0,,,07/04/2021 12:00:00 AM,AM,2021,7,Jul,28,Parks,,12,,12,,,,,X-02,,false,2021-07-11 07:37:46.0000000,M&O MS Forms
X-1119.0,,,09/25/2021 12:00:00 AM,AM,2021,9,Sep,39,Parks,,7,,7,,,,,X-02,,false,2021-09-25 14:28:08.0000000,M&O MS Forms
X-0744.0,,,07/25/2021 12:00:00 AM,AM,2021,7,Jul,31,Parks,,1,,1,,,,,X-02,,false,2021-07-25 20:15:01.0000000,M&O MS Forms
X-0405.0,,,06/04/2021 12:00:00 AM,AM,2021,6,Jun,23,Parks,,12,,12,,,,,X-02,,false,2021-06-08 07:47:58.0000000,M&O MS Forms
X-1941.0,,,12/28/2021 12:00:00 AM,AM,2021,12,Dec,53,Parks,,1,,1,,,,,X-02,,false,2022-01-05 10:52:29.0000000,M&O MS Forms
X-1720.0,,,12/09/2021 12:00:00 AM,AM,2021,12,Dec,50,Parks,,4,,4,,,,,X-02,,false,2021-12-14 09:14:41.0000000,M&O MS Forms
X-1265.0,,,10/06/2021 12:00:00 AM,AM,2021,10,Oct,41,Parks,,2,,2,,,,,X-02,,false,2021-10-11 08:35:33.0000000,M&O MS Forms
X-1306.0,,,10/11/2021 12:00:00 AM,PM,2021,10,Oct,42,Parks,,2,,2,,,,,X-02,,false,2021-10-16 15:45:36.0000000,M&O MS Forms
X-1417.0,,,10/29/2021 12:00:00 AM,AM,2021,10,Oct,44,Parks,,4,,4,,,,,X-02,,false,2021-10-31 09:38:52.0000000,M&O MS Forms
X-3789.0,,,09/10/2022 12:00:00 AM,AM,2022,9,Sep,37,Parks,,1,,1,,,,,X-02,,false,2022-09-12 12:46:53.0000000,M&O MS Forms
X-4623.0,,,01/14/2023 12:00:00 AM,AM,2023,1,Jan,2,Parks,,1,,1,,,,,X-02,,false,2023-01-18 09:52:01.0000000,M&O MS Forms
X-3022.0,,,06/06/2022 12:00:00 AM,AM,2022,6,Jun,24,Parks,,15,,15,,,,,X-02,,false,2022-06-15 08:15:45.0000000,M&O MS Forms
X-3073.0,,,06/15/2022 12:00:00 AM,AM,2022,6,Jun,25,Parks,,1,,1,,,,,X-02,,false,2022-06-19 18:07:33.0000000,M&O MS Forms
X-3136.0,,,06/22/2022 12:00:00 AM,AM,2022,6,Jun,26,Parks,,2,,2,,,,,X-02,,false,2022-06-28 11:36:20.0000000,M&O MS Forms
X-3185.0,,,06/28/2022 12:00:00 AM,AM,2022,6,Jun,27,Parks,,1,,1,,,,,X-02,,false,2022-07-07 08:04:44.0000000,M&O MS Forms
X-3237.0,,,07/06/2022 12:00:00 AM,AM,2022,7,Jul,28,Parks,,2,,2,,,,,X-02,,false,2022-07-12 10:49:42.0000000,M&O MS Forms
X-3277.0,,,07/11/2022 12:00:00 AM,AM,2022,7,Jul,29,Parks,,1,,1,,,,,X-02,,false,2022-07-18 12:22:46.0000000,M&O MS Forms
M-002702,M037,M037-03,04/01/2022 12:00:00 AM,AM,2022,4,Apr,14,Parks,Highbridge Park,10,,10,,,34,Manhattan,M-12A,PLGD,true,2022-04-01 15:59:54.0000000,M&O MS Forms
M-002827,M037,M037-03,04/14/2022 12:00:00 AM,AM,2022,4,Apr,16,Parks,Highbridge Park,8,,8,,,34,Manhattan,M-12A,PLGD,true,2022-04-17 16:44:51.0000000,M&O MS Forms
M-002819,M037,M037-03,04/13/2022 12:00:00 AM,AM,2022,4,Apr,16,Parks,Highbridge Park,6,,6,,,34,Manhattan,M-12A,PLGD,true,2022-04-17 16:42:29.0000000,M&O MS Forms
M-002810,M037,M037-03,04/12/2022 12:00:00 AM,AM,2022,4,Apr,16,Parks,Highbridge Park,2,,2,,,34,Manhattan,M-12A,PLGD,true,2022-04-17 16:39:54.0000000,M&O MS Forms
M-002801,M037,M037-03,04/11/2022 12:00:00 AM,AM,2022,4,Apr,16,Parks,Highbridge Park,4,,4,,,34,Manhattan,M-12A,PLGD,true,2022-04-17 16:35:49.0000000,M&O MS Forms
M-002792,M037,M037-03,04/10/2022 12:00:00 AM,AM,2022,4,Apr,16,Parks,Highbridge Park,5,,5,,,34,Manhattan,M-12A,PLGD,true,2022-04-17 16:32:33.0000000,M&O MS Forms
M-002783,M037,M037-03,04/09/2022 12:00:00 AM,AM,2022,4,Apr,15,Parks,Highbridge Park,9,,9,,,34,Manhattan,M-12A,PLGD,true,2022-04-17 16:26:12.0000000,M&O MS Forms
M-002775,M037,M037-03,04/08/2022 12:00:00 AM,AM,2022,4,Apr,15,Parks,Highbridge Park,4,,4,,,34,Manhattan,M-12A,PLGD,true,2022-04-17 16:23:50.0000000,M&O MS Forms
M-002889,M037,M037-03,04/22/2022 12:00:00 AM,AM,2022,4,Apr,17,Parks,Highbridge Park,10,,10,,,34,Manhattan,M-12A,PLGD,true,2022-04-23 12:31:36.0000000,M&O MS Forms
M-002880,M037,M037-03,04/21/2022 12:00:00 AM,AM,2022,4,Apr,17,Parks,Highbridge Park,7,,7,,,34,Manhattan,M-12A,PLGD,true,2022-04-23 12:28:48.0000000,M&O MS Forms
M-002871,M037,M037-03,04/20/2022 12:00:00 AM,AM,2022,4,Apr,17,Parks,Highbridge Park,5,,5,,,34,Manhattan,M-12A,PLGD,true,2022-04-23 12:25:37.0000000,M&O MS Forms
M-002863,M037,M037-03,04/19/2022 12:00:00 AM,AM,2022,4,Apr,17,Parks,Highbridge Park,2,,2,,,34,Manhattan,M-12A,PLGD,true,2022-04-23 12:22:49.0000000,M&O MS Forms
M-002854,M037,M037-03,04/18/2022 12:00:00 AM,AM,2022,4,Apr,17,Parks,Highbridge Park,1,,1,,,34,Manhattan,M-12A,PLGD,true,2022-04-23 12:19:44.0000000,M&O MS Forms
M-002845,M037,M037-03,04/17/2022 12:00:00 AM,AM,2022,4,Apr,17,Parks,Highbridge Park,2,,2,,,34,Manhattan,M-12A,PLGD,true,2022-04-23 12:16:28.0000000,M&O MS Forms
M-002836,M037,M037-03,04/15/2022 12:00:00 AM,AM,2022,4,Apr,16,Parks,Highbridge Park,10,,10,,,34,Manhattan,M-12A,PLGD,true,2022-04-17 16:48:27.0000000,M&O MS Forms
M-002965,M037,M037-03,04/30/2022 12:00:00 AM,AM,2022,4,Apr,18,Parks,Highbridge Park,7,,7,,,34,Manhattan,M-12A,PLGD,true,2022-04-30 14:54:13.0000000,M&O MS Forms
M-002956,M037,M037-03,04/29/2022 12:00:00 AM,AM,2022,4,Apr,18,Parks,Highbridge Park,8,,8,,,34,Manhattan,M-12A,PLGD,true,2022-04-30 14:39:22.0000000,M&O MS Forms
M-002947,M037,M037-03,04/28/2022 12:00:00 AM,AM,2022,4,Apr,18,Parks,Highbridge Park,2,,2,,,34,Manhattan,M-12A,PLGD,true,2022-04-30 14:34:01.0000000,M&O MS Forms
M-002938,M037,M037-03,04/27/2022 12:00:00 AM,AM,2022,4,Apr,18,Parks,Highbridge Park,6,,6,,,34,Manhattan,M-12A,PLGD,true,2022-04-30 14:30:52.0000000,M&O MS Forms
M-002929,M037,M037-03,04/26/2022 12:00:00 AM,AM,2022,4,Apr,18,Parks,Highbridge Park,2,,2,,,34,Manhattan,M-12A,PLGD,true,2022-04-30 14:24:21.0000000,M&O MS Forms
M-002913,M037,M037-03,04/24/2022 12:00:00 AM,AM,2022,4,Apr,18,Parks,Highbridge Park,2,,2,,,34,Manhattan,M-12A,PLGD,true,2022-04-30 13:55:20.0000000,M&O MS Forms
M-003000,M037,M037-03,05/02/2022 12:00:00 AM,AM,2022,5,May,19,Parks,Highbridge Park,10,,10,,,34,Manhattan,M-12A,PLGD,true,2022-05-06 19:23:08.0000000,M&O MS Forms
M-002996,M037,M037-03,05/01/2022 12:00:00 AM,AM,2022,5,May,19,Parks,Highbridge Park,10,,10,,,34,Manhattan,M-12A,PLGD,true,2022-05-06 19:21:30.0000000,M&O MS Forms
M-002974,M037,M037-03,04/23/2022 12:00:00 AM,AM,2022,4,Apr,17,Parks,Highbridge Park,12,,12,,,34,Manhattan,M-12A,PLGD,true,2022-04-30 15:00:56.0000000,M&O MS Forms
M-003030,M037,M037-03,05/06/2022 12:00:00 AM,AM,2022,5,May,19,Parks,Highbridge Park,12,,12,,,34,Manhattan,M-12A,PLGD,true,2022-05-06 20:06:36.0000000,M&O MS Forms
M-003020,M037,M037-03,05/05/2022 12:00:00 AM,AM,2022,5,May,19,Parks,Highbridge Park,10,,10,,,34,Manhattan,M-12A,PLGD,true,2022-05-06 19:50:55.0000000,M&O MS Forms
M-003011,M037,M037-03,05/04/2022 12:00:00 AM,AM,2022,5,May,19,Parks,Highbridge Park,7,,7,,,34,Manhattan,M-12A,PLGD,true,2022-05-06 19:47:05.0000000,M&O MS Forms
M-003049,M037,M037-03,05/08/2022 12:00:00 AM,AM,2022,5,May,20,Parks,Highbridge Park,5,,5,,,34,Manhattan,M-12A,PLGD,true,2022-05-09 08:09:35.0000000,M&O MS Forms
M-003040,M037,M037-03,05/07/2022 12:00:00 AM,AM,2022,5,May,19,Parks,Highbridge Park,4,,4,,,34,Manhattan,M-12A,PLGD,true,2022-05-09 08:02:53.0000000,M&O MS Forms
M-003059,M037,M037-03,05/08/2022 12:00:00 AM,AM,2022,5,May,20,Parks,Highbridge Park,5,,5,,,34,Manhattan,M-12A,PLGD,true,2022-05-13 15:11:00.0000000,M&O MS Forms
M-003096,M037,M037-03,05/12/2022 12:00:00 AM,AM,2022,5,May,20,Parks,Highbridge Park,12,,12,,,34,Manhattan,M-12A,PLGD,true,2022-05-13 15:28:35.0000000,M&O MS Forms
M-003087,M037,M037-03,05/11/2022 12:00:00 AM,AM,2022,5,May,20,Parks,Highbridge Park,6,,6,,,34,Manhattan,M-12A,PLGD,true,2022-05-13 15:22:56.0000000,M&O MS Forms
M-003078,M037,M037-03,05/10/2022 12:00:00 AM,AM,2022,5,May,20,Parks,Highbridge Park,1,,1,,,34,Manhattan,M-12A,PLGD,true,2022-05-13 15:19:31.0000000,M&O MS Forms
M-000667,M037,M037-03,08/10/2021 12:00:00 AM,AM,2021,8,Aug,33,BBP,Highbridge Park,5,,5,,,34,Manhattan,M-12A,PLGD,true,2021-08-14 06:35:42.0000000,M&O MS Forms
M-000664,M037,M037-03,08/09/2021 12:00:00 AM,AM,2021,8,Aug,33,Parks,Highbridge Park,25,,25,,,34,Manhattan,M-12A,PLGD,true,2021-08-14 06:33:38.0000000,M&O MS Forms
M-000625,M037,M037-03,08/02/2021 12:00:00 AM,AM,2021,8,Aug,32,Parks,Highbridge Park,3,,3,,,34,Manhattan,M-12A,PLGD,true,2021-08-09 08:06:38.0000000,M&O MS Forms
M-000622,M037,M037-03,08/01/2021 12:00:00 AM,AM,2021,8,Aug,32,Parks,Highbridge Park,4,,4,,,34,Manhattan,M-12A,PLGD,true,2021-08-09 08:05:23.0000000,M&O MS Forms
M-000660,M037,M037-03,08/08/2021 12:00:00 AM,AM,2021,8,Aug,33,Parks,Highbridge Park,2,,2,,,34,Manhattan,M-12A,PLGD,true,2021-08-14 06:31:57.0000000,M&O MS Forms
M-000639,M037,M037-03,08/06/2021 12:00:00 AM,AM,2021,8,Aug,32,Parks,Highbridge Park,5,,5,,,34,Manhattan,M-12A,PLGD,true,2021-08-09 08:24:11.0000000,M&O MS Forms
M-000636,M037,M037-03,08/04/2021 12:00:00 AM,PM,2021,8,Aug,32,BBP,Highbridge Park,2,,2,,,34,Manhattan,M-12A,PLGD,true,2021-08-09 08:22:39.0000000,M&O MS Forms
M-000630,M037,M037-03,08/03/2021 12:00:00 AM,AM,2021,8,Aug,32,BBP,Highbridge Park,6,,6,,,34,Manhattan,M-12A,PLGD,true,2021-08-09 08:19:20.0000000,M&O MS Forms
M-000552,M037,M037-03,07/18/2021 12:00:00 AM,AM,2021,7,Jul,30,Parks,Highbridge Park,4,,4,,,34,Manhattan,M-12A,PLGD,true,2021-07-27 19:45:38.0000000,M&O MS Forms
M-000533,M037,M037-03,07/16/2021 12:00:00 AM,AM,2021,7,Jul,29,Parks,Highbridge Park,4,,4,,,34,Manhattan,M-12A,PLGD,true,2021-07-21 18:31:24.0000000,M&O MS Forms
M-000529,M037,M037-03,07/15/2021 12:00:00 AM,AM,2021,7,Jul,29,Parks,Highbridge Park,8,,8,,,34,Manhattan,M-12A,PLGD,true,2021-07-21 18:28:51.0000000,M&O MS Forms
M-000524,M037,M037-03,07/14/2021 12:00:00 AM,AM,2021,7,Jul,29,BBP,Highbridge Park,4,,4,,,34,Manhattan,M-12A,PLGD,true,2021-07-21 18:26:57.0000000,M&O MS Forms
M-000522,M037,M037-03,07/13/2021 12:00:00 AM,AM,2021,7,Jul,29,BBP,Highbridge Park,6,,6,,,34,Manhattan,M-12A,PLGD,true,2021-07-21 18:26:19.0000000,M&O MS Forms
M-000569,M037,M037-03,07/23/2021 12:00:00 AM,AM,2021,7,Jul,30,Parks,Highbridge Park,2,,2,,,34,Manhattan,M-12A,PLGD,true,2021-07-27 19:52:32.0000000,M&O MS Forms
M-000566,M037,M037-03,07/21/2021 12:00:00 AM,AM,2021,7,Jul,30,Parks,Highbridge Park,4,,4,,,34,Manhattan,M-12A,PLGD,true,2021-07-27 19:51:07.0000000,M&O MS Forms
M-000561,M037,M037-03,07/21/2021 12:00:00 AM,AM,2021,7,Jul,30,BBP,Highbridge Park,6,,6,,,34,Manhattan,M-12A,PLGD,true,2021-07-27 19:49:15.0000000,M&O MS Forms
M-000559,M037,M037-03,07/20/2021 12:00:00 AM,AM,2021,7,Jul,30,BBP,Highbridge Park,3,,3,,,34,Manhattan,M-12A,PLGD,true,2021-07-27 19:48:32.0000000,M&O MS Forms
M-000556,M037,M037-03,07/19/2021 12:00:00 AM,AM,2021,7,Jul,30,Parks,Highbridge Park,6,,6,,,34,Manhattan,M-12A,PLGD,true,2021-07-27 19:47:09.0000000,M&O MS Forms
M-000489,M037,M037-03,07/05/2021 12:00:00 AM,AM,2021,7,Jul,28,Parks,Highbridge Park,3,,3,,,34,Manhattan,M-12A,PLGD,true,2021-07-10 05:19:08.0000000,M&O MS Forms
M-000462,M037,M037-03,06/30/2021 12:00:00 AM,AM,2021,6,Jun,27,BBP,Highbridge Park,2,,2,,,34,Manhattan,M-12A,PLGD,true,2021-07-04 04:41:52.0000000,M&O MS Forms
M-000460,M037,M037-03,06/29/2021 12:00:00 AM,AM,2021,6,Jun,27,BBP,Highbridge Park,2,,2,,,34,Manhattan,M-12A,PLGD,true,2021-07-04 04:40:55.0000000,M&O MS Forms
M-000456,M037,M037-03,06/28/2021 12:00:00 AM,AM,2021,6,Jun,27,Parks,Highbridge Park,2,,2,,,34,Manhattan,M-12A,PLGD,true,2021-07-04 04:39:18.0000000,M&O MS Forms
M-000452,M037,M037-03,06/27/2021 12:00:00 AM,AM,2021,6,Jun,27,Parks,Highbridge Park,4,,4,,,34,Manhattan,M-12A,PLGD,true,2021-07-04 04:37:33.0000000,M&O MS Forms
M-000515,M037,M037-03,07/11/2021 12:00:00 AM,AM,2021,7,Jul,29,Parks,Highbridge Park,6,,6,,,34,Manhattan,M-12A,PLGD,true,2021-07-21 18:21:15.0000000,M&O MS Forms
M-000505,M037,M037-03,07/09/2021 12:00:00 AM,AM,2021,7,Jul,28,Parks,Highbridge Park,5,,5,,,34,Manhattan,M-12A,PLGD,true,2021-07-10 05:53:46.0000000,M&O MS Forms
M-000503,M037,M037-03,07/08/2021 12:00:00 AM,AM,2021,7,Jul,28,Parks,Highbridge Park,3,,3,,,34,Manhattan,M-12A,PLGD,true,2021-07-10 05:52:57.0000000,M&O MS Forms
M-000497,M037,M037-03,07/07/2021 12:00:00 AM,AM,2021,7,Jul,28,BBP,Highbridge Park,2,,2,,,34,Manhattan,M-12A,PLGD,true,2021-07-10 05:50:42.0000000,M&O MS Forms
M-000496,M037,M037-03,07/06/2021 12:00:00 AM,AM,2021,7,Jul,28,BBP,Highbridge Park,4,,4,,,34,Manhattan,M-12A,PLGD,true,2021-07-10 05:50:12.0000000,M&O MS Forms
M-000442,M037,M037-03,06/25/2021 12:00:00 AM,AM,2021,6,Jun,26,BBP,Highbridge Park,1,,1,,,34,Manhattan,M-12A,PLGD,true,2021-06-25 20:01:43.0000000,M&O MS Forms
M-000437,M037,M037-03,06/24/2021 12:00:00 AM,AM,2021,6,Jun,26,Parks,Highbridge Park,3,,3,,,34,Manhattan,M-12A,PLGD,true,2021-06-25 19:59:46.0000000,M&O MS Forms
M-000435,M037,M037-03,06/23/2021 12:00:00 AM,AM,2021,6,Jun,26,BBP,Highbridge Park,1,,1,,,34,Manhattan,M-12A,PLGD,true,2021-06-25 19:59:07.0000000,M&O MS Forms
M-000431,M037,M037-03,06/22/2021 12:00:00 AM,AM,2021,6,Jun,26,BBP,Highbridge Park,2,,2,,,34,Manhattan,M-12A,PLGD,true,2021-06-25 19:57:40.0000000,M&O MS Forms
M-000429,M037,M037-03,06/21/2021 12:00:00 AM,AM,2021,6,Jun,26,Parks,Highbridge Park,1,,1,,,34,Manhattan,M-12A,PLGD,true,2021-06-25 19:56:49.0000000,M&O MS Forms
M-005430,M037,M037-03,01/09/2023 12:00:00 AM,AM,2023,1,Jan,2,Parks,Highbridge Park,3,,3,,,34,Manhattan,M-12A,PLGD,true,2023-01-14 15:00:06.0000000,M&O MS Forms
M-005421,M037,M037-03,01/08/2023 12:00:00 AM,AM,2023,1,Jan,2,Parks,Highbridge Park,2,,2,,,34,Manhattan,M-12A,PLGD,true,2023-01-14 14:57:50.0000000,M&O MS Forms
M-005334,M037,M037-03,12/30/2022 12:00:00 AM,AM,2022,12,Dec,53,Parks,Highbridge Park,8,,8,,,34,Manhattan,M-12A,PLGD,true,2022-12-31 11:04:37.0000000,M&O MS Forms
M-005325,M037,M037-03,12/29/2022 12:00:00 AM,AM,2022,12,Dec,53,Parks,Highbridge Park,10,,10,,,34,Manhattan,M-12A,PLGD,true,2022-12-31 11:01:57.0000000,M&O MS Forms
M-005316,M037,M037-03,12/28/2022 12:00:00 AM,AM,2022,12,Dec,53,Parks,Highbridge Park,7,,7,,,34,Manhattan,M-12A,PLGD,true,2022-12-31 10:59:14.0000000,M&O MS Forms
M-005307,M037,M037-03,12/27/2022 12:00:00 AM,AM,2022,12,Dec,53,Parks,Highbridge Park,5,,5,,,34,Manhattan,M-12A,PLGD,true,2022-12-31 10:56:41.0000000,M&O MS Forms
M-005298,M037,M037-03,12/26/2022 12:00:00 AM,AM,2022,12,Dec,53,Parks,Highbridge Park,3,,3,,,34,Manhattan,M-12A,PLGD,true,2022-12-31 10:53:58.0000000,M&O MS Forms
M-005289,M037,M037-03,12/25/2022 12:00:00 AM,AM,2022,12,Dec,53,Parks,Highbridge Park,5,,5,,,34,Manhattan,M-12A,PLGD,true,2022-12-31 10:51:29.0000000,M&O MS Forms
M-005279,M037,M037-03,12/23/2022 12:00:00 AM,AM,2022,12,Dec,52,Parks,Highbridge Park,2,,2,,,34,Manhattan,M-12A,PLGD,true,2022-12-24 16:05:30.0000000,M&O MS Forms
M-005273,M037,M037-03,12/22/2022 12:00:00 AM,AM,2022,12,Dec,52,Parks,Highbridge Park,4,,4,,,34,Manhattan,M-12A,PLGD,true,2022-12-24 16:03:04.0000000,M&O MS Forms
M-005264,M037,M037-03,12/21/2022 12:00:00 AM,AM,2022,12,Dec,52,Parks,Highbridge Park,5,,5,,,34,Manhattan,M-12A,PLGD,true,2022-12-24 15:59:43.0000000,M&O MS Forms
M-005255,M037,M037-03,12/20/2022 12:00:00 AM,AM,2022,12,Dec,52,Parks,Highbridge Park,3,,3,,,34,Manhattan,M-12A,PLGD,true,2022-12-24 15:56:41.0000000,M&O MS Forms
M-005244,M037,M037-03,12/19/2022 12:00:00 AM,AM,2022,12,Dec,52,Parks,Highbridge Park,1,,1,,,34,Manhattan,M-12A,PLGD,true,2022-12-19 15:20:53.0000000,M&O MS Forms
M-005235,M037,M037-03,12/18/2022 12:00:00 AM,AM,2022,12,Dec,52,Parks,Highbridge Park,2,,2,,,34,Manhattan,M-12A,PLGD,true,2022-12-19 15:17:55.0000000,M&O MS Forms
M-005222,M037,M037-03,12/16/2022 12:00:00 AM,AM,2022,12,Dec,51,Parks,Highbridge Park,6,,6,,,34,Manhattan,M-12A,PLGD,true,2022-12-18 16:14:45.0000000,M&O MS Forms
M-005201,M037,M037-03,12/13/2022 12:00:00 AM,AM,2022,12,Dec,51,Parks,Highbridge Park,1,,1,,,34,Manhattan,M-12A,PLGD,true,2022-12-14 05:28:43.0000000,M&O MS Forms
M-005194,M037,M037-03,12/12/2022 12:00:00 AM,AM,2022,12,Dec,51,Parks,Highbridge Park,5,,5,,,34,Manhattan,M-12A,PLGD,true,2022-12-13 05:49:36.0000000,M&O MS Forms
M-005185,M037,M037-03,12/11/2022 12:00:00 AM,AM,2022,12,Dec,51,Parks,Highbridge Park,3,,3,,,34,Manhattan,M-12A,PLGD,true,2022-12-13 05:41:35.0000000,M&O MS Forms
M-005176,M037,M037-03,12/10/2022 12:00:00 AM,AM,2022,12,Dec,50,Parks,Highbridge Park,7,,7,,,34,Manhattan,M-12A,PLGD,true,2022-12-13 05:38:13.0000000,M&O MS Forms
M-005167,M037,M037-03,12/09/2022 12:00:00 AM,AM,2022,12,Dec,50,Parks,Highbridge Park,4,,4,,,34,Manhattan,M-12A,PLGD,true,2022-12-13 05:34:21.0000000,M&O MS Forms
M-005158,M037,M037-03,12/08/2022 12:00:00 AM,AM,2022,12,Dec,50,Parks,Highbridge Park,9,,9,,,34,Manhattan,M-12A,PLGD,true,2022-12-08 16:59:02.0000000,M&O MS Forms
M-005149,M037,M037-03,12/07/2022 12:00:00 AM,AM,2022,12,Dec,50,Parks,Highbridge Park,6,,6,,,34,Manhattan,M-12A,PLGD,true,2022-12-07 17:14:22.0000000,M&O MS Forms
M-005140,M037,M037-03,12/06/2022 12:00:00 AM,AM,2022,12,Dec,50,Parks,Highbridge Park,2,,2,,,34,Manhattan,M-12A,PLGD,true,2022-12-07 17:11:41.0000000,M&O MS Forms
M-005131,M037,M037-03,12/05/2022 12:00:00 AM,AM,2022,12,Dec,50,Parks,Highbridge Park,3,,3,,,34,Manhattan,M-12A,PLGD,true,2022-12-07 16:58:07.0000000,M&O MS Forms
M-005122,M037,M037-03,12/04/2022 12:00:00 AM,AM,2022,12,Dec,50,Parks,Highbridge Park,5,,5,,,34,Manhattan,M-12A,PLGD,true,2022-12-07 16:54:33.0000000,M&O MS Forms
M-005105,M037,M037-03,12/03/2022 12:00:00 AM,AM,2022,12,Dec,49,Parks,Highbridge Park,12,,12,,,34,Manhattan,M-12A,PLGD,true,2022-12-03 13:39:44.0000000,M&O MS Forms
M-005096,M037,M037-03,12/02/2022 12:00:00 AM,AM,2022,12,Dec,49,Parks,Highbridge Park,7,,7,,,34,Manhattan,M-12A,PLGD,true,2022-12-03 13:37:17.0000000,M&O MS Forms
M-005087,M037,M037-03,12/01/2022 12:00:00 AM,AM,2022,12,Dec,49,Parks,Highbridge Park,4,,4,,,34,Manhattan,M-12A,PLGD,true,2022-12-03 13:09:26.0000000,M&O MS Forms
M-005079,M037,M037-03,11/30/2022 12:00:00 AM,AM,2022,11,Nov,49,Parks,Highbridge Park,5,,5,,,34,Manhattan,M-12A,PLGD,true,2022-12-03 13:07:10.0000000,M&O MS Forms
M-005070,M037,M037-03,11/29/2022 12:00:00 AM,AM,2022,11,Nov,49,Parks,Highbridge Park,1,,1,,,34,Manhattan,M-12A,PLGD,true,2022-12-03 13:04:36.0000000,M&O MS Forms
M-005061,M037,M037-03,11/28/2022 12:00:00 AM,AM,2022,11,Nov,49,Parks,Highbridge Park,3,,3,,,34,Manhattan,M-12A,PLGD,true,2022-12-03 13:01:37.0000000,M&O MS Forms
M-005052,M037,M037-03,11/27/2022 12:00:00 AM,AM,2022,11,Nov,49,Parks,Highbridge Park,2,,2,,,34,Manhattan,M-12A,PLGD,true,2022-12-03 12:58:58.0000000,M&O MS Forms
M-005799,M037,M037-03,02/17/2023 12:00:00 AM,AM,2023,2,Feb,7,Parks,Highbridge Park,11,,11,,,34,Manhattan,M-12A,PLGD,true,2023-02-19 13:40:06.0000000,M&O MS Forms
M-004713,M037,M037-ZN02,10/20/2022 12:00:00 AM,AM,2022,10,Oct,43,Parks,Highbridge Park,15,,15,,,2,Manhattan,M-12A,ZONE,true,2022-10-30 13:13:19.0000000,M&O MS Forms
M-003826,M037,M037-ZN02,07/27/2022 12:00:00 AM,AM,2022,7,Jul,31,Parks,Highbridge Park,45,,45,,,2,Manhattan,M-12A,ZONE,true,2022-07-29 16:03:23.0000000,M&O MS Forms
M-003843,M037,M037-ZN02,07/29/2022 12:00:00 AM,AM,2022,7,Jul,31,Parks,Highbridge Park,43,,43,,,2,Manhattan,M-12A,ZONE,true,2022-07-29 16:12:07.0000000,M&O MS Forms
M-003834,M037,M037-ZN02,07/28/2022 12:00:00 AM,AM,2022,7,Jul,31,Parks,Highbridge Park,38,,38,,,2,Manhattan,M-12A,ZONE,true,2022-07-29 16:05:51.0000000,M&O MS Forms
M-003852,M037,M037-ZN02,07/30/2022 12:00:00 AM,AM,2022,7,Jul,31,Parks,Highbridge Park,50,,50,,,2,Manhattan,M-12A,ZONE,true,2022-07-31 09:41:11.0000000,M&O MS Forms
M-003861,M037,M037-ZN02,07/31/2022 12:00:00 AM,AM,2022,7,Jul,32,Parks,Highbridge Park,52,,52,,,2,Manhattan,M-12A,ZONE,true,2022-07-31 16:56:57.0000000,M&O MS Forms
M-004604,M037,M037-ZN02,10/17/2022 12:00:00 AM,AM,2022,10,Oct,43,Parks,Highbridge Park,15,,15,,,2,Manhattan,M-12A,ZONE,true,2022-10-19 06:38:39.0000000,M&O MS Forms
M-003779,M037,M037-ZN02,07/22/2022 12:00:00 AM,AM,2022,7,Jul,30,Parks,Highbridge Park,63,,63,,,2,Manhattan,M-12A,ZONE,true,2022-07-23 15:35:25.0000000,M&O MS Forms
M-003770,M037,M037-ZN02,07/21/2022 12:00:00 AM,AM,2022,7,Jul,30,Parks,Highbridge Park,40,,40,,,2,Manhattan,M-12A,ZONE,true,2022-07-23 15:32:17.0000000,M&O MS Forms
M-003761,M037,M037-ZN02,07/20/2022 12:00:00 AM,AM,2022,7,Jul,30,Parks,Highbridge Park,21,,21,,,2,Manhattan,M-12A,ZONE,true,2022-07-23 15:29:15.0000000,M&O MS Forms
M-003808,M037,M037-ZN02,07/25/2022 12:00:00 AM,AM,2022,7,Jul,31,Parks,Highbridge Park,80,,80,,,2,Manhattan,M-12A,ZONE,true,2022-07-29 15:57:26.0000000,M&O MS Forms
M-003817,M037,M037-ZN02,07/26/2022 12:00:00 AM,AM,2022,7,Jul,31,Parks,Highbridge Park,65,,65,,,2,Manhattan,M-12A,ZONE,true,2022-07-29 16:00:24.0000000,M&O MS Forms
M-003787,M037,M037-ZN02,07/23/2022 12:00:00 AM,AM,2022,7,Jul,30,Parks,Highbridge Park,50,,50,,,2,Manhattan,M-12A,ZONE,true,2022-07-24 12:10:48.0000000,M&O MS Forms
M-003799,M037,M037-ZN02,07/24/2022 12:00:00 AM,AM,2022,7,Jul,31,Parks,Highbridge Park,62,,62,,,2,Manhattan,M-12A,ZONE,true,2022-07-29 15:54:19.0000000,M&O MS Forms
M-003169,M037,M037-ZN02,05/20/2022 12:00:00 AM,AM,2022,5,May,21,Parks,Highbridge Park,9,,9,,,2,Manhattan,M-12A,ZONE,true,2022-05-20 15:13:13.0000000,M&O MS Forms
M-003178,M037,M037-ZN02,05/21/2022 12:00:00 AM,AM,2022,5,May,21,Parks,Highbridge Park,16,,16,,,2,Manhattan,M-12A,ZONE,true,2022-05-22 08:31:23.0000000,M&O MS Forms
M-003190,M037,M037-ZN02,05/22/2022 12:00:00 AM,AM,2022,5,May,22,Parks,Highbridge Park,30,,30,,,2,Manhattan,M-12A,ZONE,true,2022-05-22 15:11:10.0000000,M&O MS Forms
M-003221,M037,M037-ZN02,05/25/2022 12:00:00 AM,AM,2022,5,May,22,Parks,Highbridge Park,15,,15,,,2,Manhattan,M-12A,ZONE,true,2022-05-28 10:50:32.0000000,M&O MS Forms
M-003212,M037,M037-ZN02,05/24/2022 12:00:00 AM,AM,2022,5,May,22,Parks,Highbridge Park,9,,9,,,2,Manhattan,M-12A,ZONE,true,2022-05-28 10:47:58.0000000,M&O MS Forms
M-003203,M037,M037-ZN02,05/23/2022 12:00:00 AM,AM,2022,5,May,22,Parks,Highbridge Park,12,,12,,,2,Manhattan,M-12A,ZONE,true,2022-05-28 10:45:24.0000000,M&O MS Forms
M-003110,M037,M037-ZN02,05/14/2022 12:00:00 AM,AM,2022,5,May,20,Parks,Highbridge Park,40,,40,,,2,Manhattan,M-12A,ZONE,true,2022-05-14 15:49:28.0000000,M&O MS Forms
M-003100,M037,M037-ZN02,05/13/2022 12:00:00 AM,AM,2022,5,May,20,Parks,Highbridge Park,35,,35,,,2,Manhattan,M-12A,ZONE,true,2022-05-14 10:49:25.0000000,M&O MS Forms
M-003120,M037,M037-ZN02,05/15/2022 12:00:00 AM,AM,2022,5,May,21,Parks,Highbridge Park,20,,20,,,2,Manhattan,M-12A,ZONE,true,2022-05-15 16:51:36.0000000,M&O MS Forms
M-003133,M037,M037-ZN02,05/16/2022 12:00:00 AM,AM,2022,5,May,21,Parks,Highbridge Park,25,,25,,,2,Manhattan,M-12A,ZONE,true,2022-05-20 15:00:54.0000000,M&O MS Forms
M-003151,M037,M037-ZN02,05/18/2022 12:00:00 AM,AM,2022,5,May,21,Parks,Highbridge Park,25,,25,,,2,Manhattan,M-12A,ZONE,true,2022-05-20 15:06:43.0000000,M&O MS Forms
M-003160,M037,M037-ZN02,05/19/2022 12:00:00 AM,AM,2022,5,May,21,Parks,Highbridge Park,10,,10,,,2,Manhattan,M-12A,ZONE,true,2022-05-20 15:09:17.0000000,M&O MS Forms
M-003142,M037,M037-ZN02,05/17/2022 12:00:00 AM,AM,2022,5,May,21,Parks,Highbridge Park,30,,30,,,2,Manhattan,M-12A,ZONE,true,2022-05-20 15:03:36.0000000,M&O MS Forms
M-003070,M037,M037-ZN02,05/10/2022 12:00:00 AM,AM,2022,5,May,20,Parks,Highbridge Park,5,,5,,,2,Manhattan,M-12A,ZONE,true,2022-05-13 15:16:25.0000000,M&O MS Forms
M-003079,M037,M037-ZN02,05/11/2022 12:00:00 AM,AM,2022,5,May,20,Parks,Highbridge Park,9,,9,,,2,Manhattan,M-12A,ZONE,true,2022-05-13 15:19:56.0000000,M&O MS Forms
M-003088,M037,M037-ZN02,05/12/2022 12:00:00 AM,AM,2022,5,May,20,Parks,Highbridge Park,21,,21,,,2,Manhattan,M-12A,ZONE,true,2022-05-13 15:25:41.0000000,M&O MS Forms
M-003060,M037,M037-ZN02,05/09/2022 12:00:00 AM,AM,2022,5,May,20,Parks,Highbridge Park,7,,7,,,2,Manhattan,M-12A,ZONE,true,2022-05-13 15:12:41.0000000,M&O MS Forms
M-003051,M037,M037-ZN02,05/08/2022 12:00:00 AM,AM,2022,5,May,20,Parks,Highbridge Park,5,,5,,,2,Manhattan,M-12A,ZONE,true,2022-05-13 15:07:59.0000000,M&O MS Forms
M-006038,M037,M037-ZN02,03/14/2023 12:00:00 AM,AM,2023,3,Mar,11,Parks,Highbridge Park,3,,3,,,2,Manhattan,M-12A,ZONE,true,2023-03-14 15:58:26.0000000,M&O MS Forms
M-006028,M037,M037-ZN02,03/13/2023 12:00:00 AM,AM,2023,3,Mar,11,Parks,Highbridge Park,7,,7,,,2,Manhattan,M-12A,ZONE,true,2023-03-13 16:09:51.0000000,M&O MS Forms
M-006048,M037,M037-ZN02,03/15/2023 12:00:00 AM,AM,2023,3,Mar,11,Parks,Highbridge Park,8,,8,,,2,Manhattan,M-12A,ZONE,true,2023-03-15 17:10:34.0000000,M&O MS Forms
M-005981,M037,M037-ZN02,03/08/2023 12:00:00 AM,AM,2023,3,Mar,10,Parks,Highbridge Park,5,,5,,,2,Manhattan,M-12A,ZONE,true,2023-03-08 15:44:22.0000000,M&O MS Forms
M-006019,M037,M037-ZN02,03/12/2023 12:00:00 AM,AM,2023,3,Mar,11,Parks,Highbridge Park,5,,5,,,2,Manhattan,M-12A,ZONE,true,2023-03-12 17:21:18.0000000,M&O MS Forms
M-006009,M037,M037-ZN02,03/11/2023 12:00:00 AM,AM,2023,3,Mar,10,Parks,Highbridge Park,7,,7,,,2,Manhattan,M-12A,ZONE,true,2023-03-11 16:02:33.0000000,M&O MS Forms
M-006000,M037,M037-ZN02,03/10/2023 12:00:00 AM,AM,2023,3,Mar,10,Parks,Highbridge Park,13,,13,,,2,Manhattan,M-12A,ZONE,true,2023-03-11 15:57:21.0000000,M&O MS Forms
M-005990,M037,M037-ZN02,03/09/2023 12:00:00 AM,AM,2023,3,Mar,10,Parks,Highbridge Park,11,,11,,,2,Manhattan,M-12A,ZONE,true,2023-03-09 15:44:22.0000000,M&O MS Forms
M-005970,M037,M037-ZN02,03/07/2023 12:00:00 AM,AM,2023,3,Mar,10,Parks,Highbridge Park,10,,10,,,2,Manhattan,M-12A,ZONE,true,2023-03-07 15:45:48.0000000,M&O MS Forms
M-005961,M037,M037-ZN02,03/06/2023 12:00:00 AM,AM,2023,3,Mar,10,Parks,Highbridge Park,8,,8,,,2,Manhattan,M-12A,ZONE,true,2023-03-06 17:33:24.0000000,M&O MS Forms
M-005944,M037,M037-ZN02,03/05/2023 12:00:00 AM,AM,2023,3,Mar,10,Parks,Highbridge Park,5,,5,,,2,Manhattan,M-12A,ZONE,true,2023-03-06 06:01:51.0000000,M&O MS Forms
M-005935,M037,M037-ZN02,03/04/2023 12:00:00 AM,AM,2023,3,Mar,9,Parks,Highbridge Park,6,,6,,,2,Manhattan,M-12A,ZONE,true,2023-03-04 13:31:44.0000000,M&O MS Forms
M-005926,M037,M037-ZN02,03/03/2023 12:00:00 AM,AM,2023,3,Mar,9,Parks,Highbridge Park,14,,14,,,2,Manhattan,M-12A,ZONE,true,2023-03-04 13:28:18.0000000,M&O MS Forms
M-004223,M037,M037-ZN02,09/04/2022 12:00:00 AM,AM,2022,9,Sep,37,Parks,Highbridge Park,50,,50,,,2,Manhattan,M-12A,ZONE,true,2022-09-06 14:38:12.0000000,M&O MS Forms
M-004233,M037,M037-ZN02,09/05/2022 12:00:00 AM,AM,2022,9,Sep,37,Parks,Highbridge Park,42,,42,,,2,Manhattan,M-12A,ZONE,true,2022-09-06 14:41:35.0000000,M&O MS Forms
M-004252,M037,M037-ZN02,09/05/2022 12:00:00 AM,AM,2022,9,Sep,37,Parks,Highbridge Park,42,,42,,,2,Manhattan,M-12A,ZONE,true,2022-09-09 05:31:43.0000000,M&O MS Forms
M-004261,M037,M037-ZN02,09/06/2022 12:00:00 AM,AM,2022,9,Sep,37,Parks,Highbridge Park,54,,54,,,2,Manhattan,M-12A,ZONE,true,2022-09-09 05:36:30.0000000,M&O MS Forms
M-004270,M037,M037-ZN02,09/07/2022 12:00:00 AM,AM,2022,9,Sep,37,Parks,Highbridge Park,37,,37,,,2,Manhattan,M-12A,ZONE,true,2022-09-09 05:39:57.0000000,M&O MS Forms
M-004279,M037,M037-ZN02,09/08/2022 12:00:00 AM,AM,2022,9,Sep,37,Parks,Highbridge Park,40,,40,,,2,Manhattan,M-12A,ZONE,true,2022-09-09 06:18:39.0000000,M&O MS Forms
M-004289,M037,M037-ZN02,09/10/2022 12:00:00 AM,AM,2022,9,Sep,37,Parks,Highbridge Park,60,,60,,,2,Manhattan,M-12A,ZONE,true,2022-09-12 06:06:28.0000000,M&O MS Forms
M-004298,M037,M037-ZN02,09/11/2022 12:00:00 AM,AM,2022,9,Sep,38,Parks,Highbridge Park,60,,60,,,2,Manhattan,M-12A,ZONE,true,2022-09-12 06:09:25.0000000,M&O MS Forms
M-004310,M037,M037-ZN02,09/11/2022 12:00:00 AM,AM,2022,9,Sep,38,Parks,Highbridge Park,60,,60,,,2,Manhattan,M-12A,ZONE,true,2022-09-13 18:00:34.0000000,M&O MS Forms
M-004319,M037,M037-ZN02,09/12/2022 12:00:00 AM,AM,2022,9,Sep,38,Parks,Highbridge Park,65,,65,,,2,Manhattan,M-12A,ZONE,true,2022-09-13 18:03:55.0000000,M&O MS Forms
M-004115,M037,M037-ZN02,08/24/2022 12:00:00 AM,AM,2022,8,Aug,35,Parks,Highbridge Park,50,,50,,,2,Manhattan,M-12A,ZONE,true,2022-08-28 17:22:00.0000000,M&O MS Forms
M-004124,M037,M037-ZN02,08/25/2022 12:00:00 AM,AM,2022,8,Aug,35,Parks,Highbridge Park,58,,58,,,2,Manhattan,M-12A,ZONE,true,2022-08-28 17:24:38.0000000,M&O MS Forms
M-004133,M037,M037-ZN02,08/26/2022 12:00:00 AM,AM,2022,8,Aug,35,Parks,Highbridge Park,65,,65,,,2,Manhattan,M-12A,ZONE,true,2022-08-28 17:30:03.0000000,M&O MS Forms
M-004141,M037,M037-ZN02,08/27/2022 12:00:00 AM,AM,2022,8,Aug,35,Parks,Highbridge Park,72,,72,,,2,Manhattan,M-12A,ZONE,true,2022-08-28 17:32:05.0000000,M&O MS Forms
M-004188,M037,M037-ZN02,08/31/2022 12:00:00 AM,AM,2022,8,Aug,36,Parks,Highbridge Park,26,,26,,,2,Manhattan,M-12A,ZONE,true,2022-09-06 14:26:51.0000000,M&O MS Forms
M-004197,M037,M037-ZN02,09/01/2022 12:00:00 AM,AM,2022,9,Sep,36,Parks,Highbridge Park,32,,32,,,2,Manhattan,M-12A,ZONE,true,2022-09-06 14:29:41.0000000,M&O MS Forms
M-004080,M037,M037-ZN02,08/20/2022 12:00:00 AM,AM,2022,8,Aug,34,Parks,Highbridge Park,75,,75,,,2,Manhattan,M-12A,ZONE,true,2022-08-28 17:11:03.0000000,M&O MS Forms
M-004089,M037,M037-ZN02,08/21/2022 12:00:00 AM,AM,2022,8,Aug,35,Parks,Highbridge Park,65,,65,,,2,Manhattan,M-12A,ZONE,true,2022-08-28 17:14:25.0000000,M&O MS Forms
M-004107,M037,M037-ZN02,08/23/2022 12:00:00 AM,AM,2022,8,Aug,35,Parks,Highbridge Park,46,,46,,,2,Manhattan,M-12A,ZONE,true,2022-08-28 17:19:43.0000000,M&O MS Forms
M-004098,M037,M037-ZN02,08/22/2022 12:00:00 AM,AM,2022,8,Aug,35,Parks,Highbridge Park,52,,52,,,2,Manhattan,M-12A,ZONE,true,2022-08-28 17:17:05.0000000,M&O MS Forms
M-004063,M037,M037-ZN02,08/19/2022 12:00:00 AM,AM,2022,8,Aug,34,Parks,Highbridge Park,45,,45,,,2,Manhattan,M-12A,ZONE,true,2022-08-20 12:03:40.0000000,M&O MS Forms
M-004051,M037,M037-ZN02,08/18/2022 12:00:00 AM,AM,2022,8,Aug,34,Parks,Highbridge Park,58,,58,,,2,Manhattan,M-12A,ZONE,true,2022-08-18 14:47:08.0000000,M&O MS Forms
M-004042,M037,M037-ZN02,08/17/2022 12:00:00 AM,AM,2022,8,Aug,34,Parks,Highbridge Park,9,,9,,,2,Manhattan,M-12A,ZONE,true,2022-08-18 14:44:34.0000000,M&O MS Forms
M-003968,M037,M037-ZN02,08/11/2022 12:00:00 AM,AM,2022,8,Aug,33,Parks,Highbridge Park,60,,60,,,2,Manhattan,M-12A,ZONE,true,2022-08-11 16:12:19.0000000,M&O MS Forms
M-003996,M037,M037-ZN02,08/13/2022 12:00:00 AM,AM,2022,8,Aug,33,Parks,Highbridge Park,82,,82,,,2,Manhattan,M-12A,ZONE,true,2022-08-15 10:08:18.0000000,M&O MS Forms
M-003988,M037,M037-ZN02,08/12/2022 12:00:00 AM,AM,2022,8,Aug,33,Parks,Highbridge Park,75,,75,,,2,Manhattan,M-12A,ZONE,true,2022-08-15 10:05:50.0000000,M&O MS Forms
M-004011,M037,M037-ZN02,08/14/2022 12:00:00 AM,AM,2022,8,Aug,34,Parks,Highbridge Park,5,,5,,,2,Manhattan,M-12A,ZONE,true,2022-08-18 14:02:36.0000000,M&O MS Forms
M-004020,M037,M037-ZN02,08/15/2022 12:00:00 AM,AM,2022,8,Aug,34,Parks,Highbridge Park,10,,10,,,2,Manhattan,M-12A,ZONE,true,2022-08-18 14:22:11.0000000,M&O MS Forms
M-004029,M037,M037-ZN02,08/16/2022 12:00:00 AM,AM,2022,8,Aug,34,Parks,Highbridge Park,10,,10,,,2,Manhattan,M-12A,ZONE,true,2022-08-18 14:24:40.0000000,M&O MS Forms
M-003933,M037,M037-ZN02,08/07/2022 12:00:00 AM,AM,2022,8,Aug,33,Parks,Highbridge Park,65,,65,,,2,Manhattan,M-12A,ZONE,true,2022-08-09 08:55:45.0000000,M&O MS Forms
M-003941,M037,M037-ZN02,08/08/2022 12:00:00 AM,AM,2022,8,Aug,33,Parks,Highbridge Park,50,,50,,,2,Manhattan,M-12A,ZONE,true,2022-08-09 08:58:02.0000000,M&O MS Forms
M-003959,M037,M037-ZN02,08/10/2022 12:00:00 AM,AM,2022,8,Aug,33,Parks,Highbridge Park,49,,49,,,2,Manhattan,M-12A,ZONE,true,2022-08-11 08:47:10.0000000,M&O MS Forms
M-003871,M037,M037-ZN03,08/01/2022 12:00:00 AM,AM,2022,8,Aug,32,Parks,Highbridge Park,35,,35,,,33,Manhattan,M-12A,ZONE,true,2022-08-04 15:27:37.0000000,M&O MS Forms
M-004440,M037,M037-ZN03,09/27/2022 12:00:00 AM,AM,2022,9,Sep,40,Parks,Highbridge Park,15,,15,,,33,Manhattan,M-12A,ZONE,true,2022-10-11 06:50:33.0000000,M&O MS Forms
M-004449,M037,M037-ZN03,09/28/2022 12:00:00 AM,AM,2022,9,Sep,40,Parks,Highbridge Park,17,,17,,,33,Manhattan,M-12A,ZONE,true,2022-10-11 06:58:13.0000000,M&O MS Forms
M-004431,M037,M037-ZN03,10/10/2022 12:00:00 AM,AM,2022,10,Oct,42,Parks,Highbridge Park,40,,40,,,33,Manhattan,M-12A,ZONE,true,2022-10-11 06:16:54.0000000,M&O MS Forms
M-004756,M037,M037-ZN03,10/30/2022 12:00:00 AM,AM,2022,10,Oct,45,Parks,Highbridge Park,25,,25,,,33,Manhattan,M-12A,ZONE,true,2022-11-05 13:57:50.0000000,M&O MS Forms
M-005773,M037,M037-ZN03,02/15/2023 12:00:00 AM,AM,2023,2,Feb,7,Parks,Highbridge Park,30,,30,,,33,Manhattan,M-12A,ZONE,true,2023-02-15 16:30:49.0000000,M&O MS Forms
M-004422,M037,M037-ZN03,10/09/2022 12:00:00 AM,AM,2022,10,Oct,42,Parks,Highbridge Park,45,,45,,,33,Manhattan,M-12A,ZONE,true,2022-10-11 06:12:54.0000000,M&O MS Forms
M-005764,M037,M037-ZN03,02/14/2023 12:00:00 AM,AM,2023,2,Feb,7,Parks,Highbridge Park,45,,45,,,33,Manhattan,M-12A,ZONE,true,2023-02-15 16:27:33.0000000,M&O MS Forms
M-005755,M037,M037-ZN03,02/13/2023 12:00:00 AM,AM,2023,2,Feb,7,Parks,Highbridge Park,50,,50,,,33,Manhattan,M-12A,ZONE,true,2023-02-14 05:48:16.0000000,M&O MS Forms
M-004765,M037,M037-ZN03,10/31/2022 12:00:00 AM,AM,2022,10,Oct,45,Parks,Highbridge Park,20,,20,,,33,Manhattan,M-12A,ZONE,true,2022-11-05 14:00:27.0000000,M&O MS Forms
M-005035,M037,M037-ZN03,11/26/2022 12:00:00 AM,AM,2022,11,Nov,48,Parks,Highbridge Park,21,,21,,,33,Manhattan,M-12A,ZONE,true,2022-11-27 11:11:43.0000000,M&O MS Forms
M-005746,M037,M037-ZN03,02/12/2023 12:00:00 AM,AM,2023,2,Feb,7,Parks,Highbridge Park,110,,110,,,33,Manhattan,M-12A,ZONE,true,2023-02-12 18:54:46.0000000,M&O MS Forms
M-003897,M037,M037-ZN03,08/04/2022 12:00:00 AM,AM,2022,8,Aug,32,Parks,Highbridge Park,36,,36,,,33,Manhattan,M-12A,ZONE,true,2022-08-04 15:35:16.0000000,M&O MS Forms
M-003925,M037,M037-ZN03,08/06/2022 12:00:00 AM,AM,2022,8,Aug,32,Parks,Highbridge Park,43,,43,,,33,Manhattan,M-12A,ZONE,true,2022-08-09 08:52:52.0000000,M&O MS Forms
M-003916,M037,M037-ZN03,08/05/2022 12:00:00 AM,AM,2022,8,Aug,32,Parks,Highbridge Park,30,,30,,,33,Manhattan,M-12A,ZONE,true,2022-08-09 08:50:11.0000000,M&O MS Forms
M-003951,M037,M037-ZN03,08/09/2022 12:00:00 AM,AM,2022,8,Aug,33,Parks,Highbridge Park,55,,55,,,33,Manhattan,M-12A,ZONE,true,2022-08-09 18:21:46.0000000,M&O MS Forms
M-003960,M037,M037-ZN03,08/10/2022 12:00:00 AM,AM,2022,8,Aug,33,Parks,Highbridge Park,25,,25,,,33,Manhattan,M-12A,ZONE,true,2022-08-11 08:47:50.0000000,M&O MS Forms
M-003942,M037,M037-ZN03,08/08/2022 12:00:00 AM,AM,2022,8,Aug,33,Parks,Highbridge Park,55,,55,,,33,Manhattan,M-12A,ZONE,true,2022-08-09 08:58:16.0000000,M&O MS Forms
M-003934,M037,M037-ZN03,08/07/2022 12:00:00 AM,AM,2022,8,Aug,33,Parks,Highbridge Park,53,,53,,,33,Manhattan,M-12A,ZONE,true,2022-08-09 08:56:00.0000000,M&O MS Forms
M-004030,M037,M037-ZN03,08/16/2022 12:00:00 AM,AM,2022,8,Aug,34,Parks,Highbridge Park,15,,15,,,33,Manhattan,M-12A,ZONE,true,2022-08-18 14:24:55.0000000,M&O MS Forms
M-004021,M037,M037-ZN03,08/15/2022 12:00:00 AM,AM,2022,8,Aug,34,Parks,Highbridge Park,22,,22,,,33,Manhattan,M-12A,ZONE,true,2022-08-18 14:22:27.0000000,M&O MS Forms
M-004012,M037,M037-ZN03,08/14/2022 12:00:00 AM,AM,2022,8,Aug,34,Parks,Highbridge Park,20,,20,,,33,Manhattan,M-12A,ZONE,true,2022-08-18 14:02:54.0000000,M&O MS Forms
M-003989,M037,M037-ZN03,08/12/2022 12:00:00 AM,AM,2022,8,Aug,33,Parks,Highbridge Park,46,,46,,,33,Manhattan,M-12A,ZONE,true,2022-08-15 10:06:07.0000000,M&O MS Forms
M-003997,M037,M037-ZN03,08/13/2022 12:00:00 AM,AM,2022,8,Aug,33,Parks,Highbridge Park,56,,56,,,33,Manhattan,M-12A,ZONE,true,2022-08-15 10:08:39.0000000,M&O MS Forms
M-003969,M037,M037-ZN03,08/11/2022 12:00:00 AM,AM,2022,8,Aug,33,Parks,Highbridge Park,37,,37,,,33,Manhattan,M-12A,ZONE,true,2022-08-11 16:12:37.0000000,M&O MS Forms
M-004043,M037,M037-ZN03,08/17/2022 12:00:00 AM,AM,2022,8,Aug,34,Parks,Highbridge Park,16,,16,,,33,Manhattan,M-12A,ZONE,true,2022-08-18 14:44:49.0000000,M&O MS Forms
M-004052,M037,M037-ZN03,08/18/2022 12:00:00 AM,AM,2022,8,Aug,34,Parks,Highbridge Park,25,,25,,,33,Manhattan,M-12A,ZONE,true,2022-08-18 14:47:25.0000000,M&O MS Forms
M-004064,M037,M037-ZN03,08/19/2022 12:00:00 AM,AM,2022,8,Aug,34,Parks,Highbridge Park,45,,45,,,33,Manhattan,M-12A,ZONE,true,2022-08-20 12:04:08.0000000,M&O MS Forms
M-004099,M037,M037-ZN03,08/22/2022 12:00:00 AM,AM,2022,8,Aug,35,Parks,Highbridge Park,32,,32,,,33,Manhattan,M-12A,ZONE,true,2022-08-28 17:17:23.0000000,M&O MS Forms
M-004090,M037,M037-ZN03,08/21/2022 12:00:00 AM,AM,2022,8,Aug,35,Parks,Highbridge Park,42,,42,,,33,Manhattan,M-12A,ZONE,true,2022-08-28 17:14:46.0000000,M&O MS Forms
M-004081,M037,M037-ZN03,08/20/2022 12:00:00 AM,AM,2022,8,Aug,34,Parks,Highbridge Park,50,,50,,,33,Manhattan,M-12A,ZONE,true,2022-08-28 17:11:21.0000000,M&O MS Forms
M-004198,M037,M037-ZN03,09/01/2022 12:00:00 AM,AM,2022,9,Sep,36,Parks,Highbridge Park,22,,22,,,33,Manhattan,M-12A,ZONE,true,2022-09-06 14:29:58.0000000,M&O MS Forms
M-005829,M037,M037-ZN03,02/21/2023 12:00:00 AM,AM,2023,2,Feb,8,Parks,Highbridge Park,5,,5,,,33,Manhattan,M-12A,ZONE,true,2023-02-22 10:40:27.0000000,M&O MS Forms
M-005851,M037,M037-ZN03,02/23/2023 12:00:00 AM,AM,2023,2,Feb,8,Parks,Highbridge Park,6,,6,,,33,Manhattan,M-12A,ZONE,true,2023-02-23 15:22:37.0000000,M&O MS Forms
M-005861,M037,M037-ZN03,02/24/2023 12:00:00 AM,AM,2023,2,Feb,8,Parks,Highbridge Park,8,,8,,,33,Manhattan,M-12A,ZONE,true,2023-02-24 18:49:56.0000000,M&O MS Forms
M-005841,M037,M037-ZN03,02/22/2023 12:00:00 AM,AM,2023,2,Feb,8,Parks,Highbridge Park,7,,7,,,33,Manhattan,M-12A,ZONE,true,2023-02-23 14:59:16.0000000,M&O MS Forms
M-005870,M037,M037-ZN03,02/25/2023 12:00:00 AM,AM,2023,2,Feb,8,Parks,Highbridge Park,9,,9,,,33,Manhattan,M-12A,ZONE,true,2023-02-26 12:02:37.0000000,M&O MS Forms
M-005879,M037,M037-ZN03,02/26/2023 12:00:00 AM,AM,2023,2,Feb,9,Parks,Highbridge Park,5,,5,,,33,Manhattan,M-12A,ZONE,true,2023-02-26 19:15:59.0000000,M&O MS Forms
M-005889,M037,M037-ZN03,02/26/2023 12:00:00 AM,AM,2023,2,Feb,9,Parks,Highbridge Park,5,,5,,,33,Manhattan,M-12A,ZONE,true,2023-03-01 05:31:34.0000000,M&O MS Forms
M-005898,M037,M037-ZN03,02/27/2023 12:00:00 AM,AM,2023,2,Feb,9,Parks,Highbridge Park,8,,8,,,33,Manhattan,M-12A,ZONE,true,2023-03-01 05:34:33.0000000,M&O MS Forms
M-005919,M037,M037-ZN03,03/02/2023 12:00:00 AM,AM,2023,3,Mar,9,Parks,Highbridge Park,10,,10,,,33,Manhattan,M-12A,ZONE,true,2023-03-04 13:25:00.0000000,M&O MS Forms
M-005927,M037,M037-ZN03,03/03/2023 12:00:00 AM,AM,2023,3,Mar,9,Parks,Highbridge Park,13,,13,,,33,Manhattan,M-12A,ZONE,true,2023-03-04 13:28:33.0000000,M&O MS Forms
M-005936,M037,M037-ZN03,03/04/2023 12:00:00 AM,AM,2023,3,Mar,9,Parks,Highbridge Park,7,,7,,,33,Manhattan,M-12A,ZONE,true,2023-03-04 13:31:59.0000000,M&O MS Forms
M-005945,M037,M037-ZN03,03/05/2023 12:00:00 AM,AM,2023,3,Mar,10,Parks,Highbridge Park,3,,3,,,33,Manhattan,M-12A,ZONE,true,2023-03-06 06:02:11.0000000,M&O MS Forms
M-005909,M037,M037-ZN03,03/01/2023 12:00:00 AM,AM,2023,3,Mar,9,Parks,Highbridge Park,4,,4,,,33,Manhattan,M-12A,ZONE,true,2023-03-01 15:45:44.0000000,M&O MS Forms
M-005962,M037,M037-ZN03,03/06/2023 12:00:00 AM,AM,2023,3,Mar,10,Parks,Highbridge Park,5,,5,,,33,Manhattan,M-12A,ZONE,true,2023-03-06 17:33:48.0000000,M&O MS Forms
M-005963,M037,M037-ZN03,03/06/2023 12:00:00 AM,AM,2023,3,Mar,10,Parks,Highbridge Park,15,,15,,,33,Manhattan,M-12A,ZONE,true,2023-03-06 17:34:11.0000000,M&O MS Forms
M-005971,M037,M037-ZN03,03/07/2023 12:00:00 AM,AM,2023,3,Mar,10,Parks,Highbridge Park,7,,7,,,33,Manhattan,M-12A,ZONE,true,2023-03-07 15:46:02.0000000,M&O MS Forms
M-006001,M037,M037-ZN03,03/10/2023 12:00:00 AM,AM,2023,3,Mar,10,Parks,Highbridge Park,10,,10,,,33,Manhattan,M-12A,ZONE,true,2023-03-11 15:57:37.0000000,M&O MS Forms
M-006010,M037,M037-ZN03,03/11/2023 12:00:00 AM,AM,2023,3,Mar,10,Parks,Highbridge Park,11,,11,,,33,Manhattan,M-12A,ZONE,true,2023-03-11 16:02:51.0000000,M&O MS Forms
M-006020,M037,M037-ZN03,03/12/2023 12:00:00 AM,AM,2023,3,Mar,11,Parks,Highbridge Park,3,,3,,,33,Manhattan,M-12A,ZONE,true,2023-03-12 17:21:32.0000000,M&O MS Forms
M-005982,M037,M037-ZN03,03/08/2023 12:00:00 AM,AM,2023,3,Mar,10,Parks,Highbridge Park,2,,2,,,33,Manhattan,M-12A,ZONE,true,2023-03-08 15:44:37.0000000,M&O MS Forms
M-000426,M037,M037-ZN03,06/21/2021 12:00:00 AM,AM,2021,6,Jun,26,Parks,Highbridge Park,25,,25,,,33,Manhattan,M-12A,ZONE,true,2021-06-25 19:55:36.0000000,M&O MS Forms
M-000415,M037,M037-ZN03,06/17/2021 12:00:00 AM,AM,2021,6,Jun,25,Parks,Highbridge Park,16,,16,,,33,Manhattan,M-12A,ZONE,true,2021-06-19 08:14:05.0000000,M&O MS Forms
M-000418,M037,M037-ZN03,06/18/2021 12:00:00 AM,AM,2021,6,Jun,25,Parks,Highbridge Park,14,,14,,,33,Manhattan,M-12A,ZONE,true,2021-06-19 08:14:50.0000000,M&O MS Forms
M-000423,M037,M037-ZN03,06/20/2021 12:00:00 AM,AM,2021,6,Jun,26,BBP,Highbridge Park,16,,16,,,33,Manhattan,M-12A,ZONE,true,2021-06-25 19:54:21.0000000,M&O MS Forms
M-000386,M037,M037-ZN03,06/08/2021 12:00:00 AM,AM,2021,6,Jun,24,BBP,Highbridge Park,155,,155,,,33,Manhattan,M-12A,ZONE,true,2021-06-11 17:41:41.0000000,M&O MS Forms
M-000380,M037,M037-ZN03,06/06/2021 12:00:00 AM,AM,2021,6,Jun,24,Parks,Highbridge Park,70,,70,,,33,Manhattan,M-12A,ZONE,true,2021-06-11 17:38:01.0000000,M&O MS Forms
M-000397,M037,M037-ZN03,06/11/2021 12:00:00 AM,AM,2021,6,Jun,24,Parks,Highbridge Park,9,,9,,,33,Manhattan,M-12A,ZONE,true,2021-06-11 17:46:29.0000000,M&O MS Forms
M-000392,M037,M037-ZN03,06/10/2021 12:00:00 AM,AM,2021,6,Jun,24,Parks,Highbridge Park,40,,40,,,33,Manhattan,M-12A,ZONE,true,2021-06-11 17:44:32.0000000,M&O MS Forms
M-000389,M037,M037-ZN03,06/09/2021 12:00:00 AM,AM,2021,6,Jun,24,BBP,Highbridge Park,58,,58,,,33,Manhattan,M-12A,ZONE,true,2021-06-11 17:43:12.0000000,M&O MS Forms
M-000402,M037,M037-ZN03,06/13/2021 12:00:00 AM,AM,2021,6,Jun,25,Parks,Highbridge Park,14,,14,,,33,Manhattan,M-12A,ZONE,true,2021-06-19 08:08:45.0000000,M&O MS Forms
M-000406,M037,M037-ZN03,06/14/2021 12:00:00 AM,AM,2021,6,Jun,25,Parks,Highbridge Park,16,,16,,,33,Manhattan,M-12A,ZONE,true,2021-06-19 08:10:18.0000000,M&O MS Forms
M-000409,M037,M037-ZN03,06/15/2021 12:00:00 AM,AM,2021,6,Jun,25,BBP,Highbridge Park,59,,59,,,33,Manhattan,M-12A,ZONE,true,2021-06-19 08:11:49.0000000,M&O MS Forms
M-000412,M037,M037-ZN03,06/16/2021 12:00:00 AM,AM,2021,6,Jun,25,BBP,Highbridge Park,82,,82,,,33,Manhattan,M-12A,ZONE,true,2021-06-19 08:12:46.0000000,M&O MS Forms
M-001089,M037,M037-ZN03,10/17/2021 12:00:00 AM,AM,2021,10,Oct,43,Parks,Highbridge Park,10,,10,,,33,Manhattan,M-12A,ZONE,true,2021-10-18 09:48:03.0000000,M&O MS Forms
M-001049,M037,M037-ZN03,10/15/2021 12:00:00 AM,AM,2021,10,Oct,42,Parks,Highbridge Park,35,,35,,,33,Manhattan,M-12A,ZONE,true,2021-10-15 16:48:59.0000000,M&O MS Forms
M-001048,M037,M037-ZN03,10/14/2021 12:00:00 AM,AM,2021,10,Oct,42,Parks,Highbridge Park,24,,24,,,33,Manhattan,M-12A,ZONE,true,2021-10-15 16:48:33.0000000,M&O MS Forms
M-001047,M037,M037-ZN03,10/13/2021 12:00:00 AM,AM,2021,10,Oct,42,Parks,Highbridge Park,17,,17,,,33,Manhattan,M-12A,ZONE,true,2021-10-15 16:48:12.0000000,M&O MS Forms
M-001046,M037,M037-ZN03,10/12/2021 12:00:00 AM,AM,2021,10,Oct,42,Parks,Highbridge Park,18,,18,,,33,Manhattan,M-12A,ZONE,true,2021-10-15 16:47:49.0000000,M&O MS Forms
M-001045,M037,M037-ZN03,10/11/2021 12:00:00 AM,AM,2021,10,Oct,42,Parks,Highbridge Park,20,,20,,,33,Manhattan,M-12A,ZONE,true,2021-10-15 16:47:28.0000000,M&O MS Forms
M-001044,M037,M037-ZN03,10/10/2021 12:00:00 AM,AM,2021,10,Oct,42,Parks,Highbridge Park,25,,25,,,33,Manhattan,M-12A,ZONE,true,2021-10-15 16:47:07.0000000,M&O MS Forms
M-001097,M037,M037-ZN03,10/16/2021 12:00:00 AM,AM,2021,10,Oct,42,Parks,Highbridge Park,40,,40,,,33,Manhattan,M-12A,ZONE,true,2021-10-18 10:02:20.0000000,M&O MS Forms
M-001104,M037,M037-ZN03,10/18/2021 12:00:00 AM,AM,2021,10,Oct,43,Parks,Highbridge Park,5,,5,,,33,Manhattan,M-12A,ZONE,true,2021-10-18 19:05:04.0000000,M&O MS Forms
M-001112,M037,M037-ZN03,10/18/2021 12:00:00 AM,AM,2021,10,Oct,43,Parks,Highbridge Park,5,,5,,,33,Manhattan,M-12A,ZONE,true,2021-10-21 16:42:15.0000000,M&O MS Forms
M-001118,M037,M037-ZN03,10/19/2021 12:00:00 AM,AM,2021,10,Oct,43,Parks,Highbridge Park,20,,20,,,33,Manhattan,M-12A,ZONE,true,2021-10-21 16:45:12.0000000,M&O MS Forms
M-001137,M037,M037-ZN03,10/22/2021 12:00:00 AM,AM,2021,10,Oct,43,Parks,Highbridge Park,55,,55,,,33,Manhattan,M-12A,ZONE,true,2021-10-22 16:06:58.0000000,M&O MS Forms
M-001131,M037,M037-ZN03,10/21/2021 12:00:00 AM,AM,2021,10,Oct,43,Parks,Highbridge Park,15,,15,,,33,Manhattan,M-12A,ZONE,true,2021-10-21 16:50:25.0000000,M&O MS Forms
M-001126,M037,M037-ZN03,10/20/2021 12:00:00 AM,AM,2021,10,Oct,43,Parks,Highbridge Park,16,,16,,,33,Manhattan,M-12A,ZONE,true,2021-10-21 16:48:39.0000000,M&O MS Forms
M-001147,M037,M037-ZN03,10/23/2021 12:00:00 AM,AM,2021,10,Oct,43,Parks,Highbridge Park,60,,60,,,33,Manhattan,M-12A,ZONE,true,2021-10-24 20:20:33.0000000,M&O MS Forms
M-001163,M037,M037-ZN03,10/25/2021 12:00:00 AM,PM,2021,10,Oct,44,Parks,Highbridge Park,5,,5,,,33,Manhattan,M-12A,ZONE,true,2021-10-29 16:20:50.0000000,M&O MS Forms
M-001171,M037,M037-ZN03,10/26/2021 12:00:00 AM,AM,2021,10,Oct,44,Parks,Highbridge Park,6,,6,,,33,Manhattan,M-12A,ZONE,true,2021-10-29 16:23:20.0000000,M&O MS Forms
M-001304,M037,M037-ZN03,11/11/2021 12:00:00 AM,AM,2021,11,Nov,46,Parks,Highbridge Park,29,,29,,,33,Manhattan,M-12A,ZONE,true,2021-11-12 15:58:57.0000000,M&O MS Forms
M-001295,M037,M037-ZN03,11/10/2021 12:00:00 AM,AM,2021,11,Nov,46,Parks,Highbridge Park,28,,28,,,33,Manhattan,M-12A,ZONE,true,2021-11-12 15:55:33.0000000,M&O MS Forms
M-003809,M037,M037-ZN03,07/25/2022 12:00:00 AM,AM,2022,7,Jul,31,Parks,Highbridge Park,65,,65,,,33,Manhattan,M-12A,ZONE,true,2022-07-29 15:57:47.0000000,M&O MS Forms
M-003762,M037,M037-ZN03,07/20/2022 12:00:00 AM,AM,2022,7,Jul,30,Parks,Highbridge Park,18,,18,,,33,Manhattan,M-12A,ZONE,true,2022-07-23 15:29:32.0000000,M&O MS Forms
M-003780,M037,M037-ZN03,07/22/2022 12:00:00 AM,AM,2022,7,Jul,30,Parks,Highbridge Park,32,,32,,,33,Manhattan,M-12A,ZONE,true,2022-07-23 15:35:43.0000000,M&O MS Forms
M-003771,M037,M037-ZN03,07/21/2022 12:00:00 AM,AM,2022,7,Jul,30,Parks,Highbridge Park,21,,21,,,33,Manhattan,M-12A,ZONE,true,2022-07-23 15:32:51.0000000,M&O MS Forms
M-004605,M037,M037-ZN03,10/17/2022 12:00:00 AM,AM,2022,10,Oct,43,Parks,Highbridge Park,25,,25,,,33,Manhattan,M-12A,ZONE,true,2022-10-19 06:38:53.0000000,M&O MS Forms
M-004596,M037,M037-ZN03,10/16/2022 12:00:00 AM,AM,2022,10,Oct,43,Parks,Highbridge Park,15,,15,,,33,Manhattan,M-12A,ZONE,true,2022-10-19 06:22:21.0000000,M&O MS Forms
M-003862,M037,M037-ZN03,07/31/2022 12:00:00 AM,AM,2022,7,Jul,32,Parks,Highbridge Park,28,,28,,,33,Manhattan,M-12A,ZONE,true,2022-07-31 16:57:14.0000000,M&O MS Forms
M-003853,M037,M037-ZN03,07/30/2022 12:00:00 AM,AM,2022,7,Jul,31,Parks,Highbridge Park,36,,36,,,33,Manhattan,M-12A,ZONE,true,2022-07-31 09:41:42.0000000,M&O MS Forms
M-003835,M037,M037-ZN03,07/28/2022 12:00:00 AM,AM,2022,7,Jul,31,Parks,Highbridge Park,22,,22,,,33,Manhattan,M-12A,ZONE,true,2022-07-29 16:06:08.0000000,M&O MS Forms
M-003844,M037,M037-ZN03,07/29/2022 12:00:00 AM,AM,2022,7,Jul,31,Parks,Highbridge Park,25,,25,,,33,Manhattan,M-12A,ZONE,true,2022-07-29 16:12:32.0000000,M&O MS Forms
M-003827,M037,M037-ZN03,07/27/2022 12:00:00 AM,AM,2022,7,Jul,31,Parks,Highbridge Park,15,,15,,,33,Manhattan,M-12A,ZONE,true,2022-07-29 16:03:42.0000000,M&O MS Forms
M-003818,M037,M037-ZN03,07/26/2022 12:00:00 AM,AM,2022,7,Jul,31,Parks,Highbridge Park,36,,36,,,33,Manhattan,M-12A,ZONE,true,2022-07-29 16:00:44.0000000,M&O MS Forms
M-004723,M037,M037-ZN03,10/28/2022 12:00:00 AM,AM,2022,10,Oct,44,Parks,Highbridge Park,16,,16,,,33,Manhattan,M-12A,ZONE,true,2022-10-30 13:20:44.0000000,M&O MS Forms
M-004697,M037,M037-ZN03,10/26/2022 12:00:00 AM,AM,2022,10,Oct,44,Parks,Highbridge Park,5,,5,,,33,Manhattan,M-12A,ZONE,true,2022-10-27 05:26:10.0000000,M&O MS Forms
M-004714,M037,M037-ZN03,10/20/2022 12:00:00 AM,AM,2022,10,Oct,43,Parks,Highbridge Park,17,,17,,,33,Manhattan,M-12A,ZONE,true,2022-10-30 13:13:38.0000000,M&O MS Forms
M-004688,M037,M037-ZN03,10/25/2022 12:00:00 AM,AM,2022,10,Oct,44,Parks,Highbridge Park,5,,5,,,33,Manhattan,M-12A,ZONE,true,2022-10-26 05:49:58.0000000,M&O MS Forms
M-004679,M037,M037-ZN03,10/24/2022 12:00:00 AM,AM,2022,10,Oct,44,Parks,Highbridge Park,3,,3,,,33,Manhattan,M-12A,ZONE,true,2022-10-25 06:31:59.0000000,M&O MS Forms
M-004670,M037,M037-ZN03,10/23/2022 12:00:00 AM,AM,2022,10,Oct,44,Parks,Highbridge Park,5,,5,,,33,Manhattan,M-12A,ZONE,true,2022-10-25 06:24:10.0000000,M&O MS Forms
M-004661,M037,M037-ZN03,10/22/2022 12:00:00 AM,AM,2022,10,Oct,43,Parks,Highbridge Park,30,,30,,,33,Manhattan,M-12A,ZONE,true,2022-10-25 06:14:12.0000000,M&O MS Forms
M-004652,M037,M037-ZN03,10/21/2022 12:00:00 AM,AM,2022,10,Oct,43,Parks,Highbridge Park,21,,21,,,33,Manhattan,M-12A,ZONE,true,2022-10-25 06:11:49.0000000,M&O MS Forms
M-004643,M037,M037-ZN03,10/20/2022 12:00:00 AM,AM,2022,10,Oct,43,Parks,Highbridge Park,17,,17,,,33,Manhattan,M-12A,ZONE,true,2022-10-25 06:09:17.0000000,M&O MS Forms
M-004634,M037,M037-ZN03,10/19/2022 12:00:00 AM,AM,2022,10,Oct,43,Parks,Highbridge Park,14,,14,,,33,Manhattan,M-12A,ZONE,true,2022-10-25 06:06:49.0000000,M&O MS Forms
M-004625,M037,M037-ZN03,10/18/2022 12:00:00 AM,AM,2022,10,Oct,43,Parks,Highbridge Park,20,,20,,,33,Manhattan,M-12A,ZONE,true,2022-10-25 06:04:12.0000000,M&O MS Forms
M-001735,M037,M037-ZN03,12/20/2021 12:00:00 AM,AM,2021,12,Dec,52,Parks,Highbridge Park,6,,6,,,33,Manhattan,M-12A,ZONE,true,2021-12-21 16:07:32.0000000,M&O MS Forms
M-001762,M037,M037-ZN03,12/22/2021 12:00:00 AM,AM,2021,12,Dec,52,Parks,Highbridge Park,8,,8,,,33,Manhattan,M-12A,ZONE,true,2021-12-23 15:42:36.0000000,M&O MS Forms
M-001774,M037,M037-ZN03,12/23/2021 12:00:00 AM,AM,2021,12,Dec,52,Parks,Highbridge Park,7,,7,,,33,Manhattan,M-12A,ZONE,true,2021-12-23 15:50:12.0000000,M&O MS Forms
M-001783,M037,M037-ZN03,12/24/2021 12:00:00 AM,AM,2021,12,Dec,52,Parks,Highbridge Park,9,,9,,,33,Manhattan,M-12A,ZONE,true,2021-12-26 12:13:01.0000000,M&O MS Forms
M-001793,M037,M037-ZN03,12/25/2021 12:00:00 AM,AM,2021,12,Dec,52,Parks,Highbridge Park,7,,7,,,33,Manhattan,M-12A,ZONE,true,2021-12-26 12:16:30.0000000,M&O MS Forms
M-001801,M037,M037-ZN03,12/26/2021 12:00:00 AM,AM,2021,12,Dec,53,Parks,Highbridge Park,4,,4,,,33,Manhattan,M-12A,ZONE,true,2021-12-27 16:01:06.0000000,M&O MS Forms
M-001812,M037,M037-ZN03,12/27/2021 12:00:00 AM,AM,2021,12,Dec,53,Parks,Highbridge Park,5,,5,,,33,Manhattan,M-12A,ZONE,true,2021-12-27 16:06:57.0000000,M&O MS Forms
M-001813,M037,M037-ZN03,12/27/2021 12:00:00 AM,AM,2021,12,Dec,53,Parks,Highbridge Park,5,,5,,,33,Manhattan,M-12A,ZONE,true,2021-12-27 16:07:38.0000000,M&O MS Forms
M-001833,M037,M037-ZN03,12/29/2021 12:00:00 AM,AM,2021,12,Dec,53,Parks,Highbridge Park,3,,3,,,33,Manhattan,M-12A,ZONE,true,2021-12-29 16:30:20.0000000,M&O MS Forms
M-003342,M037,M037-ZN04,06/04/2022 12:00:00 AM,AM,2022,6,Jun,23,Parks,Highbridge Park,15,,15,,,34,Manhattan,M-12A,ZONE,true,2022-06-06 19:33:24.0000000,M&O MS Forms
M-003351,M037,M037-ZN04,06/05/2022 12:00:00 AM,AM,2022,6,Jun,24,Parks,Highbridge Park,12,,12,,,34,Manhattan,M-12A,ZONE,true,2022-06-06 19:43:18.0000000,M&O MS Forms
M-003360,M037,M037-ZN04,06/06/2022 12:00:00 AM,AM,2022,6,Jun,24,Parks,Highbridge Park,10,,10,,,34,Manhattan,M-12A,ZONE,true,2022-06-06 19:46:23.0000000,M&O MS Forms
M-003232,M037,M037-ZN04,05/26/2022 12:00:00 AM,AM,2022,5,May,22,Parks,Highbridge Park,5,,5,,,34,Manhattan,M-12A,ZONE,true,2022-05-28 10:53:50.0000000,M&O MS Forms
M-003241,M037,M037-ZN04,05/27/2022 12:00:00 AM,AM,2022,5,May,22,Parks,Highbridge Park,20,,20,,,34,Manhattan,M-12A,ZONE,true,2022-05-28 10:56:27.0000000,M&O MS Forms
M-003253,M037,M037-ZN04,05/28/2022 12:00:00 AM,AM,2022,5,May,22,Parks,Highbridge Park,23,,23,,,34,Manhattan,M-12A,ZONE,true,2022-05-30 10:35:49.0000000,M&O MS Forms
M-003262,M037,M037-ZN04,05/29/2022 12:00:00 AM,AM,2022,5,May,23,Parks,Highbridge Park,10,,10,,,34,Manhattan,M-12A,ZONE,true,2022-05-30 10:39:02.0000000,M&O MS Forms
M-003297,M037,M037-ZN04,05/30/2022 12:00:00 AM,AM,2022,5,May,23,Parks,Highbridge Park,9,,9,,,34,Manhattan,M-12A,ZONE,true,2022-06-06 19:14:36.0000000,M&O MS Forms
M-000039,M037,M037-ZN04,04/05/2021 12:00:00 AM,AM,2021,4,Apr,15,Parks,Highbridge Park,6,,6,,,34,Manhattan,M-12A,ZONE,true,2021-04-11 00:29:00.0000000,M&O MS Forms
M-001727,M037,M037-ZN04,12/19/2021 12:00:00 AM,AM,2021,12,Dec,52,Parks,Highbridge Park,15,,15,,,34,Manhattan,M-12A,ZONE,true,2021-12-21 16:05:14.0000000,M&O MS Forms
M-001861,M037,M037-ZN04,12/31/2021 12:00:00 AM,AM,2021,12,Dec,53,Parks,Highbridge Park,10,,10,,,34,Manhattan,M-12A,ZONE,true,2021-12-31 19:58:59.0000000,M&O MS Forms
M-001847,M037,M037-ZN04,12/30/2021 12:00:00 AM,AM,2021,12,Dec,53,Parks,Highbridge Park,5,,5,,,34,Manhattan,M-12A,ZONE,true,2021-12-30 15:53:40.0000000,M&O MS Forms
M-001822,M037,M037-ZN04,12/28/2021 12:00:00 AM,AM,2021,12,Dec,53,Parks,Highbridge Park,8,,8,,,34,Manhattan,M-12A,ZONE,true,2021-12-28 15:32:31.0000000,M&O MS Forms
M-001834,M037,M037-ZN04,12/29/2021 12:00:00 AM,AM,2021,12,Dec,53,Parks,Highbridge Park,8,,8,,,34,Manhattan,M-12A,ZONE,true,2021-12-29 16:30:36.0000000,M&O MS Forms
M-001835,M037,M037-ZN04,12/29/2021 12:00:00 AM,AM,2021,12,Dec,53,Parks,Highbridge Park,8,,8,,,34,Manhattan,M-12A,ZONE,true,2021-12-29 16:31:03.0000000,M&O MS Forms
M-001814,M037,M037-ZN04,12/27/2021 12:00:00 AM,AM,2021,12,Dec,53,Parks,Highbridge Park,8,,8,,,34,Manhattan,M-12A,ZONE,true,2021-12-27 16:08:24.0000000,M&O MS Forms
M-001802,M037,M037-ZN04,12/26/2021 12:00:00 AM,AM,2021,12,Dec,53,Parks,Highbridge Park,3,,3,,,34,Manhattan,M-12A,ZONE,true,2021-12-27 16:01:48.0000000,M&O MS Forms
M-001803,M037,M037-ZN04,12/26/2021 12:00:00 AM,AM,2021,12,Dec,53,Parks,Highbridge Park,3,,3,,,34,Manhattan,M-12A,ZONE,true,2021-12-27 16:01:55.0000000,M&O MS Forms
M-001794,M037,M037-ZN04,12/25/2021 12:00:00 AM,AM,2021,12,Dec,52,Parks,Highbridge Park,12,,12,,,34,Manhattan,M-12A,ZONE,true,2021-12-26 12:16:49.0000000,M&O MS Forms
M-001784,M037,M037-ZN04,12/24/2021 12:00:00 AM,AM,2021,12,Dec,52,Parks,Highbridge Park,21,,21,,,34,Manhattan,M-12A,ZONE,true,2021-12-26 12:13:22.0000000,M&O MS Forms
M-001775,M037,M037-ZN04,12/23/2021 12:00:00 AM,AM,2021,12,Dec,52,Parks,Highbridge Park,27,,27,,,34,Manhattan,M-12A,ZONE,true,2021-12-23 15:51:23.0000000,M&O MS Forms
M-001763,M037,M037-ZN04,12/22/2021 12:00:00 AM,AM,2021,12,Dec,52,Parks,Highbridge Park,38,,38,,,34,Manhattan,M-12A,ZONE,true,2021-12-23 15:43:48.0000000,M&O MS Forms
M-001764,M037,M037-ZN04,12/22/2021 12:00:00 AM,AM,2021,12,Dec,52,Parks,Highbridge Park,38,,38,,,34,Manhattan,M-12A,ZONE,true,2021-12-23 15:43:49.0000000,M&O MS Forms
M-001736,M037,M037-ZN04,12/20/2021 12:00:00 AM,AM,2021,12,Dec,52,Parks,Highbridge Park,18,,18,,,34,Manhattan,M-12A,ZONE,true,2021-12-21 16:07:50.0000000,M&O MS Forms
M-001743,M037,M037-ZN04,12/21/2021 12:00:00 AM,AM,2021,12,Dec,52,Parks,Highbridge Park,34,,34,,,34,Manhattan,M-12A,ZONE,true,2021-12-21 16:09:44.0000000,M&O MS Forms
M-004626,M037,M037-ZN04,10/18/2022 12:00:00 AM,AM,2022,10,Oct,43,Parks,Highbridge Park,10,,10,,,34,Manhattan,M-12A,ZONE,true,2022-10-25 06:04:29.0000000,M&O MS Forms
M-004635,M037,M037-ZN04,10/19/2022 12:00:00 AM,AM,2022,10,Oct,43,Parks,Highbridge Park,15,,15,,,34,Manhattan,M-12A,ZONE,true,2022-10-25 06:07:06.0000000,M&O MS Forms
M-004644,M037,M037-ZN04,10/20/2022 12:00:00 AM,AM,2022,10,Oct,43,Parks,Highbridge Park,20,,20,,,34,Manhattan,M-12A,ZONE,true,2022-10-25 06:09:33.0000000,M&O MS Forms
M-004653,M037,M037-ZN04,10/21/2022 12:00:00 AM,AM,2022,10,Oct,43,Parks,Highbridge Park,18,,18,,,34,Manhattan,M-12A,ZONE,true,2022-10-25 06:12:05.0000000,M&O MS Forms
M-004662,M037,M037-ZN04,10/22/2022 12:00:00 AM,AM,2022,10,Oct,43,Parks,Highbridge Park,20,,20,,,34,Manhattan,M-12A,ZONE,true,2022-10-25 06:14:28.0000000,M&O MS Forms
M-004671,M037,M037-ZN04,10/23/2022 12:00:00 AM,AM,2022,10,Oct,44,Parks,Highbridge Park,2,,2,,,34,Manhattan,M-12A,ZONE,true,2022-10-25 06:24:27.0000000,M&O MS Forms
M-004689,M037,M037-ZN04,10/25/2022 12:00:00 AM,AM,2022,10,Oct,44,Parks,Highbridge Park,15,,15,,,34,Manhattan,M-12A,ZONE,true,2022-10-26 05:50:14.0000000,M&O MS Forms
M-000867,M037,M037-ZN04,09/13/2021 12:00:00 AM,AM,2021,9,Sep,38,Parks,Highbridge Park,13,,13,,,34,Manhattan,M-12A,ZONE,true,2021-09-18 05:50:15.0000000,M&O MS Forms
M-000765,M037,M037-ZN04,08/15/2021 12:00:00 AM,AM,2021,8,Aug,34,Parks,Highbridge Park,4,,4,,,34,Manhattan,M-12A,ZONE,true,2021-08-24 17:02:11.0000000,M&O MS Forms
M-001238,M037,M037-ZN04,11/04/2021 12:00:00 AM,AM,2021,11,Nov,45,Parks,Highbridge Park,218,,218,,,34,Manhattan,M-12A,ZONE,true,2021-11-05 16:08:36.0000000,M&O MS Forms
M-001247,M037,M037-ZN04,11/05/2021 12:00:00 AM,AM,2021,11,Nov,45,Parks,Highbridge Park,67,,67,,,34,Manhattan,M-12A,ZONE,true,2021-11-05 16:11:06.0000000,M&O MS Forms
M-001269,M037,M037-ZN04,11/07/2021 12:00:00 AM,AM,2021,11,Nov,46,Parks,Highbridge Park,10,,10,,,34,Manhattan,M-12A,ZONE,true,2021-11-12 15:46:35.0000000,M&O MS Forms
M-001278,M037,M037-ZN04,11/08/2021 12:00:00 AM,AM,2021,11,Nov,46,Parks,Highbridge Park,8,,8,,,34,Manhattan,M-12A,ZONE,true,2021-11-12 15:50:01.0000000,M&O MS Forms
M-001287,M037,M037-ZN04,11/09/2021 12:00:00 AM,AM,2021,11,Nov,46,Parks,Highbridge Park,10,,10,,,34,Manhattan,M-12A,ZONE,true,2021-11-12 15:52:46.0000000,M&O MS Forms
M-001296,M037,M037-ZN04,11/10/2021 12:00:00 AM,AM,2021,11,Nov,46,Parks,Highbridge Park,50,,50,,,34,Manhattan,M-12A,ZONE,true,2021-11-12 15:55:51.0000000,M&O MS Forms
M-001305,M037,M037-ZN04,11/11/2021 12:00:00 AM,AM,2021,11,Nov,46,Parks,Highbridge Park,15,,15,,,34,Manhattan,M-12A,ZONE,true,2021-11-12 15:59:29.0000000,M&O MS Forms
M-000395,M037,M037-ZN04,06/10/2021 12:00:00 AM,AM,2021,6,Jun,24,Parks,Highbridge Park,14,,14,,,34,Manhattan,M-12A,ZONE,true,2021-06-11 17:45:35.0000000,M&O MS Forms
M-000382,M037,M037-ZN04,06/06/2021 12:00:00 AM,AM,2021,6,Jun,24,Parks,Highbridge Park,9,,9,,,34,Manhattan,M-12A,ZONE,true,2021-06-11 17:38:44.0000000,M&O MS Forms
M-000356,M037,M037-ZN04,06/02/2021 12:00:00 AM,AM,2021,6,Jun,23,Parks,Highbridge Park,27,,27,,,34,Manhattan,M-12A,ZONE,true,2021-06-05 09:01:21.0000000,M&O MS Forms
M-000183,M037,M037-ZN04,05/02/2021 12:00:00 AM,AM,2021,5,May,19,Parks,Highbridge Park,8,,8,,,34,Manhattan,M-12A,ZONE,true,2021-05-07 19:38:39.0000000,M&O MS Forms
M-000189,M037,M037-ZN04,05/04/2021 12:00:00 AM,AM,2021,5,May,19,Parks,Highbridge Park,12,,12,,,34,Manhattan,M-12A,ZONE,true,2021-05-07 19:41:32.0000000,M&O MS Forms
M-000198,M037,M037-ZN04,05/07/2021 12:00:00 AM,AM,2021,5,May,19,Parks,Highbridge Park,7,,7,,,34,Manhattan,M-12A,ZONE,true,2021-05-07 19:46:48.0000000,M&O MS Forms
M-000220,M037,M037-ZN04,05/10/2021 12:00:00 AM,AM,2021,5,May,20,Parks,Highbridge Park,10,,10,,,34,Manhattan,M-12A,ZONE,true,2021-05-15 07:49:12.0000000,M&O MS Forms
M-000675,M037,M037-ZN04,08/12/2021 12:00:00 AM,AM,2021,8,Aug,33,Parks,Highbridge Park,10,,10,,,34,Manhattan,M-12A,ZONE,true,2021-08-14 06:41:07.0000000,M&O MS Forms
M-000628,M037,M037-ZN04,08/02/2021 12:00:00 AM,AM,2021,8,Aug,32,Parks,Highbridge Park,5,,5,,,34,Manhattan,M-12A,ZONE,true,2021-08-09 08:08:30.0000000,M&O MS Forms
M-000531,M037,M037-ZN04,07/15/2021 12:00:00 AM,AM,2021,7,Jul,29,Parks,Highbridge Park,4,,4,,,34,Manhattan,M-12A,ZONE,true,2021-07-21 18:29:33.0000000,M&O MS Forms
M-000472,M037,M037-ZN04,07/02/2021 12:00:00 AM,AM,2021,7,Jul,27,Parks,Highbridge Park,4,,4,,,34,Manhattan,M-12A,ZONE,true,2021-07-04 04:45:36.0000000,M&O MS Forms
M-000466,M037,M037-ZN04,07/01/2021 12:00:00 AM,AM,2021,7,Jul,27,Parks,Highbridge Park,4,,4,,,34,Manhattan,M-12A,ZONE,true,2021-07-04 04:43:34.0000000,M&O MS Forms
M-000465,M037,M037-ZN04,06/30/2021 12:00:00 AM,AM,2021,6,Jun,27,Parks,Highbridge Park,4,,4,,,34,Manhattan,M-12A,ZONE,true,2021-07-04 04:42:58.0000000,M&O MS Forms
M-000455,M037,M037-ZN04,06/28/2021 12:00:00 AM,AM,2021,6,Jun,27,Parks,Highbridge Park,14,,14,,,34,Manhattan,M-12A,ZONE,true,2021-07-04 04:38:56.0000000,M&O MS Forms
M-000490,M037,M037-ZN04,07/05/2021 12:00:00 AM,PM,2021,7,Jul,28,Parks,Highbridge Park,6,,6,,,34,Manhattan,M-12A,ZONE,true,2021-07-10 05:19:32.0000000,M&O MS Forms
M-000516,M037,M037-ZN04,07/12/2021 12:00:00 AM,AM,2021,7,Jul,29,Parks,Highbridge Park,10,,10,,,34,Manhattan,M-12A,ZONE,true,2021-07-21 18:22:54.0000000,M&O MS Forms
M-000504,M037,M037-ZN04,07/08/2021 12:00:00 AM,AM,2021,7,Jul,28,Parks,Highbridge Park,3,,3,,,34,Manhattan,M-12A,ZONE,true,2021-07-10 05:53:28.0000000,M&O MS Forms
M-001314,M037,M037-ZN04,11/12/2021 12:00:00 AM,AM,2021,11,Nov,46,Parks,Highbridge Park,16,,16,,,34,Manhattan,M-12A,ZONE,true,2021-11-12 16:04:15.0000000,M&O MS Forms
M-001323,M037,M037-ZN04,11/13/2021 12:00:00 AM,AM,2021,11,Nov,46,Parks,Highbridge Park,19,,19,,,34,Manhattan,M-12A,ZONE,true,2021-11-13 15:53:12.0000000,M&O MS Forms
M-001353,M037,M037-ZN04,11/15/2021 12:00:00 AM,AM,2021,11,Nov,47,Parks,Highbridge Park,28,,28,,,34,Manhattan,M-12A,ZONE,true,2021-11-18 16:38:13.0000000,M&O MS Forms
M-001343,M037,M037-ZN04,11/14/2021 12:00:00 AM,AM,2021,11,Nov,47,Parks,Highbridge Park,25,,25,,,34,Manhattan,M-12A,ZONE,true,2021-11-18 16:32:30.0000000,M&O MS Forms
M-001363,M037,M037-ZN04,11/16/2021 12:00:00 AM,AM,2021,11,Nov,47,Parks,Highbridge Park,50,,50,,,34,Manhattan,M-12A,ZONE,true,2021-11-18 16:55:45.0000000,M&O MS Forms
M-001372,M037,M037-ZN04,11/17/2021 12:00:00 AM,AM,2021,11,Nov,47,Parks,Highbridge Park,39,,39,,,34,Manhattan,M-12A,ZONE,true,2021-11-18 17:02:28.0000000,M&O MS Forms
M-005737,M037,M037-ZN04,02/11/2023 12:00:00 AM,AM,2023,2,Feb,6,Parks,Highbridge Park,18,,18,,,34,Manhattan,M-12A,ZONE,true,2023-02-11 17:52:41.0000000,M&O MS Forms
M-004785,M037,M037-ZN04,11/02/2022 12:00:00 AM,AM,2022,11,Nov,45,Parks,Highbridge Park,22,,22,,,34,Manhattan,M-12A,ZONE,true,2022-11-05 14:06:44.0000000,M&O MS Forms
M-004775,M037,M037-ZN04,11/01/2022 12:00:00 AM,AM,2022,11,Nov,45,Parks,Highbridge Park,2,,2,,,34,Manhattan,M-12A,ZONE,true,2022-11-05 14:03:33.0000000,M&O MS Forms
M-004793,M037,M037-ZN04,11/03/2022 12:00:00 AM,AM,2022,11,Nov,45,Parks,Highbridge Park,14,,14,,,34,Manhattan,M-12A,ZONE,true,2022-11-05 14:09:04.0000000,M&O MS Forms
M-004813,M037,M037-ZN04,11/05/2022 12:00:00 AM,AM,2022,11,Nov,45,Parks,Highbridge Park,35,,35,,,34,Manhattan,M-12A,ZONE,true,2022-11-07 06:45:59.0000000,M&O MS Forms
M-004802,M037,M037-ZN04,11/04/2022 12:00:00 AM,AM,2022,11,Nov,45,Parks,Highbridge Park,21,,21,,,34,Manhattan,M-12A,ZONE,true,2022-11-05 14:11:35.0000000,M&O MS Forms
M-004854,M037,M037-ZN04,11/06/2022 12:00:00 AM,AM,2022,11,Nov,46,Parks,Highbridge Park,21,,21,,,34,Manhattan,M-12A,ZONE,true,2022-11-13 10:05:49.0000000,M&O MS Forms
M-004881,M037,M037-ZN04,11/09/2022 12:00:00 AM,AM,2022,11,Nov,46,Parks,Highbridge Park,22,,22,,,34,Manhattan,M-12A,ZONE,true,2022-11-13 10:15:07.0000000,M&O MS Forms
M-004863,M037,M037-ZN04,11/07/2022 12:00:00 AM,AM,2022,11,Nov,46,Parks,Highbridge Park,25,,25,,,34,Manhattan,M-12A,ZONE,true,2022-11-13 10:08:34.0000000,M&O MS Forms
M-004872,M037,M037-ZN04,11/08/2022 12:00:00 AM,AM,2022,11,Nov,46,Parks,Highbridge Park,25,,25,,,34,Manhattan,M-12A,ZONE,true,2022-11-13 10:12:11.0000000,M&O MS Forms
M-004889,M037,M037-ZN04,11/10/2022 12:00:00 AM,AM,2022,11,Nov,46,Parks,Highbridge Park,14,,14,,,34,Manhattan,M-12A,ZONE,true,2022-11-13 10:18:50.0000000,M&O MS Forms
M-004898,M037,M037-ZN04,11/11/2022 12:00:00 AM,AM,2022,11,Nov,46,Parks,Highbridge Park,21,,21,,,34,Manhattan,M-12A,ZONE,true,2022-11-13 10:21:34.0000000,M&O MS Forms
M-004923,M037,M037-ZN04,11/13/2022 12:00:00 AM,AM,2022,11,Nov,47,Parks,Highbridge Park,13,,13,,,34,Manhattan,M-12A,ZONE,true,2022-11-15 05:28:11.0000000,M&O MS Forms
M-004907,M037,M037-ZN04,11/12/2022 12:00:00 AM,AM,2022,11,Nov,46,Parks,Highbridge Park,35,,35,,,34,Manhattan,M-12A,ZONE,true,2022-11-13 10:24:33.0000000,M&O MS Forms
M-004953,M037,M037-ZN04,11/16/2022 12:00:00 AM,AM,2022,11,Nov,47,Parks,Highbridge Park,12,,12,,,34,Manhattan,M-12A,ZONE,true,2022-11-17 06:56:30.0000000,M&O MS Forms
M-004933,M037,M037-ZN04,11/14/2022 12:00:00 AM,AM,2022,11,Nov,47,Parks,Highbridge Park,10,,10,,,34,Manhattan,M-12A,ZONE,true,2022-11-16 07:09:13.0000000,M&O MS Forms
M-004963,M037,M037-ZN04,11/18/2022 12:00:00 AM,AM,2022,11,Nov,47,Parks,Highbridge Park,11,,11,,,34,Manhattan,M-12A,ZONE,true,2022-11-21 05:51:47.0000000,M&O MS Forms
M-004943,M037,M037-ZN04,11/15/2022 12:00:00 AM,AM,2022,11,Nov,47,Parks,Highbridge Park,15,,15,,,34,Manhattan,M-12A,ZONE,true,2022-11-17 06:51:25.0000000,M&O MS Forms
M-005000,M037,M037-ZN04,11/22/2022 12:00:00 AM,AM,2022,11,Nov,48,Parks,Highbridge Park,10,,10,,,34,Manhattan,M-12A,ZONE,true,2022-11-27 10:58:27.0000000,M&O MS Forms
M-005018,M037,M037-ZN04,11/24/2022 12:00:00 AM,AM,2022,11,Nov,48,Parks,Highbridge Park,5,,5,,,34,Manhattan,M-12A,ZONE,true,2022-11-27 11:06:08.0000000,M&O MS Forms
M-005027,M037,M037-ZN04,11/25/2022 12:00:00 AM,AM,2022,11,Nov,48,Parks,Highbridge Park,15,,15,,,34,Manhattan,M-12A,ZONE,true,2022-11-27 11:09:16.0000000,M&O MS Forms
M-004972,M037,M037-ZN04,11/19/2022 12:00:00 AM,AM,2022,11,Nov,47,Parks,Highbridge Park,9,,9,,,34,Manhattan,M-12A,ZONE,true,2022-11-21 05:54:42.0000000,M&O MS Forms
M-004981,M037,M037-ZN04,11/20/2022 12:00:00 AM,AM,2022,11,Nov,48,Parks,Highbridge Park,15,,15,,,34,Manhattan,M-12A,ZONE,true,2022-11-21 06:00:32.0000000,M&O MS Forms
M-004991,M037,M037-ZN04,11/21/2022 12:00:00 AM,AM,2022,11,Nov,48,Parks,Highbridge Park,5,,5,,,34,Manhattan,M-12A,ZONE,true,2022-11-27 10:55:27.0000000,M&O MS Forms
M-005009,M037,M037-ZN04,11/22/2022 12:00:00 AM,AM,2022,11,Nov,48,Parks,Highbridge Park,6,,6,,,34,Manhattan,M-12A,ZONE,true,2022-11-27 11:01:56.0000000,M&O MS Forms
M-005388,M037,M037-ZN04,01/05/2023 12:00:00 AM,AM,2023,1,Jan,1,Parks,Highbridge Park,16,,16,,,34,Manhattan,M-12A,ZONE,true,2023-01-08 12:18:35.0000000,M&O MS Forms
M-005379,M037,M037-ZN04,01/04/2023 12:00:00 AM,AM,2023,1,Jan,1,Parks,Highbridge Park,14,,14,,,34,Manhattan,M-12A,ZONE,true,2023-01-08 12:13:24.0000000,M&O MS Forms
M-005368,M037,M037-ZN04,01/03/2023 12:00:00 AM,AM,2023,1,Jan,1,Parks,Highbridge Park,12,,12,,,34,Manhattan,M-12A,ZONE,true,2023-01-03 17:15:22.0000000,M&O MS Forms
M-005359,M037,M037-ZN04,01/02/2023 12:00:00 AM,AM,2023,1,Jan,1,Parks,Highbridge Park,10,,10,,,34,Manhattan,M-12A,ZONE,true,2023-01-03 17:12:04.0000000,M&O MS Forms
M-005493,M037,M037-ZN04,01/16/2023 12:00:00 AM,AM,2023,1,Jan,3,Parks,Highbridge Park,10,,10,,,34,Manhattan,M-12A,ZONE,true,2023-01-23 16:02:28.0000000,M&O MS Forms
M-005339,M037,M037-ZN04,12/31/2022 12:00:00 AM,AM,2022,12,Dec,53,Parks,Highbridge Park,18,,18,,,34,Manhattan,M-12A,ZONE,true,2023-01-01 10:32:25.0000000,M&O MS Forms
M-005350,M037,M037-ZN04,01/01/2023 12:00:00 AM,AM,2023,1,Jan,1,Parks,Highbridge Park,15,,15,,,34,Manhattan,M-12A,ZONE,true,2023-01-03 15:22:56.0000000,M&O MS Forms
M-002154,M037,M037-ZN04,02/04/2022 12:00:00 AM,AM,2022,2,Feb,6,Parks,Highbridge Park,5,,5,,,34,Manhattan,M-12A,ZONE,true,2022-02-10 08:30:38.0000000,M&O MS Forms
M-002155,M037,M037-ZN05,02/04/2022 12:00:00 AM,AM,2022,2,Feb,6,Parks,Highbridge Park,7,,7,,,34,Manhattan,M-12A,ZONE,true,2022-02-10 08:31:00.0000000,M&O MS Forms
M-002133,M037,M037-ZN05,01/28/2022 12:00:00 AM,AM,2022,1,Jan,5,Parks,Highbridge Park,1,,1,,,34,Manhattan,M-12A,ZONE,true,2022-01-29 15:30:11.0000000,M&O MS Forms
M-002127,M037,M037-ZN05,01/27/2022 12:00:00 AM,AM,2022,1,Jan,5,Parks,Highbridge Park,1,,1,,,34,Manhattan,M-12A,ZONE,true,2022-01-29 15:28:35.0000000,M&O MS Forms
M-002088,M037,M037-ZN05,01/20/2022 12:00:00 AM,AM,2022,1,Jan,4,Parks,Highbridge Park,1,,1,,,34,Manhattan,M-12A,ZONE,true,2022-01-24 19:05:18.0000000,M&O MS Forms
M-002080,M037,M037-ZN05,01/24/2022 12:00:00 AM,AM,2022,1,Jan,5,Parks,Highbridge Park,1,,1,,,34,Manhattan,M-12A,ZONE,true,2022-01-24 18:55:46.0000000,M&O MS Forms
M-002038,M037,M037-ZN05,01/18/2022 12:00:00 AM,AM,2022,1,Jan,4,Parks,Highbridge Park,3,,3,,,34,Manhattan,M-12A,ZONE,true,2022-01-20 17:03:53.0000000,M&O MS Forms
M-002046,M037,M037-ZN05,01/19/2022 12:00:00 AM,AM,2022,1,Jan,4,Parks,Highbridge Park,1,,1,,,34,Manhattan,M-12A,ZONE,true,2022-01-20 17:06:04.0000000,M&O MS Forms
M-001928,M037,M037-ZN05,01/06/2022 12:00:00 AM,AM,2022,1,Jan,2,Parks,Highbridge Park,2,,2,,,34,Manhattan,M-12A,ZONE,true,2022-01-06 16:39:59.0000000,M&O MS Forms
M-001904,M037,M037-ZN05,01/04/2022 12:00:00 AM,AM,2022,1,Jan,2,Parks,Highbridge Park,1,,1,,,34,Manhattan,M-12A,ZONE,true,2022-01-05 17:30:42.0000000,M&O MS Forms
M-001913,M037,M037-ZN05,01/05/2022 12:00:00 AM,AM,2022,1,Jan,2,Parks,Highbridge Park,1,,1,,,34,Manhattan,M-12A,ZONE,true,2022-01-05 17:38:28.0000000,M&O MS Forms
M-001892,M037,M037-ZN05,01/03/2022 12:00:00 AM,AM,2022,1,Jan,2,Parks,Highbridge Park,2,,2,,,34,Manhattan,M-12A,ZONE,true,2022-01-04 13:23:14.0000000,M&O MS Forms
M-001995,M037,M037-ZN05,01/15/2022 12:00:00 AM,AM,2022,1,Jan,3,Parks,Highbridge Park,2,,2,,,34,Manhattan,M-12A,ZONE,true,2022-01-15 19:28:30.0000000,M&O MS Forms
M-001982,M037,M037-ZN05,01/13/2022 12:00:00 AM,AM,2022,1,Jan,3,Parks,Highbridge Park,6,,6,,,34,Manhattan,M-12A,ZONE,true,2022-01-14 16:44:52.0000000,M&O MS Forms
M-001981,M037,M037-ZN05,01/13/2022 12:00:00 AM,AM,2022,1,Jan,3,Parks,Highbridge Park,1,,1,,,34,Manhattan,M-12A,ZONE,true,2022-01-14 16:44:32.0000000,M&O MS Forms
M-002026,M037,M037-ZN05,01/16/2022 12:00:00 AM,AM,2022,1,Jan,4,Parks,Highbridge Park,1,,1,,,34,Manhattan,M-12A,ZONE,true,2022-01-20 17:00:30.0000000,M&O MS Forms
M-001969,M037,M037-ZN05,01/12/2022 12:00:00 AM,AM,2022,1,Jan,3,Parks,Highbridge Park,3,,3,,,34,Manhattan,M-12A,ZONE,true,2022-01-13 14:54:06.0000000,M&O MS Forms
M-001961,M037,M037-ZN05,01/11/2022 12:00:00 AM,AM,2022,1,Jan,3,Parks,Highbridge Park,1,,1,,,34,Manhattan,M-12A,ZONE,true,2022-01-13 14:51:26.0000000,M&O MS Forms
M-001952,M037,M037-ZN05,01/10/2022 12:00:00 AM,AM,2022,1,Jan,3,Parks,Highbridge Park,3,,3,,,34,Manhattan,M-12A,ZONE,true,2022-01-13 14:48:15.0000000,M&O MS Forms
M-004368,M037,M037-ZN05,09/22/2022 12:00:00 AM,AM,2022,9,Sep,39,Parks,Highbridge Park,10,,10,,,34,Manhattan,M-12A,ZONE,true,2022-09-23 05:29:05.0000000,M&O MS Forms
M-004386,M037,M037-ZN05,09/24/2022 12:00:00 AM,AM,2022,9,Sep,39,Parks,Highbridge Park,12,,12,,,34,Manhattan,M-12A,ZONE,true,2022-09-26 06:06:09.0000000,M&O MS Forms
M-004377,M037,M037-ZN05,09/23/2022 12:00:00 AM,AM,2022,9,Sep,39,Parks,Highbridge Park,8,,8,,,34,Manhattan,M-12A,ZONE,true,2022-09-26 06:03:16.0000000,M&O MS Forms
M-004359,M037,M037-ZN05,09/21/2022 12:00:00 AM,AM,2022,9,Sep,39,Parks,Highbridge Park,7,,7,,,34,Manhattan,M-12A,ZONE,true,2022-09-23 05:26:15.0000000,M&O MS Forms
M-004351,M037,M037-ZN05,09/20/2022 12:00:00 AM,AM,2022,9,Sep,39,Parks,Highbridge Park,6,,6,,,34,Manhattan,M-12A,ZONE,true,2022-09-22 16:52:32.0000000,M&O MS Forms
M-004334,M037,M037-ZN05,09/18/2022 12:00:00 AM,AM,2022,9,Sep,39,Parks,Highbridge Park,3,,3,,,34,Manhattan,M-12A,ZONE,true,2022-09-22 16:46:22.0000000,M&O MS Forms
M-004343,M037,M037-ZN05,09/19/2022 12:00:00 AM,AM,2022,9,Sep,39,Parks,Highbridge Park,3,,3,,,34,Manhattan,M-12A,ZONE,true,2022-09-22 16:49:16.0000000,M&O MS Forms
M-004161,M037,M037-ZN05,08/28/2022 12:00:00 AM,AM,2022,8,Aug,36,Parks,Highbridge Park,6,,6,,,34,Manhattan,M-12A,ZONE,true,2022-09-02 13:03:28.0000000,M&O MS Forms
M-004482,M037,M037-ZN05,10/01/2022 12:00:00 AM,AM,2022,10,Oct,40,Parks,Highbridge Park,4,,4,,,34,Manhattan,M-12A,ZONE,true,2022-10-11 07:13:37.0000000,M&O MS Forms
M-004471,M037,M037-ZN05,09/30/2022 12:00:00 AM,AM,2022,9,Sep,40,Parks,Highbridge Park,7,,7,,,34,Manhattan,M-12A,ZONE,true,2022-10-11 07:08:38.0000000,M&O MS Forms
M-004170,M037,M037-ZN05,08/29/2022 12:00:00 AM,AM,2022,8,Aug,36,Parks,Highbridge Park,5,,5,,,34,Manhattan,M-12A,ZONE,true,2022-09-02 13:06:30.0000000,M&O MS Forms
M-004461,M037,M037-ZN05,09/29/2022 12:00:00 AM,AM,2022,9,Sep,40,Parks,Highbridge Park,8,,8,,,34,Manhattan,M-12A,ZONE,true,2022-10-11 07:04:10.0000000,M&O MS Forms
M-004395,M037,M037-ZN05,09/25/2022 12:00:00 AM,AM,2022,9,Sep,40,Parks,Highbridge Park,3,,3,,,34,Manhattan,M-12A,ZONE,true,2022-09-26 06:09:16.0000000,M&O MS Forms
M-005425,M037,M037-ZN05,01/09/2023 12:00:00 AM,AM,2023,1,Jan,2,Parks,Highbridge Park,5,,5,,,34,Manhattan,M-12A,ZONE,true,2023-01-14 14:58:59.0000000,M&O MS Forms
M-005417,M037,M037-ZN05,01/08/2023 12:00:00 AM,AM,2023,1,Jan,2,Parks,Highbridge Park,3,,3,,,34,Manhattan,M-12A,ZONE,true,2023-01-14 14:56:38.0000000,M&O MS Forms
M-005329,M037,M037-ZN05,12/30/2022 12:00:00 AM,AM,2022,12,Dec,53,Parks,Highbridge Park,11,,11,,,34,Manhattan,M-12A,ZONE,true,2022-12-31 11:03:16.0000000,M&O MS Forms
M-005320,M037,M037-ZN05,12/29/2022 12:00:00 AM,AM,2022,12,Dec,53,Parks,Highbridge Park,10,,10,,,34,Manhattan,M-12A,ZONE,true,2022-12-31 11:00:35.0000000,M&O MS Forms
M-005311,M037,M037-ZN05,12/28/2022 12:00:00 AM,AM,2022,12,Dec,53,Parks,Highbridge Park,7,,7,,,34,Manhattan,M-12A,ZONE,true,2022-12-31 10:57:50.0000000,M&O MS Forms
M-005302,M037,M037-ZN05,12/27/2022 12:00:00 AM,AM,2022,12,Dec,53,Parks,Highbridge Park,8,,8,,,34,Manhattan,M-12A,ZONE,true,2022-12-31 10:55:16.0000000,M&O MS Forms
M-005293,M037,M037-ZN05,12/26/2022 12:00:00 AM,AM,2022,12,Dec,53,Parks,Highbridge Park,5,,5,,,34,Manhattan,M-12A,ZONE,true,2022-12-31 10:52:40.0000000,M&O MS Forms
M-005282,M037,M037-ZN05,12/24/2022 12:00:00 AM,AM,2022,12,Dec,52,Parks,Highbridge Park,3,,3,,,34,Manhattan,M-12A,ZONE,true,2022-12-24 16:44:41.0000000,M&O MS Forms
M-005268,M037,M037-ZN05,12/22/2022 12:00:00 AM,AM,2022,12,Dec,52,Parks,Highbridge Park,7,,7,,,34,Manhattan,M-12A,ZONE,true,2022-12-24 16:01:28.0000000,M&O MS Forms
M-005259,M037,M037-ZN05,12/21/2022 12:00:00 AM,AM,2022,12,Dec,52,Parks,Highbridge Park,6,,6,,,34,Manhattan,M-12A,ZONE,true,2022-12-24 15:58:18.0000000,M&O MS Forms
M-005250,M037,M037-ZN05,12/20/2022 12:00:00 AM,AM,2022,12,Dec,52,Parks,Highbridge Park,4,,4,,,34,Manhattan,M-12A,ZONE,true,2022-12-24 15:55:03.0000000,M&O MS Forms
M-005231,M037,M037-ZN05,12/18/2022 12:00:00 AM,AM,2022,12,Dec,52,Parks,Highbridge Park,2,,2,,,34,Manhattan,M-12A,ZONE,true,2022-12-19 15:16:28.0000000,M&O MS Forms
M-005239,M037,M037-ZN05,12/19/2022 12:00:00 AM,AM,2022,12,Dec,52,Parks,Highbridge Park,3,,3,,,34,Manhattan,M-12A,ZONE,true,2022-12-19 15:19:30.0000000,M&O MS Forms
M-005217,M037,M037-ZN05,12/16/2022 12:00:00 AM,AM,2022,12,Dec,51,Parks,Highbridge Park,6,,6,,,34,Manhattan,M-12A,ZONE,true,2022-12-18 16:12:46.0000000,M&O MS Forms
M-005208,M037,M037-ZN05,12/14/2022 12:00:00 AM,AM,2022,12,Dec,51,Parks,Highbridge Park,5,,5,,,34,Manhattan,M-12A,ZONE,true,2022-12-14 15:42:56.0000000,M&O MS Forms
M-005197,M037,M037-ZN05,12/13/2022 12:00:00 AM,AM,2022,12,Dec,51,Parks,Highbridge Park,3,,3,,,34,Manhattan,M-12A,ZONE,true,2022-12-14 05:27:32.0000000,M&O MS Forms
M-005180,M037,M037-ZN05,12/11/2022 12:00:00 AM,AM,2022,12,Dec,51,Parks,Highbridge Park,6,,6,,,34,Manhattan,M-12A,ZONE,true,2022-12-13 05:39:56.0000000,M&O MS Forms
M-005189,M037,M037-ZN05,12/12/2022 12:00:00 AM,AM,2022,12,Dec,51,Parks,Highbridge Park,4,,4,,,34,Manhattan,M-12A,ZONE,true,2022-12-13 05:43:16.0000000,M&O MS Forms
M-005171,M037,M037-ZN05,12/10/2022 12:00:00 AM,AM,2022,12,Dec,50,Parks,Highbridge Park,9,,9,,,34,Manhattan,M-12A,ZONE,true,2022-12-13 05:36:29.0000000,M&O MS Forms
M-005162,M037,M037-ZN05,12/09/2022 12:00:00 AM,AM,2022,12,Dec,50,Parks,Highbridge Park,6,,6,,,34,Manhattan,M-12A,ZONE,true,2022-12-13 05:32:47.0000000,M&O MS Forms
M-005153,M037,M037-ZN05,12/08/2022 12:00:00 AM,AM,2022,12,Dec,50,Parks,Highbridge Park,13,,13,,,34,Manhattan,M-12A,ZONE,true,2022-12-08 16:57:21.0000000,M&O MS Forms
M-005135,M037,M037-ZN05,12/06/2022 12:00:00 AM,AM,2022,12,Dec,50,Parks,Highbridge Park,4,,4,,,34,Manhattan,M-12A,ZONE,true,2022-12-07 17:10:11.0000000,M&O MS Forms
M-005144,M037,M037-ZN05,12/07/2022 12:00:00 AM,AM,2022,12,Dec,50,Parks,Highbridge Park,10,,10,,,34,Manhattan,M-12A,ZONE,true,2022-12-07 17:12:57.0000000,M&O MS Forms
M-005126,M037,M037-ZN05,12/05/2022 12:00:00 AM,AM,2022,12,Dec,50,Parks,Highbridge Park,5,,5,,,34,Manhattan,M-12A,ZONE,true,2022-12-07 16:56:07.0000000,M&O MS Forms
M-005117,M037,M037-ZN05,12/04/2022 12:00:00 AM,AM,2022,12,Dec,50,Parks,Highbridge Park,2,,2,,,34,Manhattan,M-12A,ZONE,true,2022-12-07 16:52:27.0000000,M&O MS Forms
M-005100,M037,M037-ZN05,12/03/2022 12:00:00 AM,AM,2022,12,Dec,49,Parks,Highbridge Park,10,,10,,,34,Manhattan,M-12A,ZONE,true,2022-12-03 13:38:27.0000000,M&O MS Forms
M-005091,M037,M037-ZN05,12/02/2022 12:00:00 AM,AM,2022,12,Dec,49,Parks,Highbridge Park,4,,4,,,34,Manhattan,M-12A,ZONE,true,2022-12-03 13:35:58.0000000,M&O MS Forms
M-005083,M037,M037-ZN05,12/01/2022 12:00:00 AM,AM,2022,12,Dec,49,Parks,Highbridge Park,7,,7,,,34,Manhattan,M-12A,ZONE,true,2022-12-03 13:08:24.0000000,M&O MS Forms
M-005074,M037,M037-ZN05,11/30/2022 12:00:00 AM,AM,2022,11,Nov,49,Parks,Highbridge Park,8,,8,,,34,Manhattan,M-12A,ZONE,true,2022-12-03 13:05:47.0000000,M&O MS Forms
M-005065,M037,M037-ZN05,11/29/2022 12:00:00 AM,AM,2022,11,Nov,49,Parks,Highbridge Park,3,,3,,,34,Manhattan,M-12A,ZONE,true,2022-12-03 13:03:11.0000000,M&O MS Forms
M-005056,M037,M037-ZN05,11/28/2022 12:00:00 AM,AM,2022,11,Nov,49,Parks,Highbridge Park,6,,6,,,34,Manhattan,M-12A,ZONE,true,2022-12-03 13:00:15.0000000,M&O MS Forms
M-005047,M037,M037-ZN05,11/27/2022 12:00:00 AM,AM,2022,11,Nov,49,Parks,Highbridge Park,2,,2,,,34,Manhattan,M-12A,ZONE,true,2022-12-03 12:57:10.0000000,M&O MS Forms
M-002447,M037,M037-ZN05,03/07/2022 12:00:00 AM,AM,2022,3,Mar,11,Parks,Highbridge Park,7,,7,,,34,Manhattan,M-12A,ZONE,true,2022-03-09 14:04:02.0000000,M&O MS Forms
M-002456,M037,M037-ZN05,03/08/2022 12:00:00 AM,AM,2022,3,Mar,11,Parks,Highbridge Park,2,,2,,,34,Manhattan,M-12A,ZONE,true,2022-03-09 14:06:21.0000000,M&O MS Forms
M-002498,M037,M037-ZN05,03/13/2022 12:00:00 AM,AM,2022,3,Mar,12,Parks,Highbridge Park,3,,3,,,34,Manhattan,M-12A,ZONE,true,2022-03-17 10:44:38.0000000,M&O MS Forms
M-002489,M037,M037-ZN05,03/12/2022 12:00:00 AM,AM,2022,3,Mar,11,Parks,Highbridge Park,9,,9,,,34,Manhattan,M-12A,ZONE,true,2022-03-17 10:40:53.0000000,M&O MS Forms
M-002472,M037,M037-ZN05,03/10/2022 12:00:00 AM,AM,2022,3,Mar,11,Parks,Highbridge Park,8,,8,,,34,Manhattan,M-12A,ZONE,true,2022-03-17 10:34:35.0000000,M&O MS Forms
M-002480,M037,M037-ZN05,03/11/2022 12:00:00 AM,AM,2022,3,Mar,11,Parks,Highbridge Park,7,,7,,,34,Manhattan,M-12A,ZONE,true,2022-03-17 10:37:34.0000000,M&O MS Forms
M-002524,M037,M037-ZN05,03/16/2022 12:00:00 AM,AM,2022,3,Mar,12,Parks,Highbridge Park,5,,5,,,34,Manhattan,M-12A,ZONE,true,2022-03-17 11:42:09.0000000,M&O MS Forms
M-002507,M037,M037-ZN05,03/14/2022 12:00:00 AM,AM,2022,3,Mar,12,Parks,Highbridge Park,7,,7,,,34,Manhattan,M-12A,ZONE,true,2022-03-17 10:47:35.0000000,M&O MS Forms
M-002544,M037,M037-ZN05,03/17/2022 12:00:00 AM,AM,2022,3,Mar,12,Parks,Highbridge Park,12,,12,,,34,Manhattan,M-12A,ZONE,true,2022-03-24 16:35:54.0000000,M&O MS Forms
M-002560,M037,M037-ZN05,03/19/2022 12:00:00 AM,AM,2022,3,Mar,12,Parks,Highbridge Park,8,,8,,,34,Manhattan,M-12A,ZONE,true,2022-03-24 16:47:29.0000000,M&O MS Forms
M-002644,M037,M037-ZN05,03/27/2022 12:00:00 AM,AM,2022,3,Mar,14,Parks,Highbridge Park,8,,8,,,34,Manhattan,M-12A,ZONE,true,2022-03-29 05:27:33.0000000,M&O MS Forms
M-002665,M037,M037-ZN05,03/29/2022 12:00:00 AM,AM,2022,3,Mar,14,Parks,Highbridge Park,13,,13,,,34,Manhattan,M-12A,ZONE,true,2022-03-30 15:29:55.0000000,M&O MS Forms
M-002653,M037,M037-ZN05,03/28/2022 12:00:00 AM,AM,2022,3,Mar,14,Parks,Highbridge Park,10,,10,,,34,Manhattan,M-12A,ZONE,true,2022-03-29 05:30:36.0000000,M&O MS Forms
M-002698,M037,M037-ZN05,04/01/2022 12:00:00 AM,AM,2022,4,Apr,14,Parks,Highbridge Park,11,,11,,,34,Manhattan,M-12A,ZONE,true,2022-04-01 15:58:45.0000000,M&O MS Forms
M-002689,M037,M037-ZN05,03/31/2022 12:00:00 AM,AM,2022,3,Mar,14,Parks,Highbridge Park,5,,5,,,34,Manhattan,M-12A,ZONE,true,2022-04-01 15:56:09.0000000,M&O MS Forms
M-002674,M037,M037-ZN05,03/30/2022 12:00:00 AM,AM,2022,3,Mar,14,Parks,Highbridge Park,9,,9,,,34,Manhattan,M-12A,ZONE,true,2022-03-30 15:33:38.0000000,M&O MS Forms
M-002603,M037,M037-ZN05,03/24/2022 12:00:00 AM,AM,2022,3,Mar,13,Parks,Highbridge Park,6,,6,,,34,Manhattan,M-12A,ZONE,true,2022-03-24 19:58:36.0000000,M&O MS Forms
M-002621,M037,M037-ZN05,03/25/2022 12:00:00 AM,AM,2022,3,Mar,13,Parks,Highbridge Park,9,,9,,,34,Manhattan,M-12A,ZONE,true,2022-03-26 19:22:06.0000000,M&O MS Forms
M-002630,M037,M037-ZN05,03/26/2022 12:00:00 AM,AM,2022,3,Mar,13,Parks,Highbridge Park,11,,11,,,34,Manhattan,M-12A,ZONE,true,2022-03-26 19:25:05.0000000,M&O MS Forms
M-002595,M037,M037-ZN05,03/23/2022 12:00:00 AM,AM,2022,3,Mar,13,Parks,Highbridge Park,11,,11,,,34,Manhattan,M-12A,ZONE,true,2022-03-24 19:55:09.0000000,M&O MS Forms
M-002586,M037,M037-ZN05,03/22/2022 12:00:00 AM,AM,2022,3,Mar,13,Parks,Highbridge Park,9,,9,,,34,Manhattan,M-12A,ZONE,true,2022-03-24 19:51:37.0000000,M&O MS Forms
M-002577,M037,M037-ZN05,03/21/2022 12:00:00 AM,AM,2022,3,Mar,13,Parks,Highbridge Park,7,,7,,,34,Manhattan,M-12A,ZONE,true,2022-03-24 19:46:33.0000000,M&O MS Forms
M-002569,M037,M037-ZN05,03/20/2022 12:00:00 AM,AM,2022,3,Mar,13,Parks,Highbridge Park,2,,2,,,34,Manhattan,M-12A,ZONE,true,2022-03-24 19:42:43.0000000,M&O MS Forms
M-002395,M037,M037-ZN05,03/01/2022 12:00:00 AM,AM,2022,3,Mar,10,Parks,Highbridge Park,9,,9,,,34,Manhattan,M-12A,ZONE,true,2022-03-04 08:38:58.0000000,M&O MS Forms
M-002385,M037,M037-ZN05,02/28/2022 12:00:00 AM,AM,2022,2,Feb,10,Parks,Highbridge Park,3,,3,,,34,Manhattan,M-12A,ZONE,true,2022-03-04 08:36:28.0000000,M&O MS Forms
M-002376,M037,M037-ZN05,02/27/2022 12:00:00 AM,AM,2022,2,Feb,10,Parks,Highbridge Park,10,,10,,,34,Manhattan,M-12A,ZONE,true,2022-03-04 08:33:02.0000000,M&O MS Forms
M-002429,M037,M037-ZN05,03/05/2022 12:00:00 AM,AM,2022,3,Mar,10,Parks,Highbridge Park,3,,3,,,34,Manhattan,M-12A,ZONE,true,2022-03-06 19:41:27.0000000,M&O MS Forms
M-002416,M037,M037-ZN05,03/03/2022 12:00:00 AM,AM,2022,3,Mar,10,Parks,Highbridge Park,9,,9,,,34,Manhattan,M-12A,ZONE,true,2022-03-04 08:45:07.0000000,M&O MS Forms
M-002412,M037,M037-ZN05,03/03/2022 12:00:00 AM,AM,2022,3,Mar,10,Parks,Highbridge Park,9,,9,,,34,Manhattan,M-12A,ZONE,true,2022-03-04 08:43:59.0000000,M&O MS Forms
M-002403,M037,M037-ZN05,03/02/2022 12:00:00 AM,AM,2022,3,Mar,10,Parks,Highbridge Park,53,,53,,,34,Manhattan,M-12A,ZONE,true,2022-03-04 08:41:12.0000000,M&O MS Forms
M-002330,M037,M037-ZN05,02/22/2022 12:00:00 AM,AM,2022,2,Feb,9,Parks,Highbridge Park,4,,4,,,34,Manhattan,M-12A,ZONE,true,2022-02-28 12:03:38.0000000,M&O MS Forms
M-002321,M037,M037-ZN05,02/21/2022 12:00:00 AM,AM,2022,2,Feb,9,Parks,Highbridge Park,6,,6,,,34,Manhattan,M-12A,ZONE,true,2022-02-28 12:01:02.0000000,M&O MS Forms
M-003215,M037,M037-ZN05,05/24/2022 12:00:00 AM,AM,2022,5,May,22,Parks,Highbridge Park,4,,4,,,34,Manhattan,M-12A,ZONE,true,2022-05-28 10:48:50.0000000,M&O MS Forms
M-003224,M037,M037-ZN05,05/25/2022 12:00:00 AM,AM,2022,5,May,22,Parks,Highbridge Park,10,,10,,,34,Manhattan,M-12A,ZONE,true,2022-05-28 10:51:27.0000000,M&O MS Forms
M-003193,M037,M037-ZN05,05/22/2022 12:00:00 AM,AM,2022,5,May,22,Parks,Highbridge Park,22,,22,,,34,Manhattan,M-12A,ZONE,true,2022-05-22 15:12:11.0000000,M&O MS Forms
M-003181,M037,M037-ZN05,05/21/2022 12:00:00 AM,AM,2022,5,May,21,Parks,Highbridge Park,23,,23,,,34,Manhattan,M-12A,ZONE,true,2022-05-22 08:32:22.0000000,M&O MS Forms
M-003172,M037,M037-ZN05,05/20/2022 12:00:00 AM,AM,2022,5,May,21,Parks,Highbridge Park,30,,30,,,34,Manhattan,M-12A,ZONE,true,2022-05-20 15:14:09.0000000,M&O MS Forms
M-003163,M037,M037-ZN05,05/19/2022 12:00:00 AM,AM,2022,5,May,21,Parks,Highbridge Park,22,,22,,,34,Manhattan,M-12A,ZONE,true,2022-05-20 15:11:30.0000000,M&O MS Forms
M-003811,M037,M037-ZN05,07/25/2022 12:00:00 AM,AM,2022,7,Jul,31,Parks,Highbridge Park,15,,15,,,34,Manhattan,M-12A,ZONE,true,2022-07-29 15:58:25.0000000,M&O MS Forms
M-003802,M037,M037-ZN05,07/24/2022 12:00:00 AM,AM,2022,7,Jul,31,Parks,Highbridge Park,7,,7,,,34,Manhattan,M-12A,ZONE,true,2022-07-29 15:55:22.0000000,M&O MS Forms
M-003764,M037,M037-ZN05,07/20/2022 12:00:00 AM,AM,2022,7,Jul,30,Parks,Highbridge Park,8,,8,,,34,Manhattan,M-12A,ZONE,true,2022-07-23 15:30:10.0000000,M&O MS Forms
M-003754,M037,M037-ZN05,07/19/2022 12:00:00 AM,AM,2022,7,Jul,30,Parks,Highbridge Park,7,,7,,,34,Manhattan,M-12A,ZONE,true,2022-07-23 15:25:37.0000000,M&O MS Forms
M-003782,M037,M037-ZN05,07/22/2022 12:00:00 AM,AM,2022,7,Jul,30,Parks,Highbridge Park,6,,6,,,34,Manhattan,M-12A,ZONE,true,2022-07-23 15:36:35.0000000,M&O MS Forms
M-003773,M037,M037-ZN05,07/21/2022 12:00:00 AM,AM,2022,7,Jul,30,Parks,Highbridge Park,4,,4,,,34,Manhattan,M-12A,ZONE,true,2022-07-23 15:33:31.0000000,M&O MS Forms
M-004598,M037,M037-ZN05,10/16/2022 12:00:00 AM,AM,2022,10,Oct,43,Parks,Highbridge Park,2,,2,,,34,Manhattan,M-12A,ZONE,true,2022-10-19 06:23:06.0000000,M&O MS Forms
M-003864,M037,M037-ZN05,07/31/2022 12:00:00 AM,AM,2022,7,Jul,32,Parks,Highbridge Park,6,,6,,,34,Manhattan,M-12A,ZONE,true,2022-07-31 16:57:50.0000000,M&O MS Forms
M-003855,M037,M037-ZN05,07/30/2022 12:00:00 AM,AM,2022,7,Jul,31,Parks,Highbridge Park,14,,14,,,34,Manhattan,M-12A,ZONE,true,2022-07-31 09:42:44.0000000,M&O MS Forms
M-003837,M037,M037-ZN05,07/28/2022 12:00:00 AM,AM,2022,7,Jul,31,Parks,Highbridge Park,17,,17,,,34,Manhattan,M-12A,ZONE,true,2022-07-29 16:06:45.0000000,M&O MS Forms
M-003846,M037,M037-ZN05,07/29/2022 12:00:00 AM,AM,2022,7,Jul,31,Parks,Highbridge Park,12,,12,,,34,Manhattan,M-12A,ZONE,true,2022-07-29 16:13:07.0000000,M&O MS Forms
M-003829,M037,M037-ZN05,07/27/2022 12:00:00 AM,AM,2022,7,Jul,31,Parks,Highbridge Park,9,,9,,,34,Manhattan,M-12A,ZONE,true,2022-07-29 16:04:22.0000000,M&O MS Forms
M-003820,M037,M037-ZN05,07/26/2022 12:00:00 AM,AM,2022,7,Jul,31,Parks,Highbridge Park,10,,10,,,34,Manhattan,M-12A,ZONE,true,2022-07-29 16:01:26.0000000,M&O MS Forms
M-004716,M037,M037-ZN05,10/27/2022 12:00:00 AM,AM,2022,10,Oct,44,Parks,Highbridge Park,15,,15,,,34,Manhattan,M-12A,ZONE,true,2022-10-30 13:17:43.0000000,M&O MS Forms
M-004699,M037,M037-ZN05,10/26/2022 12:00:00 AM,AM,2022,10,Oct,44,Parks,Highbridge Park,16,,16,,,34,Manhattan,M-12A,ZONE,true,2022-10-27 05:27:03.0000000,M&O MS Forms
M-004725,M037,M037-ZN05,10/28/2022 12:00:00 AM,AM,2022,10,Oct,44,Parks,Highbridge Park,19,,19,,,34,Manhattan,M-12A,ZONE,true,2022-10-30 13:21:04.0000000,M&O MS Forms
M-004681,M037,M037-ZN05,10/24/2022 12:00:00 AM,AM,2022,10,Oct,44,Parks,Highbridge Park,25,,25,,,34,Manhattan,M-12A,ZONE,true,2022-10-25 06:32:39.0000000,M&O MS Forms
M-004690,M037,M037-ZN05,10/25/2022 12:00:00 AM,AM,2022,10,Oct,44,Parks,Highbridge Park,16,,16,,,34,Manhattan,M-12A,ZONE,true,2022-10-26 05:50:40.0000000,M&O MS Forms
M-004672,M037,M037-ZN05,10/23/2022 12:00:00 AM,AM,2022,10,Oct,44,Parks,Highbridge Park,15,,15,,,34,Manhattan,M-12A,ZONE,true,2022-10-25 06:24:52.0000000,M&O MS Forms
M-004663,M037,M037-ZN05,10/22/2022 12:00:00 AM,AM,2022,10,Oct,43,Parks,Highbridge Park,15,,15,,,34,Manhattan,M-12A,ZONE,true,2022-10-25 06:15:16.0000000,M&O MS Forms
M-004654,M037,M037-ZN05,10/21/2022 12:00:00 AM,AM,2022,10,Oct,43,Parks,Highbridge Park,7,,7,,,34,Manhattan,M-12A,ZONE,true,2022-10-25 06:12:18.0000000,M&O MS Forms
M-004645,M037,M037-ZN05,10/20/2022 12:00:00 AM,AM,2022,10,Oct,43,Parks,Highbridge Park,8,,8,,,34,Manhattan,M-12A,ZONE,true,2022-10-25 06:09:51.0000000,M&O MS Forms
M-004636,M037,M037-ZN05,10/19/2022 12:00:00 AM,AM,2022,10,Oct,43,Parks,Highbridge Park,6,,6,,,34,Manhattan,M-12A,ZONE,true,2022-10-25 06:07:21.0000000,M&O MS Forms
M-004627,M037,M037-ZN05,10/18/2022 12:00:00 AM,AM,2022,10,Oct,43,Parks,Highbridge Park,3,,3,,,34,Manhattan,M-12A,ZONE,true,2022-10-25 06:04:44.0000000,M&O MS Forms
M-004607,M037,M037-ZN05,10/17/2022 12:00:00 AM,AM,2022,10,Oct,43,BBP,Highbridge Park,1,,1,,,34,Manhattan,M-12A,ZONE,true,2022-10-19 06:39:43.0000000,M&O MS Forms
M-001765,M037,M037-ZN05,12/22/2021 12:00:00 AM,AM,2021,12,Dec,52,Parks,Highbridge Park,9,,9,,,34,Manhattan,M-12A,ZONE,true,2021-12-23 15:44:22.0000000,M&O MS Forms
M-003115,M037,M037-ZN07,05/14/2022 12:00:00 AM,AM,2022,5,May,20,Parks,Highbridge Park,160,,160,,,34,Manhattan,M-12A,ZONE,true,2022-05-14 15:51:02.0000000,M&O MS Forms
M-003105,M037,M037-ZN07,05/13/2022 12:00:00 AM,AM,2022,5,May,20,Parks,Highbridge Park,110,,110,,,34,Manhattan,M-12A,ZONE,true,2022-05-14 10:50:51.0000000,M&O MS Forms
M-003208,M037,M037-ZN07,05/23/2022 12:00:00 AM,AM,2022,5,May,22,Parks,Highbridge Park,56,,56,,,34,Manhattan,M-12A,ZONE,true,2022-05-28 10:46:49.0000000,M&O MS Forms
M-003217,M037,M037-ZN07,05/24/2022 12:00:00 AM,AM,2022,5,May,22,Parks,Highbridge Park,45,,45,,,34,Manhattan,M-12A,ZONE,true,2022-05-28 10:49:23.0000000,M&O MS Forms
M-003226,M037,M037-ZN07,05/25/2022 12:00:00 AM,AM,2022,5,May,22,Parks,Highbridge Park,56,,56,,,34,Manhattan,M-12A,ZONE,true,2022-05-28 10:52:03.0000000,M&O MS Forms
M-003195,M037,M037-ZN07,05/22/2022 12:00:00 AM,AM,2022,5,May,22,Parks,Highbridge Park,140,,140,,,34,Manhattan,M-12A,ZONE,true,2022-05-22 15:12:46.0000000,M&O MS Forms
M-003183,M037,M037-ZN07,05/21/2022 12:00:00 AM,AM,2022,5,May,21,Parks,Highbridge Park,125,,125,,,34,Manhattan,M-12A,ZONE,true,2022-05-22 08:32:55.0000000,M&O MS Forms
M-003174,M037,M037-ZN07,05/20/2022 12:00:00 AM,AM,2022,5,May,21,Parks,Highbridge Park,65,,65,,,34,Manhattan,M-12A,ZONE,true,2022-05-20 15:14:40.0000000,M&O MS Forms
M-003165,M037,M037-ZN07,05/19/2022 12:00:00 AM,AM,2022,5,May,21,Parks,Highbridge Park,72,,72,,,34,Manhattan,M-12A,ZONE,true,2022-05-20 15:12:10.0000000,M&O MS Forms
M-003813,M037,M037-ZN07,07/25/2022 12:00:00 AM,AM,2022,7,Jul,31,Parks,Highbridge Park,160,,160,,,34,Manhattan,M-12A,ZONE,true,2022-07-29 15:59:04.0000000,M&O MS Forms
M-003804,M037,M037-ZN07,07/24/2022 12:00:00 AM,AM,2022,7,Jul,31,Parks,Highbridge Park,152,,152,,,34,Manhattan,M-12A,ZONE,true,2022-07-29 15:56:03.0000000,M&O MS Forms
M-003790,M037,M037-ZN07,07/23/2022 12:00:00 AM,AM,2022,7,Jul,30,Parks,Highbridge Park,140,,140,,,34,Manhattan,M-12A,ZONE,true,2022-07-24 12:11:38.0000000,M&O MS Forms
M-003766,M037,M037-ZN07,07/20/2022 12:00:00 AM,AM,2022,7,Jul,30,Parks,Highbridge Park,125,,125,,,34,Manhattan,M-12A,ZONE,true,2022-07-23 15:30:45.0000000,M&O MS Forms
M-003756,M037,M037-ZN07,07/19/2022 12:00:00 AM,AM,2022,7,Jul,30,Parks,Highbridge Park,110,,110,,,34,Manhattan,M-12A,ZONE,true,2022-07-23 15:26:49.0000000,M&O MS Forms
M-003784,M037,M037-ZN07,07/22/2022 12:00:00 AM,AM,2022,7,Jul,30,Parks,Highbridge Park,117,,117,,,34,Manhattan,M-12A,ZONE,true,2022-07-23 15:37:06.0000000,M&O MS Forms
M-003775,M037,M037-ZN07,07/21/2022 12:00:00 AM,AM,2022,7,Jul,30,Parks,Highbridge Park,152,,152,,,34,Manhattan,M-12A,ZONE,true,2022-07-23 15:34:06.0000000,M&O MS Forms
M-003866,M037,M037-ZN07,07/31/2022 12:00:00 AM,AM,2022,7,Jul,32,Parks,Highbridge Park,136,,136,,,34,Manhattan,M-12A,ZONE,true,2022-07-31 16:58:29.0000000,M&O MS Forms
M-004600,M037,M037-ZN07,10/16/2022 12:00:00 AM,AM,2022,10,Oct,43,Parks,Highbridge Park,55,,55,,,34,Manhattan,M-12A,ZONE,true,2022-10-19 06:23:38.0000000,M&O MS Forms
M-003857,M037,M037-ZN07,07/30/2022 12:00:00 AM,AM,2022,7,Jul,31,Parks,Highbridge Park,182,,182,,,34,Manhattan,M-12A,ZONE,true,2022-07-31 09:43:50.0000000,M&O MS Forms
M-003839,M037,M037-ZN07,07/28/2022 12:00:00 AM,AM,2022,7,Jul,31,Parks,Highbridge Park,123,,123,,,34,Manhattan,M-12A,ZONE,true,2022-07-29 16:07:22.0000000,M&O MS Forms
M-003848,M037,M037-ZN07,07/29/2022 12:00:00 AM,AM,2022,7,Jul,31,Parks,Highbridge Park,157,,157,,,34,Manhattan,M-12A,ZONE,true,2022-07-29 16:13:45.0000000,M&O MS Forms
M-003831,M037,M037-ZN07,07/27/2022 12:00:00 AM,AM,2022,7,Jul,31,Parks,Highbridge Park,135,,135,,,34,Manhattan,M-12A,ZONE,true,2022-07-29 16:05:00.0000000,M&O MS Forms
M-003822,M037,M037-ZN07,07/26/2022 12:00:00 AM,AM,2022,7,Jul,31,Parks,Highbridge Park,171,,171,,,34,Manhattan,M-12A,ZONE,true,2022-07-29 16:02:04.0000000,M&O MS Forms
M-004701,M037,M037-ZN07,10/26/2022 12:00:00 AM,AM,2022,10,Oct,44,Parks,Highbridge Park,50,,50,,,34,Manhattan,M-12A,ZONE,true,2022-10-27 05:27:35.0000000,M&O MS Forms
M-004718,M037,M037-ZN07,10/27/2022 12:00:00 AM,AM,2022,10,Oct,44,Parks,Highbridge Park,115,,115,,,34,Manhattan,M-12A,ZONE,true,2022-10-30 13:18:36.0000000,M&O MS Forms
M-004727,M037,M037-ZN07,10/28/2022 12:00:00 AM,AM,2022,10,Oct,44,Parks,Highbridge Park,122,,122,,,34,Manhattan,M-12A,ZONE,true,2022-10-30 13:21:45.0000000,M&O MS Forms
M-004683,M037,M037-ZN07,10/24/2022 12:00:00 AM,AM,2022,10,Oct,44,Parks,Highbridge Park,2,,2,,,34,Manhattan,M-12A,ZONE,true,2022-10-25 06:33:15.0000000,M&O MS Forms
M-004692,M037,M037-ZN07,10/25/2022 12:00:00 AM,AM,2022,10,Oct,44,Parks,Highbridge Park,50,,50,,,34,Manhattan,M-12A,ZONE,true,2022-10-26 05:51:14.0000000,M&O MS Forms
M-004665,M037,M037-ZN07,10/22/2022 12:00:00 AM,AM,2022,10,Oct,43,Parks,Highbridge Park,90,,90,,,34,Manhattan,M-12A,ZONE,true,2022-10-25 06:15:58.0000000,M&O MS Forms
M-004674,M037,M037-ZN07,10/23/2022 12:00:00 AM,AM,2022,10,Oct,44,Parks,Highbridge Park,1,,1,,,34,Manhattan,M-12A,ZONE,true,2022-10-25 06:25:22.0000000,M&O MS Forms
M-004656,M037,M037-ZN07,10/21/2022 12:00:00 AM,AM,2022,10,Oct,43,Parks,Highbridge Park,54,,54,,,34,Manhattan,M-12A,ZONE,true,2022-10-25 06:12:50.0000000,M&O MS Forms
M-004647,M037,M037-ZN07,10/20/2022 12:00:00 AM,AM,2022,10,Oct,43,Parks,Highbridge Park,82,,82,,,34,Manhattan,M-12A,ZONE,true,2022-10-25 06:10:24.0000000,M&O MS Forms
X-2830.0,,,05/21/2022 12:00:00 AM,AM,2022,5,May,21,BBP,,12,,12,,,,,X-02,,false,2022-05-21 14:37:31.0000000,M&O MS Forms
X-2843.0,,,05/15/2022 12:00:00 AM,AM,2022,5,May,21,Parks,,1,,1,,,,,X-02,,false,2022-05-23 10:13:09.0000000,M&O MS Forms
X-2837.0,,,05/10/2022 12:00:00 AM,AM,2022,5,May,20,Parks,,2,,2,,,,,X-02,,false,2022-05-23 10:08:00.0000000,M&O MS Forms
X-2772.0,,,05/11/2022 12:00:00 AM,AM,2022,5,May,20,BBP,,1,,1,,,,,X-02,,false,2022-05-13 09:03:37.0000000,M&O MS Forms
X-4949.0,,,03/03/2023 12:00:00 AM,AM,2023,3,Mar,9,Parks,,4,,4,,,,,X-03,,false,2023-03-03 10:31:23.0000000,M&O MS Forms
X-4737.0,,,02/07/2023 12:00:00 AM,AM,2023,2,Feb,6,Parks,,5,,5,,,,,X-03,,false,2023-02-07 17:08:00.0000000,M&O MS Forms
X-4278.0,,,11/19/2022 12:00:00 AM,AM,2022,11,Nov,47,BBP,,77,,77,,,,,X-04,,false,2022-11-21 07:09:10.0000000,M&O MS Forms
X-0199.0,,,04/06/2021 12:00:00 AM,AM,2021,4,Apr,15,BBP,,31,,31,,,,,X-06,,false,2021-04-06 17:28:48.0000000,M&O MS Forms
X-0183.0,,,04/02/2021 12:00:00 AM,AM,2021,4,Apr,14,BBP,,21,,21,,,,,X-06,,false,2021-04-02 19:04:42.0000000,M&O MS Forms
M-000713,M004,M004,07/22/2021 12:00:00 AM,AM,2021,7,Jul,30,Parks,Allen Street Malls,2,,2,,,7,Manhattan,M-03,PARK,false,2021-08-15 09:28:00.0000000,M&O MS Forms
M-000738,M004,M004,07/17/2021 12:00:00 AM,AM,2021,7,Jul,29,Parks,Allen Street Malls,2,,2,,,7,Manhattan,M-03,PARK,false,2021-08-15 09:47:35.0000000,M&O MS Forms
M-000722,M004,M004,07/12/2021 12:00:00 AM,AM,2021,7,Jul,29,Parks,Allen Street Malls,3,,3,,,7,Manhattan,M-03,PARK,false,2021-08-15 09:38:30.0000000,M&O MS Forms
M-000708,M004,M004,07/24/2021 12:00:00 AM,AM,2021,7,Jul,30,Parks,Allen Street Malls,2,,2,,,7,Manhattan,M-03,PARK,false,2021-08-15 09:25:06.0000000,M&O MS Forms
M-000707,M004,M004,07/23/2021 12:00:00 AM,AM,2021,7,Jul,30,Parks,Allen Street Malls,3,,3,,,7,Manhattan,M-03,PARK,false,2021-08-15 09:24:44.0000000,M&O MS Forms
M-000704,M004,M004,08/15/2021 12:00:00 AM,AM,2021,8,Aug,34,Parks,Allen Street Malls,3,,3,,,7,Manhattan,M-03,PARK,false,2021-08-15 09:20:16.0000000,M&O MS Forms
M-000703,M004,M004,06/25/2021 12:00:00 AM,AM,2021,6,Jun,26,Parks,Allen Street Malls,2,,2,,,7,Manhattan,M-03,PARK,false,2021-08-15 09:19:47.0000000,M&O MS Forms
M-000690,M004,M004,08/15/2021 12:00:00 AM,AM,2021,8,Aug,34,Parks,Allen Street Malls,4,,4,,,7,Manhattan,M-03,PARK,false,2021-08-15 09:06:39.0000000,M&O MS Forms
M-000696,M004,M004,06/13/2021 12:00:00 AM,AM,2021,6,Jun,25,Parks,Allen Street Malls,7,,7,,,7,Manhattan,M-03,PARK,false,2021-08-15 09:15:12.0000000,M&O MS Forms
M-000656,M004,M004,08/12/2021 12:00:00 AM,PM,2021,8,Aug,33,Parks,Allen Street Malls,17,,17,,,7,Manhattan,M-03,PARK,false,2021-08-13 12:59:33.0000000,M&O MS Forms
M-001160,M004,M004,10/28/2021 12:00:00 AM,AM,2021,10,Oct,44,Parks,Allen Street Malls,14,,14,,,7,Manhattan,M-03,PARK,false,2021-10-28 10:59:20.0000000,M&O MS Forms
M-000735,M004,M004,07/10/2021 12:00:00 AM,AM,2021,7,Jul,28,Parks,Allen Street Malls,3,,3,,,7,Manhattan,M-03,PARK,false,2021-08-15 09:46:21.0000000,M&O MS Forms
M-000730,M004,M004,06/27/2021 12:00:00 AM,AM,2021,6,Jun,27,Parks,Allen Street Malls,4,,4,,,7,Manhattan,M-03,PARK,false,2021-08-15 09:43:29.0000000,M&O MS Forms
M-000540,M009,M009,07/14/2021 12:00:00 AM,AM,2021,7,Jul,29,Parks,Bennett Park,4,,4,,,34,Manhattan,M-12,PARK,false,2021-07-21 18:34:55.0000000,M&O MS Forms
M-000473,M009,M009,06/30/2021 12:00:00 AM,AM,2021,6,Jun,27,Parks,Bennett Park,3,,3,,,34,Manhattan,M-12,PARK,false,2021-07-04 04:46:26.0000000,M&O MS Forms
M-000094,M009,M009,04/22/2021 12:00:00 AM,AM,2021,4,Apr,17,Parks,Bennett Park,3,,3,,,34,Manhattan,M-12,PARK,false,2021-04-23 07:28:00.0000000,M&O MS Forms
M-004914,M009,M009,11/11/2022 12:00:00 AM,AM,2022,11,Nov,46,Parks,Bennett Park,1,,1,,,34,Manhattan,M-12,PARK,false,2022-11-13 10:30:42.0000000,M&O MS Forms
M-004988,M010,M010,11/21/2022 12:00:00 AM,AM,2022,11,Nov,48,BBP,Central Park,50,,50,,,18,Manhattan,M-13,PARK,false,2022-11-21 13:43:12.0000000,M&O MS Forms
M-004155,M010,M010,09/02/2022 12:00:00 AM,AM,2022,9,Sep,36,BBP,Central Park,1,,1,,,18,Manhattan,M-13,PARK,false,2022-09-02 06:12:29.0000000,M&O MS Forms
M-004156,M010,M010,09/02/2022 12:00:00 AM,AM,2022,9,Sep,36,BBP,Central Park,4,,4,,,18,Manhattan,M-13,PARK,false,2022-09-02 06:13:13.0000000,M&O MS Forms
M-004157,M010,M010,08/30/2022 12:00:00 AM,AM,2022,8,Aug,36,BBP,Central Park,5,,5,,,18,Manhattan,M-13,PARK,false,2022-09-02 06:14:23.0000000,M&O MS Forms
M-004007,M010,M010,08/17/2022 12:00:00 AM,AM,2022,8,Aug,34,BBP,Central Park,2,,2,,,18,Manhattan,M-13,PARK,false,2022-08-18 05:22:55.0000000,M&O MS Forms
M-004006,M010,M010,08/17/2022 12:00:00 AM,AM,2022,8,Aug,34,BBP,Central Park,39,,39,,,18,Manhattan,M-13,PARK,false,2022-08-18 05:22:09.0000000,M&O MS Forms
M-004005,M010,M010,08/17/2022 12:00:00 AM,AM,2022,8,Aug,34,BBP,Central Park,34,,34,,,18,Manhattan,M-13,PARK,false,2022-08-18 05:20:57.0000000,M&O MS Forms
M-003069,M037,M037-03,05/09/2022 12:00:00 AM,AM,2022,5,May,20,Parks,Highbridge Park,2,,2,,,34,Manhattan,M-12A,PLGD,true,2022-05-13 15:15:45.0000000,M&O MS Forms
M-003141,M037,M037-03,05/16/2022 12:00:00 AM,AM,2022,5,May,21,Parks,Highbridge Park,5,,5,,,34,Manhattan,M-12A,PLGD,true,2022-05-20 15:03:16.0000000,M&O MS Forms
M-003159,M037,M037-03,05/18/2022 12:00:00 AM,AM,2022,5,May,21,Parks,Highbridge Park,9,,9,,,34,Manhattan,M-12A,PLGD,true,2022-05-20 15:08:56.0000000,M&O MS Forms
M-003150,M037,M037-03,05/17/2022 12:00:00 AM,AM,2022,5,May,21,Parks,Highbridge Park,9,,9,,,34,Manhattan,M-12A,PLGD,true,2022-05-20 15:06:13.0000000,M&O MS Forms
M-003128,M037,M037-03,05/08/2022 12:00:00 AM,AM,2022,5,May,20,Parks,Highbridge Park,7,,7,,,34,Manhattan,M-12A,PLGD,true,2022-05-15 17:08:11.0000000,M&O MS Forms
M-003118,M037,M037-03,05/14/2022 12:00:00 AM,AM,2022,5,May,20,Parks,Highbridge Park,17,,17,,,34,Manhattan,M-12A,PLGD,true,2022-05-14 15:51:48.0000000,M&O MS Forms
M-003108,M037,M037-03,05/13/2022 12:00:00 AM,AM,2022,5,May,20,Parks,Highbridge Park,15,,15,,,34,Manhattan,M-12A,PLGD,true,2022-05-14 10:51:38.0000000,M&O MS Forms
M-003198,M037,M037-03,05/22/2022 12:00:00 AM,AM,2022,5,May,22,Parks,Highbridge Park,5,,5,,,34,Manhattan,M-12A,PLGD,true,2022-05-22 15:13:35.0000000,M&O MS Forms
M-003211,M037,M037-03,05/23/2022 12:00:00 AM,AM,2022,5,May,22,Parks,Highbridge Park,7,,7,,,34,Manhattan,M-12A,PLGD,true,2022-05-28 10:47:37.0000000,M&O MS Forms
M-003220,M037,M037-03,05/24/2022 12:00:00 AM,AM,2022,5,May,22,Parks,Highbridge Park,4,,4,,,34,Manhattan,M-12A,PLGD,true,2022-05-28 10:50:09.0000000,M&O MS Forms
M-003186,M037,M037-03,05/21/2022 12:00:00 AM,AM,2022,5,May,21,Parks,Highbridge Park,10,,10,,,34,Manhattan,M-12A,PLGD,true,2022-05-22 08:33:54.0000000,M&O MS Forms
M-003177,M037,M037-03,05/20/2022 12:00:00 AM,AM,2022,5,May,21,Parks,Highbridge Park,5,,5,,,34,Manhattan,M-12A,PLGD,true,2022-05-20 15:15:35.0000000,M&O MS Forms
M-003168,M037,M037-03,05/19/2022 12:00:00 AM,AM,2022,5,May,21,Parks,Highbridge Park,5,,5,,,34,Manhattan,M-12A,PLGD,true,2022-05-20 15:12:57.0000000,M&O MS Forms
M-001742,M037,M037-03,12/20/2021 12:00:00 AM,AM,2021,12,Dec,52,Parks,Highbridge Park,30,,30,,,34,Manhattan,M-12A,PLGD,true,2021-12-21 16:09:23.0000000,M&O MS Forms
M-001733,M037,M037-03,12/19/2021 12:00:00 AM,AM,2021,12,Dec,52,Parks,Highbridge Park,27,,27,,,34,Manhattan,M-12A,PLGD,true,2021-12-21 16:06:56.0000000,M&O MS Forms
M-001747,M037,M037-03,12/21/2021 12:00:00 AM,AM,2021,12,Dec,52,Parks,Highbridge Park,10,,10,,,34,Manhattan,M-12A,PLGD,true,2021-12-21 16:10:50.0000000,M&O MS Forms
M-001772,M037,M037-03,12/22/2021 12:00:00 AM,AM,2021,12,Dec,52,Parks,Highbridge Park,25,,25,,,34,Manhattan,M-12A,PLGD,true,2021-12-23 15:48:33.0000000,M&O MS Forms
M-001780,M037,M037-03,12/23/2021 12:00:00 AM,AM,2021,12,Dec,52,Parks,Highbridge Park,4,,4,,,34,Manhattan,M-12A,PLGD,true,2021-12-23 16:17:22.0000000,M&O MS Forms
M-001790,M037,M037-03,12/24/2021 12:00:00 AM,AM,2021,12,Dec,52,Parks,Highbridge Park,11,,11,,,34,Manhattan,M-12A,PLGD,true,2021-12-26 12:15:14.0000000,M&O MS Forms
M-001799,M037,M037-03,12/25/2021 12:00:00 AM,AM,2021,12,Dec,52,Parks,Highbridge Park,5,,5,,,34,Manhattan,M-12A,PLGD,true,2021-12-26 12:18:43.0000000,M&O MS Forms
M-001809,M037,M037-03,12/26/2021 12:00:00 AM,AM,2021,12,Dec,53,Parks,Highbridge Park,16,,16,,,34,Manhattan,M-12A,PLGD,true,2021-12-27 16:05:08.0000000,M&O MS Forms
M-001820,M037,M037-03,12/27/2021 12:00:00 AM,AM,2021,12,Dec,53,Parks,Highbridge Park,5,,5,,,34,Manhattan,M-12A,PLGD,true,2021-12-27 16:11:46.0000000,M&O MS Forms
M-001828,M037,M037-03,12/28/2021 12:00:00 AM,AM,2021,12,Dec,53,Parks,Highbridge Park,5,,5,,,34,Manhattan,M-12A,PLGD,true,2021-12-28 15:34:13.0000000,M&O MS Forms
M-001853,M037,M037-03,12/30/2021 12:00:00 AM,AM,2021,12,Dec,53,Parks,Highbridge Park,1,,1,,,34,Manhattan,M-12A,PLGD,true,2021-12-30 15:55:17.0000000,M&O MS Forms
M-001867,M037,M037-03,12/31/2021 12:00:00 AM,AM,2021,12,Dec,53,Parks,Highbridge Park,4,,4,,,34,Manhattan,M-12A,PLGD,true,2021-12-31 20:03:05.0000000,M&O MS Forms
M-004735,M037,M037-03,10/29/2022 12:00:00 AM,AM,2022,10,Oct,44,Parks,Highbridge Park,10,,10,,,34,Manhattan,M-12A,PLGD,true,2022-10-30 13:24:29.0000000,M&O MS Forms
M-004730,M037,M037-03,10/28/2022 12:00:00 AM,AM,2022,10,Oct,44,Parks,Highbridge Park,22,,22,,,34,Manhattan,M-12A,PLGD,true,2022-10-30 13:22:56.0000000,M&O MS Forms
M-000107,M037,M037-03,04/21/2021 12:00:00 AM,AM,2021,4,Apr,17,Parks,Highbridge Park,1,,1,,,34,Manhattan,M-12A,PLGD,true,2021-04-23 22:00:26.0000000,M&O MS Forms
M-000156,M037,M037-03,04/30/2021 12:00:00 AM,AM,2021,4,Apr,18,Parks,Highbridge Park,2,,2,,,34,Manhattan,M-12A,PLGD,true,2021-04-30 23:22:28.0000000,M&O MS Forms
M-003793,M037,M037-03,07/23/2022 12:00:00 AM,AM,2022,7,Jul,30,Parks,Highbridge Park,7,,7,,,34,Manhattan,M-12A,PLGD,true,2022-07-24 12:12:38.0000000,M&O MS Forms
M-003786,M037,M037-03,07/22/2022 12:00:00 AM,AM,2022,7,Jul,30,Parks,Highbridge Park,6,,6,,,34,Manhattan,M-12A,PLGD,true,2022-07-23 15:37:43.0000000,M&O MS Forms
M-003816,M037,M037-03,07/25/2022 12:00:00 AM,AM,2022,7,Jul,31,Parks,Highbridge Park,3,,3,,,34,Manhattan,M-12A,PLGD,true,2022-07-29 15:59:56.0000000,M&O MS Forms
M-003807,M037,M037-03,07/24/2022 12:00:00 AM,AM,2022,7,Jul,31,Parks,Highbridge Park,9,,9,,,34,Manhattan,M-12A,PLGD,true,2022-07-29 15:56:57.0000000,M&O MS Forms
M-000425,M037,M037-03,06/20/2021 12:00:00 AM,AM,2021,6,Jun,26,Parks,Highbridge Park,2,,2,,,34,Manhattan,M-12A,PLGD,true,2021-06-25 19:55:03.0000000,M&O MS Forms
M-000420,M037,M037-03,06/18/2021 12:00:00 AM,AM,2021,6,Jun,25,Parks,Highbridge Park,5,,5,,,34,Manhattan,M-12A,PLGD,true,2021-06-19 08:15:24.0000000,M&O MS Forms
M-000416,M037,M037-03,06/17/2021 12:00:00 AM,AM,2021,6,Jun,25,Parks,Highbridge Park,2,,2,,,34,Manhattan,M-12A,PLGD,true,2021-06-19 08:14:17.0000000,M&O MS Forms
M-000410,M037,M037-03,06/15/2021 12:00:00 AM,AM,2021,6,Jun,25,BBP,Highbridge Park,3,,3,,,34,Manhattan,M-12A,PLGD,true,2021-06-19 08:12:02.0000000,M&O MS Forms
M-000408,M037,M037-03,06/14/2021 12:00:00 AM,AM,2021,6,Jun,25,Parks,Highbridge Park,4,,4,,,34,Manhattan,M-12A,PLGD,true,2021-06-19 08:11:17.0000000,M&O MS Forms
M-000404,M037,M037-03,06/13/2021 12:00:00 AM,AM,2021,6,Jun,25,Parks,Highbridge Park,5,,5,,,34,Manhattan,M-12A,PLGD,true,2021-06-19 08:09:31.0000000,M&O MS Forms
M-000394,M037,M037-03,06/10/2021 12:00:00 AM,AM,2021,6,Jun,24,Parks,Highbridge Park,3,,3,,,34,Manhattan,M-12A,PLGD,true,2021-06-11 17:45:14.0000000,M&O MS Forms
M-000388,M037,M037-03,06/08/2021 12:00:00 AM,AM,2021,6,Jun,24,BBP,Highbridge Park,4,,4,,,34,Manhattan,M-12A,PLGD,true,2021-06-11 17:42:49.0000000,M&O MS Forms
M-002160,M037,M037-03,02/04/2022 12:00:00 AM,AM,2022,2,Feb,6,Parks,Highbridge Park,4,,4,,,34,Manhattan,M-12A,PLGD,true,2022-02-10 08:32:54.0000000,M&O MS Forms
M-002104,M037,M037-03,01/25/2022 12:00:00 AM,AM,2022,1,Jan,5,Parks,Highbridge Park,6,,6,,,34,Manhattan,M-12A,PLGD,true,2022-01-25 15:53:28.0000000,M&O MS Forms
M-002085,M037,M037-03,01/24/2022 12:00:00 AM,AM,2022,1,Jan,5,Parks,Highbridge Park,1,,1,,,34,Manhattan,M-12A,PLGD,true,2022-01-24 18:58:12.0000000,M&O MS Forms
M-002076,M037,M037-03,01/23/2022 12:00:00 AM,AM,2022,1,Jan,5,Parks,Highbridge Park,5,,5,,,34,Manhattan,M-12A,PLGD,true,2022-01-24 18:52:33.0000000,M&O MS Forms
M-002051,M037,M037-03,01/19/2022 12:00:00 AM,AM,2022,1,Jan,4,Parks,Highbridge Park,3,,3,,,34,Manhattan,M-12A,PLGD,true,2022-01-20 17:07:21.0000000,M&O MS Forms
M-002042,M037,M037-03,01/18/2022 12:00:00 AM,AM,2022,1,Jan,4,Parks,Highbridge Park,2,,2,,,34,Manhattan,M-12A,PLGD,true,2022-01-20 17:04:56.0000000,M&O MS Forms
M-002029,M037,M037-03,01/16/2022 12:00:00 AM,AM,2022,1,Jan,4,Parks,Highbridge Park,1,,1,,,34,Manhattan,M-12A,PLGD,true,2022-01-20 17:01:22.0000000,M&O MS Forms
M-001933,M037,M037-03,01/06/2022 12:00:00 AM,AM,2022,1,Jan,2,Parks,Highbridge Park,3,,3,,,34,Manhattan,M-12A,PLGD,true,2022-01-06 16:41:25.0000000,M&O MS Forms
M-001919,M037,M037-03,01/05/2022 12:00:00 AM,AM,2022,1,Jan,2,Parks,Highbridge Park,8,,8,,,34,Manhattan,M-12A,PLGD,true,2022-01-05 17:42:16.0000000,M&O MS Forms
M-001909,M037,M037-03,01/04/2022 12:00:00 AM,AM,2022,1,Jan,2,Parks,Highbridge Park,7,,7,,,34,Manhattan,M-12A,PLGD,true,2022-01-05 17:33:10.0000000,M&O MS Forms
M-001897,M037,M037-03,01/03/2022 12:00:00 AM,AM,2022,1,Jan,2,Parks,Highbridge Park,8,,8,,,34,Manhattan,M-12A,PLGD,true,2022-01-04 13:24:50.0000000,M&O MS Forms
M-001888,M037,M037-03,01/02/2022 12:00:00 AM,AM,2022,1,Jan,2,Parks,Highbridge Park,10,,10,,,34,Manhattan,M-12A,PLGD,true,2022-01-02 19:08:33.0000000,M&O MS Forms
M-001974,M037,M037-03,01/12/2022 12:00:00 AM,AM,2022,1,Jan,3,Parks,Highbridge Park,2,,2,,,34,Manhattan,M-12A,PLGD,true,2022-01-13 14:55:32.0000000,M&O MS Forms
M-001957,M037,M037-03,01/10/2022 12:00:00 AM,AM,2022,1,Jan,3,Parks,Highbridge Park,2,,2,,,34,Manhattan,M-12A,PLGD,true,2022-01-13 14:50:00.0000000,M&O MS Forms
M-004373,M037,M037-03,09/22/2022 12:00:00 AM,AM,2022,9,Sep,39,Parks,Highbridge Park,8,,8,,,34,Manhattan,M-12A,PLGD,true,2022-09-23 05:30:31.0000000,M&O MS Forms
M-004364,M037,M037-03,09/21/2022 12:00:00 AM,AM,2022,9,Sep,39,Parks,Highbridge Park,4,,4,,,34,Manhattan,M-12A,PLGD,true,2022-09-23 05:27:55.0000000,M&O MS Forms
M-004391,M037,M037-03,09/24/2022 12:00:00 AM,AM,2022,9,Sep,39,Parks,Highbridge Park,7,,7,,,34,Manhattan,M-12A,PLGD,true,2022-09-26 06:07:35.0000000,M&O MS Forms
M-004382,M037,M037-03,09/23/2022 12:00:00 AM,AM,2022,9,Sep,39,Parks,Highbridge Park,6,,6,,,34,Manhattan,M-12A,PLGD,true,2022-09-26 06:04:46.0000000,M&O MS Forms
M-004355,M037,M037-03,09/20/2022 12:00:00 AM,AM,2022,9,Sep,39,Parks,Highbridge Park,4,,4,,,34,Manhattan,M-12A,PLGD,true,2022-09-22 16:53:45.0000000,M&O MS Forms
M-004347,M037,M037-03,09/19/2022 12:00:00 AM,AM,2022,9,Sep,39,Parks,Highbridge Park,3,,3,,,34,Manhattan,M-12A,PLGD,true,2022-09-22 16:51:10.0000000,M&O MS Forms
M-004339,M037,M037-03,09/18/2022 12:00:00 AM,AM,2022,9,Sep,39,Parks,Highbridge Park,5,,5,,,34,Manhattan,M-12A,PLGD,true,2022-09-22 16:47:51.0000000,M&O MS Forms
M-004466,M037,M037-03,09/30/2022 12:00:00 AM,AM,2022,9,Sep,40,Parks,Highbridge Park,9,,9,,,34,Manhattan,M-12A,PLGD,true,2022-10-11 07:06:04.0000000,M&O MS Forms
M-004467,M037,M037-03,09/30/2022 12:00:00 AM,AM,2022,9,Sep,40,Parks,Highbridge Park,9,,9,,,34,Manhattan,M-12A,PLGD,true,2022-10-11 07:06:04.0000000,M&O MS Forms
M-004476,M037,M037-03,09/30/2022 12:00:00 AM,AM,2022,9,Sep,40,Parks,Highbridge Park,8,,8,,,34,Manhattan,M-12A,PLGD,true,2022-10-11 07:10:52.0000000,M&O MS Forms
M-004166,M037,M037-03,08/28/2022 12:00:00 AM,AM,2022,8,Aug,36,Parks,Highbridge Park,8,,8,,,34,Manhattan,M-12A,PLGD,true,2022-09-02 13:04:57.0000000,M&O MS Forms
M-005810,M037,M037-03,02/18/2023 12:00:00 AM,AM,2023,2,Feb,7,Parks,Highbridge Park,10,,10,,,34,Manhattan,M-12A,PLGD,true,2023-02-19 13:46:17.0000000,M&O MS Forms
M-005819,M037,M037-03,02/19/2023 12:00:00 AM,AM,2023,2,Feb,8,Parks,Highbridge Park,2,,2,,,34,Manhattan,M-12A,PLGD,true,2023-02-22 08:41:46.0000000,M&O MS Forms
M-005827,M037,M037-03,02/20/2023 12:00:00 AM,AM,2023,2,Feb,8,Parks,Highbridge Park,7,,7,,,34,Manhattan,M-12A,PLGD,true,2023-02-22 10:38:22.0000000,M&O MS Forms
M-005836,M037,M037-03,02/21/2023 12:00:00 AM,AM,2023,2,Feb,8,Parks,Highbridge Park,5,,5,,,34,Manhattan,M-12A,PLGD,true,2023-02-22 10:42:34.0000000,M&O MS Forms
M-005848,M037,M037-03,02/22/2023 12:00:00 AM,AM,2023,2,Feb,8,Parks,Highbridge Park,6,,6,,,34,Manhattan,M-12A,PLGD,true,2023-02-23 15:21:30.0000000,M&O MS Forms
M-005849,M037,M037-03,02/22/2023 12:00:00 AM,AM,2023,2,Feb,8,Parks,Highbridge Park,6,,6,,,34,Manhattan,M-12A,PLGD,true,2023-02-23 15:21:31.0000000,M&O MS Forms
M-005790,M037,M037-03,02/16/2023 12:00:00 AM,AM,2023,2,Feb,7,Parks,Highbridge Park,9,,9,,,34,Manhattan,M-12A,PLGD,true,2023-02-16 16:06:22.0000000,M&O MS Forms
M-005858,M037,M037-03,02/23/2023 12:00:00 AM,AM,2023,2,Feb,8,Parks,Highbridge Park,4,,4,,,34,Manhattan,M-12A,PLGD,true,2023-02-23 15:25:06.0000000,M&O MS Forms
M-005859,M037,M037-03,02/23/2023 12:00:00 AM,AM,2023,2,Feb,8,Parks,Highbridge Park,4,,4,,,34,Manhattan,M-12A,PLGD,true,2023-02-23 15:25:07.0000000,M&O MS Forms
M-005868,M037,M037-03,02/24/2023 12:00:00 AM,AM,2023,2,Feb,8,Parks,Highbridge Park,3,,3,,,34,Manhattan,M-12A,PLGD,true,2023-02-24 18:52:25.0000000,M&O MS Forms
M-005877,M037,M037-03,02/25/2023 12:00:00 AM,AM,2023,2,Feb,8,Parks,Highbridge Park,2,,2,,,34,Manhattan,M-12A,PLGD,true,2023-02-26 12:04:39.0000000,M&O MS Forms
M-005896,M037,M037-03,02/26/2023 12:00:00 AM,AM,2023,2,Feb,9,Parks,Highbridge Park,7,,7,,,34,Manhattan,M-12A,PLGD,true,2023-03-01 05:33:45.0000000,M&O MS Forms
M-005886,M037,M037-03,02/26/2023 12:00:00 AM,AM,2023,2,Feb,9,Parks,Highbridge Park,7,,7,,,34,Manhattan,M-12A,PLGD,true,2023-02-26 19:18:19.0000000,M&O MS Forms
M-005905,M037,M037-03,02/27/2023 12:00:00 AM,AM,2023,2,Feb,9,Parks,Highbridge Park,5,,5,,,34,Manhattan,M-12A,PLGD,true,2023-03-01 05:37:17.0000000,M&O MS Forms
M-005917,M037,M037-03,03/01/2023 12:00:00 AM,AM,2023,3,Mar,9,Parks,Highbridge Park,5,,5,,,34,Manhattan,M-12A,PLGD,true,2023-03-01 16:25:13.0000000,M&O MS Forms
M-005925,M037,M037-03,03/02/2023 12:00:00 AM,AM,2023,3,Mar,9,Parks,Highbridge Park,9,,9,,,34,Manhattan,M-12A,PLGD,true,2023-03-04 13:27:45.0000000,M&O MS Forms
M-005934,M037,M037-03,03/03/2023 12:00:00 AM,AM,2023,3,Mar,9,Parks,Highbridge Park,10,,10,,,34,Manhattan,M-12A,PLGD,true,2023-03-04 13:31:13.0000000,M&O MS Forms
M-005952,M037,M037-03,03/05/2023 12:00:00 AM,AM,2023,3,Mar,10,Parks,Highbridge Park,5,,5,,,34,Manhattan,M-12A,PLGD,true,2023-03-06 06:05:07.0000000,M&O MS Forms
M-005969,M037,M037-03,03/06/2023 12:00:00 AM,AM,2023,3,Mar,10,Parks,Highbridge Park,3,,3,,,34,Manhattan,M-12A,PLGD,true,2023-03-06 17:36:24.0000000,M&O MS Forms
M-005943,M037,M037-03,03/04/2023 12:00:00 AM,AM,2023,3,Mar,9,Parks,Highbridge Park,6,,6,,,34,Manhattan,M-12A,PLGD,true,2023-03-04 13:34:21.0000000,M&O MS Forms
M-005980,M037,M037-03,03/07/2023 12:00:00 AM,AM,2023,3,Mar,10,Parks,Highbridge Park,4,,4,,,34,Manhattan,M-12A,PLGD,true,2023-03-07 15:51:37.0000000,M&O MS Forms
M-005989,M037,M037-03,03/08/2023 12:00:00 AM,AM,2023,3,Mar,10,Parks,Highbridge Park,3,,3,,,34,Manhattan,M-12A,PLGD,true,2023-03-08 15:47:07.0000000,M&O MS Forms
M-003041,M037,M037-ZN02,05/08/2022 12:00:00 AM,AM,2022,5,May,20,Parks,Highbridge Park,5,,5,,,2,Manhattan,M-12A,ZONE,true,2022-05-09 08:07:00.0000000,M&O MS Forms
M-003012,M037,M037-ZN02,05/05/2022 12:00:00 AM,AM,2022,5,May,19,Parks,Highbridge Park,12,,12,,,2,Manhattan,M-12A,ZONE,true,2022-05-06 19:47:35.0000000,M&O MS Forms
M-003003,M037,M037-ZN02,05/04/2022 12:00:00 AM,AM,2022,5,May,19,Parks,Highbridge Park,8,,8,,,2,Manhattan,M-12A,ZONE,true,2022-05-06 19:43:07.0000000,M&O MS Forms
M-003021,M037,M037-ZN02,05/06/2022 12:00:00 AM,AM,2022,5,May,19,Parks,Highbridge Park,9,,9,,,2,Manhattan,M-12A,ZONE,true,2022-05-06 20:03:24.0000000,M&O MS Forms
M-003033,M037,M037-ZN02,05/07/2022 12:00:00 AM,AM,2022,5,May,19,Parks,Highbridge Park,5,,5,,,2,Manhattan,M-12A,ZONE,true,2022-05-09 07:59:55.0000000,M&O MS Forms
M-002988,M037,M037-ZN02,05/01/2022 12:00:00 AM,AM,2022,5,May,19,Parks,Highbridge Park,12,,12,,,2,Manhattan,M-12A,ZONE,true,2022-05-06 19:18:08.0000000,M&O MS Forms
M-002966,M037,M037-ZN02,04/23/2022 12:00:00 AM,AM,2022,4,Apr,17,Parks,Highbridge Park,15,,15,,,2,Manhattan,M-12A,ZONE,true,2022-04-30 14:55:39.0000000,M&O MS Forms
M-002997,M037,M037-ZN02,05/02/2022 12:00:00 AM,AM,2022,5,May,19,Parks,Highbridge Park,1,,1,,,2,Manhattan,M-12A,ZONE,true,2022-05-06 19:22:01.0000000,M&O MS Forms
M-002914,M037,M037-ZN02,04/25/2022 12:00:00 AM,AM,2022,4,Apr,18,Parks,Highbridge Park,5,,5,,,2,Manhattan,M-12A,ZONE,true,2022-04-30 13:57:02.0000000,M&O MS Forms
M-002905,M037,M037-ZN02,04/24/2022 12:00:00 AM,AM,2022,4,Apr,18,Parks,Highbridge Park,10,,10,,,2,Manhattan,M-12A,ZONE,true,2022-04-30 13:51:04.0000000,M&O MS Forms
M-002930,M037,M037-ZN02,04/27/2022 12:00:00 AM,AM,2022,4,Apr,18,Parks,Highbridge Park,10,,10,,,2,Manhattan,M-12A,ZONE,true,2022-04-30 14:26:46.0000000,M&O MS Forms
M-002921,M037,M037-ZN02,04/26/2022 12:00:00 AM,AM,2022,4,Apr,18,Parks,Highbridge Park,7,,7,,,2,Manhattan,M-12A,ZONE,true,2022-04-30 14:09:09.0000000,M&O MS Forms
M-002939,M037,M037-ZN02,04/28/2022 12:00:00 AM,AM,2022,4,Apr,18,Parks,Highbridge Park,7,,7,,,2,Manhattan,M-12A,ZONE,true,2022-04-30 14:31:17.0000000,M&O MS Forms
M-002948,M037,M037-ZN02,04/29/2022 12:00:00 AM,AM,2022,4,Apr,18,Parks,Highbridge Park,21,,21,,,2,Manhattan,M-12A,ZONE,true,2022-04-30 14:35:01.0000000,M&O MS Forms
M-002957,M037,M037-ZN02,04/30/2022 12:00:00 AM,AM,2022,4,Apr,18,Parks,Highbridge Park,11,,11,,,2,Manhattan,M-12A,ZONE,true,2022-04-30 14:50:44.0000000,M&O MS Forms
M-002838,M037,M037-ZN02,04/17/2022 12:00:00 AM,AM,2022,4,Apr,17,Parks,Highbridge Park,8,,8,,,2,Manhattan,M-12A,ZONE,true,2022-04-23 12:13:22.0000000,M&O MS Forms
M-002846,M037,M037-ZN02,04/18/2022 12:00:00 AM,AM,2022,4,Apr,17,Parks,Highbridge Park,5,,5,,,2,Manhattan,M-12A,ZONE,true,2022-04-23 12:16:55.0000000,M&O MS Forms
M-002855,M037,M037-ZN02,04/19/2022 12:00:00 AM,AM,2022,4,Apr,17,Parks,Highbridge Park,3,,3,,,2,Manhattan,M-12A,ZONE,true,2022-04-23 12:20:18.0000000,M&O MS Forms
M-002864,M037,M037-ZN02,04/20/2022 12:00:00 AM,AM,2022,4,Apr,17,Parks,Highbridge Park,6,,6,,,2,Manhattan,M-12A,ZONE,true,2022-04-23 12:23:23.0000000,M&O MS Forms
M-002872,M037,M037-ZN02,04/21/2022 12:00:00 AM,AM,2022,4,Apr,17,Parks,Highbridge Park,10,,10,,,2,Manhattan,M-12A,ZONE,true,2022-04-23 12:26:11.0000000,M&O MS Forms
M-002881,M037,M037-ZN02,04/22/2022 12:00:00 AM,AM,2022,4,Apr,17,Parks,Highbridge Park,8,,8,,,2,Manhattan,M-12A,ZONE,true,2022-04-23 12:29:15.0000000,M&O MS Forms
M-002776,M037,M037-ZN02,04/09/2022 12:00:00 AM,AM,2022,4,Apr,15,Parks,Highbridge Park,7,,7,,,2,Manhattan,M-12A,ZONE,true,2022-04-17 16:24:14.0000000,M&O MS Forms
M-002784,M037,M037-ZN02,04/10/2022 12:00:00 AM,AM,2022,4,Apr,16,Parks,Highbridge Park,50,,50,,,2,Manhattan,M-12A,ZONE,true,2022-04-17 16:30:09.0000000,M&O MS Forms
M-002793,M037,M037-ZN02,04/11/2022 12:00:00 AM,AM,2022,4,Apr,16,Parks,Highbridge Park,30,,30,,,2,Manhattan,M-12A,ZONE,true,2022-04-17 16:32:59.0000000,M&O MS Forms
M-002802,M037,M037-ZN02,04/12/2022 12:00:00 AM,AM,2022,4,Apr,16,Parks,Highbridge Park,23,,23,,,2,Manhattan,M-12A,ZONE,true,2022-04-17 16:36:11.0000000,M&O MS Forms
M-002811,M037,M037-ZN02,04/13/2022 12:00:00 AM,AM,2022,4,Apr,16,Parks,Highbridge Park,18,,18,,,2,Manhattan,M-12A,ZONE,true,2022-04-17 16:40:15.0000000,M&O MS Forms
M-002820,M037,M037-ZN02,04/14/2022 12:00:00 AM,AM,2022,4,Apr,16,Parks,Highbridge Park,22,,22,,,2,Manhattan,M-12A,ZONE,true,2022-04-17 16:42:50.0000000,M&O MS Forms
M-002828,M037,M037-ZN02,04/15/2022 12:00:00 AM,AM,2022,4,Apr,16,Parks,Highbridge Park,15,,15,,,2,Manhattan,M-12A,ZONE,true,2022-04-17 16:45:52.0000000,M&O MS Forms
M-002719,M037,M037-ZN02,04/03/2022 12:00:00 AM,AM,2022,4,Apr,15,Parks,Highbridge Park,5,,5,,,2,Manhattan,M-12A,ZONE,true,2022-04-07 13:57:04.0000000,M&O MS Forms
M-002728,M037,M037-ZN02,04/04/2022 12:00:00 AM,AM,2022,4,Apr,15,Parks,Highbridge Park,3,,3,,,2,Manhattan,M-12A,ZONE,true,2022-04-07 14:00:11.0000000,M&O MS Forms
M-002745,M037,M037-ZN02,04/06/2022 12:00:00 AM,AM,2022,4,Apr,15,Parks,Highbridge Park,3,,3,,,2,Manhattan,M-12A,ZONE,true,2022-04-07 14:07:07.0000000,M&O MS Forms
M-002737,M037,M037-ZN02,04/05/2022 12:00:00 AM,AM,2022,4,Apr,15,Parks,Highbridge Park,2,,2,,,2,Manhattan,M-12A,ZONE,true,2022-04-07 14:04:02.0000000,M&O MS Forms
M-005918,M037,M037-ZN02,03/02/2023 12:00:00 AM,AM,2023,3,Mar,9,Parks,Highbridge Park,12,,12,,,2,Manhattan,M-12A,ZONE,true,2023-03-04 13:24:44.0000000,M&O MS Forms
M-005906,M037,M037-ZN02,02/28/2023 12:00:00 AM,AM,2023,2,Feb,9,Parks,Highbridge Park,1,,1,,,2,Manhattan,M-12A,ZONE,true,2023-03-01 05:37:54.0000000,M&O MS Forms
M-005908,M037,M037-ZN02,03/01/2023 12:00:00 AM,AM,2023,3,Mar,9,Parks,Highbridge Park,5,,5,,,2,Manhattan,M-12A,ZONE,true,2023-03-01 15:45:24.0000000,M&O MS Forms
M-005901,M037,M037-ZN02,02/27/2023 12:00:00 AM,AM,2023,2,Feb,9,Parks,Highbridge Park,3,,3,,,2,Manhattan,M-12A,ZONE,true,2023-03-01 05:35:58.0000000,M&O MS Forms
M-005897,M037,M037-ZN02,02/27/2023 12:00:00 AM,AM,2023,2,Feb,9,Parks,Highbridge Park,12,,12,,,2,Manhattan,M-12A,ZONE,true,2023-03-01 05:34:18.0000000,M&O MS Forms
M-005888,M037,M037-ZN02,02/26/2023 12:00:00 AM,AM,2023,2,Feb,9,Parks,Highbridge Park,10,,10,,,2,Manhattan,M-12A,ZONE,true,2023-03-01 05:31:17.0000000,M&O MS Forms
M-005878,M037,M037-ZN02,02/26/2023 12:00:00 AM,AM,2023,2,Feb,9,Parks,Highbridge Park,10,,10,,,2,Manhattan,M-12A,ZONE,true,2023-02-26 19:15:42.0000000,M&O MS Forms
M-005869,M037,M037-ZN02,02/25/2023 12:00:00 AM,AM,2023,2,Feb,8,Parks,Highbridge Park,6,,6,,,2,Manhattan,M-12A,ZONE,true,2023-02-26 12:02:19.0000000,M&O MS Forms
M-005840,M037,M037-ZN02,02/22/2023 12:00:00 AM,AM,2023,2,Feb,8,Parks,Highbridge Park,8,,8,,,2,Manhattan,M-12A,ZONE,true,2023-02-23 14:59:02.0000000,M&O MS Forms
M-005860,M037,M037-ZN02,02/24/2023 12:00:00 AM,AM,2023,2,Feb,8,Parks,Highbridge Park,7,,7,,,2,Manhattan,M-12A,ZONE,true,2023-02-24 18:49:41.0000000,M&O MS Forms
M-005850,M037,M037-ZN02,02/23/2023 12:00:00 AM,AM,2023,2,Feb,8,Parks,Highbridge Park,4,,4,,,2,Manhattan,M-12A,ZONE,true,2023-02-23 15:22:22.0000000,M&O MS Forms
M-005044,M037,M037-ZN02,11/27/2022 12:00:00 AM,AM,2022,11,Nov,49,Parks,Highbridge Park,5,,5,,,2,Manhattan,M-12A,ZONE,true,2022-12-03 12:56:17.0000000,M&O MS Forms
M-005828,M037,M037-ZN02,02/21/2023 12:00:00 AM,AM,2023,2,Feb,8,Parks,Highbridge Park,10,,10,,,2,Manhattan,M-12A,ZONE,true,2023-02-22 10:40:08.0000000,M&O MS Forms
M-005820,M037,M037-ZN02,02/20/2023 12:00:00 AM,AM,2023,2,Feb,8,Parks,Highbridge Park,9,,9,,,2,Manhattan,M-12A,ZONE,true,2023-02-22 10:35:53.0000000,M&O MS Forms
M-005811,M037,M037-ZN02,02/19/2023 12:00:00 AM,AM,2023,2,Feb,8,Parks,Highbridge Park,15,,15,,,2,Manhattan,M-12A,ZONE,true,2023-02-22 08:34:23.0000000,M&O MS Forms
M-005800,M037,M037-ZN02,02/18/2023 12:00:00 AM,AM,2023,2,Feb,7,Parks,Highbridge Park,13,,13,,,2,Manhattan,M-12A,ZONE,true,2023-02-19 13:43:05.0000000,M&O MS Forms
M-005781,M037,M037-ZN02,02/16/2023 12:00:00 AM,AM,2023,2,Feb,7,Parks,Highbridge Park,17,,17,,,2,Manhattan,M-12A,ZONE,true,2023-02-16 15:56:41.0000000,M&O MS Forms
M-005791,M037,M037-ZN02,02/17/2023 12:00:00 AM,AM,2023,2,Feb,7,Parks,Highbridge Park,20,,20,,,2,Manhattan,M-12A,ZONE,true,2023-02-19 13:37:34.0000000,M&O MS Forms
M-005062,M037,M037-ZN02,11/29/2022 12:00:00 AM,AM,2022,11,Nov,49,Parks,Highbridge Park,8,,8,,,2,Manhattan,M-12A,ZONE,true,2022-12-03 13:02:23.0000000,M&O MS Forms
M-005053,M037,M037-ZN02,11/28/2022 12:00:00 AM,AM,2022,11,Nov,49,Parks,Highbridge Park,10,,10,,,2,Manhattan,M-12A,ZONE,true,2022-12-03 12:59:22.0000000,M&O MS Forms
M-005071,M037,M037-ZN02,11/30/2022 12:00:00 AM,AM,2022,11,Nov,49,Parks,Highbridge Park,15,,15,,,2,Manhattan,M-12A,ZONE,true,2022-12-03 13:04:55.0000000,M&O MS Forms
M-005080,M037,M037-ZN02,12/01/2022 12:00:00 AM,AM,2022,12,Dec,49,Parks,Highbridge Park,14,,14,,,2,Manhattan,M-12A,ZONE,true,2022-12-03 13:07:30.0000000,M&O MS Forms
M-005088,M037,M037-ZN02,12/02/2022 12:00:00 AM,AM,2022,12,Dec,49,Parks,Highbridge Park,9,,9,,,2,Manhattan,M-12A,ZONE,true,2022-12-03 13:35:00.0000000,M&O MS Forms
M-003950,M037,M037-ZN02,08/09/2022 12:00:00 AM,AM,2022,8,Aug,33,Parks,Highbridge Park,50,,50,,,2,Manhattan,M-12A,ZONE,true,2022-08-09 18:21:11.0000000,M&O MS Forms
M-003924,M037,M037-ZN02,08/06/2022 12:00:00 AM,AM,2022,8,Aug,32,Parks,Highbridge Park,56,,56,,,2,Manhattan,M-12A,ZONE,true,2022-08-09 08:52:34.0000000,M&O MS Forms
M-003915,M037,M037-ZN02,08/05/2022 12:00:00 AM,AM,2022,8,Aug,32,Parks,Highbridge Park,49,,49,,,2,Manhattan,M-12A,ZONE,true,2022-08-09 08:49:49.0000000,M&O MS Forms
M-003896,M037,M037-ZN02,08/04/2022 12:00:00 AM,AM,2022,8,Aug,32,Parks,Highbridge Park,64,,64,,,2,Manhattan,M-12A,ZONE,true,2022-08-04 15:35:00.0000000,M&O MS Forms
M-005744,M037,M037-ZN02,02/12/2023 12:00:00 AM,AM,2023,2,Feb,7,Parks,Highbridge Park,3,,3,,,2,Manhattan,M-12A,ZONE,true,2023-02-12 18:52:51.0000000,M&O MS Forms
M-005745,M037,M037-ZN02,02/12/2023 12:00:00 AM,AM,2023,2,Feb,7,Parks,Highbridge Park,15,,15,,,2,Manhattan,M-12A,ZONE,true,2023-02-12 18:53:42.0000000,M&O MS Forms
M-005034,M037,M037-ZN02,11/26/2022 12:00:00 AM,AM,2022,11,Nov,48,Parks,Highbridge Park,30,,30,,,2,Manhattan,M-12A,ZONE,true,2022-11-27 11:11:22.0000000,M&O MS Forms
M-005754,M037,M037-ZN02,02/13/2023 12:00:00 AM,AM,2023,2,Feb,7,Parks,Highbridge Park,12,,12,,,2,Manhattan,M-12A,ZONE,true,2023-02-14 05:47:59.0000000,M&O MS Forms
M-004764,M037,M037-ZN02,10/31/2022 12:00:00 AM,AM,2022,10,Oct,45,Parks,Highbridge Park,35,,35,,,2,Manhattan,M-12A,ZONE,true,2022-11-05 14:00:11.0000000,M&O MS Forms
M-005763,M037,M037-ZN02,02/14/2023 12:00:00 AM,AM,2023,2,Feb,7,Parks,Highbridge Park,10,,10,,,2,Manhattan,M-12A,ZONE,true,2023-02-15 16:27:13.0000000,M&O MS Forms
M-004421,M037,M037-ZN02,10/09/2022 12:00:00 AM,AM,2022,10,Oct,42,Parks,Highbridge Park,60,,60,,,2,Manhattan,M-12A,ZONE,true,2022-10-11 06:12:25.0000000,M&O MS Forms
M-005772,M037,M037-ZN02,02/15/2023 12:00:00 AM,AM,2023,2,Feb,7,Parks,Highbridge Park,13,,13,,,2,Manhattan,M-12A,ZONE,true,2023-02-15 16:30:34.0000000,M&O MS Forms
M-004755,M037,M037-ZN02,10/30/2022 12:00:00 AM,AM,2022,10,Oct,45,Parks,Highbridge Park,30,,30,,,2,Manhattan,M-12A,ZONE,true,2022-11-05 13:57:30.0000000,M&O MS Forms
M-004430,M037,M037-ZN02,10/10/2022 12:00:00 AM,AM,2022,10,Oct,42,Parks,Highbridge Park,65,,65,,,2,Manhattan,M-12A,ZONE,true,2022-10-11 06:16:26.0000000,M&O MS Forms
M-004448,M037,M037-ZN02,09/28/2022 12:00:00 AM,AM,2022,9,Sep,40,Parks,Highbridge Park,11,,11,,,2,Manhattan,M-12A,ZONE,true,2022-10-11 06:57:39.0000000,M&O MS Forms
M-004439,M037,M037-ZN02,09/27/2022 12:00:00 AM,AM,2022,9,Sep,40,Parks,Highbridge Park,12,,12,,,2,Manhattan,M-12A,ZONE,true,2022-10-11 06:38:26.0000000,M&O MS Forms
M-004458,M037,M037-ZN02,09/29/2022 12:00:00 AM,AM,2022,9,Sep,40,Parks,Highbridge Park,13,,13,,,2,Manhattan,M-12A,ZONE,true,2022-10-11 07:03:01.0000000,M&O MS Forms
M-003870,M037,M037-ZN02,08/01/2022 12:00:00 AM,AM,2022,8,Aug,32,Parks,Highbridge Park,60,,60,,,2,Manhattan,M-12A,ZONE,true,2022-08-04 15:27:20.0000000,M&O MS Forms
M-003879,M037,M037-ZN02,08/02/2022 12:00:00 AM,AM,2022,8,Aug,32,Parks,Highbridge Park,52,,52,,,2,Manhattan,M-12A,ZONE,true,2022-08-04 15:30:03.0000000,M&O MS Forms
M-003887,M037,M037-ZN02,08/03/2022 12:00:00 AM,AM,2022,8,Aug,32,Parks,Highbridge Park,48,,48,,,2,Manhattan,M-12A,ZONE,true,2022-08-04 15:32:29.0000000,M&O MS Forms
M-004489,M037,M037-ZN02,10/02/2022 12:00:00 AM,AM,2022,10,Oct,41,Parks,Highbridge Park,5,,5,,,2,Manhattan,M-12A,ZONE,true,2022-10-11 07:17:26.0000000,M&O MS Forms
M-004508,M037,M037-ZN02,10/04/2022 12:00:00 AM,AM,2022,10,Oct,41,Parks,Highbridge Park,15,,15,,,2,Manhattan,M-12A,ZONE,true,2022-10-11 15:14:20.0000000,M&O MS Forms
M-004499,M037,M037-ZN02,10/03/2022 12:00:00 AM,AM,2022,10,Oct,41,Parks,Highbridge Park,10,,10,,,2,Manhattan,M-12A,ZONE,true,2022-10-11 15:11:21.0000000,M&O MS Forms
M-004517,M037,M037-ZN02,10/05/2022 12:00:00 AM,AM,2022,10,Oct,41,Parks,Highbridge Park,11,,11,,,2,Manhattan,M-12A,ZONE,true,2022-10-11 15:17:03.0000000,M&O MS Forms
M-004524,M037,M037-ZN02,10/06/2022 12:00:00 AM,AM,2022,10,Oct,41,Parks,Highbridge Park,6,,6,,,2,Manhattan,M-12A,ZONE,true,2022-10-11 15:19:18.0000000,M&O MS Forms
M-004531,M037,M037-ZN02,10/07/2022 12:00:00 AM,AM,2022,10,Oct,41,Parks,Highbridge Park,15,,15,,,2,Manhattan,M-12A,ZONE,true,2022-10-11 15:21:31.0000000,M&O MS Forms
M-004541,M037,M037-ZN02,10/08/2022 12:00:00 AM,AM,2022,10,Oct,41,Parks,Highbridge Park,36,,36,,,2,Manhattan,M-12A,ZONE,true,2022-10-11 15:24:38.0000000,M&O MS Forms
M-004540,M037,M037-ZN02,10/08/2022 12:00:00 AM,AM,2022,10,Oct,41,Parks,Highbridge Park,36,,36,,,2,Manhattan,M-12A,ZONE,true,2022-10-11 15:24:13.0000000,M&O MS Forms
M-004550,M037,M037-ZN02,10/11/2022 12:00:00 AM,AM,2022,10,Oct,42,Parks,Highbridge Park,25,,25,,,2,Manhattan,M-12A,ZONE,true,2022-10-11 16:04:48.0000000,M&O MS Forms
M-004577,M037,M037-ZN02,10/14/2022 12:00:00 AM,AM,2022,10,Oct,42,Parks,Highbridge Park,30,,30,,,2,Manhattan,M-12A,ZONE,true,2022-10-19 05:38:43.0000000,M&O MS Forms
M-004568,M037,M037-ZN02,10/13/2022 12:00:00 AM,AM,2022,10,Oct,42,Parks,Highbridge Park,28,,28,,,2,Manhattan,M-12A,ZONE,true,2022-10-19 05:35:35.0000000,M&O MS Forms
M-004586,M037,M037-ZN02,10/15/2022 12:00:00 AM,AM,2022,10,Oct,42,Parks,Highbridge Park,40,,40,,,2,Manhattan,M-12A,ZONE,true,2022-10-19 05:41:37.0000000,M&O MS Forms
M-004189,M037,M037-ZN03,08/31/2022 12:00:00 AM,AM,2022,8,Aug,36,Parks,Highbridge Park,15,,15,,,33,Manhattan,M-12A,ZONE,true,2022-09-06 14:27:11.0000000,M&O MS Forms
M-004142,M037,M037-ZN03,08/27/2022 12:00:00 AM,AM,2022,8,Aug,35,Parks,Highbridge Park,42,,42,,,33,Manhattan,M-12A,ZONE,true,2022-08-28 17:32:20.0000000,M&O MS Forms
M-004125,M037,M037-ZN03,08/25/2022 12:00:00 AM,AM,2022,8,Aug,35,Parks,Highbridge Park,41,,41,,,33,Manhattan,M-12A,ZONE,true,2022-08-28 17:24:53.0000000,M&O MS Forms
M-004134,M037,M037-ZN03,08/26/2022 12:00:00 AM,AM,2022,8,Aug,35,Parks,Highbridge Park,35,,35,,,33,Manhattan,M-12A,ZONE,true,2022-08-28 17:30:17.0000000,M&O MS Forms
M-004108,M037,M037-ZN03,08/23/2022 12:00:00 AM,AM,2022,8,Aug,35,Parks,Highbridge Park,25,,25,,,33,Manhattan,M-12A,ZONE,true,2022-08-28 17:19:59.0000000,M&O MS Forms
M-004116,M037,M037-ZN03,08/24/2022 12:00:00 AM,AM,2022,8,Aug,35,Parks,Highbridge Park,36,,36,,,33,Manhattan,M-12A,ZONE,true,2022-08-28 17:22:22.0000000,M&O MS Forms
M-004320,M037,M037-ZN03,09/12/2022 12:00:00 AM,AM,2022,9,Sep,38,Parks,Highbridge Park,40,,40,,,33,Manhattan,M-12A,ZONE,true,2022-09-13 18:04:15.0000000,M&O MS Forms
M-004311,M037,M037-ZN03,09/11/2022 12:00:00 AM,AM,2022,9,Sep,38,Parks,Highbridge Park,45,,45,,,33,Manhattan,M-12A,ZONE,true,2022-09-13 18:00:53.0000000,M&O MS Forms
M-004299,M037,M037-ZN03,09/11/2022 12:00:00 AM,AM,2022,9,Sep,38,Parks,Highbridge Park,45,,45,,,33,Manhattan,M-12A,ZONE,true,2022-09-12 06:09:52.0000000,M&O MS Forms
M-004290,M037,M037-ZN03,09/10/2022 12:00:00 AM,AM,2022,9,Sep,37,Parks,Highbridge Park,41,,41,,,33,Manhattan,M-12A,ZONE,true,2022-09-12 06:06:46.0000000,M&O MS Forms
M-004280,M037,M037-ZN03,09/08/2022 12:00:00 AM,AM,2022,9,Sep,37,Parks,Highbridge Park,29,,29,,,33,Manhattan,M-12A,ZONE,true,2022-09-09 06:18:54.0000000,M&O MS Forms
M-004271,M037,M037-ZN03,09/07/2022 12:00:00 AM,AM,2022,9,Sep,37,Parks,Highbridge Park,22,,22,,,33,Manhattan,M-12A,ZONE,true,2022-09-09 05:40:11.0000000,M&O MS Forms
M-004262,M037,M037-ZN03,09/06/2022 12:00:00 AM,AM,2022,9,Sep,37,Parks,Highbridge Park,20,,20,,,33,Manhattan,M-12A,ZONE,true,2022-09-09 05:36:47.0000000,M&O MS Forms
M-004253,M037,M037-ZN03,09/05/2022 12:00:00 AM,AM,2022,9,Sep,37,Parks,Highbridge Park,14,,14,,,33,Manhattan,M-12A,ZONE,true,2022-09-09 05:31:58.0000000,M&O MS Forms
M-004234,M037,M037-ZN03,09/05/2022 12:00:00 AM,AM,2022,9,Sep,37,Parks,Highbridge Park,14,,14,,,33,Manhattan,M-12A,ZONE,true,2022-09-06 14:42:09.0000000,M&O MS Forms
M-004244,M037,M037-ZN03,09/04/2022 12:00:00 AM,AM,2022,9,Sep,37,Parks,Highbridge Park,23,,23,,,33,Manhattan,M-12A,ZONE,true,2022-09-09 05:27:43.0000000,M&O MS Forms
M-004224,M037,M037-ZN03,09/04/2022 12:00:00 AM,AM,2022,9,Sep,37,Parks,Highbridge Park,23,,23,,,33,Manhattan,M-12A,ZONE,true,2022-09-06 14:38:29.0000000,M&O MS Forms
M-004215,M037,M037-ZN03,09/03/2022 12:00:00 AM,AM,2022,9,Sep,36,Parks,Highbridge Park,31,,31,,,33,Manhattan,M-12A,ZONE,true,2022-09-06 14:35:17.0000000,M&O MS Forms
M-004206,M037,M037-ZN03,09/02/2022 12:00:00 AM,AM,2022,9,Sep,36,Parks,Highbridge Park,15,,15,,,33,Manhattan,M-12A,ZONE,true,2022-09-06 14:32:15.0000000,M&O MS Forms
M-005621,M037,M037-ZN03,01/30/2023 12:00:00 AM,AM,2023,1,Jan,5,Parks,Highbridge Park,3,,3,,,33,Manhattan,M-12A,ZONE,true,2023-01-30 16:21:51.0000000,M&O MS Forms
M-005638,M037,M037-ZN03,01/31/2023 12:00:00 AM,AM,2023,1,Jan,5,Parks,Highbridge Park,5,,5,,,33,Manhattan,M-12A,ZONE,true,2023-01-31 15:44:29.0000000,M&O MS Forms
M-005612,M037,M037-ZN03,01/29/2023 12:00:00 AM,AM,2023,1,Jan,5,Parks,Highbridge Park,6,,6,,,33,Manhattan,M-12A,ZONE,true,2023-01-30 16:18:14.0000000,M&O MS Forms
M-005604,M037,M037-ZN03,01/28/2023 12:00:00 AM,AM,2023,1,Jan,4,Parks,Highbridge Park,14,,14,,,33,Manhattan,M-12A,ZONE,true,2023-01-30 16:09:47.0000000,M&O MS Forms
M-005585,M037,M037-ZN03,01/26/2023 12:00:00 AM,AM,2023,1,Jan,4,Parks,Highbridge Park,16,,16,,,33,Manhattan,M-12A,ZONE,true,2023-01-26 17:36:07.0000000,M&O MS Forms
M-005586,M037,M037-ZN03,01/26/2023 12:00:00 AM,AM,2023,1,Jan,4,Parks,Highbridge Park,5,,5,,,33,Manhattan,M-12A,ZONE,true,2023-01-26 17:36:23.0000000,M&O MS Forms
M-005595,M037,M037-ZN03,01/27/2023 12:00:00 AM,AM,2023,1,Jan,4,Parks,Highbridge Park,14,,14,,,33,Manhattan,M-12A,ZONE,true,2023-01-30 16:02:25.0000000,M&O MS Forms
M-005567,M037,M037-ZN03,01/24/2023 12:00:00 AM,AM,2023,1,Jan,4,Parks,Highbridge Park,12,,12,,,33,Manhattan,M-12A,ZONE,true,2023-01-24 17:12:48.0000000,M&O MS Forms
M-005575,M037,M037-ZN03,01/25/2023 12:00:00 AM,AM,2023,1,Jan,4,Parks,Highbridge Park,15,,15,,,33,Manhattan,M-12A,ZONE,true,2023-01-25 17:08:51.0000000,M&O MS Forms
M-005727,M037,M037-ZN03,02/10/2023 12:00:00 AM,AM,2023,2,Feb,6,Parks,Highbridge Park,8,,8,,,33,Manhattan,M-12A,ZONE,true,2023-02-11 17:48:25.0000000,M&O MS Forms
M-005718,M037,M037-ZN03,02/09/2023 12:00:00 AM,AM,2023,2,Feb,6,Parks,Highbridge Park,11,,11,,,33,Manhattan,M-12A,ZONE,true,2023-02-09 15:42:20.0000000,M&O MS Forms
M-005697,M037,M037-ZN03,02/07/2023 12:00:00 AM,AM,2023,2,Feb,6,Parks,Highbridge Park,4,,4,,,33,Manhattan,M-12A,ZONE,true,2023-02-07 17:29:28.0000000,M&O MS Forms
M-005688,M037,M037-ZN03,02/06/2023 12:00:00 AM,AM,2023,2,Feb,6,Parks,Highbridge Park,4,,4,,,33,Manhattan,M-12A,ZONE,true,2023-02-07 17:25:07.0000000,M&O MS Forms
M-005991,M037,M037-ZN03,03/09/2023 12:00:00 AM,AM,2023,3,Mar,10,Parks,Highbridge Park,8,,8,,,33,Manhattan,M-12A,ZONE,true,2023-03-09 15:44:36.0000000,M&O MS Forms
M-006049,M037,M037-ZN03,03/15/2023 12:00:00 AM,AM,2023,3,Mar,11,Parks,Highbridge Park,7,,7,,,33,Manhattan,M-12A,ZONE,true,2023-03-15 17:10:52.0000000,M&O MS Forms
M-006039,M037,M037-ZN03,03/14/2023 12:00:00 AM,AM,2023,3,Mar,11,Parks,Highbridge Park,8,,8,,,33,Manhattan,M-12A,ZONE,true,2023-03-14 15:58:43.0000000,M&O MS Forms
M-006029,M037,M037-ZN03,03/13/2023 12:00:00 AM,AM,2023,3,Mar,11,Parks,Highbridge Park,5,,5,,,33,Manhattan,M-12A,ZONE,true,2023-03-13 16:10:07.0000000,M&O MS Forms
M-001674,M037,M037-ZN03,12/15/2021 12:00:00 AM,AM,2021,12,Dec,51,Parks,Highbridge Park,45,,45,,,33,Manhattan,M-12A,ZONE,true,2021-12-16 16:35:53.0000000,M&O MS Forms
M-001686,M037,M037-ZN03,12/16/2021 12:00:00 AM,AM,2021,12,Dec,51,Parks,Highbridge Park,50,,50,,,33,Manhattan,M-12A,ZONE,true,2021-12-16 16:45:39.0000000,M&O MS Forms
M-001665,M037,M037-ZN03,12/14/2021 12:00:00 AM,AM,2021,12,Dec,51,Parks,Highbridge Park,30,,30,,,33,Manhattan,M-12A,ZONE,true,2021-12-16 16:27:01.0000000,M&O MS Forms
M-001644,M037,M037-ZN03,12/13/2021 12:00:00 AM,AM,2021,12,Dec,51,Parks,Highbridge Park,65,,65,,,33,Manhattan,M-12A,ZONE,true,2021-12-14 16:32:36.0000000,M&O MS Forms
M-001635,M037,M037-ZN03,12/12/2021 12:00:00 AM,AM,2021,12,Dec,51,Parks,Highbridge Park,40,,40,,,33,Manhattan,M-12A,ZONE,true,2021-12-14 16:29:53.0000000,M&O MS Forms
M-001626,M037,M037-ZN03,12/11/2021 12:00:00 AM,AM,2021,12,Dec,50,Parks,Highbridge Park,213,,213,,,33,Manhattan,M-12A,ZONE,true,2021-12-14 16:22:22.0000000,M&O MS Forms
M-001605,M037,M037-ZN03,12/09/2021 12:00:00 AM,AM,2021,12,Dec,50,Parks,Highbridge Park,215,,215,,,33,Manhattan,M-12A,ZONE,true,2021-12-11 07:58:14.0000000,M&O MS Forms
M-001614,M037,M037-ZN03,12/10/2021 12:00:00 AM,AM,2021,12,Dec,50,Parks,Highbridge Park,175,,175,,,33,Manhattan,M-12A,ZONE,true,2021-12-11 08:03:10.0000000,M&O MS Forms
M-001589,M037,M037-ZN03,12/08/2021 12:00:00 AM,AM,2021,12,Dec,50,Parks,Highbridge Park,200,,200,,,33,Manhattan,M-12A,ZONE,true,2021-12-09 16:15:11.0000000,M&O MS Forms
M-001580,M037,M037-ZN03,12/07/2021 12:00:00 AM,AM,2021,12,Dec,50,Parks,Highbridge Park,100,,100,,,33,Manhattan,M-12A,ZONE,true,2021-12-09 16:12:07.0000000,M&O MS Forms
M-001571,M037,M037-ZN03,12/06/2021 12:00:00 AM,AM,2021,12,Dec,50,Parks,Highbridge Park,55,,55,,,33,Manhattan,M-12A,ZONE,true,2021-12-09 16:08:49.0000000,M&O MS Forms
M-001702,M037,M037-ZN03,12/17/2021 12:00:00 AM,AM,2021,12,Dec,51,Parks,Highbridge Park,75,,75,,,33,Manhattan,M-12A,ZONE,true,2021-12-19 10:17:45.0000000,M&O MS Forms
M-001286,M037,M037-ZN03,11/09/2021 12:00:00 AM,AM,2021,11,Nov,46,Parks,Highbridge Park,17,,17,,,33,Manhattan,M-12A,ZONE,true,2021-11-12 15:52:25.0000000,M&O MS Forms
M-001277,M037,M037-ZN03,11/08/2021 12:00:00 AM,AM,2021,11,Nov,46,Parks,Highbridge Park,7,,7,,,33,Manhattan,M-12A,ZONE,true,2021-11-12 15:49:36.0000000,M&O MS Forms
M-001268,M037,M037-ZN03,11/07/2021 12:00:00 AM,AM,2021,11,Nov,46,Parks,Highbridge Park,7,,7,,,33,Manhattan,M-12A,ZONE,true,2021-11-12 15:46:17.0000000,M&O MS Forms
M-001258,M037,M037-ZN03,11/06/2021 12:00:00 AM,AM,2021,11,Nov,45,Parks,Highbridge Park,10,,10,,,33,Manhattan,M-12A,ZONE,true,2021-11-08 12:21:43.0000000,M&O MS Forms
M-001246,M037,M037-ZN03,11/05/2021 12:00:00 AM,AM,2021,11,Nov,45,Parks,Highbridge Park,17,,17,,,33,Manhattan,M-12A,ZONE,true,2021-11-05 16:10:50.0000000,M&O MS Forms
M-001237,M037,M037-ZN03,11/04/2021 12:00:00 AM,AM,2021,11,Nov,45,Parks,Highbridge Park,18,,18,,,33,Manhattan,M-12A,ZONE,true,2021-11-05 16:08:18.0000000,M&O MS Forms
M-001229,M037,M037-ZN03,11/03/2021 12:00:00 AM,AM,2021,11,Nov,45,Parks,Highbridge Park,17,,17,,,33,Manhattan,M-12A,ZONE,true,2021-11-05 16:05:57.0000000,M&O MS Forms
M-001221,M037,M037-ZN03,11/02/2021 12:00:00 AM,AM,2021,11,Nov,45,Parks,Highbridge Park,18,,18,,,33,Manhattan,M-12A,ZONE,true,2021-11-05 16:03:19.0000000,M&O MS Forms
M-001214,M037,M037-ZN03,11/01/2021 12:00:00 AM,AM,2021,11,Nov,45,Parks,Highbridge Park,5,,5,,,33,Manhattan,M-12A,ZONE,true,2021-11-05 16:01:05.0000000,M&O MS Forms
M-001209,M037,M037-ZN03,10/31/2021 12:00:00 AM,AM,2021,10,Oct,45,Parks,Highbridge Park,7,,7,,,33,Manhattan,M-12A,ZONE,true,2021-11-05 15:59:27.0000000,M&O MS Forms
M-001193,M037,M037-ZN03,10/29/2021 12:00:00 AM,AM,2021,10,Oct,44,Parks,Highbridge Park,16,,16,,,33,Manhattan,M-12A,ZONE,true,2021-10-29 16:30:31.0000000,M&O MS Forms
M-001185,M037,M037-ZN03,10/28/2021 12:00:00 AM,AM,2021,10,Oct,44,Parks,Highbridge Park,29,,29,,,33,Manhattan,M-12A,ZONE,true,2021-10-29 16:28:05.0000000,M&O MS Forms
M-001178,M037,M037-ZN03,10/27/2021 12:00:00 AM,AM,2021,10,Oct,44,Parks,Highbridge Park,4,,4,,,33,Manhattan,M-12A,ZONE,true,2021-10-29 16:25:43.0000000,M&O MS Forms
M-000780,M037,M037-ZN03,08/19/2021 12:00:00 AM,AM,2021,8,Aug,34,Parks,Highbridge Park,25,,25,,,33,Manhattan,M-12A,ZONE,true,2021-08-24 17:08:20.0000000,M&O MS Forms
M-000777,M037,M037-ZN03,08/18/2021 12:00:00 AM,AM,2021,8,Aug,34,BBP,Highbridge Park,60,,60,,,33,Manhattan,M-12A,ZONE,true,2021-08-24 17:07:14.0000000,M&O MS Forms
M-000772,M037,M037-ZN03,08/17/2021 12:00:00 AM,AM,2021,8,Aug,34,BBP,Highbridge Park,30,,30,,,33,Manhattan,M-12A,ZONE,true,2021-08-24 17:05:33.0000000,M&O MS Forms
M-000784,M037,M037-ZN03,08/20/2021 12:00:00 AM,AM,2021,8,Aug,34,BBP,Highbridge Park,15,,15,,,33,Manhattan,M-12A,ZONE,true,2021-08-24 17:10:36.0000000,M&O MS Forms
M-000769,M037,M037-ZN03,08/16/2021 12:00:00 AM,AM,2021,8,Aug,34,Parks,Highbridge Park,25,,25,,,33,Manhattan,M-12A,ZONE,true,2021-08-24 17:04:16.0000000,M&O MS Forms
M-000763,M037,M037-ZN03,08/15/2021 12:00:00 AM,AM,2021,8,Aug,34,Parks,Highbridge Park,26,,26,,,33,Manhattan,M-12A,ZONE,true,2021-08-24 17:01:28.0000000,M&O MS Forms
M-000844,M037,M037-ZN03,09/10/2021 12:00:00 AM,AM,2021,9,Sep,37,Parks,Highbridge Park,8,,8,,,33,Manhattan,M-12A,ZONE,true,2021-09-13 17:10:00.0000000,M&O MS Forms
M-000841,M037,M037-ZN03,09/09/2021 12:00:00 AM,AM,2021,9,Sep,37,Parks,Highbridge Park,20,,20,,,33,Manhattan,M-12A,ZONE,true,2021-09-13 17:08:47.0000000,M&O MS Forms
M-000860,M037,M037-ZN03,09/12/2021 12:00:00 AM,AM,2021,9,Sep,38,Parks,Highbridge Park,25,,25,,,33,Manhattan,M-12A,ZONE,true,2021-09-18 05:47:14.0000000,M&O MS Forms
M-000869,M037,M037-ZN03,09/14/2021 12:00:00 AM,AM,2021,9,Sep,38,BBP,Highbridge Park,40,,40,,,33,Manhattan,M-12A,ZONE,true,2021-09-18 05:50:50.0000000,M&O MS Forms
M-000874,M037,M037-ZN03,09/15/2021 12:00:00 AM,AM,2021,9,Sep,38,BBP,Highbridge Park,12,,12,,,33,Manhattan,M-12A,ZONE,true,2021-09-18 05:52:51.0000000,M&O MS Forms
M-000831,M037,M037-ZN03,09/06/2021 12:00:00 AM,AM,2021,9,Sep,37,BBP,Highbridge Park,56,,56,,,33,Manhattan,M-12A,ZONE,true,2021-09-13 17:05:03.0000000,M&O MS Forms
M-000835,M037,M037-ZN03,09/08/2021 12:00:00 AM,AM,2021,9,Sep,37,BBP,Highbridge Park,45,,45,,,33,Manhattan,M-12A,ZONE,true,2021-09-13 17:06:30.0000000,M&O MS Forms
M-000828,M037,M037-ZN03,09/06/2021 12:00:00 AM,AM,2021,9,Sep,37,Parks,Highbridge Park,19,,19,,,33,Manhattan,M-12A,ZONE,true,2021-09-13 17:03:41.0000000,M&O MS Forms
M-000825,M037,M037-ZN03,09/05/2021 12:00:00 AM,AM,2021,9,Sep,37,Parks,Highbridge Park,62,,62,,,33,Manhattan,M-12A,ZONE,true,2021-09-13 17:01:41.0000000,M&O MS Forms
M-000878,M037,M037-ZN03,09/16/2021 12:00:00 AM,AM,2021,9,Sep,38,Parks,Highbridge Park,10,,10,,,33,Manhattan,M-12A,ZONE,true,2021-09-18 05:54:14.0000000,M&O MS Forms
M-002470,M037,M037-ZN03,03/10/2022 12:00:00 AM,AM,2022,3,Mar,11,Parks,Highbridge Park,9,,9,,,33,Manhattan,M-12A,ZONE,true,2022-03-17 10:33:48.0000000,M&O MS Forms
M-002454,M037,M037-ZN03,03/08/2022 12:00:00 AM,AM,2022,3,Mar,11,Parks,Highbridge Park,3,,3,,,33,Manhattan,M-12A,ZONE,true,2022-03-09 14:05:52.0000000,M&O MS Forms
M-002496,M037,M037-ZN03,03/13/2022 12:00:00 AM,AM,2022,3,Mar,12,Parks,Highbridge Park,5,,5,,,33,Manhattan,M-12A,ZONE,true,2022-03-17 10:43:57.0000000,M&O MS Forms
M-001821,M037,M037-ZN03,12/28/2021 12:00:00 AM,AM,2021,12,Dec,53,Parks,Highbridge Park,5,,5,,,33,Manhattan,M-12A,ZONE,true,2021-12-28 15:32:12.0000000,M&O MS Forms
M-001846,M037,M037-ZN03,12/30/2021 12:00:00 AM,AM,2021,12,Dec,53,Parks,Highbridge Park,4,,4,,,33,Manhattan,M-12A,ZONE,true,2021-12-30 15:53:23.0000000,M&O MS Forms
M-001860,M037,M037-ZN03,12/31/2021 12:00:00 AM,AM,2021,12,Dec,53,Parks,Highbridge Park,9,,9,,,33,Manhattan,M-12A,ZONE,true,2021-12-31 19:58:33.0000000,M&O MS Forms
M-001726,M037,M037-ZN03,12/19/2021 12:00:00 AM,AM,2021,12,Dec,52,Parks,Highbridge Park,9,,9,,,33,Manhattan,M-12A,ZONE,true,2021-12-21 16:04:57.0000000,M&O MS Forms
M-000034,M037,M037-ZN03,04/04/2021 12:00:00 AM,PM,2021,4,Apr,15,BBP,Highbridge Park,19,,19,,,33,Manhattan,M-12A,ZONE,true,2021-04-11 00:26:15.0000000,M&O MS Forms
M-000040,M037,M037-ZN03,04/06/2021 12:00:00 AM,PM,2021,4,Apr,15,BBP,Highbridge Park,109,,109,,,33,Manhattan,M-12A,ZONE,true,2021-04-11 00:29:29.0000000,M&O MS Forms
M-000043,M037,M037-ZN03,04/07/2021 12:00:00 AM,PM,2021,4,Apr,15,BBP,Highbridge Park,60,,60,,,33,Manhattan,M-12A,ZONE,true,2021-04-11 00:30:53.0000000,M&O MS Forms
M-000037,M037,M037-ZN03,04/05/2021 12:00:00 AM,PM,2021,4,Apr,15,BBP,Highbridge Park,29,,29,,,33,Manhattan,M-12A,ZONE,true,2021-04-11 00:27:38.0000000,M&O MS Forms
M-000046,M037,M037-ZN03,04/08/2021 12:00:00 AM,PM,2021,4,Apr,15,BBP,Highbridge Park,165,,165,,,33,Manhattan,M-12A,ZONE,true,2021-04-11 00:32:43.0000000,M&O MS Forms
M-000050,M037,M037-ZN03,04/09/2021 12:00:00 AM,AM,2021,4,Apr,15,Parks,Highbridge Park,7,,7,,,33,Manhattan,M-12A,ZONE,true,2021-04-11 00:34:32.0000000,M&O MS Forms
M-000077,M037,M037-ZN03,04/15/2021 12:00:00 AM,PM,2021,4,Apr,16,BBP,Highbridge Park,19,,19,,,33,Manhattan,M-12A,ZONE,true,2021-04-15 22:31:28.0000000,M&O MS Forms
M-000073,M037,M037-ZN03,04/14/2021 12:00:00 AM,AM,2021,4,Apr,16,BBP,Highbridge Park,79,,79,,,33,Manhattan,M-12A,ZONE,true,2021-04-15 11:48:07.0000000,M&O MS Forms
M-000071,M037,M037-ZN03,04/13/2021 12:00:00 AM,AM,2021,4,Apr,16,BBP,Highbridge Park,45,,45,,,33,Manhattan,M-12A,ZONE,true,2021-04-15 11:46:57.0000000,M&O MS Forms
M-000069,M037,M037-ZN03,04/12/2021 12:00:00 AM,AM,2021,4,Apr,16,Parks,Highbridge Park,9,,9,,,33,Manhattan,M-12A,ZONE,true,2021-04-15 11:40:23.0000000,M&O MS Forms
M-000066,M037,M037-ZN03,04/11/2021 12:00:00 AM,AM,2021,4,Apr,16,Parks,Highbridge Park,6,,6,,,33,Manhattan,M-12A,ZONE,true,2021-04-15 11:39:02.0000000,M&O MS Forms
M-000101,M037,M037-ZN03,04/19/2021 12:00:00 AM,AM,2021,4,Apr,17,Parks,Highbridge Park,28,,28,,,33,Manhattan,M-12A,ZONE,true,2021-04-23 21:57:52.0000000,M&O MS Forms
M-000096,M037,M037-ZN03,04/18/2021 12:00:00 AM,AM,2021,4,Apr,17,Parks,Highbridge Park,13,,13,,,33,Manhattan,M-12A,ZONE,true,2021-04-23 21:55:58.0000000,M&O MS Forms
M-000104,M037,M037-ZN03,04/20/2021 12:00:00 AM,PM,2021,4,Apr,17,BBP,Highbridge Park,92,,92,,,33,Manhattan,M-12A,ZONE,true,2021-04-23 21:59:13.0000000,M&O MS Forms
M-000111,M037,M037-ZN03,04/22/2021 12:00:00 AM,PM,2021,4,Apr,17,BBP,Highbridge Park,67,,67,,,33,Manhattan,M-12A,ZONE,true,2021-04-23 22:02:09.0000000,M&O MS Forms
M-000108,M037,M037-ZN03,04/21/2021 12:00:00 AM,PM,2021,4,Apr,17,BBP,Highbridge Park,107,,107,,,33,Manhattan,M-12A,ZONE,true,2021-04-23 22:00:50.0000000,M&O MS Forms
M-000113,M037,M037-ZN03,04/23/2021 12:00:00 AM,AM,2021,4,Apr,17,Parks,Highbridge Park,6,,6,,,33,Manhattan,M-12A,ZONE,true,2021-04-23 22:03:09.0000000,M&O MS Forms
M-000153,M037,M037-ZN03,04/30/2021 12:00:00 AM,AM,2021,4,Apr,18,Parks,Highbridge Park,16,,16,,,33,Manhattan,M-12A,ZONE,true,2021-04-30 23:21:20.0000000,M&O MS Forms
M-000150,M037,M037-ZN03,04/29/2021 12:00:00 AM,PM,2021,4,Apr,18,BBP,Highbridge Park,72,,72,,,33,Manhattan,M-12A,ZONE,true,2021-04-30 23:19:49.0000000,M&O MS Forms
M-000148,M037,M037-ZN03,04/28/2021 12:00:00 AM,PM,2021,4,Apr,18,BBP,Highbridge Park,62,,62,,,33,Manhattan,M-12A,ZONE,true,2021-04-30 23:18:49.0000000,M&O MS Forms
M-000145,M037,M037-ZN03,04/27/2021 12:00:00 AM,PM,2021,4,Apr,18,BBP,Highbridge Park,70,,70,,,33,Manhattan,M-12A,ZONE,true,2021-04-30 23:17:16.0000000,M&O MS Forms
M-000143,M037,M037-ZN03,04/26/2021 12:00:00 AM,AM,2021,4,Apr,18,Parks,Highbridge Park,30,,30,,,33,Manhattan,M-12A,ZONE,true,2021-04-30 23:15:28.0000000,M&O MS Forms
M-000138,M037,M037-ZN03,04/25/2021 12:00:00 AM,AM,2021,4,Apr,18,Parks,Highbridge Park,16,,16,,,33,Manhattan,M-12A,ZONE,true,2021-04-30 19:45:00.0000000,M&O MS Forms
M-000134,M037,M037-ZN03,04/29/2021 12:00:00 AM,AM,2021,4,Apr,18,BBP,Highbridge Park,389,,389,,,33,Manhattan,M-12A,ZONE,true,2021-04-29 20:23:52.0000000,M&O MS Forms
M-003261,M037,M037-ZN03,05/29/2022 12:00:00 AM,AM,2022,5,May,23,Parks,Highbridge Park,15,,15,,,33,Manhattan,M-12A,ZONE,true,2022-05-30 10:38:44.0000000,M&O MS Forms
M-003296,M037,M037-ZN03,05/30/2022 12:00:00 AM,AM,2022,5,May,23,Parks,Highbridge Park,30,,30,,,33,Manhattan,M-12A,ZONE,true,2022-06-06 19:14:14.0000000,M&O MS Forms
M-003252,M037,M037-ZN03,05/28/2022 12:00:00 AM,AM,2022,5,May,22,Parks,Highbridge Park,9,,9,,,33,Manhattan,M-12A,ZONE,true,2022-05-30 10:35:26.0000000,M&O MS Forms
M-003240,M037,M037-ZN03,05/27/2022 12:00:00 AM,AM,2022,5,May,22,Parks,Highbridge Park,9,,9,,,33,Manhattan,M-12A,ZONE,true,2022-05-28 10:56:12.0000000,M&O MS Forms
M-004680,M037,M037-ZN04,10/24/2022 12:00:00 AM,AM,2022,10,Oct,44,Parks,Highbridge Park,22,,22,,,34,Manhattan,M-12A,ZONE,true,2022-10-25 06:32:15.0000000,M&O MS Forms
M-004698,M037,M037-ZN04,10/26/2022 12:00:00 AM,AM,2022,10,Oct,44,Parks,Highbridge Park,15,,15,,,34,Manhattan,M-12A,ZONE,true,2022-10-27 05:26:27.0000000,M&O MS Forms
M-004715,M037,M037-ZN04,10/20/2022 12:00:00 AM,AM,2022,10,Oct,43,Parks,Highbridge Park,20,,20,,,34,Manhattan,M-12A,ZONE,true,2022-10-30 13:13:52.0000000,M&O MS Forms
M-003819,M037,M037-ZN04,07/26/2022 12:00:00 AM,AM,2022,7,Jul,31,Parks,Highbridge Park,27,,27,,,34,Manhattan,M-12A,ZONE,true,2022-07-29 16:01:04.0000000,M&O MS Forms
M-003828,M037,M037-ZN04,07/27/2022 12:00:00 AM,AM,2022,7,Jul,31,Parks,Highbridge Park,8,,8,,,34,Manhattan,M-12A,ZONE,true,2022-07-29 16:03:59.0000000,M&O MS Forms
M-003845,M037,M037-ZN04,07/29/2022 12:00:00 AM,AM,2022,7,Jul,31,Parks,Highbridge Park,10,,10,,,34,Manhattan,M-12A,ZONE,true,2022-07-29 16:12:50.0000000,M&O MS Forms
M-003836,M037,M037-ZN04,07/28/2022 12:00:00 AM,AM,2022,7,Jul,31,Parks,Highbridge Park,14,,14,,,34,Manhattan,M-12A,ZONE,true,2022-07-29 16:06:25.0000000,M&O MS Forms
M-003854,M037,M037-ZN04,07/30/2022 12:00:00 AM,AM,2022,7,Jul,31,Parks,Highbridge Park,15,,15,,,34,Manhattan,M-12A,ZONE,true,2022-07-31 09:42:14.0000000,M&O MS Forms
M-003863,M037,M037-ZN04,07/31/2022 12:00:00 AM,AM,2022,7,Jul,32,Parks,Highbridge Park,107,,107,,,34,Manhattan,M-12A,ZONE,true,2022-07-31 16:57:32.0000000,M&O MS Forms
M-004597,M037,M037-ZN04,10/16/2022 12:00:00 AM,AM,2022,10,Oct,43,Parks,Highbridge Park,12,,12,,,34,Manhattan,M-12A,ZONE,true,2022-10-19 06:22:36.0000000,M&O MS Forms
M-004606,M037,M037-ZN04,10/17/2022 12:00:00 AM,AM,2022,10,Oct,43,Parks,Highbridge Park,15,,15,,,34,Manhattan,M-12A,ZONE,true,2022-10-19 06:39:06.0000000,M&O MS Forms
M-003772,M037,M037-ZN04,07/21/2022 12:00:00 AM,AM,2022,7,Jul,30,Parks,Highbridge Park,12,,12,,,34,Manhattan,M-12A,ZONE,true,2022-07-23 15:33:12.0000000,M&O MS Forms
M-003781,M037,M037-ZN04,07/22/2022 12:00:00 AM,AM,2022,7,Jul,30,Parks,Highbridge Park,9,,9,,,34,Manhattan,M-12A,ZONE,true,2022-07-23 15:36:12.0000000,M&O MS Forms
M-003753,M037,M037-ZN04,07/19/2022 12:00:00 AM,AM,2022,7,Jul,30,Parks,Highbridge Park,6,,6,,,34,Manhattan,M-12A,ZONE,true,2022-07-23 15:25:20.0000000,M&O MS Forms
M-003763,M037,M037-ZN04,07/20/2022 12:00:00 AM,AM,2022,7,Jul,30,Parks,Highbridge Park,3,,3,,,34,Manhattan,M-12A,ZONE,true,2022-07-23 15:29:51.0000000,M&O MS Forms
M-003810,M037,M037-ZN04,07/25/2022 12:00:00 AM,AM,2022,7,Jul,31,Parks,Highbridge Park,57,,57,,,34,Manhattan,M-12A,ZONE,true,2022-07-29 15:58:04.0000000,M&O MS Forms
M-003801,M037,M037-ZN04,07/24/2022 12:00:00 AM,AM,2022,7,Jul,31,Parks,Highbridge Park,46,,46,,,34,Manhattan,M-12A,ZONE,true,2022-07-29 15:55:00.0000000,M&O MS Forms
M-003789,M037,M037-ZN04,07/23/2022 12:00:00 AM,AM,2022,7,Jul,30,Parks,Highbridge Park,12,,12,,,34,Manhattan,M-12A,ZONE,true,2022-07-24 12:11:18.0000000,M&O MS Forms
M-003171,M037,M037-ZN04,05/20/2022 12:00:00 AM,AM,2022,5,May,21,Parks,Highbridge Park,18,,18,,,34,Manhattan,M-12A,ZONE,true,2022-05-20 15:13:46.0000000,M&O MS Forms
M-003180,M037,M037-ZN04,05/21/2022 12:00:00 AM,AM,2022,5,May,21,Parks,Highbridge Park,20,,20,,,34,Manhattan,M-12A,ZONE,true,2022-05-22 08:32:02.0000000,M&O MS Forms
M-003192,M037,M037-ZN04,05/22/2022 12:00:00 AM,AM,2022,5,May,22,Parks,Highbridge Park,36,,36,,,34,Manhattan,M-12A,ZONE,true,2022-05-22 15:11:49.0000000,M&O MS Forms
M-003223,M037,M037-ZN04,05/25/2022 12:00:00 AM,AM,2022,5,May,22,Parks,Highbridge Park,15,,15,,,34,Manhattan,M-12A,ZONE,true,2022-05-28 10:51:08.0000000,M&O MS Forms
M-003214,M037,M037-ZN04,05/24/2022 12:00:00 AM,AM,2022,5,May,22,Parks,Highbridge Park,11,,11,,,34,Manhattan,M-12A,ZONE,true,2022-05-28 10:48:32.0000000,M&O MS Forms
M-003205,M037,M037-ZN04,05/23/2022 12:00:00 AM,AM,2022,5,May,22,Parks,Highbridge Park,18,,18,,,34,Manhattan,M-12A,ZONE,true,2022-05-28 10:45:59.0000000,M&O MS Forms
M-003112,M037,M037-ZN04,05/14/2022 12:00:00 AM,AM,2022,5,May,20,Parks,Highbridge Park,4,,4,,,34,Manhattan,M-12A,ZONE,true,2022-05-14 15:50:03.0000000,M&O MS Forms
M-003102,M037,M037-ZN04,05/13/2022 12:00:00 AM,AM,2022,5,May,20,Parks,Highbridge Park,12,,12,,,34,Manhattan,M-12A,ZONE,true,2022-05-14 10:50:02.0000000,M&O MS Forms
M-003122,M037,M037-ZN04,05/15/2022 12:00:00 AM,AM,2022,5,May,21,Parks,Highbridge Park,99,,99,,,34,Manhattan,M-12A,ZONE,true,2022-05-15 16:52:29.0000000,M&O MS Forms
M-003153,M037,M037-ZN04,05/18/2022 12:00:00 AM,AM,2022,5,May,21,Parks,Highbridge Park,21,,21,,,34,Manhattan,M-12A,ZONE,true,2022-05-20 15:07:19.0000000,M&O MS Forms
M-003162,M037,M037-ZN04,05/19/2022 12:00:00 AM,AM,2022,5,May,21,Parks,Highbridge Park,15,,15,,,34,Manhattan,M-12A,ZONE,true,2022-05-20 15:09:50.0000000,M&O MS Forms
M-003144,M037,M037-ZN04,05/17/2022 12:00:00 AM,AM,2022,5,May,21,Parks,Highbridge Park,40,,40,,,34,Manhattan,M-12A,ZONE,true,2022-05-20 15:04:16.0000000,M&O MS Forms
M-003135,M037,M037-ZN04,05/09/2022 12:00:00 AM,AM,2022,5,May,20,Parks,Highbridge Park,161,,161,,,34,Manhattan,M-12A,ZONE,true,2022-05-20 15:01:28.0000000,M&O MS Forms
M-003072,M037,M037-ZN04,05/10/2022 12:00:00 AM,AM,2022,5,May,20,Parks,Highbridge Park,40,,40,,,34,Manhattan,M-12A,ZONE,true,2022-05-13 15:17:17.0000000,M&O MS Forms
M-001380,M037,M037-ZN04,11/18/2021 12:00:00 AM,AM,2021,11,Nov,47,Parks,Highbridge Park,45,,45,,,34,Manhattan,M-12A,ZONE,true,2021-11-18 17:05:31.0000000,M&O MS Forms
M-001390,M037,M037-ZN04,11/19/2021 12:00:00 AM,AM,2021,11,Nov,47,Parks,Highbridge Park,16,,16,,,34,Manhattan,M-12A,ZONE,true,2021-11-20 07:07:02.0000000,M&O MS Forms
M-001399,M037,M037-ZN04,11/20/2021 12:00:00 AM,AM,2021,11,Nov,47,Parks,Highbridge Park,32,,32,,,34,Manhattan,M-12A,ZONE,true,2021-11-20 18:39:53.0000000,M&O MS Forms
M-001408,M037,M037-ZN04,11/21/2021 12:00:00 AM,AM,2021,11,Nov,48,Parks,Highbridge Park,50,,50,,,34,Manhattan,M-12A,ZONE,true,2021-11-25 12:25:45.0000000,M&O MS Forms
M-001417,M037,M037-ZN04,11/22/2021 12:00:00 AM,AM,2021,11,Nov,48,Parks,Highbridge Park,90,,90,,,34,Manhattan,M-12A,ZONE,true,2021-11-25 12:29:32.0000000,M&O MS Forms
M-001426,M037,M037-ZN04,11/23/2021 12:00:00 AM,AM,2021,11,Nov,48,Parks,Highbridge Park,85,,85,,,34,Manhattan,M-12A,ZONE,true,2021-11-25 12:33:41.0000000,M&O MS Forms
M-001436,M037,M037-ZN04,11/24/2021 12:00:00 AM,AM,2021,11,Nov,48,Parks,Highbridge Park,44,,44,,,34,Manhattan,M-12A,ZONE,true,2021-11-25 12:36:49.0000000,M&O MS Forms
M-001454,M037,M037-ZN04,11/26/2021 12:00:00 AM,AM,2021,11,Nov,48,Parks,Highbridge Park,12,,12,,,34,Manhattan,M-12A,ZONE,true,2021-11-26 20:01:48.0000000,M&O MS Forms
M-001445,M037,M037-ZN04,11/25/2021 12:00:00 AM,AM,2021,11,Nov,48,Parks,Highbridge Park,19,,19,,,34,Manhattan,M-12A,ZONE,true,2021-11-26 19:58:48.0000000,M&O MS Forms
M-001475,M037,M037-ZN04,11/27/2021 12:00:00 AM,AM,2021,11,Nov,48,Parks,Highbridge Park,32,,32,,,34,Manhattan,M-12A,ZONE,true,2021-11-29 08:56:27.0000000,M&O MS Forms
M-001497,M037,M037-ZN04,11/29/2021 12:00:00 AM,AM,2021,11,Nov,49,Parks,Highbridge Park,20,,20,,,34,Manhattan,M-12A,ZONE,true,2021-12-02 08:44:15.0000000,M&O MS Forms
M-001489,M037,M037-ZN04,11/28/2021 12:00:00 AM,AM,2021,11,Nov,49,Parks,Highbridge Park,45,,45,,,34,Manhattan,M-12A,ZONE,true,2021-12-02 08:41:12.0000000,M&O MS Forms
M-001506,M037,M037-ZN04,11/30/2021 12:00:00 AM,AM,2021,11,Nov,49,Parks,Highbridge Park,35,,35,,,34,Manhattan,M-12A,ZONE,true,2021-12-02 08:48:06.0000000,M&O MS Forms
M-001515,M037,M037-ZN04,12/01/2021 12:00:00 AM,AM,2021,12,Dec,49,Parks,Highbridge Park,55,,55,,,34,Manhattan,M-12A,ZONE,true,2021-12-02 08:50:25.0000000,M&O MS Forms
M-001531,M037,M037-ZN04,12/05/2021 12:00:00 AM,AM,2021,12,Dec,50,Parks,Highbridge Park,75,,75,,,34,Manhattan,M-12A,ZONE,true,2021-12-05 13:34:35.0000000,M&O MS Forms
M-001540,M037,M037-ZN04,12/05/2021 12:00:00 AM,AM,2021,12,Dec,50,Parks,Highbridge Park,31,,31,,,34,Manhattan,M-12A,ZONE,true,2021-12-05 13:38:29.0000000,M&O MS Forms
M-001550,M037,M037-ZN04,12/04/2021 12:00:00 AM,AM,2021,12,Dec,49,Parks,Highbridge Park,50,,50,,,34,Manhattan,M-12A,ZONE,true,2021-12-05 13:42:24.0000000,M&O MS Forms
M-001563,M037,M037-ZN04,12/05/2021 12:00:00 AM,AM,2021,12,Dec,50,Parks,Highbridge Park,75,,75,,,34,Manhattan,M-12A,ZONE,true,2021-12-09 16:06:15.0000000,M&O MS Forms
M-001712,M037,M037-ZN04,12/18/2021 12:00:00 AM,AM,2021,12,Dec,51,Parks,Highbridge Park,6,,6,,,34,Manhattan,M-12A,ZONE,true,2021-12-19 10:23:03.0000000,M&O MS Forms
M-001703,M037,M037-ZN04,12/17/2021 12:00:00 AM,AM,2021,12,Dec,51,Parks,Highbridge Park,57,,57,,,34,Manhattan,M-12A,ZONE,true,2021-12-19 10:18:20.0000000,M&O MS Forms
M-001572,M037,M037-ZN04,12/06/2021 12:00:00 AM,AM,2021,12,Dec,50,Parks,Highbridge Park,90,,90,,,34,Manhattan,M-12A,ZONE,true,2021-12-09 16:09:08.0000000,M&O MS Forms
M-001581,M037,M037-ZN04,12/07/2021 12:00:00 AM,AM,2021,12,Dec,50,Parks,Highbridge Park,90,,90,,,34,Manhattan,M-12A,ZONE,true,2021-12-09 16:12:26.0000000,M&O MS Forms
M-001590,M037,M037-ZN04,12/08/2021 12:00:00 AM,AM,2021,12,Dec,50,Parks,Highbridge Park,95,,95,,,34,Manhattan,M-12A,ZONE,true,2021-12-09 16:15:25.0000000,M&O MS Forms
M-001615,M037,M037-ZN04,12/10/2021 12:00:00 AM,AM,2021,12,Dec,50,Parks,Highbridge Park,92,,92,,,34,Manhattan,M-12A,ZONE,true,2021-12-11 08:04:02.0000000,M&O MS Forms
M-001606,M037,M037-ZN04,12/09/2021 12:00:00 AM,AM,2021,12,Dec,50,Parks,Highbridge Park,75,,75,,,34,Manhattan,M-12A,ZONE,true,2021-12-11 07:58:48.0000000,M&O MS Forms
M-001627,M037,M037-ZN04,12/11/2021 12:00:00 AM,AM,2021,12,Dec,50,Parks,Highbridge Park,105,,105,,,34,Manhattan,M-12A,ZONE,true,2021-12-14 16:22:45.0000000,M&O MS Forms
M-001636,M037,M037-ZN04,12/12/2021 12:00:00 AM,AM,2021,12,Dec,51,Parks,Highbridge Park,35,,35,,,34,Manhattan,M-12A,ZONE,true,2021-12-14 16:30:09.0000000,M&O MS Forms
M-001645,M037,M037-ZN04,12/13/2021 12:00:00 AM,AM,2021,12,Dec,51,Parks,Highbridge Park,90,,90,,,34,Manhattan,M-12A,ZONE,true,2021-12-14 16:32:57.0000000,M&O MS Forms
M-001687,M037,M037-ZN04,12/16/2021 12:00:00 AM,AM,2021,12,Dec,51,Parks,Highbridge Park,40,,40,,,34,Manhattan,M-12A,ZONE,true,2021-12-16 16:46:04.0000000,M&O MS Forms
M-001676,M037,M037-ZN04,12/15/2021 12:00:00 AM,AM,2021,12,Dec,51,Parks,Highbridge Park,80,,80,,,34,Manhattan,M-12A,ZONE,true,2021-12-16 16:37:48.0000000,M&O MS Forms
M-001675,M037,M037-ZN04,12/15/2021 12:00:00 AM,AM,2021,12,Dec,51,Parks,Highbridge Park,80,,80,,,34,Manhattan,M-12A,ZONE,true,2021-12-16 16:37:44.0000000,M&O MS Forms
M-001666,M037,M037-ZN04,12/14/2021 12:00:00 AM,AM,2021,12,Dec,51,Parks,Highbridge Park,75,,75,,,34,Manhattan,M-12A,ZONE,true,2021-12-16 16:27:29.0000000,M&O MS Forms
M-005524,M037,M037-ZN04,01/19/2023 12:00:00 AM,AM,2023,1,Jan,3,Parks,Highbridge Park,15,,15,,,34,Manhattan,M-12A,ZONE,true,2023-01-23 16:29:07.0000000,M&O MS Forms
M-005515,M037,M037-ZN04,01/18/2023 12:00:00 AM,AM,2023,1,Jan,3,Parks,Highbridge Park,13,,13,,,34,Manhattan,M-12A,ZONE,true,2023-01-23 16:14:50.0000000,M&O MS Forms
M-005504,M037,M037-ZN04,01/17/2023 12:00:00 AM,AM,2023,1,Jan,3,Parks,Highbridge Park,12,,12,,,34,Manhattan,M-12A,ZONE,true,2023-01-23 16:10:54.0000000,M&O MS Forms
M-005560,M037,M037-ZN04,01/23/2023 12:00:00 AM,AM,2023,1,Jan,4,Parks,Highbridge Park,5,,5,,,34,Manhattan,M-12A,ZONE,true,2023-01-23 16:49:25.0000000,M&O MS Forms
M-005551,M037,M037-ZN04,01/22/2023 12:00:00 AM,AM,2023,1,Jan,4,Parks,Highbridge Park,10,,10,,,34,Manhattan,M-12A,ZONE,true,2023-01-23 16:46:41.0000000,M&O MS Forms
M-005542,M037,M037-ZN04,01/21/2023 12:00:00 AM,AM,2023,1,Jan,3,Parks,Highbridge Park,14,,14,,,34,Manhattan,M-12A,ZONE,true,2023-01-23 16:35:06.0000000,M&O MS Forms
M-005533,M037,M037-ZN04,01/20/2023 12:00:00 AM,AM,2023,1,Jan,3,Parks,Highbridge Park,16,,16,,,34,Manhattan,M-12A,ZONE,true,2023-01-23 16:32:05.0000000,M&O MS Forms
M-005659,M037,M037-ZN04,02/02/2023 12:00:00 AM,AM,2023,2,Feb,5,Parks,Highbridge Park,12,,12,,,34,Manhattan,M-12A,ZONE,true,2023-02-02 15:41:06.0000000,M&O MS Forms
M-005649,M037,M037-ZN04,02/01/2023 12:00:00 AM,AM,2023,2,Feb,5,Parks,Highbridge Park,11,,11,,,34,Manhattan,M-12A,ZONE,true,2023-02-01 15:50:47.0000000,M&O MS Forms
M-005707,M037,M037-ZN04,02/08/2023 12:00:00 AM,AM,2023,2,Feb,6,Parks,Highbridge Park,9,,9,,,34,Manhattan,M-12A,ZONE,true,2023-02-08 16:00:25.0000000,M&O MS Forms
M-005669,M037,M037-ZN04,02/03/2023 12:00:00 AM,AM,2023,2,Feb,5,Parks,Highbridge Park,14,,14,,,34,Manhattan,M-12A,ZONE,true,2023-02-03 17:14:43.0000000,M&O MS Forms
M-005678,M037,M037-ZN04,02/04/2023 12:00:00 AM,AM,2023,2,Feb,5,Parks,Highbridge Park,2,,2,,,34,Manhattan,M-12A,ZONE,true,2023-02-05 11:30:17.0000000,M&O MS Forms
M-005689,M037,M037-ZN04,02/06/2023 12:00:00 AM,AM,2023,2,Feb,6,Parks,Highbridge Park,4,,4,,,34,Manhattan,M-12A,ZONE,true,2023-02-07 17:25:45.0000000,M&O MS Forms
M-005698,M037,M037-ZN04,02/07/2023 12:00:00 AM,AM,2023,2,Feb,6,Parks,Highbridge Park,6,,6,,,34,Manhattan,M-12A,ZONE,true,2023-02-07 17:29:48.0000000,M&O MS Forms
M-005719,M037,M037-ZN04,02/09/2023 12:00:00 AM,AM,2023,2,Feb,6,Parks,Highbridge Park,12,,12,,,34,Manhattan,M-12A,ZONE,true,2023-02-09 15:42:35.0000000,M&O MS Forms
M-005728,M037,M037-ZN04,02/10/2023 12:00:00 AM,AM,2023,2,Feb,6,Parks,Highbridge Park,15,,15,,,34,Manhattan,M-12A,ZONE,true,2023-02-11 17:48:48.0000000,M&O MS Forms
M-005576,M037,M037-ZN04,01/25/2023 12:00:00 AM,AM,2023,1,Jan,4,Parks,Highbridge Park,1,,1,,,34,Manhattan,M-12A,ZONE,true,2023-01-25 17:09:11.0000000,M&O MS Forms
M-005568,M037,M037-ZN04,01/24/2023 12:00:00 AM,AM,2023,1,Jan,4,Parks,Highbridge Park,3,,3,,,34,Manhattan,M-12A,ZONE,true,2023-01-24 17:13:08.0000000,M&O MS Forms
M-005596,M037,M037-ZN04,01/27/2023 12:00:00 AM,AM,2023,1,Jan,4,Parks,Highbridge Park,8,,8,,,34,Manhattan,M-12A,ZONE,true,2023-01-30 16:02:44.0000000,M&O MS Forms
M-005605,M037,M037-ZN04,01/28/2023 12:00:00 AM,AM,2023,1,Jan,4,Parks,Highbridge Park,9,,9,,,34,Manhattan,M-12A,ZONE,true,2023-01-30 16:10:27.0000000,M&O MS Forms
M-005613,M037,M037-ZN04,01/29/2023 12:00:00 AM,AM,2023,1,Jan,5,Parks,Highbridge Park,10,,10,,,34,Manhattan,M-12A,ZONE,true,2023-01-30 16:18:33.0000000,M&O MS Forms
M-005639,M037,M037-ZN04,01/30/2023 12:00:00 AM,AM,2023,1,Jan,5,Parks,Highbridge Park,9,,9,,,34,Manhattan,M-12A,ZONE,true,2023-01-31 15:44:47.0000000,M&O MS Forms
M-005622,M037,M037-ZN04,01/30/2023 12:00:00 AM,AM,2023,1,Jan,5,Parks,Highbridge Park,15,,15,,,34,Manhattan,M-12A,ZONE,true,2023-01-30 16:22:08.0000000,M&O MS Forms
M-004199,M037,M037-ZN04,09/01/2022 12:00:00 AM,AM,2022,9,Sep,36,Parks,Highbridge Park,3,,3,,,34,Manhattan,M-12A,ZONE,true,2022-09-06 14:30:12.0000000,M&O MS Forms
M-004207,M037,M037-ZN04,09/02/2022 12:00:00 AM,AM,2022,9,Sep,36,Parks,Highbridge Park,3,,3,,,34,Manhattan,M-12A,ZONE,true,2022-09-06 14:32:35.0000000,M&O MS Forms
M-004216,M037,M037-ZN04,09/03/2022 12:00:00 AM,AM,2022,9,Sep,36,Parks,Highbridge Park,14,,14,,,34,Manhattan,M-12A,ZONE,true,2022-09-06 14:35:33.0000000,M&O MS Forms
M-004225,M037,M037-ZN04,09/04/2022 12:00:00 AM,AM,2022,9,Sep,37,Parks,Highbridge Park,15,,15,,,34,Manhattan,M-12A,ZONE,true,2022-09-06 14:38:48.0000000,M&O MS Forms
M-004245,M037,M037-ZN04,09/04/2022 12:00:00 AM,AM,2022,9,Sep,37,Parks,Highbridge Park,5,,5,,,34,Manhattan,M-12A,ZONE,true,2022-09-09 05:27:59.0000000,M&O MS Forms
M-004235,M037,M037-ZN04,09/05/2022 12:00:00 AM,AM,2022,9,Sep,37,Parks,Highbridge Park,10,,10,,,34,Manhattan,M-12A,ZONE,true,2022-09-06 14:42:36.0000000,M&O MS Forms
M-004254,M037,M037-ZN04,09/05/2022 12:00:00 AM,AM,2022,9,Sep,37,Parks,Highbridge Park,15,,15,,,34,Manhattan,M-12A,ZONE,true,2022-09-09 05:32:15.0000000,M&O MS Forms
M-004263,M037,M037-ZN04,09/06/2022 12:00:00 AM,AM,2022,9,Sep,37,Parks,Highbridge Park,72,,72,,,34,Manhattan,M-12A,ZONE,true,2022-09-09 05:37:04.0000000,M&O MS Forms
M-004272,M037,M037-ZN04,09/07/2022 12:00:00 AM,AM,2022,9,Sep,37,Parks,Highbridge Park,10,,10,,,34,Manhattan,M-12A,ZONE,true,2022-09-09 05:40:25.0000000,M&O MS Forms
M-001875,M037,M037-ZN05,01/01/2022 12:00:00 AM,AM,2022,1,Jan,1,Parks,Highbridge Park,15,,15,,,34,Manhattan,M-12A,ZONE,true,2022-01-02 18:58:09.0000000,M&O MS Forms
M-004580,M037,M037-ZN05,10/14/2022 12:00:00 AM,AM,2022,10,Oct,42,Parks,Highbridge Park,6,,6,,,34,Manhattan,M-12A,ZONE,true,2022-10-19 05:39:40.0000000,M&O MS Forms
M-004589,M037,M037-ZN05,10/15/2022 12:00:00 AM,AM,2022,10,Oct,42,Parks,Highbridge Park,7,,7,,,34,Manhattan,M-12A,ZONE,true,2022-10-19 05:42:27.0000000,M&O MS Forms
M-004554,M037,M037-ZN05,10/11/2022 12:00:00 AM,AM,2022,10,Oct,42,Parks,Highbridge Park,3,,3,,,34,Manhattan,M-12A,ZONE,true,2022-10-11 16:49:12.0000000,M&O MS Forms
M-004553,M037,M037-ZN05,10/11/2022 12:00:00 AM,AM,2022,10,Oct,42,Parks,Highbridge Park,3,,3,,,34,Manhattan,M-12A,ZONE,true,2022-10-11 16:46:59.0000000,M&O MS Forms
M-004571,M037,M037-ZN05,10/13/2022 12:00:00 AM,AM,2022,10,Oct,42,Parks,Highbridge Park,4,,4,,,34,Manhattan,M-12A,ZONE,true,2022-10-19 05:36:40.0000000,M&O MS Forms
M-004544,M037,M037-ZN05,10/08/2022 12:00:00 AM,AM,2022,10,Oct,41,Parks,Highbridge Park,10,,10,,,34,Manhattan,M-12A,ZONE,true,2022-10-11 15:25:27.0000000,M&O MS Forms
M-004534,M037,M037-ZN05,10/07/2022 12:00:00 AM,AM,2022,10,Oct,41,Parks,Highbridge Park,6,,6,,,34,Manhattan,M-12A,ZONE,true,2022-10-11 15:22:22.0000000,M&O MS Forms
M-004527,M037,M037-ZN05,10/06/2022 12:00:00 AM,AM,2022,10,Oct,41,Parks,Highbridge Park,3,,3,,,34,Manhattan,M-12A,ZONE,true,2022-10-11 15:20:16.0000000,M&O MS Forms
M-004520,M037,M037-ZN05,10/05/2022 12:00:00 AM,AM,2022,10,Oct,41,Parks,Highbridge Park,1,,1,,,34,Manhattan,M-12A,ZONE,true,2022-10-11 15:17:59.0000000,M&O MS Forms
M-004502,M037,M037-ZN05,10/03/2022 12:00:00 AM,AM,2022,10,Oct,41,Parks,Highbridge Park,1,,1,,,34,Manhattan,M-12A,ZONE,true,2022-10-11 15:12:24.0000000,M&O MS Forms
M-004511,M037,M037-ZN05,10/04/2022 12:00:00 AM,AM,2022,10,Oct,41,Parks,Highbridge Park,2,,2,,,34,Manhattan,M-12A,ZONE,true,2022-10-11 15:15:16.0000000,M&O MS Forms
M-004492,M037,M037-ZN05,10/02/2022 12:00:00 AM,AM,2022,10,Oct,41,Parks,Highbridge Park,2,,2,,,34,Manhattan,M-12A,ZONE,true,2022-10-11 07:18:58.0000000,M&O MS Forms
M-003890,M037,M037-ZN05,08/03/2022 12:00:00 AM,AM,2022,8,Aug,32,Parks,Highbridge Park,4,,4,,,34,Manhattan,M-12A,ZONE,true,2022-08-04 15:33:18.0000000,M&O MS Forms
M-003882,M037,M037-ZN05,08/02/2022 12:00:00 AM,AM,2022,8,Aug,32,Parks,Highbridge Park,3,,3,,,34,Manhattan,M-12A,ZONE,true,2022-08-04 15:31:01.0000000,M&O MS Forms
M-003873,M037,M037-ZN05,08/01/2022 12:00:00 AM,AM,2022,8,Aug,32,Parks,Highbridge Park,6,,6,,,34,Manhattan,M-12A,ZONE,true,2022-08-04 15:28:19.0000000,M&O MS Forms
M-004442,M037,M037-ZN05,09/27/2022 12:00:00 AM,AM,2022,9,Sep,40,Parks,Highbridge Park,2,,2,,,34,Manhattan,M-12A,ZONE,true,2022-10-11 06:51:28.0000000,M&O MS Forms
M-004451,M037,M037-ZN05,09/28/2022 12:00:00 AM,AM,2022,9,Sep,40,Parks,Highbridge Park,6,,6,,,34,Manhattan,M-12A,ZONE,true,2022-10-11 06:59:35.0000000,M&O MS Forms
M-004424,M037,M037-ZN05,10/09/2022 12:00:00 AM,AM,2022,10,Oct,42,Parks,Highbridge Park,13,,13,,,34,Manhattan,M-12A,ZONE,true,2022-10-11 06:13:38.0000000,M&O MS Forms
M-004433,M037,M037-ZN05,10/10/2022 12:00:00 AM,AM,2022,10,Oct,42,Parks,Highbridge Park,15,,15,,,34,Manhattan,M-12A,ZONE,true,2022-10-11 06:17:48.0000000,M&O MS Forms
M-004758,M037,M037-ZN05,10/30/2022 12:00:00 AM,AM,2022,10,Oct,45,Parks,Highbridge Park,10,,10,,,34,Manhattan,M-12A,ZONE,true,2022-11-05 13:58:20.0000000,M&O MS Forms
M-004767,M037,M037-ZN05,10/31/2022 12:00:00 AM,AM,2022,10,Oct,45,Parks,Highbridge Park,15,,15,,,34,Manhattan,M-12A,ZONE,true,2022-11-05 14:01:03.0000000,M&O MS Forms
M-005757,M037,M037-ZN05,02/13/2023 12:00:00 AM,AM,2023,2,Feb,7,Parks,Highbridge Park,1,,1,,,34,Manhattan,M-12A,ZONE,true,2023-02-14 05:49:03.0000000,M&O MS Forms
M-005037,M037,M037-ZN05,11/26/2022 12:00:00 AM,AM,2022,11,Nov,48,Parks,Highbridge Park,13,,13,,,34,Manhattan,M-12A,ZONE,true,2022-11-27 11:12:38.0000000,M&O MS Forms
M-005748,M037,M037-ZN05,02/12/2023 12:00:00 AM,AM,2023,2,Feb,7,Parks,Highbridge Park,3,,3,,,34,Manhattan,M-12A,ZONE,true,2023-02-12 18:55:39.0000000,M&O MS Forms
M-003899,M037,M037-ZN05,08/04/2022 12:00:00 AM,AM,2022,8,Aug,32,Parks,Highbridge Park,7,,7,,,34,Manhattan,M-12A,ZONE,true,2022-08-04 15:35:51.0000000,M&O MS Forms
M-003927,M037,M037-ZN05,08/06/2022 12:00:00 AM,AM,2022,8,Aug,32,Parks,Highbridge Park,9,,9,,,34,Manhattan,M-12A,ZONE,true,2022-08-09 08:53:27.0000000,M&O MS Forms
M-003918,M037,M037-ZN05,08/05/2022 12:00:00 AM,AM,2022,8,Aug,32,Parks,Highbridge Park,8,,8,,,34,Manhattan,M-12A,ZONE,true,2022-08-09 08:50:42.0000000,M&O MS Forms
M-003953,M037,M037-ZN05,08/09/2022 12:00:00 AM,AM,2022,8,Aug,33,Parks,Highbridge Park,10,,10,,,34,Manhattan,M-12A,ZONE,true,2022-08-09 18:26:09.0000000,M&O MS Forms
M-003944,M037,M037-ZN05,08/08/2022 12:00:00 AM,AM,2022,8,Aug,33,Parks,Highbridge Park,10,,10,,,34,Manhattan,M-12A,ZONE,true,2022-08-09 08:58:48.0000000,M&O MS Forms
M-003936,M037,M037-ZN05,08/07/2022 12:00:00 AM,AM,2022,8,Aug,33,Parks,Highbridge Park,8,,8,,,34,Manhattan,M-12A,ZONE,true,2022-08-09 08:56:38.0000000,M&O MS Forms
M-004036,M037,M037-ZN05,08/16/2022 12:00:00 AM,AM,2022,8,Aug,34,Parks,Highbridge Park,4,,4,,,34,Manhattan,M-12A,ZONE,true,2022-08-18 14:42:56.0000000,M&O MS Forms
M-005794,M037,M037-ZN05,02/17/2023 12:00:00 AM,AM,2023,2,Feb,7,Parks,Highbridge Park,8,,8,,,34,Manhattan,M-12A,ZONE,true,2023-02-19 13:38:36.0000000,M&O MS Forms
M-005785,M037,M037-ZN05,02/16/2023 12:00:00 AM,AM,2023,2,Feb,7,Parks,Highbridge Park,6,,6,,,34,Manhattan,M-12A,ZONE,true,2023-02-16 16:04:23.0000000,M&O MS Forms
M-005804,M037,M037-ZN05,02/18/2023 12:00:00 AM,AM,2023,2,Feb,7,Parks,Highbridge Park,10,,10,,,34,Manhattan,M-12A,ZONE,true,2023-02-19 13:44:01.0000000,M&O MS Forms
M-005814,M037,M037-ZN05,02/19/2023 12:00:00 AM,AM,2023,2,Feb,8,Parks,Highbridge Park,3,,3,,,34,Manhattan,M-12A,ZONE,true,2023-02-22 08:37:09.0000000,M&O MS Forms
M-005831,M037,M037-ZN05,02/21/2023 12:00:00 AM,AM,2023,2,Feb,8,Parks,Highbridge Park,1,,1,,,34,Manhattan,M-12A,ZONE,true,2023-02-22 10:41:13.0000000,M&O MS Forms
M-005853,M037,M037-ZN05,02/23/2023 12:00:00 AM,AM,2023,2,Feb,8,Parks,Highbridge Park,2,,2,,,34,Manhattan,M-12A,ZONE,true,2023-02-23 15:23:12.0000000,M&O MS Forms
M-005863,M037,M037-ZN05,02/24/2023 12:00:00 AM,AM,2023,2,Feb,8,Parks,Highbridge Park,5,,5,,,34,Manhattan,M-12A,ZONE,true,2023-02-24 18:50:47.0000000,M&O MS Forms
M-005843,M037,M037-ZN05,02/22/2023 12:00:00 AM,AM,2023,2,Feb,8,Parks,Highbridge Park,3,,3,,,34,Manhattan,M-12A,ZONE,true,2023-02-23 14:59:51.0000000,M&O MS Forms
M-005872,M037,M037-ZN05,02/25/2023 12:00:00 AM,AM,2023,2,Feb,8,Parks,Highbridge Park,4,,4,,,34,Manhattan,M-12A,ZONE,true,2023-02-26 12:03:15.0000000,M&O MS Forms
M-005881,M037,M037-ZN05,02/26/2023 12:00:00 AM,AM,2023,2,Feb,9,Parks,Highbridge Park,8,,8,,,34,Manhattan,M-12A,ZONE,true,2023-02-26 19:16:43.0000000,M&O MS Forms
M-005891,M037,M037-ZN05,02/26/2023 12:00:00 AM,AM,2023,2,Feb,9,Parks,Highbridge Park,8,,8,,,34,Manhattan,M-12A,ZONE,true,2023-03-01 05:32:09.0000000,M&O MS Forms
M-005911,M037,M037-ZN05,03/01/2023 12:00:00 AM,AM,2023,3,Mar,9,Parks,Highbridge Park,7,,7,,,34,Manhattan,M-12A,ZONE,true,2023-03-01 15:46:27.0000000,M&O MS Forms
M-005900,M037,M037-ZN05,02/27/2023 12:00:00 AM,AM,2023,2,Feb,9,Parks,Highbridge Park,2,,2,,,34,Manhattan,M-12A,ZONE,true,2023-03-01 05:35:20.0000000,M&O MS Forms
M-005921,M037,M037-ZN05,03/02/2023 12:00:00 AM,AM,2023,3,Mar,9,Parks,Highbridge Park,25,,25,,,34,Manhattan,M-12A,ZONE,true,2023-03-04 13:25:52.0000000,M&O MS Forms
M-005929,M037,M037-ZN05,03/03/2023 12:00:00 AM,AM,2023,3,Mar,9,Parks,Highbridge Park,15,,15,,,34,Manhattan,M-12A,ZONE,true,2023-03-04 13:29:16.0000000,M&O MS Forms
M-005938,M037,M037-ZN05,03/04/2023 12:00:00 AM,AM,2023,3,Mar,9,Parks,Highbridge Park,6,,6,,,34,Manhattan,M-12A,ZONE,true,2023-03-04 13:32:33.0000000,M&O MS Forms
M-005947,M037,M037-ZN05,03/05/2023 12:00:00 AM,AM,2023,3,Mar,10,Parks,Highbridge Park,6,,6,,,34,Manhattan,M-12A,ZONE,true,2023-03-06 06:02:46.0000000,M&O MS Forms
M-005993,M037,M037-ZN05,03/09/2023 12:00:00 AM,AM,2023,3,Mar,10,Parks,Highbridge Park,9,,9,,,34,Manhattan,M-12A,ZONE,true,2023-03-09 15:45:20.0000000,M&O MS Forms
M-005973,M037,M037-ZN05,03/07/2023 12:00:00 AM,AM,2023,3,Mar,10,Parks,Highbridge Park,7,,7,,,34,Manhattan,M-12A,ZONE,true,2023-03-07 15:47:04.0000000,M&O MS Forms
M-005964,M037,M037-ZN05,03/06/2023 12:00:00 AM,AM,2023,3,Mar,10,Parks,Highbridge Park,4,,4,,,34,Manhattan,M-12A,ZONE,true,2023-03-06 17:34:29.0000000,M&O MS Forms
M-006003,M037,M037-ZN05,03/10/2023 12:00:00 AM,AM,2023,3,Mar,10,Parks,Highbridge Park,11,,11,,,34,Manhattan,M-12A,ZONE,true,2023-03-11 15:58:21.0000000,M&O MS Forms
M-002475,M037,M037-ZN08,03/10/2022 12:00:00 AM,AM,2022,3,Mar,11,Parks,Highbridge Park,2,,2,,,33,Manhattan,M-12A,ZONE,true,2022-03-17 10:35:36.0000000,M&O MS Forms
M-002492,M037,M037-ZN08,03/12/2022 12:00:00 AM,AM,2022,3,Mar,11,Parks,Highbridge Park,10,,10,,,33,Manhattan,M-12A,ZONE,true,2022-03-17 10:41:47.0000000,M&O MS Forms
M-002483,M037,M037-ZN08,03/11/2022 12:00:00 AM,AM,2022,3,Mar,11,Parks,Highbridge Park,5,,5,,,33,Manhattan,M-12A,ZONE,true,2022-03-17 10:38:38.0000000,M&O MS Forms
M-002459,M037,M037-ZN08,03/08/2022 12:00:00 AM,AM,2022,3,Mar,11,Parks,Highbridge Park,3,,3,,,33,Manhattan,M-12A,ZONE,true,2022-03-09 14:07:08.0000000,M&O MS Forms
M-002450,M037,M037-ZN08,03/07/2022 12:00:00 AM,AM,2022,3,Mar,11,Parks,Highbridge Park,1,,1,,,33,Manhattan,M-12A,ZONE,true,2022-03-09 14:04:48.0000000,M&O MS Forms
M-002432,M037,M037-ZN08,03/05/2022 12:00:00 AM,AM,2022,3,Mar,10,Parks,Highbridge Park,9,,9,,,33,Manhattan,M-12A,ZONE,true,2022-03-06 19:43:18.0000000,M&O MS Forms
M-000846,M037,M037-ZN08,09/10/2021 12:00:00 AM,PM,2021,9,Sep,37,Parks,Highbridge Park,39,,39,,,33,Manhattan,M-12A,ZONE,true,2021-09-13 17:10:47.0000000,M&O MS Forms
M-000876,M037,M037-ZN08,09/15/2021 12:00:00 AM,PM,2021,9,Sep,38,Parks,Highbridge Park,40,,40,,,33,Manhattan,M-12A,ZONE,true,2021-09-18 05:53:34.0000000,M&O MS Forms
M-001093,M037,M037-ZN08,10/17/2021 12:00:00 AM,AM,2021,10,Oct,43,Parks,Highbridge Park,50,,50,,,33,Manhattan,M-12A,ZONE,true,2021-10-18 09:49:45.0000000,M&O MS Forms
M-001073,M037,M037-ZN08,10/15/2021 12:00:00 AM,AM,2021,10,Oct,42,Parks,Highbridge Park,5,,5,,,33,Manhattan,M-12A,ZONE,true,2021-10-15 16:57:25.0000000,M&O MS Forms
M-001072,M037,M037-ZN08,10/14/2021 12:00:00 AM,AM,2021,10,Oct,42,Parks,Highbridge Park,2,,2,,,33,Manhattan,M-12A,ZONE,true,2021-10-15 16:57:08.0000000,M&O MS Forms
M-001071,M037,M037-ZN08,10/13/2021 12:00:00 AM,AM,2021,10,Oct,42,Parks,Highbridge Park,2,,2,,,33,Manhattan,M-12A,ZONE,true,2021-10-15 16:56:46.0000000,M&O MS Forms
M-001070,M037,M037-ZN08,10/12/2021 12:00:00 AM,AM,2021,10,Oct,42,Parks,Highbridge Park,3,,3,,,33,Manhattan,M-12A,ZONE,true,2021-10-15 16:56:28.0000000,M&O MS Forms
M-001069,M037,M037-ZN08,10/11/2021 12:00:00 AM,AM,2021,10,Oct,42,Parks,Highbridge Park,4,,4,,,33,Manhattan,M-12A,ZONE,true,2021-10-15 16:56:09.0000000,M&O MS Forms
M-001068,M037,M037-ZN08,10/10/2021 12:00:00 AM,AM,2021,10,Oct,42,Parks,Highbridge Park,4,,4,,,33,Manhattan,M-12A,ZONE,true,2021-10-15 16:55:49.0000000,M&O MS Forms
M-001107,M037,M037-ZN08,10/18/2021 12:00:00 AM,AM,2021,10,Oct,43,Parks,Highbridge Park,40,,40,,,33,Manhattan,M-12A,ZONE,true,2021-10-18 19:06:49.0000000,M&O MS Forms
M-001101,M037,M037-ZN08,10/16/2021 12:00:00 AM,AM,2021,10,Oct,42,Parks,Highbridge Park,7,,7,,,33,Manhattan,M-12A,ZONE,true,2021-10-18 10:04:02.0000000,M&O MS Forms
M-001114,M037,M037-ZN08,10/18/2021 12:00:00 AM,AM,2021,10,Oct,43,Parks,Highbridge Park,40,,40,,,33,Manhattan,M-12A,ZONE,true,2021-10-21 16:43:18.0000000,M&O MS Forms
M-001122,M037,M037-ZN08,10/19/2021 12:00:00 AM,AM,2021,10,Oct,43,Parks,Highbridge Park,24,,24,,,33,Manhattan,M-12A,ZONE,true,2021-10-21 16:46:46.0000000,M&O MS Forms
M-001141,M037,M037-ZN08,10/22/2021 12:00:00 AM,AM,2021,10,Oct,43,Parks,Highbridge Park,8,,8,,,33,Manhattan,M-12A,ZONE,true,2021-10-22 16:08:21.0000000,M&O MS Forms
M-001151,M037,M037-ZN08,10/23/2021 12:00:00 AM,AM,2021,10,Oct,43,Parks,Highbridge Park,15,,15,,,33,Manhattan,M-12A,ZONE,true,2021-10-24 20:22:12.0000000,M&O MS Forms
M-001167,M037,M037-ZN08,10/25/2021 12:00:00 AM,AM,2021,10,Oct,44,Parks,Highbridge Park,9,,9,,,33,Manhattan,M-12A,ZONE,true,2021-10-29 16:22:03.0000000,M&O MS Forms
M-001158,M037,M037-ZN08,10/24/2021 12:00:00 AM,AM,2021,10,Oct,44,Parks,Highbridge Park,2,,2,,,33,Manhattan,M-12A,ZONE,true,2021-10-26 12:19:57.0000000,M&O MS Forms
M-001204,M037,M037-ZN08,10/30/2021 12:00:00 AM,AM,2021,10,Oct,44,Parks,Highbridge Park,1,,1,,,33,Manhattan,M-12A,ZONE,true,2021-11-01 15:47:08.0000000,M&O MS Forms
M-001197,M037,M037-ZN08,10/29/2021 12:00:00 AM,AM,2021,10,Oct,44,Parks,Highbridge Park,25,,25,,,33,Manhattan,M-12A,ZONE,true,2021-10-29 16:31:49.0000000,M&O MS Forms
M-001182,M037,M037-ZN08,10/27/2021 12:00:00 AM,AM,2021,10,Oct,44,Parks,Highbridge Park,3,,3,,,33,Manhattan,M-12A,ZONE,true,2021-10-29 16:27:00.0000000,M&O MS Forms
M-001175,M037,M037-ZN08,10/26/2021 12:00:00 AM,AM,2021,10,Oct,44,Parks,Highbridge Park,1,,1,,,33,Manhattan,M-12A,ZONE,true,2021-10-29 16:24:37.0000000,M&O MS Forms
M-001225,M037,M037-ZN08,11/02/2021 12:00:00 AM,AM,2021,11,Nov,45,Parks,Highbridge Park,18,,18,,,33,Manhattan,M-12A,ZONE,true,2021-11-05 16:04:34.0000000,M&O MS Forms
M-001233,M037,M037-ZN08,11/03/2021 12:00:00 AM,AM,2021,11,Nov,45,Parks,Highbridge Park,15,,15,,,33,Manhattan,M-12A,ZONE,true,2021-11-05 16:07:12.0000000,M&O MS Forms
M-001251,M037,M037-ZN08,11/05/2021 12:00:00 AM,AM,2021,11,Nov,45,Parks,Highbridge Park,8,,8,,,33,Manhattan,M-12A,ZONE,true,2021-11-05 16:12:11.0000000,M&O MS Forms
M-001242,M037,M037-ZN08,11/04/2021 12:00:00 AM,AM,2021,11,Nov,45,Parks,Highbridge Park,3,,3,,,33,Manhattan,M-12A,ZONE,true,2021-11-05 16:09:41.0000000,M&O MS Forms
M-001273,M037,M037-ZN08,11/07/2021 12:00:00 AM,AM,2021,11,Nov,46,Parks,Highbridge Park,7,,7,,,33,Manhattan,M-12A,ZONE,true,2021-11-12 15:48:16.0000000,M&O MS Forms
M-001262,M037,M037-ZN08,11/06/2021 12:00:00 AM,AM,2021,11,Nov,45,Parks,Highbridge Park,13,,13,,,33,Manhattan,M-12A,ZONE,true,2021-11-08 12:23:25.0000000,M&O MS Forms
M-001282,M037,M037-ZN08,11/08/2021 12:00:00 AM,AM,2021,11,Nov,46,Parks,Highbridge Park,9,,9,,,33,Manhattan,M-12A,ZONE,true,2021-11-12 15:51:10.0000000,M&O MS Forms
M-001291,M037,M037-ZN08,11/09/2021 12:00:00 AM,AM,2021,11,Nov,46,Parks,Highbridge Park,18,,18,,,33,Manhattan,M-12A,ZONE,true,2021-11-12 15:54:16.0000000,M&O MS Forms
M-001300,M037,M037-ZN08,11/10/2021 12:00:00 AM,AM,2021,11,Nov,46,Parks,Highbridge Park,65,,65,,,33,Manhattan,M-12A,ZONE,true,2021-11-12 15:57:07.0000000,M&O MS Forms
M-000352,M037,M037-ZN08,06/01/2021 12:00:00 AM,AM,2021,6,Jun,23,Parks,Highbridge Park,4,,4,,,33,Manhattan,M-12A,ZONE,true,2021-06-05 08:59:46.0000000,M&O MS Forms
M-000364,M037,M037-ZN08,06/04/2021 12:00:00 AM,AM,2021,6,Jun,23,Parks,Highbridge Park,2,,2,,,33,Manhattan,M-12A,ZONE,true,2021-06-05 09:04:52.0000000,M&O MS Forms
M-000443,M037,M037-ZN08,06/25/2021 12:00:00 AM,PM,2021,6,Jun,26,Parks,Highbridge Park,4,,4,,,33,Manhattan,M-12A,ZONE,true,2021-06-25 20:02:04.0000000,M&O MS Forms
M-000414,M037,M037-ZN08,06/16/2021 12:00:00 AM,AM,2021,6,Jun,25,Parks,Highbridge Park,4,,4,,,33,Manhattan,M-12A,ZONE,true,2021-06-19 08:13:40.0000000,M&O MS Forms
M-000385,M037,M037-ZN08,06/07/2021 12:00:00 AM,AM,2021,6,Jun,24,Parks,Highbridge Park,7,,7,,,33,Manhattan,M-12A,ZONE,true,2021-06-11 17:40:56.0000000,M&O MS Forms
M-000268,M037,M037-ZN08,05/20/2021 12:00:00 AM,AM,2021,5,May,21,Parks,Highbridge Park,6,,6,,,33,Manhattan,M-12A,ZONE,true,2021-05-21 20:31:53.0000000,M&O MS Forms
M-000300,M037,M037-ZN08,05/24/2021 12:00:00 AM,AM,2021,5,May,22,Parks,Highbridge Park,22,,22,,,33,Manhattan,M-12A,ZONE,true,2021-05-29 08:46:58.0000000,M&O MS Forms
M-000227,M037,M037-ZN08,05/12/2021 12:00:00 AM,AM,2021,5,May,20,Parks,Highbridge Park,7,,7,,,33,Manhattan,M-12A,ZONE,true,2021-05-15 07:51:41.0000000,M&O MS Forms
M-000224,M037,M037-ZN08,05/11/2021 12:00:00 AM,AM,2021,5,May,20,Parks,Highbridge Park,16,,16,,,33,Manhattan,M-12A,ZONE,true,2021-05-15 07:50:42.0000000,M&O MS Forms
M-000221,M037,M037-ZN08,05/10/2021 12:00:00 AM,AM,2021,5,May,20,Parks,Highbridge Park,8,,8,,,33,Manhattan,M-12A,ZONE,true,2021-05-15 07:49:30.0000000,M&O MS Forms
M-000184,M037,M037-ZN08,05/03/2021 12:00:00 AM,AM,2021,5,May,19,Parks,Highbridge Park,6,,6,,,33,Manhattan,M-12A,ZONE,true,2021-05-07 19:39:11.0000000,M&O MS Forms
M-000451,M037,M037-ZN08,06/27/2021 12:00:00 AM,AM,2021,6,Jun,27,Parks,Highbridge Park,8,,8,,,33,Manhattan,M-12A,ZONE,true,2021-07-04 04:37:16.0000000,M&O MS Forms
M-001327,M037,M037-ZN08,11/13/2021 12:00:00 AM,AM,2021,11,Nov,46,Parks,Highbridge Park,16,,16,,,33,Manhattan,M-12A,ZONE,true,2021-11-13 15:54:34.0000000,M&O MS Forms
M-001309,M037,M037-ZN08,11/11/2021 12:00:00 AM,AM,2021,11,Nov,46,Parks,Highbridge Park,11,,11,,,33,Manhattan,M-12A,ZONE,true,2021-11-12 16:00:46.0000000,M&O MS Forms
M-001317,M037,M037-ZN08,11/12/2021 12:00:00 AM,AM,2021,11,Nov,46,Parks,Highbridge Park,3,,3,,,33,Manhattan,M-12A,ZONE,true,2021-11-12 16:05:12.0000000,M&O MS Forms
M-001348,M037,M037-ZN08,11/14/2021 12:00:00 AM,AM,2021,11,Nov,47,Parks,Highbridge Park,7,,7,,,33,Manhattan,M-12A,ZONE,true,2021-11-18 16:35:09.0000000,M&O MS Forms
M-001358,M037,M037-ZN08,11/15/2021 12:00:00 AM,AM,2021,11,Nov,47,Parks,Highbridge Park,3,,3,,,33,Manhattan,M-12A,ZONE,true,2021-11-18 16:40:46.0000000,M&O MS Forms
M-001367,M037,M037-ZN08,11/16/2021 12:00:00 AM,AM,2021,11,Nov,47,Parks,Highbridge Park,16,,16,,,33,Manhattan,M-12A,ZONE,true,2021-11-18 17:00:32.0000000,M&O MS Forms
M-001384,M037,M037-ZN08,11/18/2021 12:00:00 AM,AM,2021,11,Nov,47,Parks,Highbridge Park,10,,10,,,33,Manhattan,M-12A,ZONE,true,2021-11-18 17:07:10.0000000,M&O MS Forms
M-001376,M037,M037-ZN08,11/17/2021 12:00:00 AM,AM,2021,11,Nov,47,Parks,Highbridge Park,9,,9,,,33,Manhattan,M-12A,ZONE,true,2021-11-18 17:03:59.0000000,M&O MS Forms
M-001394,M037,M037-ZN08,11/19/2021 12:00:00 AM,AM,2021,11,Nov,47,Parks,Highbridge Park,18,,18,,,33,Manhattan,M-12A,ZONE,true,2021-11-20 07:08:43.0000000,M&O MS Forms
M-001403,M037,M037-ZN08,11/20/2021 12:00:00 AM,AM,2021,11,Nov,47,Parks,Highbridge Park,17,,17,,,33,Manhattan,M-12A,ZONE,true,2021-11-20 18:41:52.0000000,M&O MS Forms
M-001412,M037,M037-ZN08,11/21/2021 12:00:00 AM,AM,2021,11,Nov,48,Parks,Highbridge Park,35,,35,,,33,Manhattan,M-12A,ZONE,true,2021-11-25 12:27:15.0000000,M&O MS Forms
M-001431,M037,M037-ZN08,11/23/2021 12:00:00 AM,AM,2021,11,Nov,48,Parks,Highbridge Park,7,,7,,,33,Manhattan,M-12A,ZONE,true,2021-11-25 12:34:56.0000000,M&O MS Forms
M-001421,M037,M037-ZN08,11/22/2021 12:00:00 AM,AM,2021,11,Nov,48,Parks,Highbridge Park,20,,20,,,33,Manhattan,M-12A,ZONE,true,2021-11-25 12:31:05.0000000,M&O MS Forms
M-001458,M037,M037-ZN08,11/26/2021 12:00:00 AM,AM,2021,11,Nov,48,Parks,Highbridge Park,16,,16,,,33,Manhattan,M-12A,ZONE,true,2021-11-26 20:03:21.0000000,M&O MS Forms
M-001440,M037,M037-ZN08,11/25/2021 12:00:00 AM,AM,2021,11,Nov,48,Parks,Highbridge Park,12,,12,,,33,Manhattan,M-12A,ZONE,true,2021-11-25 12:38:10.0000000,M&O MS Forms
M-001449,M037,M037-ZN08,11/25/2021 12:00:00 AM,AM,2021,11,Nov,48,Parks,Highbridge Park,19,,19,,,33,Manhattan,M-12A,ZONE,true,2021-11-26 20:00:03.0000000,M&O MS Forms
M-001480,M037,M037-ZN08,11/27/2021 12:00:00 AM,AM,2021,11,Nov,48,Parks,Highbridge Park,17,,17,,,33,Manhattan,M-12A,ZONE,true,2021-11-29 08:58:39.0000000,M&O MS Forms
M-001479,M037,M037-ZN08,11/27/2021 12:00:00 AM,AM,2021,11,Nov,48,Parks,Highbridge Park,17,,17,,,33,Manhattan,M-12A,ZONE,true,2021-11-29 08:57:58.0000000,M&O MS Forms
M-001501,M037,M037-ZN08,11/29/2021 12:00:00 AM,AM,2021,11,Nov,49,Parks,Highbridge Park,45,,45,,,33,Manhattan,M-12A,ZONE,true,2021-12-02 08:45:31.0000000,M&O MS Forms
M-001510,M037,M037-ZN08,11/30/2021 12:00:00 AM,AM,2021,11,Nov,49,Parks,Highbridge Park,30,,30,,,33,Manhattan,M-12A,ZONE,true,2021-12-02 08:49:04.0000000,M&O MS Forms
M-001518,M037,M037-ZN08,12/01/2021 12:00:00 AM,AM,2021,12,Dec,49,Parks,Highbridge Park,50,,50,,,33,Manhattan,M-12A,ZONE,true,2021-12-02 08:51:11.0000000,M&O MS Forms
M-001535,M037,M037-ZN08,12/05/2021 12:00:00 AM,AM,2021,12,Dec,50,Parks,Highbridge Park,25,,25,,,33,Manhattan,M-12A,ZONE,true,2021-12-05 13:36:20.0000000,M&O MS Forms
M-001545,M037,M037-ZN08,12/05/2021 12:00:00 AM,AM,2021,12,Dec,50,Parks,Highbridge Park,16,,16,,,33,Manhattan,M-12A,ZONE,true,2021-12-05 13:40:07.0000000,M&O MS Forms
M-001567,M037,M037-ZN08,12/05/2021 12:00:00 AM,AM,2021,12,Dec,50,Parks,Highbridge Park,35,,35,,,33,Manhattan,M-12A,ZONE,true,2021-12-09 16:07:34.0000000,M&O MS Forms
M-001556,M037,M037-ZN08,12/04/2021 12:00:00 AM,AM,2021,12,Dec,49,Parks,Highbridge Park,48,,48,,,33,Manhattan,M-12A,ZONE,true,2021-12-05 13:44:25.0000000,M&O MS Forms
M-001555,M037,M037-ZN08,12/04/2021 12:00:00 AM,AM,2021,12,Dec,49,Parks,Highbridge Park,48,,48,,,33,Manhattan,M-12A,ZONE,true,2021-12-05 13:44:05.0000000,M&O MS Forms
M-001707,M037,M037-ZN08,12/17/2021 12:00:00 AM,AM,2021,12,Dec,51,Parks,Highbridge Park,32,,32,,,33,Manhattan,M-12A,ZONE,true,2021-12-19 10:20:43.0000000,M&O MS Forms
M-001716,M037,M037-ZN08,12/18/2021 12:00:00 AM,AM,2021,12,Dec,51,Parks,Highbridge Park,29,,29,,,33,Manhattan,M-12A,ZONE,true,2021-12-19 10:24:44.0000000,M&O MS Forms
M-001576,M037,M037-ZN08,12/06/2021 12:00:00 AM,AM,2021,12,Dec,50,Parks,Highbridge Park,60,,60,,,33,Manhattan,M-12A,ZONE,true,2021-12-09 16:10:40.0000000,M&O MS Forms
M-001594,M037,M037-ZN08,12/08/2021 12:00:00 AM,AM,2021,12,Dec,50,Parks,Highbridge Park,40,,40,,,33,Manhattan,M-12A,ZONE,true,2021-12-09 16:16:34.0000000,M&O MS Forms
M-001585,M037,M037-ZN08,12/07/2021 12:00:00 AM,AM,2021,12,Dec,50,Parks,Highbridge Park,20,,20,,,33,Manhattan,M-12A,ZONE,true,2021-12-09 16:13:41.0000000,M&O MS Forms
M-001610,M037,M037-ZN08,12/09/2021 12:00:00 AM,AM,2021,12,Dec,50,Parks,Highbridge Park,35,,35,,,33,Manhattan,M-12A,ZONE,true,2021-12-11 08:00:47.0000000,M&O MS Forms
M-001619,M037,M037-ZN08,12/10/2021 12:00:00 AM,AM,2021,12,Dec,50,Parks,Highbridge Park,53,,53,,,33,Manhattan,M-12A,ZONE,true,2021-12-11 08:06:37.0000000,M&O MS Forms
M-001631,M037,M037-ZN08,12/11/2021 12:00:00 AM,AM,2021,12,Dec,50,Parks,Highbridge Park,71,,71,,,33,Manhattan,M-12A,ZONE,true,2021-12-14 16:24:10.0000000,M&O MS Forms
M-001640,M037,M037-ZN08,12/12/2021 12:00:00 AM,AM,2021,12,Dec,51,Parks,Highbridge Park,70,,70,,,33,Manhattan,M-12A,ZONE,true,2021-12-14 16:31:28.0000000,M&O MS Forms
M-001649,M037,M037-ZN08,12/13/2021 12:00:00 AM,AM,2021,12,Dec,51,Parks,Highbridge Park,90,,90,,,33,Manhattan,M-12A,ZONE,true,2021-12-14 16:34:11.0000000,M&O MS Forms
M-001692,M037,M037-ZN08,12/16/2021 12:00:00 AM,AM,2021,12,Dec,51,Parks,Highbridge Park,25,,25,,,33,Manhattan,M-12A,ZONE,true,2021-12-16 16:50:13.0000000,M&O MS Forms
M-001691,M037,M037-ZN08,12/16/2021 12:00:00 AM,AM,2021,12,Dec,51,Parks,Highbridge Park,25,,25,,,33,Manhattan,M-12A,ZONE,true,2021-12-16 16:50:12.0000000,M&O MS Forms
M-001680,M037,M037-ZN08,12/15/2021 12:00:00 AM,AM,2021,12,Dec,51,Parks,Highbridge Park,80,,80,,,33,Manhattan,M-12A,ZONE,true,2021-12-16 16:39:39.0000000,M&O MS Forms
M-001670,M037,M037-ZN08,12/14/2021 12:00:00 AM,AM,2021,12,Dec,51,Parks,Highbridge Park,95,,95,,,33,Manhattan,M-12A,ZONE,true,2021-12-16 16:29:38.0000000,M&O MS Forms
M-006034,M037,M037-ZN08,03/13/2023 12:00:00 AM,AM,2023,3,Mar,11,Parks,Highbridge Park,3,,3,,,33,Manhattan,M-12A,ZONE,true,2023-03-13 16:14:27.0000000,M&O MS Forms
M-006044,M037,M037-ZN08,03/14/2023 12:00:00 AM,AM,2023,3,Mar,11,Parks,Highbridge Park,4,,4,,,33,Manhattan,M-12A,ZONE,true,2023-03-14 16:01:10.0000000,M&O MS Forms
M-006054,M037,M037-ZN08,03/15/2023 12:00:00 AM,AM,2023,3,Mar,11,Parks,Highbridge Park,1,,1,,,33,Manhattan,M-12A,ZONE,true,2023-03-15 17:12:27.0000000,M&O MS Forms
M-005987,M037,M037-ZN08,03/08/2023 12:00:00 AM,AM,2023,3,Mar,10,Parks,Highbridge Park,5,,5,,,33,Manhattan,M-12A,ZONE,true,2023-03-08 15:46:19.0000000,M&O MS Forms
M-006025,M037,M037-ZN08,03/12/2023 12:00:00 AM,AM,2023,3,Mar,11,Parks,Highbridge Park,2,,2,,,33,Manhattan,M-12A,ZONE,true,2023-03-12 17:23:14.0000000,M&O MS Forms
M-006015,M037,M037-ZN08,03/11/2023 12:00:00 AM,AM,2023,3,Mar,10,Parks,Highbridge Park,4,,4,,,33,Manhattan,M-12A,ZONE,true,2023-03-11 16:04:42.0000000,M&O MS Forms
M-006006,M037,M037-ZN08,03/10/2023 12:00:00 AM,AM,2023,3,Mar,10,Parks,Highbridge Park,8,,8,,,33,Manhattan,M-12A,ZONE,true,2023-03-11 15:59:23.0000000,M&O MS Forms
M-005967,M037,M037-ZN08,03/06/2023 12:00:00 AM,AM,2023,3,Mar,10,Parks,Highbridge Park,3,,3,,,33,Manhattan,M-12A,ZONE,true,2023-03-06 17:35:54.0000000,M&O MS Forms
M-005978,M037,M037-ZN08,03/07/2023 12:00:00 AM,AM,2023,3,Mar,10,Parks,Highbridge Park,2,,2,,,33,Manhattan,M-12A,ZONE,true,2023-03-07 15:49:52.0000000,M&O MS Forms
M-005996,M037,M037-ZN08,03/09/2023 12:00:00 AM,AM,2023,3,Mar,10,Parks,Highbridge Park,7,,7,,,33,Manhattan,M-12A,ZONE,true,2023-03-09 15:46:59.0000000,M&O MS Forms
M-005950,M037,M037-ZN08,03/05/2023 12:00:00 AM,AM,2023,3,Mar,10,Parks,Highbridge Park,5,,5,,,33,Manhattan,M-12A,ZONE,true,2023-03-06 06:04:14.0000000,M&O MS Forms
M-005914,M037,M037-ZN08,03/01/2023 12:00:00 AM,PM,2023,3,Mar,9,Parks,Highbridge Park,9,,9,,,33,Manhattan,M-12A,ZONE,true,2023-03-01 16:24:28.0000000,M&O MS Forms
M-005941,M037,M037-ZN08,03/04/2023 12:00:00 AM,AM,2023,3,Mar,9,Parks,Highbridge Park,6,,6,,,33,Manhattan,M-12A,ZONE,true,2023-03-04 13:33:46.0000000,M&O MS Forms
M-005932,M037,M037-ZN08,03/03/2023 12:00:00 AM,AM,2023,3,Mar,9,Parks,Highbridge Park,7,,7,,,33,Manhattan,M-12A,ZONE,true,2023-03-04 13:30:29.0000000,M&O MS Forms
M-005923,M037,M037-ZN08,03/02/2023 12:00:00 AM,AM,2023,3,Mar,9,Parks,Highbridge Park,8,,8,,,33,Manhattan,M-12A,ZONE,true,2023-03-04 13:27:05.0000000,M&O MS Forms
M-003922,M037,M037-ZN09,08/05/2022 12:00:00 AM,AM,2022,8,Aug,32,Parks,Highbridge Park,7,,7,,,34,Manhattan,M-12A,ZONE,true,2022-08-09 08:51:48.0000000,M&O MS Forms
M-003948,M037,M037-ZN09,08/08/2022 12:00:00 AM,AM,2022,8,Aug,33,Parks,Highbridge Park,10,,10,,,34,Manhattan,M-12A,ZONE,true,2022-08-09 09:00:05.0000000,M&O MS Forms
M-003957,M037,M037-ZN09,08/09/2022 12:00:00 AM,AM,2022,8,Aug,33,Parks,Highbridge Park,10,,10,,,34,Manhattan,M-12A,ZONE,true,2022-08-09 18:28:10.0000000,M&O MS Forms
M-003931,M037,M037-ZN09,08/06/2022 12:00:00 AM,AM,2022,8,Aug,32,Parks,Highbridge Park,1,,1,,,34,Manhattan,M-12A,ZONE,true,2022-08-09 08:54:33.0000000,M&O MS Forms
M-004027,M037,M037-ZN09,08/15/2022 12:00:00 AM,AM,2022,8,Aug,34,Parks,Highbridge Park,25,,25,,,34,Manhattan,M-12A,ZONE,true,2022-08-18 14:24:04.0000000,M&O MS Forms
M-004003,M037,M037-ZN09,08/13/2022 12:00:00 AM,AM,2022,8,Aug,33,Parks,Highbridge Park,5,,5,,,34,Manhattan,M-12A,ZONE,true,2022-08-15 10:10:32.0000000,M&O MS Forms
M-004018,M037,M037-ZN09,08/14/2022 12:00:00 AM,AM,2022,8,Aug,34,Parks,Highbridge Park,28,,28,,,34,Manhattan,M-12A,ZONE,true,2022-08-18 14:04:36.0000000,M&O MS Forms
M-003975,M037,M037-ZN09,08/11/2022 12:00:00 AM,AM,2022,8,Aug,33,Parks,Highbridge Park,2,,2,,,34,Manhattan,M-12A,ZONE,true,2022-08-11 16:14:23.0000000,M&O MS Forms
M-003966,M037,M037-ZN09,08/10/2022 12:00:00 AM,AM,2022,8,Aug,33,Parks,Highbridge Park,65,,65,,,34,Manhattan,M-12A,ZONE,true,2022-08-11 08:50:04.0000000,M&O MS Forms
M-004040,M037,M037-ZN09,08/16/2022 12:00:00 AM,AM,2022,8,Aug,34,Parks,Highbridge Park,5,,5,,,34,Manhattan,M-12A,ZONE,true,2022-08-18 14:44:00.0000000,M&O MS Forms
M-004049,M037,M037-ZN09,08/17/2022 12:00:00 AM,AM,2022,8,Aug,34,Parks,Highbridge Park,10,,10,,,34,Manhattan,M-12A,ZONE,true,2022-08-18 14:46:28.0000000,M&O MS Forms
M-004058,M037,M037-ZN09,08/18/2022 12:00:00 AM,AM,2022,8,Aug,34,Parks,Highbridge Park,8,,8,,,34,Manhattan,M-12A,ZONE,true,2022-08-18 14:49:16.0000000,M&O MS Forms
M-004096,M037,M037-ZN09,08/21/2022 12:00:00 AM,AM,2022,8,Aug,35,Parks,Highbridge Park,3,,3,,,34,Manhattan,M-12A,ZONE,true,2022-08-28 17:16:30.0000000,M&O MS Forms
M-004070,M037,M037-ZN09,08/19/2022 12:00:00 AM,AM,2022,8,Aug,34,Parks,Highbridge Park,6,,6,,,34,Manhattan,M-12A,ZONE,true,2022-08-20 12:06:29.0000000,M&O MS Forms
M-004087,M037,M037-ZN09,08/20/2022 12:00:00 AM,AM,2022,8,Aug,34,Parks,Highbridge Park,4,,4,,,34,Manhattan,M-12A,ZONE,true,2022-08-28 17:13:02.0000000,M&O MS Forms
M-004195,M037,M037-ZN09,08/31/2022 12:00:00 AM,AM,2022,8,Aug,36,Parks,Highbridge Park,6,,6,,,34,Manhattan,M-12A,ZONE,true,2022-09-06 14:29:05.0000000,M&O MS Forms
M-004148,M037,M037-ZN09,08/27/2022 12:00:00 AM,AM,2022,8,Aug,35,Parks,Highbridge Park,6,,6,,,34,Manhattan,M-12A,ZONE,true,2022-08-28 17:34:03.0000000,M&O MS Forms
M-004139,M037,M037-ZN09,08/26/2022 12:00:00 AM,AM,2022,8,Aug,35,Parks,Highbridge Park,1,,1,,,34,Manhattan,M-12A,ZONE,true,2022-08-28 17:31:32.0000000,M&O MS Forms
M-004122,M037,M037-ZN09,08/24/2022 12:00:00 AM,AM,2022,8,Aug,35,Parks,Highbridge Park,11,,11,,,34,Manhattan,M-12A,ZONE,true,2022-08-28 17:24:03.0000000,M&O MS Forms
M-004131,M037,M037-ZN09,08/25/2022 12:00:00 AM,AM,2022,8,Aug,35,Parks,Highbridge Park,1,,1,,,34,Manhattan,M-12A,ZONE,true,2022-08-28 17:29:29.0000000,M&O MS Forms
M-004105,M037,M037-ZN09,08/22/2022 12:00:00 AM,AM,2022,8,Aug,35,Parks,Highbridge Park,17,,17,,,34,Manhattan,M-12A,ZONE,true,2022-08-28 17:19:03.0000000,M&O MS Forms
M-004113,M037,M037-ZN09,08/23/2022 12:00:00 AM,AM,2022,8,Aug,35,Parks,Highbridge Park,8,,8,,,34,Manhattan,M-12A,ZONE,true,2022-08-28 17:21:22.0000000,M&O MS Forms
M-004317,M037,M037-ZN09,09/11/2022 12:00:00 AM,AM,2022,9,Sep,38,Parks,Highbridge Park,6,,6,,,34,Manhattan,M-12A,ZONE,true,2022-09-13 18:03:01.0000000,M&O MS Forms
M-004326,M037,M037-ZN09,09/12/2022 12:00:00 AM,AM,2022,9,Sep,38,Parks,Highbridge Park,18,,18,,,34,Manhattan,M-12A,ZONE,true,2022-09-13 18:06:36.0000000,M&O MS Forms
M-004305,M037,M037-ZN09,09/11/2022 12:00:00 AM,AM,2022,9,Sep,38,Parks,Highbridge Park,6,,6,,,34,Manhattan,M-12A,ZONE,true,2022-09-12 06:11:40.0000000,M&O MS Forms
M-004296,M037,M037-ZN09,09/10/2022 12:00:00 AM,AM,2022,9,Sep,37,Parks,Highbridge Park,10,,10,,,34,Manhattan,M-12A,ZONE,true,2022-09-12 06:08:40.0000000,M&O MS Forms
M-004285,M037,M037-ZN09,09/08/2022 12:00:00 AM,AM,2022,9,Sep,37,Parks,Highbridge Park,15,,15,,,34,Manhattan,M-12A,ZONE,true,2022-09-09 06:20:38.0000000,M&O MS Forms
M-004268,M037,M037-ZN09,09/06/2022 12:00:00 AM,AM,2022,9,Sep,37,Parks,Highbridge Park,28,,28,,,34,Manhattan,M-12A,ZONE,true,2022-09-09 05:39:10.0000000,M&O MS Forms
M-004277,M037,M037-ZN09,09/07/2022 12:00:00 AM,AM,2022,9,Sep,37,Parks,Highbridge Park,12,,12,,,34,Manhattan,M-12A,ZONE,true,2022-09-09 05:42:13.0000000,M&O MS Forms
M-004240,M037,M037-ZN09,09/05/2022 12:00:00 AM,AM,2022,9,Sep,37,Parks,Highbridge Park,10,,10,,,34,Manhattan,M-12A,ZONE,true,2022-09-06 14:45:59.0000000,M&O MS Forms
M-004259,M037,M037-ZN09,09/05/2022 12:00:00 AM,AM,2022,9,Sep,37,Parks,Highbridge Park,10,,10,,,34,Manhattan,M-12A,ZONE,true,2022-09-09 05:34:13.0000000,M&O MS Forms
M-004231,M037,M037-ZN09,09/04/2022 12:00:00 AM,AM,2022,9,Sep,37,Parks,Highbridge Park,5,,5,,,34,Manhattan,M-12A,ZONE,true,2022-09-06 14:40:43.0000000,M&O MS Forms
M-002380,M037,M037-ZN09,02/27/2022 12:00:00 AM,AM,2022,2,Feb,10,Parks,Highbridge Park,4,,4,,,34,Manhattan,M-12A,ZONE,true,2022-03-04 08:34:06.0000000,M&O MS Forms
M-002367,M037,M037-ZN09,02/26/2022 12:00:00 AM,AM,2022,2,Feb,9,Parks,Highbridge Park,4,,4,,,34,Manhattan,M-12A,ZONE,true,2022-02-28 12:14:36.0000000,M&O MS Forms
M-002424,M037,M037-ZN09,03/04/2022 12:00:00 AM,AM,2022,3,Mar,10,Parks,Highbridge Park,1,,1,,,34,Manhattan,M-12A,ZONE,true,2022-03-06 19:38:23.0000000,M&O MS Forms
M-002398,M037,M037-ZN09,03/01/2022 12:00:00 AM,AM,2022,3,Mar,10,Parks,Highbridge Park,7,,7,,,34,Manhattan,M-12A,ZONE,true,2022-03-04 08:39:46.0000000,M&O MS Forms
M-002407,M037,M037-ZN09,03/02/2022 12:00:00 AM,AM,2022,3,Mar,10,Parks,Highbridge Park,6,,6,,,34,Manhattan,M-12A,ZONE,true,2022-03-04 08:42:26.0000000,M&O MS Forms
M-002325,M037,M037-ZN09,02/21/2022 12:00:00 AM,AM,2022,2,Feb,9,Parks,Highbridge Park,5,,5,,,34,Manhattan,M-12A,ZONE,true,2022-02-28 12:02:06.0000000,M&O MS Forms
M-002297,M037,M037-ZN09,02/20/2022 12:00:00 AM,AM,2022,2,Feb,9,Parks,Highbridge Park,6,,6,,,34,Manhattan,M-12A,ZONE,true,2022-02-21 15:14:49.0000000,M&O MS Forms
M-002334,M037,M037-ZN09,02/22/2022 12:00:00 AM,AM,2022,2,Feb,9,Parks,Highbridge Park,18,,18,,,34,Manhattan,M-12A,ZONE,true,2022-02-28 12:04:50.0000000,M&O MS Forms
M-002343,M037,M037-ZN09,02/23/2022 12:00:00 AM,AM,2022,2,Feb,9,Parks,Highbridge Park,3,,3,,,34,Manhattan,M-12A,ZONE,true,2022-02-28 12:07:30.0000000,M&O MS Forms
M-002352,M037,M037-ZN09,02/24/2022 12:00:00 AM,AM,2022,2,Feb,9,Parks,Highbridge Park,2,,2,,,34,Manhattan,M-12A,ZONE,true,2022-02-28 12:10:31.0000000,M&O MS Forms
M-002360,M037,M037-ZN09,02/25/2022 12:00:00 AM,AM,2022,2,Feb,9,Parks,Highbridge Park,5,,5,,,34,Manhattan,M-12A,ZONE,true,2022-02-28 12:12:40.0000000,M&O MS Forms
M-002289,M037,M037-ZN09,02/19/2022 12:00:00 AM,AM,2022,2,Feb,8,Parks,Highbridge Park,5,,5,,,34,Manhattan,M-12A,ZONE,true,2022-02-21 15:12:24.0000000,M&O MS Forms
M-002283,M037,M037-ZN09,02/18/2022 12:00:00 AM,AM,2022,2,Feb,8,Parks,Highbridge Park,8,,8,,,34,Manhattan,M-12A,ZONE,true,2022-02-21 15:10:35.0000000,M&O MS Forms
M-002274,M037,M037-ZN09,02/17/2022 12:00:00 AM,AM,2022,2,Feb,8,Parks,Highbridge Park,15,,15,,,34,Manhattan,M-12A,ZONE,true,2022-02-21 15:07:11.0000000,M&O MS Forms
M-002265,M037,M037-ZN09,02/16/2022 12:00:00 AM,AM,2022,2,Feb,8,Parks,Highbridge Park,125,,125,,,34,Manhattan,M-12A,ZONE,true,2022-02-21 15:04:40.0000000,M&O MS Forms
M-002256,M037,M037-ZN09,02/15/2022 12:00:00 AM,AM,2022,2,Feb,8,Parks,Highbridge Park,11,,11,,,34,Manhattan,M-12A,ZONE,true,2022-02-21 15:01:38.0000000,M&O MS Forms
M-002247,M037,M037-ZN09,02/14/2022 12:00:00 AM,AM,2022,2,Feb,8,Parks,Highbridge Park,7,,7,,,34,Manhattan,M-12A,ZONE,true,2022-02-21 14:57:58.0000000,M&O MS Forms
M-002237,M037,M037-ZN09,02/13/2022 12:00:00 AM,AM,2022,2,Feb,8,Parks,Highbridge Park,6,,6,,,34,Manhattan,M-12A,ZONE,true,2022-02-21 14:54:45.0000000,M&O MS Forms
M-002206,M037,M037-ZN09,02/10/2022 12:00:00 AM,AM,2022,2,Feb,7,Parks,Highbridge Park,2,,2,,,34,Manhattan,M-12A,ZONE,true,2022-02-14 14:03:43.0000000,M&O MS Forms
M-002214,M037,M037-ZN09,02/11/2022 12:00:00 AM,AM,2022,2,Feb,7,Parks,Highbridge Park,3,,3,,,34,Manhattan,M-12A,ZONE,true,2022-02-14 14:06:17.0000000,M&O MS Forms
M-002194,M037,M037-ZN09,02/09/2022 12:00:00 AM,AM,2022,2,Feb,7,Parks,Highbridge Park,3,,3,,,34,Manhattan,M-12A,ZONE,true,2022-02-11 09:22:47.0000000,M&O MS Forms
M-002744,M037,M037-ZN09,04/05/2022 12:00:00 AM,AM,2022,4,Apr,15,Parks,Highbridge Park,4,,4,,,34,Manhattan,M-12A,ZONE,true,2022-04-07 14:06:37.0000000,M&O MS Forms
M-002701,M037,M037-ZN09,04/01/2022 12:00:00 AM,AM,2022,4,Apr,14,Parks,Highbridge Park,5,,5,,,34,Manhattan,M-12A,ZONE,true,2022-04-01 15:59:39.0000000,M&O MS Forms
M-002726,M037,M037-ZN09,04/03/2022 12:00:00 AM,AM,2022,4,Apr,15,Parks,Highbridge Park,9,,9,,,34,Manhattan,M-12A,ZONE,true,2022-04-07 13:59:31.0000000,M&O MS Forms
M-002735,M037,M037-ZN09,04/04/2022 12:00:00 AM,AM,2022,4,Apr,15,Parks,Highbridge Park,1,,1,,,34,Manhattan,M-12A,ZONE,true,2022-04-07 14:03:17.0000000,M&O MS Forms
M-002809,M037,M037-ZN09,04/12/2022 12:00:00 AM,AM,2022,4,Apr,16,Parks,Highbridge Park,6,,6,,,34,Manhattan,M-12A,ZONE,true,2022-04-17 16:39:41.0000000,M&O MS Forms
M-002818,M037,M037-ZN09,04/13/2022 12:00:00 AM,AM,2022,4,Apr,16,Parks,Highbridge Park,1,,1,,,34,Manhattan,M-12A,ZONE,true,2022-04-17 16:42:15.0000000,M&O MS Forms
M-002791,M037,M037-ZN09,04/10/2022 12:00:00 AM,AM,2022,4,Apr,16,Parks,Highbridge Park,1,,1,,,34,Manhattan,M-12A,ZONE,true,2022-04-17 16:32:18.0000000,M&O MS Forms
M-002800,M037,M037-ZN09,04/11/2022 12:00:00 AM,AM,2022,4,Apr,16,Parks,Highbridge Park,1,,1,,,34,Manhattan,M-12A,ZONE,true,2022-04-17 16:35:33.0000000,M&O MS Forms
M-002879,M037,M037-ZN09,04/21/2022 12:00:00 AM,AM,2022,4,Apr,17,Parks,Highbridge Park,2,,2,,,34,Manhattan,M-12A,ZONE,true,2022-04-23 12:28:31.0000000,M&O MS Forms
M-002888,M037,M037-ZN09,04/22/2022 12:00:00 AM,AM,2022,4,Apr,17,Parks,Highbridge Park,3,,3,,,34,Manhattan,M-12A,ZONE,true,2022-04-23 12:31:21.0000000,M&O MS Forms
M-002853,M037,M037-ZN09,04/18/2022 12:00:00 AM,AM,2022,4,Apr,17,Parks,Highbridge Park,1,,1,,,34,Manhattan,M-12A,ZONE,true,2022-04-23 12:19:23.0000000,M&O MS Forms
M-000280,M058,M058-01,05/24/2021 12:00:00 AM,PM,2021,5,May,22,BBP,Marcus Garvey Park,10,,10,,,25,Manhattan,M-11,PLGD,false,2021-05-24 15:01:20.0000000,M&O MS Forms
M-000284,M058,M058-01,05/25/2021 12:00:00 AM,PM,2021,5,May,22,BBP,Marcus Garvey Park,50,,50,,,25,Manhattan,M-11,PLGD,false,2021-05-26 13:30:15.0000000,M&O MS Forms
M-003099,M058,M058-01,05/14/2022 12:00:00 AM,AM,2022,5,May,20,BBP,Marcus Garvey Park,15,,15,,,25,Manhattan,M-11,PLGD,false,2022-05-14 07:48:39.0000000,M&O MS Forms
M-000160,M058,M058-06,05/02/2021 12:00:00 AM,AM,2021,5,May,19,BBP,Marcus Garvey Park,37,,37,,,25,Manhattan,M-11,PLGD,false,2021-05-02 13:00:53.0000000,M&O MS Forms
M-000159,M058,M058-06,05/01/2021 12:00:00 AM,PM,2021,5,May,18,BBP,Marcus Garvey Park,5,,5,,,25,Manhattan,M-11,PLGD,false,2021-05-01 18:39:22.0000000,M&O MS Forms
M-000201,M058,M058-06,05/09/2021 12:00:00 AM,PM,2021,5,May,20,BBP,Marcus Garvey Park,14,,14,,,25,Manhattan,M-11,PLGD,false,2021-05-09 16:06:44.0000000,M&O MS Forms
M-000170,M058,M058-06,05/04/2021 12:00:00 AM,AM,2021,5,May,19,BBP,Marcus Garvey Park,14,,14,,,25,Manhattan,M-11,PLGD,false,2021-05-04 12:43:29.0000000,M&O MS Forms
M-004309,M058,M058-06,09/11/2022 12:00:00 AM,AM,2022,9,Sep,38,BBP,Marcus Garvey Park,40,,40,,,25,Manhattan,M-11,PLGD,false,2022-09-13 15:29:33.0000000,M&O MS Forms
M-000082,M058,M058-07,04/21/2021 12:00:00 AM,AM,2021,4,Apr,17,BBP,Marcus Garvey Park,15,,15,,,25,Manhattan,M-11,PLGD,false,2021-04-21 15:41:21.0000000,M&O MS Forms
M-000029,M058,M058-07,04/08/2021 12:00:00 AM,AM,2021,4,Apr,15,BBP,Marcus Garvey Park,41,,41,,,25,Manhattan,M-11,PLGD,false,2021-04-08 15:45:50.0000000,M&O MS Forms
M-000169,M058,M058-07,05/03/2021 12:00:00 AM,AM,2021,5,May,19,BBP,Marcus Garvey Park,14,,14,,,25,Manhattan,M-11,PLGD,false,2021-05-03 13:01:07.0000000,M&O MS Forms
M-000234,M058,M058-ZN01,05/16/2021 12:00:00 AM,PM,2021,5,May,21,BBP,Marcus Garvey Park,15,,15,,,25,Manhattan,M-11,ZONE,false,2021-05-16 13:01:16.0000000,M&O MS Forms
M-000095,M058,M058-ZN01,04/23/2021 12:00:00 AM,AM,2021,4,Apr,17,BBP,Marcus Garvey Park,15,,15,,,25,Manhattan,M-11,ZONE,false,2021-04-23 18:56:10.0000000,M&O MS Forms
M-003250,M058,M058-ZN01,05/29/2022 12:00:00 AM,AM,2022,5,May,23,BBP,Marcus Garvey Park,16,,16,,,25,Manhattan,M-11,ZONE,false,2022-05-29 21:01:14.0000000,M&O MS Forms
M-003109,M058,M058-ZN01,05/14/2022 12:00:00 AM,PM,2022,5,May,20,BBP,Marcus Garvey Park,28,,28,,,25,Manhattan,M-11,ZONE,false,2022-05-14 15:40:48.0000000,M&O MS Forms
M-003129,M058,M058-ZN01,05/16/2022 12:00:00 AM,AM,2022,5,May,21,BBP,Marcus Garvey Park,12,,12,,,25,Manhattan,M-11,ZONE,false,2022-05-16 13:02:40.0000000,M&O MS Forms
M-004154,M058,M058-ZN01,09/01/2022 12:00:00 AM,AM,2022,9,Sep,36,Parks,Marcus Garvey Park,23,,23,,,25,Manhattan,M-11,ZONE,false,2022-09-01 08:20:25.0000000,M&O MS Forms
M-004826,M058,M058-ZN01,11/09/2022 12:00:00 AM,PM,2022,11,Nov,46,Parks,Marcus Garvey Park,8,,8,,,25,Manhattan,M-11,ZONE,false,2022-11-09 19:39:18.0000000,M&O MS Forms
M-004839,M058,M058-ZN02,11/09/2022 12:00:00 AM,AM,2022,11,Nov,46,BBP,Marcus Garvey Park,65,,65,,,25,Manhattan,M-11,ZONE,false,2022-11-13 02:12:44.0000000,M&O MS Forms
M-004843,M058,M058-ZN02,11/10/2022 12:00:00 AM,AM,2022,11,Nov,46,BBP,Marcus Garvey Park,42,,42,,,25,Manhattan,M-11,ZONE,false,2022-11-13 02:17:40.0000000,M&O MS Forms
M-004847,M058,M058-ZN02,11/11/2022 12:00:00 AM,AM,2022,11,Nov,46,BBP,Marcus Garvey Park,25,,25,,,25,Manhattan,M-11,ZONE,false,2022-11-13 02:22:22.0000000,M&O MS Forms
M-004832,M058,M058-ZN02,11/06/2022 12:00:00 AM,AM,2022,11,Nov,46,BBP,Marcus Garvey Park,60,,60,,,25,Manhattan,M-11,ZONE,false,2022-11-12 21:16:48.0000000,M&O MS Forms
M-004750,M058,M058-ZN02,11/03/2022 12:00:00 AM,AM,2022,11,Nov,45,BBP,Marcus Garvey Park,30,,30,,,25,Manhattan,M-11,ZONE,false,2022-11-03 15:14:07.0000000,M&O MS Forms
M-004851,M058,M058-ZN02,11/12/2022 12:00:00 AM,AM,2022,11,Nov,46,BBP,Marcus Garvey Park,4,,4,,,25,Manhattan,M-11,ZONE,false,2022-11-13 02:26:22.0000000,M&O MS Forms
M-004915,M058,M058-ZN02,11/13/2022 12:00:00 AM,AM,2022,11,Nov,47,BBP,Marcus Garvey Park,50,,50,,,25,Manhattan,M-11,ZONE,false,2022-11-14 02:16:03.0000000,M&O MS Forms
M-001922,M058,M058-ZN02,01/06/2022 12:00:00 AM,AM,2022,1,Jan,2,BBP,Marcus Garvey Park,63,,63,,,25,Manhattan,M-11,ZONE,false,2022-01-06 13:06:26.0000000,M&O MS Forms
M-002061,M058,M058-ZN02,01/23/2022 12:00:00 AM,AM,2022,1,Jan,5,BBP,Marcus Garvey Park,13,,13,,,25,Manhattan,M-11,ZONE,false,2022-01-23 11:44:13.0000000,M&O MS Forms
M-004078,M058,M058-ZN02,08/26/2022 12:00:00 AM,PM,2022,8,Aug,35,BBP,Marcus Garvey Park,60,,60,,,25,Manhattan,M-11,ZONE,false,2022-08-26 14:06:40.0000000,M&O MS Forms
M-002348,M037,M037-ZN05,02/24/2022 12:00:00 AM,AM,2022,2,Feb,9,Parks,Highbridge Park,2,,2,,,34,Manhattan,M-12A,ZONE,true,2022-02-28 12:09:11.0000000,M&O MS Forms
M-002339,M037,M037-ZN05,02/23/2022 12:00:00 AM,AM,2022,2,Feb,9,Parks,Highbridge Park,5,,5,,,34,Manhattan,M-12A,ZONE,true,2022-02-28 12:06:26.0000000,M&O MS Forms
M-002357,M037,M037-ZN05,02/25/2022 12:00:00 AM,AM,2022,2,Feb,9,Parks,Highbridge Park,3,,3,,,34,Manhattan,M-12A,ZONE,true,2022-02-28 12:11:58.0000000,M&O MS Forms
M-002293,M037,M037-ZN05,02/20/2022 12:00:00 AM,AM,2022,2,Feb,9,Parks,Highbridge Park,5,,5,,,34,Manhattan,M-12A,ZONE,true,2022-02-21 15:13:48.0000000,M&O MS Forms
M-002286,M037,M037-ZN05,02/19/2022 12:00:00 AM,AM,2022,2,Feb,8,Parks,Highbridge Park,9,,9,,,34,Manhattan,M-12A,ZONE,true,2022-02-21 15:11:32.0000000,M&O MS Forms
M-002279,M037,M037-ZN05,02/18/2022 12:00:00 AM,AM,2022,2,Feb,8,Parks,Highbridge Park,15,,15,,,34,Manhattan,M-12A,ZONE,true,2022-02-21 15:09:25.0000000,M&O MS Forms
M-002270,M037,M037-ZN05,02/17/2022 12:00:00 AM,AM,2022,2,Feb,8,Parks,Highbridge Park,1,,1,,,34,Manhattan,M-12A,ZONE,true,2022-02-21 15:06:04.0000000,M&O MS Forms
M-002252,M037,M037-ZN05,02/15/2022 12:00:00 AM,AM,2022,2,Feb,8,Parks,Highbridge Park,1,,1,,,34,Manhattan,M-12A,ZONE,true,2022-02-21 15:00:30.0000000,M&O MS Forms
M-002261,M037,M037-ZN05,02/16/2022 12:00:00 AM,AM,2022,2,Feb,8,Parks,Highbridge Park,2,,2,,,34,Manhattan,M-12A,ZONE,true,2022-02-21 15:03:31.0000000,M&O MS Forms
M-002242,M037,M037-ZN05,02/14/2022 12:00:00 AM,AM,2022,2,Feb,8,Parks,Highbridge Park,2,,2,,,34,Manhattan,M-12A,ZONE,true,2022-02-21 14:56:19.0000000,M&O MS Forms
M-002233,M037,M037-ZN05,02/13/2022 12:00:00 AM,AM,2022,2,Feb,8,Parks,Highbridge Park,3,,3,,,34,Manhattan,M-12A,ZONE,true,2022-02-21 14:53:41.0000000,M&O MS Forms
M-002202,M037,M037-ZN05,02/10/2022 12:00:00 AM,AM,2022,2,Feb,7,Parks,Highbridge Park,4,,4,,,34,Manhattan,M-12A,ZONE,true,2022-02-14 14:02:30.0000000,M&O MS Forms
M-002210,M037,M037-ZN05,02/11/2022 12:00:00 AM,AM,2022,2,Feb,7,Parks,Highbridge Park,4,,4,,,34,Manhattan,M-12A,ZONE,true,2022-02-14 14:05:08.0000000,M&O MS Forms
M-002219,M037,M037-ZN05,02/12/2022 12:00:00 AM,AM,2022,2,Feb,7,Parks,Highbridge Park,12,,12,,,34,Manhattan,M-12A,ZONE,true,2022-02-14 14:07:50.0000000,M&O MS Forms
M-002181,M037,M037-ZN05,02/08/2022 12:00:00 AM,AM,2022,2,Feb,7,Parks,Highbridge Park,5,,5,,,34,Manhattan,M-12A,ZONE,true,2022-02-11 09:19:11.0000000,M&O MS Forms
M-002183,M037,M037-ZN05,02/08/2022 12:00:00 AM,AM,2022,2,Feb,7,Parks,Highbridge Park,2,,2,,,34,Manhattan,M-12A,ZONE,true,2022-02-11 09:19:42.0000000,M&O MS Forms
M-002176,M037,M037-ZN05,02/06/2022 12:00:00 AM,AM,2022,2,Feb,7,Parks,Highbridge Park,3,,3,,,34,Manhattan,M-12A,ZONE,true,2022-02-10 08:46:56.0000000,M&O MS Forms
M-002169,M037,M037-ZN05,02/06/2022 12:00:00 AM,AM,2022,2,Feb,7,Parks,Highbridge Park,7,,7,,,34,Manhattan,M-12A,ZONE,true,2022-02-10 08:37:19.0000000,M&O MS Forms
M-002190,M037,M037-ZN05,02/09/2022 12:00:00 AM,AM,2022,2,Feb,7,Parks,Highbridge Park,6,,6,,,34,Manhattan,M-12A,ZONE,true,2022-02-11 09:21:40.0000000,M&O MS Forms
M-002764,M037,M037-ZN05,04/07/2022 12:00:00 AM,AM,2022,4,Apr,15,Parks,Highbridge Park,6,,6,,,34,Manhattan,M-12A,ZONE,true,2022-04-17 16:20:03.0000000,M&O MS Forms
M-002748,M037,M037-ZN05,04/06/2022 12:00:00 AM,AM,2022,4,Apr,15,Parks,Highbridge Park,1,,1,,,34,Manhattan,M-12A,ZONE,true,2022-04-07 14:09:14.0000000,M&O MS Forms
M-002740,M037,M037-ZN05,04/05/2022 12:00:00 AM,AM,2022,4,Apr,15,Parks,Highbridge Park,5,,5,,,34,Manhattan,M-12A,ZONE,true,2022-04-07 14:05:12.0000000,M&O MS Forms
M-002722,M037,M037-ZN05,04/03/2022 12:00:00 AM,AM,2022,4,Apr,15,Parks,Highbridge Park,5,,5,,,34,Manhattan,M-12A,ZONE,true,2022-04-07 13:58:07.0000000,M&O MS Forms
M-002731,M037,M037-ZN05,04/04/2022 12:00:00 AM,AM,2022,4,Apr,15,Parks,Highbridge Park,6,,6,,,34,Manhattan,M-12A,ZONE,true,2022-04-07 14:01:36.0000000,M&O MS Forms
M-002831,M037,M037-ZN05,04/15/2022 12:00:00 AM,AM,2022,4,Apr,16,Parks,Highbridge Park,19,,19,,,34,Manhattan,M-12A,ZONE,true,2022-04-17 16:46:45.0000000,M&O MS Forms
M-002823,M037,M037-ZN05,04/14/2022 12:00:00 AM,AM,2022,4,Apr,16,Parks,Highbridge Park,10,,10,,,34,Manhattan,M-12A,ZONE,true,2022-04-17 16:43:43.0000000,M&O MS Forms
M-002805,M037,M037-ZN05,04/12/2022 12:00:00 AM,AM,2022,4,Apr,16,Parks,Highbridge Park,6,,6,,,34,Manhattan,M-12A,ZONE,true,2022-04-17 16:37:13.0000000,M&O MS Forms
M-002814,M037,M037-ZN05,04/13/2022 12:00:00 AM,AM,2022,4,Apr,16,Parks,Highbridge Park,8,,8,,,34,Manhattan,M-12A,ZONE,true,2022-04-17 16:41:08.0000000,M&O MS Forms
M-002796,M037,M037-ZN05,04/11/2022 12:00:00 AM,AM,2022,4,Apr,16,Parks,Highbridge Park,20,,20,,,34,Manhattan,M-12A,ZONE,true,2022-04-17 16:34:13.0000000,M&O MS Forms
M-002787,M037,M037-ZN05,04/10/2022 12:00:00 AM,AM,2022,4,Apr,16,Parks,Highbridge Park,10,,10,,,34,Manhattan,M-12A,ZONE,true,2022-04-17 16:31:07.0000000,M&O MS Forms
M-002779,M037,M037-ZN05,04/09/2022 12:00:00 AM,AM,2022,4,Apr,15,Parks,Highbridge Park,13,,13,,,34,Manhattan,M-12A,ZONE,true,2022-04-17 16:25:09.0000000,M&O MS Forms
M-002772,M037,M037-ZN05,04/08/2022 12:00:00 AM,AM,2022,4,Apr,15,Parks,Highbridge Park,9,,9,,,34,Manhattan,M-12A,ZONE,true,2022-04-17 16:22:36.0000000,M&O MS Forms
M-002525,M037,M037-ZN06,03/16/2022 12:00:00 AM,AM,2022,3,Mar,12,Parks,Highbridge Park,15,,15,,,34,Manhattan,M-12A,ZONE,true,2022-03-17 11:42:25.0000000,M&O MS Forms
M-002516,M037,M037-ZN06,03/15/2022 12:00:00 AM,AM,2022,3,Mar,12,Parks,Highbridge Park,20,,20,,,34,Manhattan,M-12A,ZONE,true,2022-03-17 11:38:28.0000000,M&O MS Forms
M-002481,M037,M037-ZN06,03/11/2022 12:00:00 AM,AM,2022,3,Mar,11,Parks,Highbridge Park,18,,18,,,34,Manhattan,M-12A,ZONE,true,2022-03-17 10:37:55.0000000,M&O MS Forms
M-002473,M037,M037-ZN06,03/10/2022 12:00:00 AM,AM,2022,3,Mar,11,Parks,Highbridge Park,11,,11,,,34,Manhattan,M-12A,ZONE,true,2022-03-17 10:34:55.0000000,M&O MS Forms
M-002490,M037,M037-ZN06,03/12/2022 12:00:00 AM,AM,2022,3,Mar,11,Parks,Highbridge Park,21,,21,,,34,Manhattan,M-12A,ZONE,true,2022-03-17 10:41:11.0000000,M&O MS Forms
M-002457,M037,M037-ZN06,03/08/2022 12:00:00 AM,AM,2022,3,Mar,11,Parks,Highbridge Park,6,,6,,,34,Manhattan,M-12A,ZONE,true,2022-03-09 14:06:35.0000000,M&O MS Forms
M-002448,M037,M037-ZN06,03/07/2022 12:00:00 AM,AM,2022,3,Mar,11,Parks,Highbridge Park,5,,5,,,34,Manhattan,M-12A,ZONE,true,2022-03-09 14:04:17.0000000,M&O MS Forms
M-002441,M037,M037-ZN06,03/06/2022 12:00:00 AM,AM,2022,3,Mar,11,Parks,Highbridge Park,276,,276,,,34,Manhattan,M-12A,ZONE,true,2022-03-09 14:02:19.0000000,M&O MS Forms
M-000871,M037,M037-ZN06,09/14/2021 12:00:00 AM,PM,2021,9,Sep,38,Parks,Highbridge Park,445,,445,,,34,Manhattan,M-12A,ZONE,true,2021-09-18 05:51:36.0000000,M&O MS Forms
M-000862,M037,M037-ZN06,09/12/2021 12:00:00 AM,PM,2021,9,Sep,38,Parks,Highbridge Park,300,,300,,,34,Manhattan,M-12A,ZONE,true,2021-09-18 05:47:54.0000000,M&O MS Forms
M-000865,M037,M037-ZN06,09/13/2021 12:00:00 AM,PM,2021,9,Sep,38,Parks,Highbridge Park,375,,375,,,34,Manhattan,M-12A,ZONE,true,2021-09-18 05:49:20.0000000,M&O MS Forms
M-000827,M037,M037-ZN06,09/05/2021 12:00:00 AM,PM,2021,9,Sep,37,Parks,Highbridge Park,225,,225,,,34,Manhattan,M-12A,ZONE,true,2021-09-13 17:02:38.0000000,M&O MS Forms
M-000834,M037,M037-ZN06,09/07/2021 12:00:00 AM,PM,2021,9,Sep,37,Parks,Highbridge Park,120,,120,,,34,Manhattan,M-12A,ZONE,true,2021-09-13 17:06:02.0000000,M&O MS Forms
M-000838,M037,M037-ZN06,09/08/2021 12:00:00 AM,PM,2021,9,Sep,37,Parks,Highbridge Park,309,,309,,,34,Manhattan,M-12A,ZONE,true,2021-09-13 17:07:42.0000000,M&O MS Forms
M-000830,M037,M037-ZN06,09/06/2021 12:00:00 AM,PM,2021,9,Sep,37,Parks,Highbridge Park,120,,120,,,34,Manhattan,M-12A,ZONE,true,2021-09-13 17:04:35.0000000,M&O MS Forms
M-001016,M037,M037-ZN06,10/08/2021 12:00:00 AM,AM,2021,10,Oct,41,Parks,Highbridge Park,4,,4,,,34,Manhattan,M-12A,ZONE,true,2021-10-08 17:12:17.0000000,M&O MS Forms
M-001018,M037,M037-ZN06,10/06/2021 12:00:00 AM,AM,2021,10,Oct,41,Parks,Highbridge Park,19,,19,,,34,Manhattan,M-12A,ZONE,true,2021-10-08 17:14:06.0000000,M&O MS Forms
M-000877,M037,M037-ZN06,09/15/2021 12:00:00 AM,PM,2021,9,Sep,38,Parks,Highbridge Park,205,,205,,,34,Manhattan,M-12A,ZONE,true,2021-09-18 05:53:51.0000000,M&O MS Forms
M-000879,M037,M037-ZN06,09/16/2021 12:00:00 AM,PM,2021,9,Sep,38,Parks,Highbridge Park,9,,9,,,34,Manhattan,M-12A,ZONE,true,2021-09-18 05:54:39.0000000,M&O MS Forms
M-001061,M037,M037-ZN06,10/15/2021 12:00:00 AM,AM,2021,10,Oct,42,Parks,Highbridge Park,50,,50,,,34,Manhattan,M-12A,ZONE,true,2021-10-15 16:53:33.0000000,M&O MS Forms
M-001060,M037,M037-ZN06,10/14/2021 12:00:00 AM,AM,2021,10,Oct,42,Parks,Highbridge Park,45,,45,,,34,Manhattan,M-12A,ZONE,true,2021-10-15 16:53:15.0000000,M&O MS Forms
M-001059,M037,M037-ZN06,10/13/2021 12:00:00 AM,AM,2021,10,Oct,42,Parks,Highbridge Park,40,,40,,,34,Manhattan,M-12A,ZONE,true,2021-10-15 16:52:56.0000000,M&O MS Forms
M-001058,M037,M037-ZN06,10/12/2021 12:00:00 AM,AM,2021,10,Oct,42,Parks,Highbridge Park,38,,38,,,34,Manhattan,M-12A,ZONE,true,2021-10-15 16:52:31.0000000,M&O MS Forms
M-001057,M037,M037-ZN06,10/11/2021 12:00:00 AM,AM,2021,10,Oct,42,Parks,Highbridge Park,35,,35,,,34,Manhattan,M-12A,ZONE,true,2021-10-15 16:52:09.0000000,M&O MS Forms
M-001056,M037,M037-ZN06,10/10/2021 12:00:00 AM,AM,2021,10,Oct,42,Parks,Highbridge Park,30,,30,,,34,Manhattan,M-12A,ZONE,true,2021-10-15 16:51:44.0000000,M&O MS Forms
M-001091,M037,M037-ZN06,10/17/2021 12:00:00 AM,AM,2021,10,Oct,43,Parks,Highbridge Park,5,,5,,,34,Manhattan,M-12A,ZONE,true,2021-10-18 09:48:54.0000000,M&O MS Forms
M-001099,M037,M037-ZN06,10/16/2021 12:00:00 AM,AM,2021,10,Oct,42,Parks,Highbridge Park,42,,42,,,34,Manhattan,M-12A,ZONE,true,2021-10-18 10:03:13.0000000,M&O MS Forms
M-001120,M037,M037-ZN06,10/19/2021 12:00:00 AM,AM,2021,10,Oct,43,Parks,Highbridge Park,3,,3,,,34,Manhattan,M-12A,ZONE,true,2021-10-21 16:46:03.0000000,M&O MS Forms
M-001139,M037,M037-ZN06,10/22/2021 12:00:00 AM,AM,2021,10,Oct,43,Parks,Highbridge Park,33,,33,,,34,Manhattan,M-12A,ZONE,true,2021-10-22 16:07:41.0000000,M&O MS Forms
M-001132,M037,M037-ZN06,10/21/2021 12:00:00 AM,AM,2021,10,Oct,43,Parks,Highbridge Park,6,,6,,,34,Manhattan,M-12A,ZONE,true,2021-10-21 16:50:43.0000000,M&O MS Forms
M-001149,M037,M037-ZN06,10/23/2021 12:00:00 AM,AM,2021,10,Oct,43,Parks,Highbridge Park,34,,34,,,34,Manhattan,M-12A,ZONE,true,2021-10-24 20:21:26.0000000,M&O MS Forms
M-001156,M037,M037-ZN06,10/24/2021 12:00:00 AM,AM,2021,10,Oct,44,Parks,Highbridge Park,3,,3,,,34,Manhattan,M-12A,ZONE,true,2021-10-26 12:19:18.0000000,M&O MS Forms
M-003920,M037,M037-ZN07,08/05/2022 12:00:00 AM,AM,2022,8,Aug,32,Parks,Highbridge Park,175,,175,,,34,Manhattan,M-12A,ZONE,true,2022-08-09 08:51:17.0000000,M&O MS Forms
M-003946,M037,M037-ZN07,08/08/2022 12:00:00 AM,AM,2022,8,Aug,33,Parks,Highbridge Park,145,,145,,,34,Manhattan,M-12A,ZONE,true,2022-08-09 08:59:21.0000000,M&O MS Forms
M-003955,M037,M037-ZN07,08/09/2022 12:00:00 AM,AM,2022,8,Aug,33,Parks,Highbridge Park,145,,145,,,34,Manhattan,M-12A,ZONE,true,2022-08-09 18:27:07.0000000,M&O MS Forms
M-003938,M037,M037-ZN07,08/07/2022 12:00:00 AM,AM,2022,8,Aug,33,Parks,Highbridge Park,186,,186,,,34,Manhattan,M-12A,ZONE,true,2022-08-09 08:57:11.0000000,M&O MS Forms
M-004034,M037,M037-ZN07,08/16/2022 12:00:00 AM,AM,2022,8,Aug,34,Parks,Highbridge Park,80,,80,,,34,Manhattan,M-12A,ZONE,true,2022-08-18 14:28:07.0000000,M&O MS Forms
M-004025,M037,M037-ZN07,08/15/2022 12:00:00 AM,AM,2022,8,Aug,34,Parks,Highbridge Park,110,,110,,,34,Manhattan,M-12A,ZONE,true,2022-08-18 14:23:32.0000000,M&O MS Forms
M-004016,M037,M037-ZN07,08/14/2022 12:00:00 AM,AM,2022,8,Aug,34,Parks,Highbridge Park,125,,125,,,34,Manhattan,M-12A,ZONE,true,2022-08-18 14:04:04.0000000,M&O MS Forms
M-004001,M037,M037-ZN07,08/13/2022 12:00:00 AM,AM,2022,8,Aug,33,Parks,Highbridge Park,215,,215,,,34,Manhattan,M-12A,ZONE,true,2022-08-15 10:09:51.0000000,M&O MS Forms
M-003993,M037,M037-ZN07,08/12/2022 12:00:00 AM,AM,2022,8,Aug,33,Parks,Highbridge Park,190,,190,,,34,Manhattan,M-12A,ZONE,true,2022-08-15 10:07:22.0000000,M&O MS Forms
M-003965,M037,M037-ZN07,08/10/2022 12:00:00 AM,AM,2022,8,Aug,33,Parks,Highbridge Park,168,,168,,,34,Manhattan,M-12A,ZONE,true,2022-08-11 08:49:42.0000000,M&O MS Forms
M-003964,M037,M037-ZN07,08/10/2022 12:00:00 AM,AM,2022,8,Aug,33,Parks,Highbridge Park,6,,6,,,34,Manhattan,M-12A,ZONE,true,2022-08-11 08:49:11.0000000,M&O MS Forms
M-003973,M037,M037-ZN07,08/11/2022 12:00:00 AM,AM,2022,8,Aug,33,Parks,Highbridge Park,185,,185,,,34,Manhattan,M-12A,ZONE,true,2022-08-11 16:13:42.0000000,M&O MS Forms
M-004038,M037,M037-ZN07,08/16/2022 12:00:00 AM,AM,2022,8,Aug,34,Parks,Highbridge Park,80,,80,,,34,Manhattan,M-12A,ZONE,true,2022-08-18 14:43:26.0000000,M&O MS Forms
M-004047,M037,M037-ZN07,08/17/2022 12:00:00 AM,AM,2022,8,Aug,34,Parks,Highbridge Park,90,,90,,,34,Manhattan,M-12A,ZONE,true,2022-08-18 14:45:56.0000000,M&O MS Forms
M-004056,M037,M037-ZN07,08/18/2022 12:00:00 AM,AM,2022,8,Aug,34,Parks,Highbridge Park,10,,10,,,34,Manhattan,M-12A,ZONE,true,2022-08-18 14:48:39.0000000,M&O MS Forms
M-004103,M037,M037-ZN07,08/22/2022 12:00:00 AM,AM,2022,8,Aug,35,Parks,Highbridge Park,102,,102,,,34,Manhattan,M-12A,ZONE,true,2022-08-28 17:18:29.0000000,M&O MS Forms
M-004094,M037,M037-ZN07,08/21/2022 12:00:00 AM,AM,2022,8,Aug,35,Parks,Highbridge Park,96,,96,,,34,Manhattan,M-12A,ZONE,true,2022-08-28 17:15:55.0000000,M&O MS Forms
M-004068,M037,M037-ZN07,08/19/2022 12:00:00 AM,AM,2022,8,Aug,34,Parks,Highbridge Park,137,,137,,,34,Manhattan,M-12A,ZONE,true,2022-08-20 12:05:38.0000000,M&O MS Forms
M-004085,M037,M037-ZN07,08/20/2022 12:00:00 AM,AM,2022,8,Aug,34,Parks,Highbridge Park,156,,156,,,34,Manhattan,M-12A,ZONE,true,2022-08-28 17:12:28.0000000,M&O MS Forms
M-004193,M037,M037-ZN07,08/31/2022 12:00:00 AM,AM,2022,8,Aug,36,Parks,Highbridge Park,59,,59,,,34,Manhattan,M-12A,ZONE,true,2022-09-06 14:28:29.0000000,M&O MS Forms
M-004137,M037,M037-ZN07,08/26/2022 12:00:00 AM,AM,2022,8,Aug,35,Parks,Highbridge Park,96,,96,,,34,Manhattan,M-12A,ZONE,true,2022-08-28 17:31:03.0000000,M&O MS Forms
M-004146,M037,M037-ZN07,08/27/2022 12:00:00 AM,AM,2022,8,Aug,35,Parks,Highbridge Park,123,,123,,,34,Manhattan,M-12A,ZONE,true,2022-08-28 17:33:34.0000000,M&O MS Forms
M-004129,M037,M037-ZN07,08/25/2022 12:00:00 AM,AM,2022,8,Aug,35,Parks,Highbridge Park,86,,86,,,34,Manhattan,M-12A,ZONE,true,2022-08-28 17:28:54.0000000,M&O MS Forms
M-004120,M037,M037-ZN07,08/24/2022 12:00:00 AM,AM,2022,8,Aug,35,Parks,Highbridge Park,70,,70,,,34,Manhattan,M-12A,ZONE,true,2022-08-28 17:23:30.0000000,M&O MS Forms
M-004112,M037,M037-ZN07,08/23/2022 12:00:00 AM,AM,2022,8,Aug,35,Parks,Highbridge Park,56,,56,,,34,Manhattan,M-12A,ZONE,true,2022-08-28 17:21:03.0000000,M&O MS Forms
M-004315,M037,M037-ZN07,09/11/2022 12:00:00 AM,AM,2022,9,Sep,38,Parks,Highbridge Park,85,,85,,,34,Manhattan,M-12A,ZONE,true,2022-09-13 18:02:17.0000000,M&O MS Forms
M-004324,M037,M037-ZN07,09/12/2022 12:00:00 AM,AM,2022,9,Sep,38,Parks,Highbridge Park,75,,75,,,34,Manhattan,M-12A,ZONE,true,2022-09-13 18:05:45.0000000,M&O MS Forms
M-004303,M037,M037-ZN07,09/11/2022 12:00:00 AM,AM,2022,9,Sep,38,Parks,Highbridge Park,85,,85,,,34,Manhattan,M-12A,ZONE,true,2022-09-12 06:11:08.0000000,M&O MS Forms
M-004294,M037,M037-ZN07,09/10/2022 12:00:00 AM,AM,2022,9,Sep,37,Parks,Highbridge Park,110,,110,,,34,Manhattan,M-12A,ZONE,true,2022-09-12 06:08:06.0000000,M&O MS Forms
M-004284,M037,M037-ZN07,09/08/2022 12:00:00 AM,AM,2022,9,Sep,37,Parks,Highbridge Park,70,,70,,,34,Manhattan,M-12A,ZONE,true,2022-09-09 06:20:12.0000000,M&O MS Forms
M-004266,M037,M037-ZN07,09/06/2022 12:00:00 AM,AM,2022,9,Sep,37,Parks,Highbridge Park,65,,65,,,34,Manhattan,M-12A,ZONE,true,2022-09-09 05:38:22.0000000,M&O MS Forms
M-004275,M037,M037-ZN07,09/07/2022 12:00:00 AM,AM,2022,9,Sep,37,Parks,Highbridge Park,52,,52,,,34,Manhattan,M-12A,ZONE,true,2022-09-09 05:41:34.0000000,M&O MS Forms
M-001737,M037,M037-ZN05,12/20/2021 12:00:00 AM,AM,2021,12,Dec,52,Parks,Highbridge Park,12,,12,,,34,Manhattan,M-12A,ZONE,true,2021-12-21 16:08:05.0000000,M&O MS Forms
M-001785,M037,M037-ZN05,12/24/2021 12:00:00 AM,AM,2021,12,Dec,52,Parks,Highbridge Park,15,,15,,,34,Manhattan,M-12A,ZONE,true,2021-12-26 12:13:42.0000000,M&O MS Forms
M-001795,M037,M037-ZN05,12/25/2021 12:00:00 AM,AM,2021,12,Dec,52,Parks,Highbridge Park,9,,9,,,34,Manhattan,M-12A,ZONE,true,2021-12-26 12:17:22.0000000,M&O MS Forms
M-001804,M037,M037-ZN05,12/26/2021 12:00:00 AM,AM,2021,12,Dec,53,Parks,Highbridge Park,4,,4,,,34,Manhattan,M-12A,ZONE,true,2021-12-27 16:02:17.0000000,M&O MS Forms
M-001815,M037,M037-ZN05,12/27/2021 12:00:00 AM,AM,2021,12,Dec,53,Parks,Highbridge Park,3,,3,,,34,Manhattan,M-12A,ZONE,true,2021-12-27 16:08:59.0000000,M&O MS Forms
M-001836,M037,M037-ZN05,12/29/2021 12:00:00 AM,AM,2021,12,Dec,53,Parks,Highbridge Park,7,,7,,,34,Manhattan,M-12A,ZONE,true,2021-12-29 16:31:22.0000000,M&O MS Forms
M-001823,M037,M037-ZN05,12/28/2021 12:00:00 AM,AM,2021,12,Dec,53,Parks,Highbridge Park,3,,3,,,34,Manhattan,M-12A,ZONE,true,2021-12-28 15:32:51.0000000,M&O MS Forms
M-001848,M037,M037-ZN05,12/30/2021 12:00:00 AM,AM,2021,12,Dec,53,Parks,Highbridge Park,9,,9,,,34,Manhattan,M-12A,ZONE,true,2021-12-30 15:53:56.0000000,M&O MS Forms
M-001862,M037,M037-ZN05,12/31/2021 12:00:00 AM,AM,2021,12,Dec,53,Parks,Highbridge Park,3,,3,,,34,Manhattan,M-12A,ZONE,true,2021-12-31 19:59:23.0000000,M&O MS Forms
M-004731,M037,M037-ZN05,10/29/2022 12:00:00 AM,AM,2022,10,Oct,44,Parks,Highbridge Park,2,,2,,,34,Manhattan,M-12A,ZONE,true,2022-10-30 13:23:16.0000000,M&O MS Forms
M-001728,M037,M037-ZN05,12/19/2021 12:00:00 AM,AM,2021,12,Dec,52,Parks,Highbridge Park,7,,7,,,34,Manhattan,M-12A,ZONE,true,2021-12-21 16:05:34.0000000,M&O MS Forms
M-000045,M037,M037-ZN05,04/07/2021 12:00:00 AM,AM,2021,4,Apr,15,Parks,Highbridge Park,6,,6,,,34,Manhattan,M-12A,ZONE,true,2021-04-11 00:32:12.0000000,M&O MS Forms
M-003298,M037,M037-ZN05,05/30/2022 12:00:00 AM,AM,2022,5,May,23,Parks,Highbridge Park,4,,4,,,34,Manhattan,M-12A,ZONE,true,2022-06-06 19:14:56.0000000,M&O MS Forms
M-003263,M037,M037-ZN05,05/29/2022 12:00:00 AM,AM,2022,5,May,23,Parks,Highbridge Park,9,,9,,,34,Manhattan,M-12A,ZONE,true,2022-05-30 10:39:20.0000000,M&O MS Forms
M-003254,M037,M037-ZN05,05/28/2022 12:00:00 AM,AM,2022,5,May,22,Parks,Highbridge Park,8,,8,,,34,Manhattan,M-12A,ZONE,true,2022-05-30 10:36:08.0000000,M&O MS Forms
M-003242,M037,M037-ZN05,05/27/2022 12:00:00 AM,AM,2022,5,May,22,Parks,Highbridge Park,12,,12,,,34,Manhattan,M-12A,ZONE,true,2022-05-28 10:56:42.0000000,M&O MS Forms
M-003233,M037,M037-ZN05,05/26/2022 12:00:00 AM,AM,2022,5,May,22,Parks,Highbridge Park,6,,6,,,34,Manhattan,M-12A,ZONE,true,2022-05-28 10:54:15.0000000,M&O MS Forms
M-003361,M037,M037-ZN05,06/06/2022 12:00:00 AM,AM,2022,6,Jun,24,Parks,Highbridge Park,2,,2,,,34,Manhattan,M-12A,ZONE,true,2022-06-06 19:46:43.0000000,M&O MS Forms
M-003352,M037,M037-ZN05,06/05/2022 12:00:00 AM,AM,2022,6,Jun,24,Parks,Highbridge Park,8,,8,,,34,Manhattan,M-12A,ZONE,true,2022-06-06 19:43:43.0000000,M&O MS Forms
M-003343,M037,M037-ZN05,06/04/2022 12:00:00 AM,AM,2022,6,Jun,23,Parks,Highbridge Park,4,,4,,,34,Manhattan,M-12A,ZONE,true,2022-06-06 19:33:43.0000000,M&O MS Forms
M-003334,M037,M037-ZN05,06/03/2022 12:00:00 AM,AM,2022,6,Jun,23,Parks,Highbridge Park,2,,2,,,34,Manhattan,M-12A,ZONE,true,2022-06-06 19:30:35.0000000,M&O MS Forms
M-003325,M037,M037-ZN05,06/02/2022 12:00:00 AM,AM,2022,6,Jun,23,Parks,Highbridge Park,1,,1,,,34,Manhattan,M-12A,ZONE,true,2022-06-06 19:26:15.0000000,M&O MS Forms
M-003316,M037,M037-ZN05,06/01/2022 12:00:00 AM,AM,2022,6,Jun,23,Parks,Highbridge Park,6,,6,,,34,Manhattan,M-12A,ZONE,true,2022-06-06 19:22:45.0000000,M&O MS Forms
M-003306,M037,M037-ZN05,05/31/2022 12:00:00 AM,AM,2022,5,May,23,Parks,Highbridge Park,5,,5,,,34,Manhattan,M-12A,ZONE,true,2022-06-06 19:18:24.0000000,M&O MS Forms
M-003486,M037,M037-ZN05,06/20/2022 12:00:00 AM,AM,2022,6,Jun,26,Parks,Highbridge Park,2,,2,,,34,Manhattan,M-12A,ZONE,true,2022-06-26 13:12:18.0000000,M&O MS Forms
M-003462,M037,M037-ZN05,06/17/2022 12:00:00 AM,AM,2022,6,Jun,25,Parks,Highbridge Park,4,,4,,,34,Manhattan,M-12A,ZONE,true,2022-06-19 12:51:29.0000000,M&O MS Forms
M-003471,M037,M037-ZN05,06/18/2022 12:00:00 AM,AM,2022,6,Jun,25,Parks,Highbridge Park,8,,8,,,34,Manhattan,M-12A,ZONE,true,2022-06-19 12:53:59.0000000,M&O MS Forms
M-003453,M037,M037-ZN05,06/16/2022 12:00:00 AM,AM,2022,6,Jun,25,Parks,Highbridge Park,6,,6,,,34,Manhattan,M-12A,ZONE,true,2022-06-19 12:48:59.0000000,M&O MS Forms
M-003444,M037,M037-ZN05,06/15/2022 12:00:00 AM,AM,2022,6,Jun,25,Parks,Highbridge Park,12,,12,,,34,Manhattan,M-12A,ZONE,true,2022-06-19 12:46:13.0000000,M&O MS Forms
M-003436,M037,M037-ZN05,06/14/2022 12:00:00 AM,AM,2022,6,Jun,25,Parks,Highbridge Park,1,,1,,,34,Manhattan,M-12A,ZONE,true,2022-06-19 12:43:08.0000000,M&O MS Forms
M-003414,M037,M037-ZN05,06/12/2022 12:00:00 AM,AM,2022,6,Jun,25,BBP,Highbridge Park,2,,2,,,34,Manhattan,M-12A,ZONE,true,2022-06-12 18:03:02.0000000,M&O MS Forms
M-003397,M037,M037-ZN05,06/10/2022 12:00:00 AM,AM,2022,6,Jun,24,Parks,Highbridge Park,6,,6,,,34,Manhattan,M-12A,ZONE,true,2022-06-11 19:28:10.0000000,M&O MS Forms
M-003388,M037,M037-ZN05,06/09/2022 12:00:00 AM,AM,2022,6,Jun,24,Parks,Highbridge Park,8,,8,,,34,Manhattan,M-12A,ZONE,true,2022-06-11 19:24:55.0000000,M&O MS Forms
M-003379,M037,M037-ZN05,06/08/2022 12:00:00 AM,AM,2022,6,Jun,24,Parks,Highbridge Park,21,,21,,,34,Manhattan,M-12A,ZONE,true,2022-06-11 19:21:36.0000000,M&O MS Forms
M-003370,M037,M037-ZN05,06/07/2022 12:00:00 AM,AM,2022,6,Jun,24,Parks,Highbridge Park,6,,6,,,34,Manhattan,M-12A,ZONE,true,2022-06-11 19:17:51.0000000,M&O MS Forms
M-003621,M037,M037-ZN05,07/04/2022 12:00:00 AM,AM,2022,7,Jul,28,Parks,Highbridge Park,8,,8,,,34,Manhattan,M-12A,ZONE,true,2022-07-09 10:37:28.0000000,M&O MS Forms
M-003612,M037,M037-ZN05,07/03/2022 12:00:00 AM,AM,2022,7,Jul,28,Parks,Highbridge Park,10,,10,,,34,Manhattan,M-12A,ZONE,true,2022-07-04 13:45:56.0000000,M&O MS Forms
M-003595,M037,M037-ZN05,07/01/2022 12:00:00 AM,AM,2022,7,Jul,27,Parks,Highbridge Park,21,,21,,,34,Manhattan,M-12A,ZONE,true,2022-07-02 10:55:36.0000000,M&O MS Forms
M-003603,M037,M037-ZN05,07/02/2022 12:00:00 AM,AM,2022,7,Jul,27,Parks,Highbridge Park,9,,9,,,34,Manhattan,M-12A,ZONE,true,2022-07-04 13:42:33.0000000,M&O MS Forms
M-003578,M037,M037-ZN05,06/29/2022 12:00:00 AM,AM,2022,6,Jun,27,Parks,Highbridge Park,10,,10,,,34,Manhattan,M-12A,ZONE,true,2022-07-02 10:50:57.0000000,M&O MS Forms
M-003587,M037,M037-ZN05,06/30/2022 12:00:00 AM,AM,2022,6,Jun,27,Parks,Highbridge Park,4,,4,,,34,Manhattan,M-12A,ZONE,true,2022-07-02 10:53:32.0000000,M&O MS Forms
M-003560,M037,M037-ZN05,06/27/2022 12:00:00 AM,AM,2022,6,Jun,27,Parks,Highbridge Park,15,,15,,,34,Manhattan,M-12A,ZONE,true,2022-07-02 10:45:47.0000000,M&O MS Forms
M-003570,M037,M037-ZN05,06/28/2022 12:00:00 AM,AM,2022,6,Jun,27,Parks,Highbridge Park,18,,18,,,34,Manhattan,M-12A,ZONE,true,2022-07-02 10:48:31.0000000,M&O MS Forms
M-003551,M037,M037-ZN05,06/26/2022 12:00:00 AM,AM,2022,6,Jun,27,Parks,Highbridge Park,10,,10,,,34,Manhattan,M-12A,ZONE,true,2022-06-26 18:08:02.0000000,M&O MS Forms
M-003542,M037,M037-ZN05,06/25/2022 12:00:00 AM,AM,2022,6,Jun,26,Parks,Highbridge Park,9,,9,,,34,Manhattan,M-12A,ZONE,true,2022-06-26 18:04:48.0000000,M&O MS Forms
M-003532,M037,M037-ZN05,06/24/2022 12:00:00 AM,AM,2022,6,Jun,26,Parks,Highbridge Park,8,,8,,,34,Manhattan,M-12A,ZONE,true,2022-06-26 18:01:45.0000000,M&O MS Forms
M-003514,M037,M037-ZN05,06/22/2022 12:00:00 AM,AM,2022,6,Jun,26,Parks,Highbridge Park,5,,5,,,34,Manhattan,M-12A,ZONE,true,2022-06-26 17:56:08.0000000,M&O MS Forms
M-003523,M037,M037-ZN05,06/23/2022 12:00:00 AM,AM,2022,6,Jun,26,Parks,Highbridge Park,7,,7,,,34,Manhattan,M-12A,ZONE,true,2022-06-26 17:58:39.0000000,M&O MS Forms
M-003496,M037,M037-ZN05,06/19/2022 12:00:00 AM,AM,2022,6,Jun,26,Parks,Highbridge Park,13,,13,,,34,Manhattan,M-12A,ZONE,true,2022-06-26 17:51:01.0000000,M&O MS Forms
M-003505,M037,M037-ZN05,06/21/2022 12:00:00 AM,AM,2022,6,Jun,26,Parks,Highbridge Park,6,,6,,,34,Manhattan,M-12A,ZONE,true,2022-06-26 17:53:38.0000000,M&O MS Forms
M-003745,M037,M037-ZN05,07/18/2022 12:00:00 AM,AM,2022,7,Jul,30,Parks,Highbridge Park,18,,18,,,34,Manhattan,M-12A,ZONE,true,2022-07-23 15:21:59.0000000,M&O MS Forms
M-003736,M037,M037-ZN05,07/17/2022 12:00:00 AM,AM,2022,7,Jul,30,Parks,Highbridge Park,5,,5,,,34,Manhattan,M-12A,ZONE,true,2022-07-23 15:18:22.0000000,M&O MS Forms
M-003725,M037,M037-ZN05,07/16/2022 12:00:00 AM,AM,2022,7,Jul,29,Parks,Highbridge Park,6,,6,,,34,Manhattan,M-12A,ZONE,true,2022-07-17 17:51:05.0000000,M&O MS Forms
M-003707,M037,M037-ZN05,07/14/2022 12:00:00 AM,AM,2022,7,Jul,29,Parks,Highbridge Park,5,,5,,,34,Manhattan,M-12A,ZONE,true,2022-07-16 09:48:28.0000000,M&O MS Forms
M-003716,M037,M037-ZN05,07/15/2022 12:00:00 AM,AM,2022,7,Jul,29,Parks,Highbridge Park,3,,3,,,34,Manhattan,M-12A,ZONE,true,2022-07-16 09:50:58.0000000,M&O MS Forms
M-003695,M037,M037-ZN05,07/12/2022 12:00:00 AM,AM,2022,7,Jul,29,Parks,Highbridge Park,2,,2,,,34,Manhattan,M-12A,ZONE,true,2022-07-16 09:44:49.0000000,M&O MS Forms
M-003701,M037,M037-ZN05,07/13/2022 12:00:00 AM,AM,2022,7,Jul,29,Parks,Highbridge Park,3,,3,,,34,Manhattan,M-12A,ZONE,true,2022-07-16 09:46:34.0000000,M&O MS Forms
M-003686,M037,M037-ZN05,07/11/2022 12:00:00 AM,AM,2022,7,Jul,29,Parks,Highbridge Park,6,,6,,,34,Manhattan,M-12A,ZONE,true,2022-07-16 09:42:11.0000000,M&O MS Forms
M-003677,M037,M037-ZN05,07/10/2022 12:00:00 AM,AM,2022,7,Jul,29,Parks,Highbridge Park,8,,8,,,34,Manhattan,M-12A,ZONE,true,2022-07-16 09:35:40.0000000,M&O MS Forms
M-003659,M037,M037-ZN05,07/08/2022 12:00:00 AM,AM,2022,7,Jul,28,Parks,Highbridge Park,7,,7,,,34,Manhattan,M-12A,ZONE,true,2022-07-11 14:12:34.0000000,M&O MS Forms
M-003668,M037,M037-ZN05,07/09/2022 12:00:00 AM,AM,2022,7,Jul,28,Parks,Highbridge Park,10,,10,,,34,Manhattan,M-12A,ZONE,true,2022-07-11 14:15:12.0000000,M&O MS Forms
M-003630,M037,M037-ZN05,07/05/2022 12:00:00 AM,AM,2022,7,Jul,28,Parks,Highbridge Park,5,,5,,,34,Manhattan,M-12A,ZONE,true,2022-07-09 10:40:09.0000000,M&O MS Forms
M-003650,M037,M037-ZN05,07/07/2022 12:00:00 AM,AM,2022,7,Jul,28,Parks,Highbridge Park,6,,6,,,34,Manhattan,M-12A,ZONE,true,2022-07-11 14:10:00.0000000,M&O MS Forms
M-003639,M037,M037-ZN05,07/06/2022 12:00:00 AM,AM,2022,7,Jul,28,Parks,Highbridge Park,10,,10,,,34,Manhattan,M-12A,ZONE,true,2022-07-09 10:43:01.0000000,M&O MS Forms
M-003640,M037,M037-ZN06,07/06/2022 12:00:00 AM,AM,2022,7,Jul,28,Parks,Highbridge Park,15,,15,,,34,Manhattan,M-12A,ZONE,true,2022-07-09 10:43:18.0000000,M&O MS Forms
M-003651,M037,M037-ZN06,07/07/2022 12:00:00 AM,AM,2022,7,Jul,28,Parks,Highbridge Park,8,,8,,,34,Manhattan,M-12A,ZONE,true,2022-07-11 14:10:16.0000000,M&O MS Forms
M-003631,M037,M037-ZN06,07/05/2022 12:00:00 AM,AM,2022,7,Jul,28,Parks,Highbridge Park,25,,25,,,34,Manhattan,M-12A,ZONE,true,2022-07-09 10:40:25.0000000,M&O MS Forms
M-003669,M037,M037-ZN06,07/09/2022 12:00:00 AM,AM,2022,7,Jul,28,Parks,Highbridge Park,17,,17,,,34,Manhattan,M-12A,ZONE,true,2022-07-11 14:15:28.0000000,M&O MS Forms
M-003660,M037,M037-ZN06,07/08/2022 12:00:00 AM,AM,2022,7,Jul,28,Parks,Highbridge Park,15,,15,,,34,Manhattan,M-12A,ZONE,true,2022-07-11 14:12:54.0000000,M&O MS Forms
M-003678,M037,M037-ZN06,07/10/2022 12:00:00 AM,AM,2022,7,Jul,29,Parks,Highbridge Park,14,,14,,,34,Manhattan,M-12A,ZONE,true,2022-07-16 09:35:55.0000000,M&O MS Forms
M-003687,M037,M037-ZN06,07/11/2022 12:00:00 AM,AM,2022,7,Jul,29,Parks,Highbridge Park,10,,10,,,34,Manhattan,M-12A,ZONE,true,2022-07-16 09:42:30.0000000,M&O MS Forms
M-003696,M037,M037-ZN06,07/12/2022 12:00:00 AM,AM,2022,7,Jul,29,Parks,Highbridge Park,5,,5,,,34,Manhattan,M-12A,ZONE,true,2022-07-16 09:45:07.0000000,M&O MS Forms
M-003717,M037,M037-ZN06,07/15/2022 12:00:00 AM,AM,2022,7,Jul,29,Parks,Highbridge Park,7,,7,,,34,Manhattan,M-12A,ZONE,true,2022-07-16 09:51:11.0000000,M&O MS Forms
M-003708,M037,M037-ZN06,07/14/2022 12:00:00 AM,AM,2022,7,Jul,29,Parks,Highbridge Park,10,,10,,,34,Manhattan,M-12A,ZONE,true,2022-07-16 09:48:43.0000000,M&O MS Forms
M-003726,M037,M037-ZN06,07/16/2022 12:00:00 AM,AM,2022,7,Jul,29,Parks,Highbridge Park,15,,15,,,34,Manhattan,M-12A,ZONE,true,2022-07-17 17:51:20.0000000,M&O MS Forms
M-003746,M037,M037-ZN06,07/18/2022 12:00:00 AM,AM,2022,7,Jul,30,Parks,Highbridge Park,30,,30,,,34,Manhattan,M-12A,ZONE,true,2022-07-23 15:22:41.0000000,M&O MS Forms
M-003737,M037,M037-ZN06,07/17/2022 12:00:00 AM,AM,2022,7,Jul,30,Parks,Highbridge Park,25,,25,,,34,Manhattan,M-12A,ZONE,true,2022-07-23 15:18:39.0000000,M&O MS Forms
M-003506,M037,M037-ZN06,06/21/2022 12:00:00 AM,AM,2022,6,Jun,26,Parks,Highbridge Park,9,,9,,,34,Manhattan,M-12A,ZONE,true,2022-06-26 17:53:52.0000000,M&O MS Forms
M-003497,M037,M037-ZN06,06/19/2022 12:00:00 AM,AM,2022,6,Jun,26,Parks,Highbridge Park,10,,10,,,34,Manhattan,M-12A,ZONE,true,2022-06-26 17:51:17.0000000,M&O MS Forms
M-003524,M037,M037-ZN06,06/23/2022 12:00:00 AM,AM,2022,6,Jun,26,Parks,Highbridge Park,15,,15,,,34,Manhattan,M-12A,ZONE,true,2022-06-26 17:58:59.0000000,M&O MS Forms
M-003515,M037,M037-ZN06,06/22/2022 12:00:00 AM,AM,2022,6,Jun,26,Parks,Highbridge Park,11,,11,,,34,Manhattan,M-12A,ZONE,true,2022-06-26 17:56:25.0000000,M&O MS Forms
M-003533,M037,M037-ZN06,06/24/2022 12:00:00 AM,AM,2022,6,Jun,26,Parks,Highbridge Park,10,,10,,,34,Manhattan,M-12A,ZONE,true,2022-06-26 18:02:02.0000000,M&O MS Forms
M-003552,M037,M037-ZN06,06/26/2022 12:00:00 AM,AM,2022,6,Jun,27,Parks,Highbridge Park,17,,17,,,34,Manhattan,M-12A,ZONE,true,2022-06-26 18:08:18.0000000,M&O MS Forms
M-003543,M037,M037-ZN06,06/25/2022 12:00:00 AM,AM,2022,6,Jun,26,Parks,Highbridge Park,20,,20,,,34,Manhattan,M-12A,ZONE,true,2022-06-26 18:05:02.0000000,M&O MS Forms
M-003571,M037,M037-ZN06,06/28/2022 12:00:00 AM,AM,2022,6,Jun,27,Parks,Highbridge Park,25,,25,,,34,Manhattan,M-12A,ZONE,true,2022-07-02 10:48:49.0000000,M&O MS Forms
M-003561,M037,M037-ZN06,06/27/2022 12:00:00 AM,AM,2022,6,Jun,27,Parks,Highbridge Park,20,,20,,,34,Manhattan,M-12A,ZONE,true,2022-07-02 10:46:05.0000000,M&O MS Forms
M-003588,M037,M037-ZN06,06/30/2022 12:00:00 AM,AM,2022,6,Jun,27,Parks,Highbridge Park,10,,10,,,34,Manhattan,M-12A,ZONE,true,2022-07-02 10:53:49.0000000,M&O MS Forms
M-003579,M037,M037-ZN06,06/29/2022 12:00:00 AM,AM,2022,6,Jun,27,Parks,Highbridge Park,14,,14,,,34,Manhattan,M-12A,ZONE,true,2022-07-02 10:51:13.0000000,M&O MS Forms
M-003604,M037,M037-ZN06,07/02/2022 12:00:00 AM,AM,2022,7,Jul,27,Parks,Highbridge Park,6,,6,,,34,Manhattan,M-12A,ZONE,true,2022-07-04 13:42:52.0000000,M&O MS Forms
M-003596,M037,M037-ZN06,07/01/2022 12:00:00 AM,AM,2022,7,Jul,27,Parks,Highbridge Park,5,,5,,,34,Manhattan,M-12A,ZONE,true,2022-07-02 10:55:58.0000000,M&O MS Forms
M-003613,M037,M037-ZN06,07/03/2022 12:00:00 AM,AM,2022,7,Jul,28,Parks,Highbridge Park,17,,17,,,34,Manhattan,M-12A,ZONE,true,2022-07-04 13:46:14.0000000,M&O MS Forms
M-003622,M037,M037-ZN06,07/04/2022 12:00:00 AM,AM,2022,7,Jul,28,Parks,Highbridge Park,20,,20,,,34,Manhattan,M-12A,ZONE,true,2022-07-09 10:37:45.0000000,M&O MS Forms
M-003371,M037,M037-ZN06,06/07/2022 12:00:00 AM,AM,2022,6,Jun,24,Parks,Highbridge Park,25,,25,,,34,Manhattan,M-12A,ZONE,true,2022-06-11 19:18:15.0000000,M&O MS Forms
M-003389,M037,M037-ZN06,06/09/2022 12:00:00 AM,AM,2022,6,Jun,24,Parks,Highbridge Park,12,,12,,,34,Manhattan,M-12A,ZONE,true,2022-06-11 19:25:29.0000000,M&O MS Forms
M-003380,M037,M037-ZN06,06/08/2022 12:00:00 AM,AM,2022,6,Jun,24,Parks,Highbridge Park,13,,13,,,34,Manhattan,M-12A,ZONE,true,2022-06-11 19:21:59.0000000,M&O MS Forms
M-003398,M037,M037-ZN06,06/10/2022 12:00:00 AM,AM,2022,6,Jun,24,Parks,Highbridge Park,10,,10,,,34,Manhattan,M-12A,ZONE,true,2022-06-11 19:28:31.0000000,M&O MS Forms
M-003405,M037,M037-ZN06,06/11/2022 12:00:00 AM,AM,2022,6,Jun,24,Parks,Highbridge Park,10,,10,,,34,Manhattan,M-12A,ZONE,true,2022-06-11 19:30:48.0000000,M&O MS Forms
M-003415,M037,M037-ZN06,06/12/2022 12:00:00 AM,AM,2022,6,Jun,25,Parks,Highbridge Park,3,,3,,,34,Manhattan,M-12A,ZONE,true,2022-06-12 18:03:19.0000000,M&O MS Forms
M-003428,M037,M037-ZN06,06/13/2022 12:00:00 AM,AM,2022,6,Jun,25,Parks,Highbridge Park,1,,1,,,34,Manhattan,M-12A,ZONE,true,2022-06-19 12:40:51.0000000,M&O MS Forms
M-003454,M037,M037-ZN06,06/16/2022 12:00:00 AM,AM,2022,6,Jun,25,Parks,Highbridge Park,20,,20,,,34,Manhattan,M-12A,ZONE,true,2022-06-19 12:49:14.0000000,M&O MS Forms
M-003445,M037,M037-ZN06,06/15/2022 12:00:00 AM,AM,2022,6,Jun,25,Parks,Highbridge Park,12,,12,,,34,Manhattan,M-12A,ZONE,true,2022-06-19 12:46:30.0000000,M&O MS Forms
M-003472,M037,M037-ZN06,06/18/2022 12:00:00 AM,AM,2022,6,Jun,25,Parks,Highbridge Park,15,,15,,,34,Manhattan,M-12A,ZONE,true,2022-06-19 12:54:15.0000000,M&O MS Forms
M-003463,M037,M037-ZN06,06/17/2022 12:00:00 AM,AM,2022,6,Jun,25,Parks,Highbridge Park,41,,41,,,34,Manhattan,M-12A,ZONE,true,2022-06-19 12:51:44.0000000,M&O MS Forms
M-003487,M037,M037-ZN06,06/20/2022 12:00:00 AM,AM,2022,6,Jun,26,Parks,Highbridge Park,15,,15,,,34,Manhattan,M-12A,ZONE,true,2022-06-26 13:12:39.0000000,M&O MS Forms
M-003299,M037,M037-ZN06,05/30/2022 12:00:00 AM,AM,2022,5,May,23,Parks,Highbridge Park,10,,10,,,34,Manhattan,M-12A,ZONE,true,2022-06-06 19:15:22.0000000,M&O MS Forms
M-003307,M037,M037-ZN06,05/31/2022 12:00:00 AM,AM,2022,5,May,23,Parks,Highbridge Park,10,,10,,,34,Manhattan,M-12A,ZONE,true,2022-06-06 19:18:45.0000000,M&O MS Forms
M-003317,M037,M037-ZN06,06/01/2022 12:00:00 AM,AM,2022,6,Jun,23,Parks,Highbridge Park,8,,8,,,34,Manhattan,M-12A,ZONE,true,2022-06-06 19:23:05.0000000,M&O MS Forms
M-003326,M037,M037-ZN06,06/02/2022 12:00:00 AM,AM,2022,6,Jun,23,Parks,Highbridge Park,9,,9,,,34,Manhattan,M-12A,ZONE,true,2022-06-06 19:27:00.0000000,M&O MS Forms
M-003335,M037,M037-ZN06,06/03/2022 12:00:00 AM,AM,2022,6,Jun,23,Parks,Highbridge Park,7,,7,,,34,Manhattan,M-12A,ZONE,true,2022-06-06 19:30:50.0000000,M&O MS Forms
M-003344,M037,M037-ZN06,06/04/2022 12:00:00 AM,AM,2022,6,Jun,23,Parks,Highbridge Park,14,,14,,,34,Manhattan,M-12A,ZONE,true,2022-06-06 19:34:02.0000000,M&O MS Forms
M-003353,M037,M037-ZN06,06/05/2022 12:00:00 AM,AM,2022,6,Jun,24,Parks,Highbridge Park,10,,10,,,34,Manhattan,M-12A,ZONE,true,2022-06-06 19:44:00.0000000,M&O MS Forms
M-003362,M037,M037-ZN06,06/06/2022 12:00:00 AM,AM,2022,6,Jun,24,Parks,Highbridge Park,15,,15,,,34,Manhattan,M-12A,ZONE,true,2022-06-06 19:47:00.0000000,M&O MS Forms
M-003234,M037,M037-ZN06,05/26/2022 12:00:00 AM,AM,2022,5,May,22,Parks,Highbridge Park,14,,14,,,34,Manhattan,M-12A,ZONE,true,2022-05-28 10:54:31.0000000,M&O MS Forms
M-003243,M037,M037-ZN06,05/27/2022 12:00:00 AM,AM,2022,5,May,22,Parks,Highbridge Park,10,,10,,,34,Manhattan,M-12A,ZONE,true,2022-05-28 10:56:57.0000000,M&O MS Forms
M-003255,M037,M037-ZN06,05/28/2022 12:00:00 AM,AM,2022,5,May,22,Parks,Highbridge Park,30,,30,,,34,Manhattan,M-12A,ZONE,true,2022-05-30 10:36:26.0000000,M&O MS Forms
M-003264,M037,M037-ZN06,05/29/2022 12:00:00 AM,AM,2022,5,May,23,Parks,Highbridge Park,4,,4,,,34,Manhattan,M-12A,ZONE,true,2022-05-30 10:39:51.0000000,M&O MS Forms
M-001729,M037,M037-ZN06,12/19/2021 12:00:00 AM,AM,2021,12,Dec,52,Parks,Highbridge Park,25,,25,,,34,Manhattan,M-12A,ZONE,true,2021-12-21 16:05:52.0000000,M&O MS Forms
M-000076,M037,M037-ZN06,04/14/2021 12:00:00 AM,PM,2021,4,Apr,16,Parks,Highbridge Park,6,,6,,,34,Manhattan,M-12A,ZONE,true,2021-04-15 11:49:33.0000000,M&O MS Forms
M-000099,M037,M037-ZN06,04/18/2021 12:00:00 AM,AM,2021,4,Apr,17,Parks,Highbridge Park,4,,4,,,34,Manhattan,M-12A,ZONE,true,2021-04-23 21:57:09.0000000,M&O MS Forms
M-000105,M037,M037-ZN06,04/20/2021 12:00:00 AM,PM,2021,4,Apr,17,Parks,Highbridge Park,2,,2,,,34,Manhattan,M-12A,ZONE,true,2021-04-23 21:59:36.0000000,M&O MS Forms
M-004732,M037,M037-ZN06,10/29/2022 12:00:00 AM,AM,2022,10,Oct,44,Parks,Highbridge Park,4,,4,,,34,Manhattan,M-12A,ZONE,true,2022-10-30 13:23:36.0000000,M&O MS Forms
M-001863,M037,M037-ZN06,12/31/2021 12:00:00 AM,AM,2021,12,Dec,53,Parks,Highbridge Park,16,,16,,,34,Manhattan,M-12A,ZONE,true,2021-12-31 20:00:27.0000000,M&O MS Forms
M-001849,M037,M037-ZN06,12/30/2021 12:00:00 AM,AM,2021,12,Dec,53,Parks,Highbridge Park,12,,12,,,34,Manhattan,M-12A,ZONE,true,2021-12-30 15:54:11.0000000,M&O MS Forms
M-001824,M037,M037-ZN06,12/28/2021 12:00:00 AM,AM,2021,12,Dec,53,Parks,Highbridge Park,3,,3,,,34,Manhattan,M-12A,ZONE,true,2021-12-28 15:33:06.0000000,M&O MS Forms
M-001837,M037,M037-ZN06,12/29/2021 12:00:00 AM,AM,2021,12,Dec,53,Parks,Highbridge Park,11,,11,,,34,Manhattan,M-12A,ZONE,true,2021-12-29 16:32:03.0000000,M&O MS Forms
M-001816,M037,M037-ZN06,12/27/2021 12:00:00 AM,AM,2021,12,Dec,53,Parks,Highbridge Park,3,,3,,,34,Manhattan,M-12A,ZONE,true,2021-12-27 16:09:20.0000000,M&O MS Forms
M-001805,M037,M037-ZN06,12/26/2021 12:00:00 AM,AM,2021,12,Dec,53,Parks,Highbridge Park,6,,6,,,34,Manhattan,M-12A,ZONE,true,2021-12-27 16:03:41.0000000,M&O MS Forms
M-001796,M037,M037-ZN06,12/25/2021 12:00:00 AM,AM,2021,12,Dec,52,Parks,Highbridge Park,15,,15,,,34,Manhattan,M-12A,ZONE,true,2021-12-26 12:17:42.0000000,M&O MS Forms
M-002255,M037,M037-ZN08,02/15/2022 12:00:00 AM,AM,2022,2,Feb,8,Parks,Highbridge Park,3,,3,,,33,Manhattan,M-12A,ZONE,true,2022-02-21 15:01:22.0000000,M&O MS Forms
M-002273,M037,M037-ZN08,02/17/2022 12:00:00 AM,AM,2022,2,Feb,8,Parks,Highbridge Park,3,,3,,,33,Manhattan,M-12A,ZONE,true,2022-02-21 15:06:51.0000000,M&O MS Forms
M-002282,M037,M037-ZN08,02/18/2022 12:00:00 AM,AM,2022,2,Feb,8,Parks,Highbridge Park,4,,4,,,33,Manhattan,M-12A,ZONE,true,2022-02-21 15:10:19.0000000,M&O MS Forms
M-002296,M037,M037-ZN08,02/20/2022 12:00:00 AM,AM,2022,2,Feb,9,Parks,Highbridge Park,5,,5,,,33,Manhattan,M-12A,ZONE,true,2022-02-21 15:14:32.0000000,M&O MS Forms
M-002366,M037,M037-ZN08,02/26/2022 12:00:00 AM,AM,2022,2,Feb,9,Parks,Highbridge Park,2,,2,,,33,Manhattan,M-12A,ZONE,true,2022-02-28 12:14:21.0000000,M&O MS Forms
M-002351,M037,M037-ZN08,02/24/2022 12:00:00 AM,AM,2022,2,Feb,9,Parks,Highbridge Park,2,,2,,,33,Manhattan,M-12A,ZONE,true,2022-02-28 12:10:16.0000000,M&O MS Forms
M-002342,M037,M037-ZN08,02/23/2022 12:00:00 AM,AM,2022,2,Feb,9,Parks,Highbridge Park,1,,1,,,33,Manhattan,M-12A,ZONE,true,2022-02-28 12:07:15.0000000,M&O MS Forms
M-002324,M037,M037-ZN08,02/21/2022 12:00:00 AM,AM,2022,2,Feb,9,Parks,Highbridge Park,2,,2,,,33,Manhattan,M-12A,ZONE,true,2022-02-28 12:01:50.0000000,M&O MS Forms
M-002333,M037,M037-ZN08,02/22/2022 12:00:00 AM,AM,2022,2,Feb,9,Parks,Highbridge Park,1,,1,,,33,Manhattan,M-12A,ZONE,true,2022-02-28 12:04:33.0000000,M&O MS Forms
M-002406,M037,M037-ZN08,03/02/2022 12:00:00 AM,AM,2022,3,Mar,10,Parks,Highbridge Park,2,,2,,,33,Manhattan,M-12A,ZONE,true,2022-03-04 08:42:06.0000000,M&O MS Forms
M-002423,M037,M037-ZN08,03/04/2022 12:00:00 AM,AM,2022,3,Mar,10,Parks,Highbridge Park,4,,4,,,33,Manhattan,M-12A,ZONE,true,2022-03-06 19:37:53.0000000,M&O MS Forms
M-002415,M037,M037-ZN08,03/03/2022 12:00:00 AM,AM,2022,3,Mar,10,Parks,Highbridge Park,1,,1,,,33,Manhattan,M-12A,ZONE,true,2022-03-04 08:44:48.0000000,M&O MS Forms
M-002379,M037,M037-ZN08,02/27/2022 12:00:00 AM,AM,2022,2,Feb,10,Parks,Highbridge Park,5,,5,,,33,Manhattan,M-12A,ZONE,true,2022-03-04 08:33:51.0000000,M&O MS Forms
M-002388,M037,M037-ZN08,02/28/2022 12:00:00 AM,AM,2022,2,Feb,10,Parks,Highbridge Park,7,,7,,,33,Manhattan,M-12A,ZONE,true,2022-03-04 08:37:25.0000000,M&O MS Forms
M-002572,M037,M037-ZN08,03/20/2022 12:00:00 AM,AM,2022,3,Mar,13,Parks,Highbridge Park,3,,3,,,33,Manhattan,M-12A,ZONE,true,2022-03-24 19:43:57.0000000,M&O MS Forms
M-002589,M037,M037-ZN08,03/22/2022 12:00:00 AM,AM,2022,3,Mar,13,Parks,Highbridge Park,8,,8,,,33,Manhattan,M-12A,ZONE,true,2022-03-24 19:52:43.0000000,M&O MS Forms
M-002580,M037,M037-ZN08,03/21/2022 12:00:00 AM,AM,2022,3,Mar,13,Parks,Highbridge Park,6,,6,,,33,Manhattan,M-12A,ZONE,true,2022-03-24 19:48:26.0000000,M&O MS Forms
M-002633,M037,M037-ZN08,03/26/2022 12:00:00 AM,AM,2022,3,Mar,13,Parks,Highbridge Park,1,,1,,,33,Manhattan,M-12A,ZONE,true,2022-03-26 19:25:55.0000000,M&O MS Forms
M-002624,M037,M037-ZN08,03/25/2022 12:00:00 AM,AM,2022,3,Mar,13,Parks,Highbridge Park,10,,10,,,33,Manhattan,M-12A,ZONE,true,2022-03-26 19:23:02.0000000,M&O MS Forms
M-002598,M037,M037-ZN08,03/23/2022 12:00:00 AM,AM,2022,3,Mar,13,Parks,Highbridge Park,5,,5,,,33,Manhattan,M-12A,ZONE,true,2022-03-24 19:56:44.0000000,M&O MS Forms
M-002668,M037,M037-ZN08,03/29/2022 12:00:00 AM,AM,2022,3,Mar,14,Parks,Highbridge Park,4,,4,,,33,Manhattan,M-12A,ZONE,true,2022-03-30 15:31:21.0000000,M&O MS Forms
M-002677,M037,M037-ZN08,03/30/2022 12:00:00 AM,AM,2022,3,Mar,14,Parks,Highbridge Park,2,,2,,,33,Manhattan,M-12A,ZONE,true,2022-03-30 15:34:42.0000000,M&O MS Forms
M-002692,M037,M037-ZN08,03/31/2022 12:00:00 AM,AM,2022,3,Mar,14,Parks,Highbridge Park,4,,4,,,33,Manhattan,M-12A,ZONE,true,2022-04-01 15:57:00.0000000,M&O MS Forms
M-002656,M037,M037-ZN08,03/28/2022 12:00:00 AM,AM,2022,3,Mar,14,Parks,Highbridge Park,25,,25,,,33,Manhattan,M-12A,ZONE,true,2022-03-29 05:31:36.0000000,M&O MS Forms
M-002663,M037,M037-ZN08,03/29/2022 12:00:00 AM,AM,2022,3,Mar,14,Parks,Highbridge Park,8,,8,,,33,Manhattan,M-12A,ZONE,true,2022-03-30 15:28:51.0000000,M&O MS Forms
M-002647,M037,M037-ZN08,03/27/2022 12:00:00 AM,AM,2022,3,Mar,14,Parks,Highbridge Park,15,,15,,,33,Manhattan,M-12A,ZONE,true,2022-03-29 05:28:37.0000000,M&O MS Forms
M-002563,M037,M037-ZN08,03/19/2022 12:00:00 AM,AM,2022,3,Mar,12,Parks,Highbridge Park,7,,7,,,33,Manhattan,M-12A,ZONE,true,2022-03-24 16:48:37.0000000,M&O MS Forms
M-002554,M037,M037-ZN08,03/18/2022 12:00:00 AM,AM,2022,3,Mar,12,Parks,Highbridge Park,3,,3,,,33,Manhattan,M-12A,ZONE,true,2022-03-24 16:40:55.0000000,M&O MS Forms
M-002510,M037,M037-ZN08,03/14/2022 12:00:00 AM,AM,2022,3,Mar,12,Parks,Highbridge Park,3,,3,,,33,Manhattan,M-12A,ZONE,true,2022-03-17 10:48:26.0000000,M&O MS Forms
M-002501,M037,M037-ZN08,03/13/2022 12:00:00 AM,AM,2022,3,Mar,12,Parks,Highbridge Park,2,,2,,,33,Manhattan,M-12A,ZONE,true,2022-03-17 10:45:37.0000000,M&O MS Forms
M-002527,M037,M037-ZN08,03/16/2022 12:00:00 AM,AM,2022,3,Mar,12,Parks,Highbridge Park,5,,5,,,33,Manhattan,M-12A,ZONE,true,2022-03-17 11:43:08.0000000,M&O MS Forms
M-002518,M037,M037-ZN08,03/15/2022 12:00:00 AM,AM,2022,3,Mar,12,Parks,Highbridge Park,8,,8,,,33,Manhattan,M-12A,ZONE,true,2022-03-17 11:39:48.0000000,M&O MS Forms
M-000911,M088,M088,09/24/2021 12:00:00 AM,PM,2021,9,Sep,39,Parks,Tompkins Square Park,75,,75,,,9,Manhattan,M-03,PARK,false,2021-09-24 13:56:11.0000000,M&O MS Forms
M-000981,M088,M088,10/01/2021 12:00:00 AM,AM,2021,10,Oct,40,Parks,Tompkins Square Park,80,,80,,,9,Manhattan,M-03,PARK,false,2021-10-01 14:13:57.0000000,M&O MS Forms
M-000980,M088,M088,09/30/2021 12:00:00 AM,AM,2021,9,Sep,40,Parks,Tompkins Square Park,120,,120,,,9,Manhattan,M-03,PARK,false,2021-10-01 14:13:15.0000000,M&O MS Forms
M-001012,M088,M088,10/08/2021 12:00:00 AM,AM,2021,10,Oct,41,Parks,Tompkins Square Park,49,,49,,,9,Manhattan,M-03,PARK,false,2021-10-08 15:03:47.0000000,M&O MS Forms
M-000758,M088,M088,08/22/2021 12:00:00 AM,AM,2021,8,Aug,35,Parks,Tompkins Square Park,12,,12,,,9,Manhattan,M-03,PARK,false,2021-08-23 08:39:36.0000000,M&O MS Forms
M-000085,M088,M088,04/08/2021 12:00:00 AM,AM,2021,4,Apr,15,BBP,Tompkins Square Park,7,,7,,,9,Manhattan,M-03,PARK,false,2021-04-21 16:11:24.0000000,M&O MS Forms
M-000084,M088,M088,04/07/2021 12:00:00 AM,AM,2021,4,Apr,15,BBP,Tompkins Square Park,4,,4,,,9,Manhattan,M-03,PARK,false,2021-04-21 16:09:25.0000000,M&O MS Forms
M-000083,M088,M088,04/06/2021 12:00:00 AM,AM,2021,4,Apr,15,BBP,Tompkins Square Park,1,,1,,,9,Manhattan,M-03,PARK,false,2021-04-21 16:06:30.0000000,M&O MS Forms
M-000093,M088,M088,04/17/2021 12:00:00 AM,PM,2021,4,Apr,16,BBP,Tompkins Square Park,1,,1,,,9,Manhattan,M-03,PARK,false,2021-04-21 16:26:33.0000000,M&O MS Forms
M-000092,M088,M088,04/17/2021 12:00:00 AM,AM,2021,4,Apr,16,BBP,Tompkins Square Park,2,,2,,,9,Manhattan,M-03,PARK,false,2021-04-21 16:25:29.0000000,M&O MS Forms
M-000090,M088,M088,04/16/2021 12:00:00 AM,AM,2021,4,Apr,16,BBP,Tompkins Square Park,6,,6,,,9,Manhattan,M-03,PARK,false,2021-04-21 16:21:02.0000000,M&O MS Forms
M-000089,M088,M088,04/15/2021 12:00:00 AM,AM,2021,4,Apr,16,BBP,Tompkins Square Park,3,,3,,,9,Manhattan,M-03,PARK,false,2021-04-21 16:19:17.0000000,M&O MS Forms
M-000088,M088,M088,04/10/2021 12:00:00 AM,AM,2021,4,Apr,15,BBP,Tompkins Square Park,4,,4,,,9,Manhattan,M-03,PARK,false,2021-04-21 16:17:22.0000000,M&O MS Forms
M-000087,M088,M088,04/09/2021 12:00:00 AM,AM,2021,4,Apr,15,BBP,Tompkins Square Park,1,,1,,,9,Manhattan,M-03,PARK,false,2021-04-21 16:14:26.0000000,M&O MS Forms
M-000059,M088,M088,04/10/2021 12:00:00 AM,AM,2021,4,Apr,15,BBP,Tompkins Square Park,3,,3,,,9,Manhattan,M-03,PARK,false,2021-04-11 17:13:59.0000000,M&O MS Forms
M-000058,M088,M088,04/10/2021 12:00:00 AM,AM,2021,4,Apr,15,BBP,Tompkins Square Park,1,,1,,,9,Manhattan,M-03,PARK,false,2021-04-11 17:12:59.0000000,M&O MS Forms
M-000057,M088,M088,04/09/2021 12:00:00 AM,AM,2021,4,Apr,15,BBP,Tompkins Square Park,1,,1,,,9,Manhattan,M-03,PARK,false,2021-04-11 17:11:21.0000000,M&O MS Forms
M-000056,M088,M088,04/09/2021 12:00:00 AM,AM,2021,4,Apr,15,BBP,Tompkins Square Park,1,,1,,,9,Manhattan,M-03,PARK,false,2021-04-11 17:10:20.0000000,M&O MS Forms
M-000054,M088,M088,04/08/2021 12:00:00 AM,AM,2021,4,Apr,15,BBP,Tompkins Square Park,3,,3,,,9,Manhattan,M-03,PARK,false,2021-04-11 17:06:03.0000000,M&O MS Forms
M-000053,M088,M088,04/08/2021 12:00:00 AM,AM,2021,4,Apr,15,BBP,Tompkins Square Park,4,,4,,,9,Manhattan,M-03,PARK,false,2021-04-11 17:04:10.0000000,M&O MS Forms
M-000052,M088,M088,04/07/2021 12:00:00 AM,AM,2021,4,Apr,15,BBP,Tompkins Square Park,4,,4,,,9,Manhattan,M-03,PARK,false,2021-04-11 17:02:33.0000000,M&O MS Forms
M-000051,M088,M088,04/06/2021 12:00:00 AM,AM,2021,4,Apr,15,BBP,Tompkins Square Park,1,,1,,,9,Manhattan,M-03,PARK,false,2021-04-11 16:59:40.0000000,M&O MS Forms
M-004708,M088,M088,10/28/2022 12:00:00 AM,AM,2022,10,Oct,44,BBP,Tompkins Square Park,4,,4,,,9,Manhattan,M-03,PARK,false,2022-10-28 18:43:12.0000000,M&O MS Forms
M-004707,M088,M088,10/28/2022 12:00:00 AM,AM,2022,10,Oct,44,BBP,Tompkins Square Park,25,,25,,,9,Manhattan,M-03,PARK,false,2022-10-28 18:42:09.0000000,M&O MS Forms
M-004706,M088,M088,10/28/2022 12:00:00 AM,AM,2022,10,Oct,44,BBP,Tompkins Square Park,5,,5,,,9,Manhattan,M-03,PARK,false,2022-10-28 18:40:56.0000000,M&O MS Forms
M-004705,M088,M088,10/28/2022 12:00:00 AM,AM,2022,10,Oct,44,BBP,Tompkins Square Park,8,,8,,,9,Manhattan,M-03,PARK,false,2022-10-28 18:40:00.0000000,M&O MS Forms
M-004712,M088,M088,10/29/2022 12:00:00 AM,AM,2022,10,Oct,44,BBP,Tompkins Square Park,10,,10,,,9,Manhattan,M-03,PARK,false,2022-10-29 16:56:56.0000000,M&O MS Forms
M-004711,M088,M088,10/29/2022 12:00:00 AM,AM,2022,10,Oct,44,BBP,Tompkins Square Park,3,,3,,,9,Manhattan,M-03,PARK,false,2022-10-29 16:56:09.0000000,M&O MS Forms
X-0005.0,,,12/06/2020 12:00:00 AM,AM,2020,12,Dec,50,Parks,,50,,50,,,,,X-04,,false,2020-12-10 23:39:56.0000000,M&O MS Forms
X-0004.0,,,12/06/2020 12:00:00 AM,AM,2020,12,Dec,50,Parks,,50,,50,,,,,X-03,,false,2020-12-10 23:39:42.0000000,M&O MS Forms
X-0006.0,,,12/07/2020 12:00:00 AM,AM,2020,12,Dec,50,Parks,,6,,6,,,,,X-02,,false,2020-12-10 23:40:14.0000000,M&O MS Forms
X-0003.0,,,12/09/2020 12:00:00 AM,AM,2020,12,Dec,50,Parks,,10,,10,,,,,X-02,,false,2020-12-10 23:39:28.0000000,M&O MS Forms
X-0008.0,,,12/10/2020 12:00:00 AM,PM,2020,12,Dec,50,Parks,,60,,60,,,,,X-08,,false,2020-12-10 23:44:17.0000000,M&O MS Forms
X-0007.0,,,12/10/2020 12:00:00 AM,AM,2020,12,Dec,50,Parks,,509,,509,,,,,X-07,,false,2020-12-10 23:40:31.0000000,M&O MS Forms
M-002691,,,03/31/2022 12:00:00 AM,AM,2022,3,Mar,14,Parks,,54,,54,,,,,,,false,2022-04-01 15:56:43.0000000,M&O MS Forms
M-002629,,,03/26/2022 12:00:00 AM,AM,2022,3,Mar,13,Parks,,9,,9,,,,,,,false,2022-03-26 19:24:47.0000000,M&O MS Forms
M-002337,,,02/23/2022 12:00:00 AM,AM,2022,2,Feb,9,Parks,,9,,9,,,,,,,false,2022-02-28 12:05:50.0000000,M&O MS Forms
M-004474,,,09/30/2022 12:00:00 AM,AM,2022,9,Sep,40,Parks,,4,,4,,,,,,,false,2022-10-11 07:09:31.0000000,M&O MS Forms
M-004367,,,09/22/2022 12:00:00 AM,AM,2022,9,Sep,39,Parks,,7,,7,,,,,,,false,2022-09-23 05:28:49.0000000,M&O MS Forms
M-005511,,,01/17/2023 12:00:00 AM,AM,2023,1,Jan,3,Parks,,5,,5,,,,,,,false,2023-01-23 16:13:13.0000000,M&O MS Forms
X-4460.0,,,12/19/2022 12:00:00 AM,AM,2022,12,Dec,52,BBP,,5,,5,,,,,X-02,,false,2022-12-19 14:33:09.0000000,M&O MS Forms
X-4269.0,,,11/14/2022 12:00:00 AM,PM,2022,11,Nov,47,BBP,,234,,234,,,,,X-04,,false,2022-11-18 09:18:51.0000000,M&O MS Forms
X-4270.0,,,11/16/2022 12:00:00 AM,PM,2022,11,Nov,47,BBP,,117,,117,,,,,X-04,,false,2022-11-18 09:22:04.0000000,M&O MS Forms
X-4271.0,,,11/17/2022 12:00:00 AM,PM,2022,11,Nov,47,BBP,,437,,437,,,,,X-04,,false,2022-11-18 09:23:47.0000000,M&O MS Forms
X-0182.0,,,04/01/2021 12:00:00 AM,AM,2021,4,Apr,14,BBP,,23,,23,,,,,X-06,,false,2021-04-01 19:05:29.0000000,M&O MS Forms
M-000716,,,04/11/2021 12:00:00 AM,AM,2021,4,Apr,16,Parks,,27,,27,,,,,M-03,,false,2021-08-15 09:34:53.0000000,M&O MS Forms
M-002613,,,03/25/2022 12:00:00 AM,PM,2022,3,Mar,13,BBP,,12,,12,,,,,M-11,,false,2022-03-25 19:11:05.0000000,M&O MS Forms
X-2656.0,,,04/24/2022 12:00:00 AM,AM,2022,4,Apr,18,Parks,,18,,18,,,,,X-04,,false,2022-04-24 11:24:01.0000000,M&O MS Forms
X-3936.0,,,09/30/2022 12:00:00 AM,AM,2022,9,Sep,40,Parks,,78,,78,,,,,X-07,,false,2022-10-02 08:06:30.0000000,M&O MS Forms
X-3940.0,,,10/01/2022 12:00:00 AM,AM,2022,10,Oct,40,Parks,,74,,74,,,,,X-07,,false,2022-10-02 08:11:18.0000000,M&O MS Forms
X-4063.0,,,10/16/2022 12:00:00 AM,AM,2022,10,Oct,43,Parks,,97,,97,,,,,X-07,,false,2022-10-18 06:35:15.0000000,M&O MS Forms
X-3884.0,,,09/16/2022 12:00:00 AM,AM,2022,9,Sep,38,BBP,,78,,78,,,,,X-07,,false,2022-09-22 06:49:18.0000000,M&O MS Forms
X-3887.0,,,09/17/2022 12:00:00 AM,AM,2022,9,Sep,38,Parks,,23,,23,,,,,X-07,,false,2022-09-22 06:52:10.0000000,M&O MS Forms
X-3875.0,,,09/11/2022 12:00:00 AM,AM,2022,9,Sep,38,Parks,,65,,65,,,,,X-07,,false,2022-09-22 06:40:53.0000000,M&O MS Forms
X-3877.0,,,09/12/2022 12:00:00 AM,AM,2022,9,Sep,38,Parks,,54,,54,,,,,X-07,,false,2022-09-22 06:42:57.0000000,M&O MS Forms
X-3881.0,,,09/14/2022 12:00:00 AM,AM,2022,9,Sep,38,Parks,,61,,61,,,,,X-07,,false,2022-09-22 06:46:47.0000000,M&O MS Forms
X-3659.0,,,08/29/2022 12:00:00 AM,AM,2022,8,Aug,36,Parks,,88,,88,,,,,X-07,,false,2022-08-31 05:07:57.0000000,M&O MS Forms
X-3746.0,,,09/04/2022 12:00:00 AM,AM,2022,9,Sep,37,Parks,,56,,56,,,,,X-07,,false,2022-09-08 09:05:02.0000000,M&O MS Forms
X-3748.0,,,09/05/2022 12:00:00 AM,AM,2022,9,Sep,37,Parks,,78,,78,,,,,X-07,,false,2022-09-08 09:06:01.0000000,M&O MS Forms
X-3750.0,,,09/06/2022 12:00:00 AM,AM,2022,9,Sep,37,Parks,,67,,67,,,,,X-07,,false,2022-09-08 09:07:21.0000000,M&O MS Forms
X-3752.0,,,09/07/2022 12:00:00 AM,AM,2022,9,Sep,37,BBP,,48,,48,,,,,X-07,,false,2022-09-08 09:08:41.0000000,M&O MS Forms
X-4189.0,,,11/06/2022 12:00:00 AM,AM,2022,11,Nov,46,Parks,,53,,53,,,,,X-07,,false,2022-11-06 12:00:26.0000000,M&O MS Forms
X-4191.0,,,11/06/2022 12:00:00 AM,PM,2022,11,Nov,46,Parks,,23,,23,,,,,X-07,,false,2022-11-06 12:03:35.0000000,M&O MS Forms
X-4140.0,,,10/30/2022 12:00:00 AM,AM,2022,10,Oct,45,Parks,,98,,98,,,,,X-07,,false,2022-11-01 12:52:00.0000000,M&O MS Forms
M-004010,M010,M010,08/16/2022 12:00:00 AM,AM,2022,8,Aug,34,BBP,Central Park,2,,2,,,18,Manhattan,M-13,PARK,false,2022-08-18 05:24:49.0000000,M&O MS Forms
M-004009,M010,M010,08/16/2022 12:00:00 AM,AM,2022,8,Aug,34,BBP,Central Park,1,,1,,,18,Manhattan,M-13,PARK,false,2022-08-18 05:24:19.0000000,M&O MS Forms
M-004008,M010,M010,08/16/2022 12:00:00 AM,AM,2022,8,Aug,34,BBP,Central Park,1,,1,,,18,Manhattan,M-13,PARK,false,2022-08-18 05:23:39.0000000,M&O MS Forms
M-003909,M010,M010,08/05/2022 12:00:00 AM,AM,2022,8,Aug,32,BBP,Central Park,1,,1,,,18,Manhattan,M-13,PARK,false,2022-08-05 11:33:10.0000000,M&O MS Forms
M-003908,M010,M010,08/05/2022 12:00:00 AM,AM,2022,8,Aug,32,BBP,Central Park,1,,1,,,18,Manhattan,M-13,PARK,false,2022-08-05 11:32:26.0000000,M&O MS Forms
M-003907,M010,M010,08/04/2022 12:00:00 AM,AM,2022,8,Aug,32,BBP,Central Park,1,,1,,,18,Manhattan,M-13,PARK,false,2022-08-05 11:31:31.0000000,M&O MS Forms
M-003906,M010,M010,08/03/2022 12:00:00 AM,AM,2022,8,Aug,32,BBP,Central Park,6,,6,,,18,Manhattan,M-13,PARK,false,2022-08-05 11:30:34.0000000,M&O MS Forms
M-003905,M010,M010,08/02/2022 12:00:00 AM,AM,2022,8,Aug,32,BBP,Central Park,23,,23,,,18,Manhattan,M-13,PARK,false,2022-08-05 11:29:45.0000000,M&O MS Forms
M-003904,M010,M010,08/02/2022 12:00:00 AM,AM,2022,8,Aug,32,BBP,Central Park,20,,20,,,18,Manhattan,M-13,PARK,false,2022-08-05 11:29:13.0000000,M&O MS Forms
M-003798,M010,M010,07/26/2022 12:00:00 AM,AM,2022,7,Jul,31,BBP,Central Park,4,,4,,,18,Manhattan,M-13,PARK,false,2022-07-29 08:17:06.0000000,M&O MS Forms
M-003797,M010,M010,07/27/2022 12:00:00 AM,AM,2022,7,Jul,31,BBP,Central Park,2,,2,,,18,Manhattan,M-13,PARK,false,2022-07-29 08:16:21.0000000,M&O MS Forms
M-003796,M010,M010,07/25/2022 12:00:00 AM,AM,2022,7,Jul,31,BBP,Central Park,2,,2,,,18,Manhattan,M-13,PARK,false,2022-07-29 08:15:05.0000000,M&O MS Forms
M-003795,M010,M010,07/22/2022 12:00:00 AM,AM,2022,7,Jul,30,BBP,Central Park,5,,5,,,18,Manhattan,M-13,PARK,false,2022-07-29 08:13:42.0000000,M&O MS Forms
M-003482,M010,M010,06/22/2022 12:00:00 AM,AM,2022,6,Jun,26,BBP,Central Park,3,,3,,,18,Manhattan,M-13,PARK,false,2022-06-24 08:05:21.0000000,M&O MS Forms
M-003481,M010,M010,06/22/2022 12:00:00 AM,AM,2022,6,Jun,26,BBP,Central Park,1,,1,,,18,Manhattan,M-13,PARK,false,2022-06-24 08:04:34.0000000,M&O MS Forms
M-003287,M010,M010,06/02/2022 12:00:00 AM,AM,2022,6,Jun,23,BBP,Central Park,1,,1,,,18,Manhattan,M-13,PARK,false,2022-06-02 10:48:08.0000000,M&O MS Forms
M-003286,M010,M010,06/02/2022 12:00:00 AM,AM,2022,6,Jun,23,BBP,Central Park,1,,1,,,18,Manhattan,M-13,PARK,false,2022-06-02 10:47:30.0000000,M&O MS Forms
M-003285,M010,M010,05/31/2022 12:00:00 AM,AM,2022,5,May,23,BBP,Central Park,2,,2,,,18,Manhattan,M-13,PARK,false,2022-06-02 10:46:33.0000000,M&O MS Forms
M-002315,M010,M010,02/24/2022 12:00:00 AM,AM,2022,2,Feb,9,BBP,Central Park,2,,2,,,18,Manhattan,M-13,PARK,false,2022-02-25 10:57:41.0000000,M&O MS Forms
M-002393,M010,M010,03/03/2022 12:00:00 AM,AM,2022,3,Mar,10,BBP,Central Park,3,,3,,,18,Manhattan,M-13,PARK,false,2022-03-04 08:38:39.0000000,M&O MS Forms
M-002607,M010,M010,03/25/2022 12:00:00 AM,AM,2022,3,Mar,13,BBP,Central Park,,,,,,18,Manhattan,M-13,PARK,false,2022-03-25 07:05:03.0000000,M&O MS Forms
M-002640,M010,M010,03/28/2022 12:00:00 AM,AM,2022,3,Mar,14,BBP,Central Park,1,,1,,,18,Manhattan,M-13,PARK,false,2022-03-28 11:29:13.0000000,M&O MS Forms
M-002639,M010,M010,03/16/2022 12:00:00 AM,AM,2022,3,Mar,12,BBP,Central Park,9,,9,,,18,Manhattan,M-13,PARK,false,2022-03-28 11:28:26.0000000,M&O MS Forms
M-002638,M010,M010,03/11/2022 12:00:00 AM,AM,2022,3,Mar,11,BBP,Central Park,2,,2,,,18,Manhattan,M-13,PARK,false,2022-03-28 11:26:30.0000000,M&O MS Forms
M-002530,M010,M010,03/18/2022 12:00:00 AM,AM,2022,3,Mar,12,BBP,Central Park,,,,,,18,Manhattan,M-13,PARK,false,2022-03-18 07:14:26.0000000,M&O MS Forms
M-003778,M037,M037-03,07/21/2022 12:00:00 AM,AM,2022,7,Jul,30,Parks,Highbridge Park,8,,8,,,34,Manhattan,M-12A,PLGD,true,2022-07-23 15:34:53.0000000,M&O MS Forms
M-003769,M037,M037-03,07/20/2022 12:00:00 AM,AM,2022,7,Jul,30,Parks,Highbridge Park,5,,5,,,34,Manhattan,M-12A,PLGD,true,2022-07-23 15:31:37.0000000,M&O MS Forms
M-003869,M037,M037-03,07/31/2022 12:00:00 AM,AM,2022,7,Jul,32,Parks,Highbridge Park,5,,5,,,34,Manhattan,M-12A,PLGD,true,2022-07-31 16:59:26.0000000,M&O MS Forms
M-003860,M037,M037-03,07/30/2022 12:00:00 AM,AM,2022,7,Jul,31,Parks,Highbridge Park,4,,4,,,34,Manhattan,M-12A,PLGD,true,2022-07-31 09:45:15.0000000,M&O MS Forms
M-003851,M037,M037-03,07/29/2022 12:00:00 AM,AM,2022,7,Jul,31,Parks,Highbridge Park,8,,8,,,34,Manhattan,M-12A,PLGD,true,2022-07-29 16:14:51.0000000,M&O MS Forms
M-003842,M037,M037-03,07/28/2022 12:00:00 AM,AM,2022,7,Jul,31,Parks,Highbridge Park,5,,5,,,34,Manhattan,M-12A,PLGD,true,2022-07-29 16:08:13.0000000,M&O MS Forms
M-003833,M037,M037-03,07/27/2022 12:00:00 AM,AM,2022,7,Jul,31,Parks,Highbridge Park,1,,1,,,34,Manhattan,M-12A,PLGD,true,2022-07-29 16:05:32.0000000,M&O MS Forms
M-003825,M037,M037-03,07/26/2022 12:00:00 AM,AM,2022,7,Jul,31,Parks,Highbridge Park,5,,5,,,34,Manhattan,M-12A,PLGD,true,2022-07-29 16:02:57.0000000,M&O MS Forms
M-004721,M037,M037-03,10/27/2022 12:00:00 AM,AM,2022,10,Oct,44,Parks,Highbridge Park,38,,38,,,34,Manhattan,M-12A,PLGD,true,2022-10-30 13:19:52.0000000,M&O MS Forms
M-004704,M037,M037-03,10/26/2022 12:00:00 AM,AM,2022,10,Oct,44,Parks,Highbridge Park,9,,9,,,34,Manhattan,M-12A,PLGD,true,2022-10-27 05:28:29.0000000,M&O MS Forms
M-004695,M037,M037-03,10/25/2022 12:00:00 AM,AM,2022,10,Oct,44,Parks,Highbridge Park,9,,9,,,34,Manhattan,M-12A,PLGD,true,2022-10-26 05:52:14.0000000,M&O MS Forms
M-004685,M037,M037-03,10/24/2022 12:00:00 AM,AM,2022,10,Oct,44,Parks,Highbridge Park,10,,10,,,34,Manhattan,M-12A,PLGD,true,2022-10-25 06:33:54.0000000,M&O MS Forms
M-004677,M037,M037-03,10/23/2022 12:00:00 AM,AM,2022,10,Oct,44,Parks,Highbridge Park,1,,1,,,34,Manhattan,M-12A,PLGD,true,2022-10-25 06:26:34.0000000,M&O MS Forms
M-004668,M037,M037-03,10/22/2022 12:00:00 AM,AM,2022,10,Oct,43,Parks,Highbridge Park,11,,11,,,34,Manhattan,M-12A,PLGD,true,2022-10-25 06:16:59.0000000,M&O MS Forms
M-004659,M037,M037-03,10/21/2022 12:00:00 AM,AM,2022,10,Oct,43,Parks,Highbridge Park,8,,8,,,34,Manhattan,M-12A,PLGD,true,2022-10-25 06:13:39.0000000,M&O MS Forms
M-004650,M037,M037-03,10/20/2022 12:00:00 AM,AM,2022,10,Oct,43,Parks,Highbridge Park,9,,9,,,34,Manhattan,M-12A,PLGD,true,2022-10-25 06:11:08.0000000,M&O MS Forms
M-004641,M037,M037-03,10/19/2022 12:00:00 AM,AM,2022,10,Oct,43,Parks,Highbridge Park,7,,7,,,34,Manhattan,M-12A,PLGD,true,2022-10-25 06:08:40.0000000,M&O MS Forms
M-004632,M037,M037-03,10/18/2022 12:00:00 AM,AM,2022,10,Oct,43,Parks,Highbridge Park,6,,6,,,34,Manhattan,M-12A,PLGD,true,2022-10-25 06:06:05.0000000,M&O MS Forms
M-004613,M037,M037-03,10/17/2022 12:00:00 AM,AM,2022,10,Oct,43,Parks,Highbridge Park,5,,5,,,34,Manhattan,M-12A,PLGD,true,2022-10-19 06:42:58.0000000,M&O MS Forms
M-004603,M037,M037-03,10/16/2022 12:00:00 AM,AM,2022,10,Oct,43,Parks,Highbridge Park,10,,10,,,34,Manhattan,M-12A,PLGD,true,2022-10-19 06:38:07.0000000,M&O MS Forms
M-003268,M037,M037-03,05/29/2022 12:00:00 AM,AM,2022,5,May,23,Parks,Highbridge Park,6,,6,,,34,Manhattan,M-12A,PLGD,true,2022-05-30 10:41:06.0000000,M&O MS Forms
M-003259,M037,M037-03,05/28/2022 12:00:00 AM,AM,2022,5,May,22,Parks,Highbridge Park,7,,7,,,34,Manhattan,M-12A,PLGD,true,2022-05-30 10:37:35.0000000,M&O MS Forms
M-003247,M037,M037-03,05/27/2022 12:00:00 AM,AM,2022,5,May,22,Parks,Highbridge Park,3,,3,,,34,Manhattan,M-12A,PLGD,true,2022-05-28 10:57:53.0000000,M&O MS Forms
M-003238,M037,M037-03,05/26/2022 12:00:00 AM,AM,2022,5,May,22,Parks,Highbridge Park,3,,3,,,34,Manhattan,M-12A,PLGD,true,2022-05-28 10:55:34.0000000,M&O MS Forms
M-003229,M037,M037-03,05/25/2022 12:00:00 AM,AM,2022,5,May,22,Parks,Highbridge Park,2,,2,,,34,Manhattan,M-12A,PLGD,true,2022-05-28 10:52:49.0000000,M&O MS Forms
M-003357,M037,M037-03,06/05/2022 12:00:00 AM,AM,2022,6,Jun,24,Parks,Highbridge Park,5,,5,,,34,Manhattan,M-12A,PLGD,true,2022-06-06 19:45:15.0000000,M&O MS Forms
M-003348,M037,M037-03,06/04/2022 12:00:00 AM,AM,2022,6,Jun,23,Parks,Highbridge Park,10,,10,,,34,Manhattan,M-12A,PLGD,true,2022-06-06 19:35:36.0000000,M&O MS Forms
M-003339,M037,M037-03,06/03/2022 12:00:00 AM,AM,2022,6,Jun,23,Parks,Highbridge Park,4,,4,,,34,Manhattan,M-12A,PLGD,true,2022-06-06 19:32:11.0000000,M&O MS Forms
M-003330,M037,M037-03,06/02/2022 12:00:00 AM,AM,2022,6,Jun,23,Parks,Highbridge Park,3,,3,,,34,Manhattan,M-12A,PLGD,true,2022-06-06 19:29:02.0000000,M&O MS Forms
M-003320,M037,M037-03,06/01/2022 12:00:00 AM,AM,2022,6,Jun,23,Parks,Highbridge Park,4,,4,,,34,Manhattan,M-12A,PLGD,true,2022-06-06 19:24:03.0000000,M&O MS Forms
M-003312,M037,M037-03,05/31/2022 12:00:00 AM,AM,2022,5,May,23,Parks,Highbridge Park,7,,7,,,34,Manhattan,M-12A,PLGD,true,2022-06-06 19:20:40.0000000,M&O MS Forms
M-003302,M037,M037-03,05/30/2022 12:00:00 AM,AM,2022,5,May,23,Parks,Highbridge Park,2,,2,,,34,Manhattan,M-12A,PLGD,true,2022-06-06 19:16:33.0000000,M&O MS Forms
M-003492,M037,M037-03,06/20/2022 12:00:00 AM,AM,2022,6,Jun,26,Parks,Highbridge Park,3,,3,,,34,Manhattan,M-12A,PLGD,true,2022-06-26 13:13:52.0000000,M&O MS Forms
M-004175,M037,M037-03,08/29/2022 12:00:00 AM,AM,2022,8,Aug,36,Parks,Highbridge Park,7,,7,,,34,Manhattan,M-12A,PLGD,true,2022-09-02 13:07:54.0000000,M&O MS Forms
M-004183,M037,M037-03,08/30/2022 12:00:00 AM,AM,2022,8,Aug,36,Parks,Highbridge Park,10,,10,,,34,Manhattan,M-12A,PLGD,true,2022-09-02 15:18:12.0000000,M&O MS Forms
M-001880,M037,M037-03,01/01/2022 12:00:00 AM,AM,2022,1,Jan,1,Parks,Highbridge Park,7,,7,,,34,Manhattan,M-12A,PLGD,true,2022-01-02 19:00:51.0000000,M&O MS Forms
M-004594,M037,M037-03,10/15/2022 12:00:00 AM,AM,2022,10,Oct,42,Parks,Highbridge Park,3,,3,,,34,Manhattan,M-12A,PLGD,true,2022-10-19 05:44:10.0000000,M&O MS Forms
M-004585,M037,M037-03,10/14/2022 12:00:00 AM,AM,2022,10,Oct,42,Parks,Highbridge Park,9,,9,,,34,Manhattan,M-12A,PLGD,true,2022-10-19 05:41:15.0000000,M&O MS Forms
M-004576,M037,M037-03,10/13/2022 12:00:00 AM,AM,2022,10,Oct,42,Parks,Highbridge Park,11,,11,,,34,Manhattan,M-12A,PLGD,true,2022-10-19 05:38:20.0000000,M&O MS Forms
M-004558,M037,M037-03,10/11/2022 12:00:00 AM,AM,2022,10,Oct,42,Parks,Highbridge Park,15,,15,,,34,Manhattan,M-12A,PLGD,true,2022-10-11 16:50:56.0000000,M&O MS Forms
M-004549,M037,M037-03,10/08/2022 12:00:00 AM,AM,2022,10,Oct,41,Parks,Highbridge Park,15,,15,,,34,Manhattan,M-12A,PLGD,true,2022-10-11 15:26:58.0000000,M&O MS Forms
M-004539,M037,M037-03,10/07/2022 12:00:00 AM,AM,2022,10,Oct,41,Parks,Highbridge Park,10,,10,,,34,Manhattan,M-12A,PLGD,true,2022-10-11 15:23:52.0000000,M&O MS Forms
M-004530,M037,M037-03,10/06/2022 12:00:00 AM,AM,2022,10,Oct,41,Parks,Highbridge Park,2,,2,,,34,Manhattan,M-12A,PLGD,true,2022-10-11 15:21:07.0000000,M&O MS Forms
M-004523,M037,M037-03,10/05/2022 12:00:00 AM,AM,2022,10,Oct,41,Parks,Highbridge Park,4,,4,,,34,Manhattan,M-12A,PLGD,true,2022-10-11 15:18:54.0000000,M&O MS Forms
M-004516,M037,M037-03,10/04/2022 12:00:00 AM,AM,2022,10,Oct,41,Parks,Highbridge Park,6,,6,,,34,Manhattan,M-12A,PLGD,true,2022-10-11 15:16:42.0000000,M&O MS Forms
M-004400,M037,M037-03,09/26/2022 12:00:00 AM,AM,2022,9,Sep,40,Parks,Highbridge Park,15,,15,,,34,Manhattan,M-12A,PLGD,true,2022-09-26 06:11:01.0000000,M&O MS Forms
M-004507,M037,M037-03,10/03/2022 12:00:00 AM,AM,2022,10,Oct,41,Parks,Highbridge Park,5,,5,,,34,Manhattan,M-12A,PLGD,true,2022-10-11 15:13:54.0000000,M&O MS Forms
M-004497,M037,M037-03,10/02/2022 12:00:00 AM,AM,2022,10,Oct,41,Parks,Highbridge Park,3,,3,,,34,Manhattan,M-12A,PLGD,true,2022-10-11 07:20:58.0000000,M&O MS Forms
M-004488,M037,M037-03,10/01/2022 12:00:00 AM,AM,2022,10,Oct,40,Parks,Highbridge Park,3,,3,,,34,Manhattan,M-12A,PLGD,true,2022-10-11 07:16:59.0000000,M&O MS Forms
M-003886,M037,M037-03,08/02/2022 12:00:00 AM,AM,2022,8,Aug,32,Parks,Highbridge Park,5,,5,,,34,Manhattan,M-12A,PLGD,true,2022-08-04 15:32:07.0000000,M&O MS Forms
M-003878,M037,M037-03,08/01/2022 12:00:00 AM,AM,2022,8,Aug,32,Parks,Highbridge Park,6,,6,,,34,Manhattan,M-12A,PLGD,true,2022-08-04 15:29:43.0000000,M&O MS Forms
M-004456,M037,M037-03,09/28/2022 12:00:00 AM,AM,2022,9,Sep,40,Parks,Highbridge Park,11,,11,,,34,Manhattan,M-12A,PLGD,true,2022-10-11 07:02:41.0000000,M&O MS Forms
M-004457,M037,M037-03,09/28/2022 12:00:00 AM,AM,2022,9,Sep,40,Parks,Highbridge Park,11,,11,,,34,Manhattan,M-12A,PLGD,true,2022-10-11 07:02:41.0000000,M&O MS Forms
M-004447,M037,M037-03,09/27/2022 12:00:00 AM,AM,2022,9,Sep,40,Parks,Highbridge Park,12,,12,,,34,Manhattan,M-12A,PLGD,true,2022-10-11 06:55:10.0000000,M&O MS Forms
M-004438,M037,M037-03,10/10/2022 12:00:00 AM,AM,2022,10,Oct,42,Parks,Highbridge Park,3,,3,,,34,Manhattan,M-12A,PLGD,true,2022-10-11 06:20:18.0000000,M&O MS Forms
M-004429,M037,M037-03,10/09/2022 12:00:00 AM,AM,2022,10,Oct,42,Parks,Highbridge Park,5,,5,,,34,Manhattan,M-12A,PLGD,true,2022-10-11 06:15:41.0000000,M&O MS Forms
M-005780,M037,M037-03,02/15/2023 12:00:00 AM,AM,2023,2,Feb,7,Parks,Highbridge Park,5,,5,,,34,Manhattan,M-12A,PLGD,true,2023-02-15 16:33:00.0000000,M&O MS Forms
M-004763,M037,M037-03,10/30/2022 12:00:00 AM,AM,2022,10,Oct,45,Parks,Highbridge Park,6,,6,,,34,Manhattan,M-12A,PLGD,true,2022-11-05 13:59:49.0000000,M&O MS Forms
M-005771,M037,M037-03,02/14/2023 12:00:00 AM,AM,2023,2,Feb,7,Parks,Highbridge Park,3,,3,,,34,Manhattan,M-12A,PLGD,true,2023-02-15 16:30:05.0000000,M&O MS Forms
M-005762,M037,M037-03,02/13/2023 12:00:00 AM,AM,2023,2,Feb,7,Parks,Highbridge Park,4,,4,,,34,Manhattan,M-12A,PLGD,true,2023-02-14 05:50:41.0000000,M&O MS Forms
M-003895,M037,M037-03,08/03/2022 12:00:00 AM,AM,2022,8,Aug,32,Parks,Highbridge Park,8,,8,,,34,Manhattan,M-12A,PLGD,true,2022-08-04 15:34:37.0000000,M&O MS Forms
M-003903,M037,M037-03,08/04/2022 12:00:00 AM,AM,2022,8,Aug,32,Parks,Highbridge Park,10,,10,,,34,Manhattan,M-12A,PLGD,true,2022-08-04 15:37:02.0000000,M&O MS Forms
M-003923,M037,M037-03,08/05/2022 12:00:00 AM,AM,2022,8,Aug,32,Parks,Highbridge Park,4,,4,,,34,Manhattan,M-12A,PLGD,true,2022-08-09 08:52:03.0000000,M&O MS Forms
M-003958,M037,M037-03,08/09/2022 12:00:00 AM,AM,2022,8,Aug,33,Parks,Highbridge Park,5,,5,,,34,Manhattan,M-12A,PLGD,true,2022-08-09 18:28:28.0000000,M&O MS Forms
M-003940,M037,M037-03,08/07/2022 12:00:00 AM,AM,2022,8,Aug,33,Parks,Highbridge Park,8,,8,,,34,Manhattan,M-12A,PLGD,true,2022-08-09 08:57:46.0000000,M&O MS Forms
M-003932,M037,M037-03,08/06/2022 12:00:00 AM,AM,2022,8,Aug,32,Parks,Highbridge Park,7,,7,,,34,Manhattan,M-12A,PLGD,true,2022-08-09 08:54:56.0000000,M&O MS Forms
M-006008,M037,M037-03,03/10/2023 12:00:00 AM,AM,2023,3,Mar,10,Parks,Highbridge Park,2,,2,,,34,Manhattan,M-12A,PLGD,true,2023-03-11 15:59:54.0000000,M&O MS Forms
M-005998,M037,M037-03,03/09/2023 12:00:00 AM,AM,2023,3,Mar,10,Parks,Highbridge Park,6,,6,,,34,Manhattan,M-12A,PLGD,true,2023-03-09 15:48:22.0000000,M&O MS Forms
M-005999,M037,M037-03,03/09/2023 12:00:00 AM,AM,2023,3,Mar,10,Parks,Highbridge Park,6,,6,,,34,Manhattan,M-12A,PLGD,true,2023-03-09 15:48:22.0000000,M&O MS Forms
M-006017,M037,M037-03,03/11/2023 12:00:00 AM,AM,2023,3,Mar,10,Parks,Highbridge Park,1,,1,,,34,Manhattan,M-12A,PLGD,true,2023-03-11 16:05:24.0000000,M&O MS Forms
M-006027,M037,M037-03,03/12/2023 12:00:00 AM,AM,2023,3,Mar,11,Parks,Highbridge Park,2,,2,,,34,Manhattan,M-12A,PLGD,true,2023-03-12 17:23:43.0000000,M&O MS Forms
M-006036,M037,M037-03,03/13/2023 12:00:00 AM,AM,2023,3,Mar,11,Parks,Highbridge Park,5,,5,,,34,Manhattan,M-12A,PLGD,true,2023-03-13 16:14:57.0000000,M&O MS Forms
M-006047,M037,M037-03,03/14/2023 12:00:00 AM,AM,2023,3,Mar,11,Parks,Highbridge Park,6,,6,,,34,Manhattan,M-12A,PLGD,true,2023-03-14 16:01:58.0000000,M&O MS Forms
M-006056,M037,M037-03,03/15/2023 12:00:00 AM,AM,2023,3,Mar,11,Parks,Highbridge Park,3,,3,,,34,Manhattan,M-12A,PLGD,true,2023-03-15 17:13:02.0000000,M&O MS Forms
M-000312,M037,M037-04,05/28/2021 12:00:00 AM,AM,2021,5,May,22,Parks,Highbridge Park,3,,3,,,34,Manhattan,M-12A,PLGD,true,2021-05-29 08:53:39.0000000,M&O MS Forms
M-000192,M037,M037-04,05/05/2021 12:00:00 AM,AM,2021,5,May,19,Parks,Highbridge Park,4,,4,,,34,Manhattan,M-12A,PLGD,true,2021-05-07 19:42:50.0000000,M&O MS Forms
M-000155,M037,M037-04,04/30/2021 12:00:00 AM,AM,2021,4,Apr,18,Parks,Highbridge Park,4,,4,,,34,Manhattan,M-12A,PLGD,true,2021-04-30 23:22:09.0000000,M&O MS Forms
M-000141,M037,M037-04,04/26/2021 12:00:00 AM,AM,2021,4,Apr,18,Parks,Highbridge Park,4,,4,,,34,Manhattan,M-12A,PLGD,true,2021-04-30 23:13:40.0000000,M&O MS Forms
M-000048,M037,M037-04,04/08/2021 12:00:00 AM,AM,2021,4,Apr,15,Parks,Highbridge Park,4,,4,,,34,Manhattan,M-12A,PLGD,true,2021-04-11 00:33:29.0000000,M&O MS Forms
M-000036,M037,M037-04,04/04/2021 12:00:00 AM,AM,2021,4,Apr,15,Parks,Highbridge Park,1,,1,,,34,Manhattan,M-12A,PLGD,true,2021-04-11 00:27:10.0000000,M&O MS Forms
M-000632,M037,M037-11,08/03/2021 12:00:00 AM,AM,2021,8,Aug,32,Parks,Highbridge Park,2,,2,,,34,Manhattan,M-12A,ZONE,true,2021-08-09 08:20:49.0000000,M&O MS Forms
M-000486,M037,M037-ZN01,07/04/2021 12:00:00 AM,AM,2021,7,Jul,28,Parks,Highbridge Park,6,,6,,,33,Manhattan,M-12A,ZONE,true,2021-07-10 05:18:05.0000000,M&O MS Forms
M-000467,M037,M037-ZN01,07/01/2021 12:00:00 AM,PM,2021,7,Jul,27,Parks,Highbridge Park,2,,2,,,33,Manhattan,M-12A,ZONE,true,2021-07-04 04:43:54.0000000,M&O MS Forms
M-002769,M037,M037-ZN02,04/08/2022 12:00:00 AM,AM,2022,4,Apr,15,Parks,Highbridge Park,6,,6,,,2,Manhattan,M-12A,ZONE,true,2022-04-17 16:21:46.0000000,M&O MS Forms
M-002761,M037,M037-ZN02,04/07/2022 12:00:00 AM,AM,2022,4,Apr,15,Parks,Highbridge Park,5,,5,,,2,Manhattan,M-12A,ZONE,true,2022-04-17 16:19:03.0000000,M&O MS Forms
M-002199,M037,M037-ZN02,02/10/2022 12:00:00 AM,AM,2022,2,Feb,7,Parks,Highbridge Park,6,,6,,,2,Manhattan,M-12A,ZONE,true,2022-02-14 14:01:23.0000000,M&O MS Forms
M-002187,M037,M037-ZN02,02/09/2022 12:00:00 AM,AM,2022,2,Feb,7,Parks,Highbridge Park,2,,2,,,2,Manhattan,M-12A,ZONE,true,2022-02-11 09:20:50.0000000,M&O MS Forms
M-002180,M037,M037-ZN02,02/08/2022 12:00:00 AM,AM,2022,2,Feb,7,Parks,Highbridge Park,3,,3,,,2,Manhattan,M-12A,ZONE,true,2022-02-10 14:05:18.0000000,M&O MS Forms
M-002173,M037,M037-ZN02,02/06/2022 12:00:00 AM,AM,2022,2,Feb,7,Parks,Highbridge Park,2,,2,,,2,Manhattan,M-12A,ZONE,true,2022-02-10 08:46:04.0000000,M&O MS Forms
M-002208,M037,M037-ZN02,02/11/2022 12:00:00 AM,AM,2022,2,Feb,7,Parks,Highbridge Park,8,,8,,,2,Manhattan,M-12A,ZONE,true,2022-02-14 14:04:19.0000000,M&O MS Forms
M-002216,M037,M037-ZN02,02/12/2022 12:00:00 AM,AM,2022,2,Feb,7,Parks,Highbridge Park,10,,10,,,2,Manhattan,M-12A,ZONE,true,2022-02-14 14:06:54.0000000,M&O MS Forms
M-002230,M037,M037-ZN02,02/13/2022 12:00:00 AM,AM,2022,2,Feb,8,Parks,Highbridge Park,3,,3,,,2,Manhattan,M-12A,ZONE,true,2022-02-21 14:52:43.0000000,M&O MS Forms
M-002239,M037,M037-ZN02,02/14/2022 12:00:00 AM,AM,2022,2,Feb,8,Parks,Highbridge Park,2,,2,,,2,Manhattan,M-12A,ZONE,true,2022-02-21 14:55:25.0000000,M&O MS Forms
M-002258,M037,M037-ZN02,02/16/2022 12:00:00 AM,AM,2022,2,Feb,8,Parks,Highbridge Park,8,,8,,,2,Manhattan,M-12A,ZONE,true,2022-02-21 15:02:35.0000000,M&O MS Forms
M-002249,M037,M037-ZN02,02/15/2022 12:00:00 AM,AM,2022,2,Feb,8,Parks,Highbridge Park,5,,5,,,2,Manhattan,M-12A,ZONE,true,2022-02-21 14:59:28.0000000,M&O MS Forms
M-002267,M037,M037-ZN02,02/17/2022 12:00:00 AM,AM,2022,2,Feb,8,Parks,Highbridge Park,13,,13,,,2,Manhattan,M-12A,ZONE,true,2022-02-21 15:05:17.0000000,M&O MS Forms
M-002276,M037,M037-ZN02,02/18/2022 12:00:00 AM,AM,2022,2,Feb,8,Parks,Highbridge Park,7,,7,,,2,Manhattan,M-12A,ZONE,true,2022-02-21 15:08:33.0000000,M&O MS Forms
M-002290,M037,M037-ZN02,02/20/2022 12:00:00 AM,AM,2022,2,Feb,9,Parks,Highbridge Park,2,,2,,,2,Manhattan,M-12A,ZONE,true,2022-02-21 15:13:02.0000000,M&O MS Forms
M-002354,M037,M037-ZN02,02/25/2022 12:00:00 AM,AM,2022,2,Feb,9,Parks,Highbridge Park,2,,2,,,2,Manhattan,M-12A,ZONE,true,2022-02-28 12:11:10.0000000,M&O MS Forms
M-002345,M037,M037-ZN02,02/24/2022 12:00:00 AM,AM,2022,2,Feb,9,Parks,Highbridge Park,5,,5,,,2,Manhattan,M-12A,ZONE,true,2022-02-28 12:08:21.0000000,M&O MS Forms
M-002336,M037,M037-ZN02,02/23/2022 12:00:00 AM,AM,2022,2,Feb,9,Parks,Highbridge Park,9,,9,,,2,Manhattan,M-12A,ZONE,true,2022-02-28 12:05:29.0000000,M&O MS Forms
M-002327,M037,M037-ZN02,02/22/2022 12:00:00 AM,AM,2022,2,Feb,9,Parks,Highbridge Park,6,,6,,,2,Manhattan,M-12A,ZONE,true,2022-02-28 12:02:41.0000000,M&O MS Forms
M-002318,M037,M037-ZN02,02/21/2022 12:00:00 AM,AM,2022,2,Feb,9,Parks,Highbridge Park,4,,4,,,2,Manhattan,M-12A,ZONE,true,2022-02-28 12:00:11.0000000,M&O MS Forms
M-002409,M037,M037-ZN02,03/03/2022 12:00:00 AM,AM,2022,3,Mar,10,Parks,Highbridge Park,8,,8,,,2,Manhattan,M-12A,ZONE,true,2022-03-04 08:43:03.0000000,M&O MS Forms
M-002420,M037,M037-ZN02,03/04/2022 12:00:00 AM,AM,2022,3,Mar,10,Parks,Highbridge Park,2,,2,,,2,Manhattan,M-12A,ZONE,true,2022-03-06 19:36:38.0000000,M&O MS Forms
M-002374,M037,M037-ZN02,02/27/2022 12:00:00 AM,AM,2022,2,Feb,10,Parks,Highbridge Park,8,,8,,,2,Manhattan,M-12A,ZONE,true,2022-03-04 08:32:29.0000000,M&O MS Forms
M-002382,M037,M037-ZN02,02/28/2022 12:00:00 AM,AM,2022,2,Feb,10,Parks,Highbridge Park,1,,1,,,2,Manhattan,M-12A,ZONE,true,2022-03-04 08:34:45.0000000,M&O MS Forms
M-002391,M037,M037-ZN02,03/04/2022 12:00:00 AM,AM,2022,3,Mar,10,Parks,Highbridge Park,6,,6,,,2,Manhattan,M-12A,ZONE,true,2022-03-04 08:38:11.0000000,M&O MS Forms
M-002400,M037,M037-ZN02,03/02/2022 12:00:00 AM,AM,2022,3,Mar,10,Parks,Highbridge Park,3,,3,,,2,Manhattan,M-12A,ZONE,true,2022-03-04 08:40:23.0000000,M&O MS Forms
M-002566,M037,M037-ZN02,03/20/2022 12:00:00 AM,AM,2022,3,Mar,13,Parks,Highbridge Park,7,,7,,,2,Manhattan,M-12A,ZONE,true,2022-03-24 19:41:33.0000000,M&O MS Forms
M-002574,M037,M037-ZN02,03/21/2022 12:00:00 AM,AM,2022,3,Mar,13,Parks,Highbridge Park,2,,2,,,2,Manhattan,M-12A,ZONE,true,2022-03-24 19:45:10.0000000,M&O MS Forms
M-002583,M037,M037-ZN02,03/22/2022 12:00:00 AM,AM,2022,3,Mar,13,Parks,Highbridge Park,5,,5,,,2,Manhattan,M-12A,ZONE,true,2022-03-24 19:50:06.0000000,M&O MS Forms
M-002592,M037,M037-ZN02,03/23/2022 12:00:00 AM,AM,2022,3,Mar,13,Parks,Highbridge Park,1,,1,,,2,Manhattan,M-12A,ZONE,true,2022-03-24 19:53:58.0000000,M&O MS Forms
M-002627,M037,M037-ZN02,03/26/2022 12:00:00 AM,AM,2022,3,Mar,13,Parks,Highbridge Park,6,,6,,,2,Manhattan,M-12A,ZONE,true,2022-03-26 19:24:08.0000000,M&O MS Forms
M-002617,M037,M037-ZN02,03/25/2022 12:00:00 AM,AM,2022,3,Mar,13,Parks,Highbridge Park,8,,8,,,2,Manhattan,M-12A,ZONE,true,2022-03-26 19:20:47.0000000,M&O MS Forms
M-005097,M037,M037-ZN02,12/03/2022 12:00:00 AM,AM,2022,12,Dec,49,Parks,Highbridge Park,12,,12,,,2,Manhattan,M-12A,ZONE,true,2022-12-03 13:37:35.0000000,M&O MS Forms
M-005114,M037,M037-ZN02,12/04/2022 12:00:00 AM,AM,2022,12,Dec,50,Parks,Highbridge Park,5,,5,,,2,Manhattan,M-12A,ZONE,true,2022-12-07 16:51:08.0000000,M&O MS Forms
M-005123,M037,M037-ZN02,12/05/2022 12:00:00 AM,AM,2022,12,Dec,50,Parks,Highbridge Park,3,,3,,,2,Manhattan,M-12A,ZONE,true,2022-12-07 16:54:59.0000000,M&O MS Forms
M-005141,M037,M037-ZN02,12/07/2022 12:00:00 AM,AM,2022,12,Dec,50,Parks,Highbridge Park,8,,8,,,2,Manhattan,M-12A,ZONE,true,2022-12-07 17:12:03.0000000,M&O MS Forms
M-005132,M037,M037-ZN02,12/06/2022 12:00:00 AM,AM,2022,12,Dec,50,Parks,Highbridge Park,5,,5,,,2,Manhattan,M-12A,ZONE,true,2022-12-07 17:09:03.0000000,M&O MS Forms
M-005150,M037,M037-ZN02,12/08/2022 12:00:00 AM,AM,2022,12,Dec,50,Parks,Highbridge Park,14,,14,,,2,Manhattan,M-12A,ZONE,true,2022-12-08 16:56:14.0000000,M&O MS Forms
M-005159,M037,M037-ZN02,12/09/2022 12:00:00 AM,AM,2022,12,Dec,50,Parks,Highbridge Park,8,,8,,,2,Manhattan,M-12A,ZONE,true,2022-12-13 05:31:36.0000000,M&O MS Forms
M-005168,M037,M037-ZN02,12/10/2022 12:00:00 AM,AM,2022,12,Dec,50,Parks,Highbridge Park,107,,107,,,2,Manhattan,M-12A,ZONE,true,2022-12-13 05:35:08.0000000,M&O MS Forms
M-005177,M037,M037-ZN02,12/11/2022 12:00:00 AM,AM,2022,12,Dec,51,Parks,Highbridge Park,5,,5,,,2,Manhattan,M-12A,ZONE,true,2022-12-13 05:38:52.0000000,M&O MS Forms
M-005186,M037,M037-ZN02,12/12/2022 12:00:00 AM,AM,2022,12,Dec,51,Parks,Highbridge Park,8,,8,,,2,Manhattan,M-12A,ZONE,true,2022-12-13 05:42:05.0000000,M&O MS Forms
M-005195,M037,M037-ZN02,12/13/2022 12:00:00 AM,AM,2022,12,Dec,51,Parks,Highbridge Park,6,,6,,,2,Manhattan,M-12A,ZONE,true,2022-12-14 05:26:37.0000000,M&O MS Forms
M-005205,M037,M037-ZN02,12/14/2022 12:00:00 AM,AM,2022,12,Dec,51,Parks,Highbridge Park,8,,8,,,2,Manhattan,M-12A,ZONE,true,2022-12-14 15:42:03.0000000,M&O MS Forms
M-005223,M037,M037-ZN02,12/17/2022 12:00:00 AM,AM,2022,12,Dec,51,Parks,Highbridge Park,1,,1,,,2,Manhattan,M-12A,ZONE,true,2022-12-18 16:15:04.0000000,M&O MS Forms
M-005214,M037,M037-ZN02,12/16/2022 12:00:00 AM,AM,2022,12,Dec,51,Parks,Highbridge Park,3,,3,,,2,Manhattan,M-12A,ZONE,true,2022-12-18 16:11:20.0000000,M&O MS Forms
M-005236,M037,M037-ZN02,12/19/2022 12:00:00 AM,AM,2022,12,Dec,52,Parks,Highbridge Park,5,,5,,,2,Manhattan,M-12A,ZONE,true,2022-12-19 15:18:28.0000000,M&O MS Forms
M-005228,M037,M037-ZN02,12/18/2022 12:00:00 AM,AM,2022,12,Dec,52,Parks,Highbridge Park,3,,3,,,2,Manhattan,M-12A,ZONE,true,2022-12-19 15:15:14.0000000,M&O MS Forms
M-005247,M037,M037-ZN02,12/20/2022 12:00:00 AM,AM,2022,12,Dec,52,Parks,Highbridge Park,3,,3,,,2,Manhattan,M-12A,ZONE,true,2022-12-24 15:53:45.0000000,M&O MS Forms
M-005256,M037,M037-ZN02,12/21/2022 12:00:00 AM,AM,2022,12,Dec,52,Parks,Highbridge Park,2,,2,,,2,Manhattan,M-12A,ZONE,true,2022-12-24 15:57:16.0000000,M&O MS Forms
M-005265,M037,M037-ZN02,12/22/2022 12:00:00 AM,AM,2022,12,Dec,52,Parks,Highbridge Park,10,,10,,,2,Manhattan,M-12A,ZONE,true,2022-12-24 16:00:26.0000000,M&O MS Forms
M-005274,M037,M037-ZN02,12/23/2022 12:00:00 AM,AM,2022,12,Dec,52,Parks,Highbridge Park,1,,1,,,2,Manhattan,M-12A,ZONE,true,2022-12-24 16:03:40.0000000,M&O MS Forms
M-005284,M037,M037-ZN02,12/25/2022 12:00:00 AM,AM,2022,12,Dec,53,Parks,Highbridge Park,2,,2,,,2,Manhattan,M-12A,ZONE,true,2022-12-31 10:50:00.0000000,M&O MS Forms
M-005290,M037,M037-ZN02,12/26/2022 12:00:00 AM,AM,2022,12,Dec,53,Parks,Highbridge Park,1,,1,,,2,Manhattan,M-12A,ZONE,true,2022-12-31 10:51:51.0000000,M&O MS Forms
M-005299,M037,M037-ZN02,12/27/2022 12:00:00 AM,AM,2022,12,Dec,53,Parks,Highbridge Park,5,,5,,,2,Manhattan,M-12A,ZONE,true,2022-12-31 10:54:22.0000000,M&O MS Forms
M-005308,M037,M037-ZN02,12/28/2022 12:00:00 AM,AM,2022,12,Dec,53,Parks,Highbridge Park,10,,10,,,2,Manhattan,M-12A,ZONE,true,2022-12-31 10:57:01.0000000,M&O MS Forms
M-005317,M037,M037-ZN02,12/29/2022 12:00:00 AM,AM,2022,12,Dec,53,Parks,Highbridge Park,15,,15,,,2,Manhattan,M-12A,ZONE,true,2022-12-31 10:59:40.0000000,M&O MS Forms
M-005326,M037,M037-ZN02,12/30/2022 12:00:00 AM,AM,2022,12,Dec,53,Parks,Highbridge Park,17,,17,,,2,Manhattan,M-12A,ZONE,true,2022-12-31 11:02:25.0000000,M&O MS Forms
M-005414,M037,M037-ZN02,01/08/2023 12:00:00 AM,AM,2023,1,Jan,2,Parks,Highbridge Park,5,,5,,,2,Manhattan,M-12A,ZONE,true,2023-01-14 14:55:48.0000000,M&O MS Forms
M-005422,M037,M037-ZN02,01/09/2023 12:00:00 AM,AM,2023,1,Jan,2,Parks,Highbridge Park,3,,3,,,2,Manhattan,M-12A,ZONE,true,2023-01-14 14:58:14.0000000,M&O MS Forms
M-005431,M037,M037-ZN02,01/10/2023 12:00:00 AM,AM,2023,1,Jan,2,Parks,Highbridge Park,5,,5,,,2,Manhattan,M-12A,ZONE,true,2023-01-14 15:00:25.0000000,M&O MS Forms
M-005440,M037,M037-ZN02,01/11/2023 12:00:00 AM,AM,2023,1,Jan,2,Parks,Highbridge Park,10,,10,,,2,Manhattan,M-12A,ZONE,true,2023-01-14 15:03:14.0000000,M&O MS Forms
M-005449,M037,M037-ZN02,01/12/2023 12:00:00 AM,AM,2023,1,Jan,2,Parks,Highbridge Park,11,,11,,,2,Manhattan,M-12A,ZONE,true,2023-01-14 15:05:50.0000000,M&O MS Forms
M-005458,M037,M037-ZN02,01/13/2023 12:00:00 AM,AM,2023,1,Jan,2,Parks,Highbridge Park,15,,15,,,2,Manhattan,M-12A,ZONE,true,2023-01-14 15:08:27.0000000,M&O MS Forms
M-001881,M037,M037-ZN02,01/02/2022 12:00:00 AM,AM,2022,1,Jan,2,Parks,Highbridge Park,7,,7,,,2,Manhattan,M-12A,ZONE,true,2022-01-02 19:05:27.0000000,M&O MS Forms
M-001872,M037,M037-ZN02,01/01/2022 12:00:00 AM,AM,2022,1,Jan,1,Parks,Highbridge Park,6,,6,,,2,Manhattan,M-12A,ZONE,true,2022-01-02 18:56:47.0000000,M&O MS Forms
M-004595,M037,M037-ZN02,10/16/2022 12:00:00 AM,AM,2022,10,Oct,43,Parks,Highbridge Park,10,,10,,,2,Manhattan,M-12A,ZONE,true,2022-10-19 06:21:53.0000000,M&O MS Forms
M-004167,M037,M037-ZN02,08/29/2022 12:00:00 AM,AM,2022,8,Aug,36,Parks,Highbridge Park,60,,60,,,2,Manhattan,M-12A,ZONE,true,2022-09-02 13:05:24.0000000,M&O MS Forms
M-004176,M037,M037-ZN02,08/30/2022 12:00:00 AM,AM,2022,8,Aug,36,Parks,Highbridge Park,45,,45,,,2,Manhattan,M-12A,ZONE,true,2022-09-02 15:15:17.0000000,M&O MS Forms
M-004478,M037,M037-ZN02,10/01/2022 12:00:00 AM,AM,2022,10,Oct,40,Parks,Highbridge Park,10,,10,,,2,Manhattan,M-12A,ZONE,true,2022-10-11 07:11:47.0000000,M&O MS Forms
M-004477,M037,M037-ZN02,10/01/2022 12:00:00 AM,AM,2022,10,Oct,40,Parks,Highbridge Park,10,,10,,,2,Manhattan,M-12A,ZONE,true,2022-10-11 07:11:46.0000000,M&O MS Forms
M-004468,M037,M037-ZN02,09/30/2022 12:00:00 AM,AM,2022,9,Sep,40,Parks,Highbridge Park,14,,14,,,2,Manhattan,M-12A,ZONE,true,2022-10-11 07:06:35.0000000,M&O MS Forms
M-004158,M037,M037-ZN02,08/28/2022 12:00:00 AM,AM,2022,8,Aug,36,Parks,Highbridge Park,56,,56,,,2,Manhattan,M-12A,ZONE,true,2022-09-02 13:02:25.0000000,M&O MS Forms
M-004340,M037,M037-ZN02,09/19/2022 12:00:00 AM,AM,2022,9,Sep,39,Parks,Highbridge Park,8,,8,,,2,Manhattan,M-12A,ZONE,true,2022-09-22 16:48:22.0000000,M&O MS Forms
M-004331,M037,M037-ZN02,09/18/2022 12:00:00 AM,AM,2022,9,Sep,39,Parks,Highbridge Park,5,,5,,,2,Manhattan,M-12A,ZONE,true,2022-09-22 16:45:21.0000000,M&O MS Forms
M-004348,M037,M037-ZN02,09/20/2022 12:00:00 AM,AM,2022,9,Sep,39,Parks,Highbridge Park,9,,9,,,2,Manhattan,M-12A,ZONE,true,2022-09-22 16:51:34.0000000,M&O MS Forms
M-004356,M037,M037-ZN02,09/21/2022 12:00:00 AM,AM,2022,9,Sep,39,Parks,Highbridge Park,12,,12,,,2,Manhattan,M-12A,ZONE,true,2022-09-22 16:54:21.0000000,M&O MS Forms
M-004383,M037,M037-ZN02,09/24/2022 12:00:00 AM,AM,2022,9,Sep,39,Parks,Highbridge Park,11,,11,,,2,Manhattan,M-12A,ZONE,true,2022-09-26 06:05:10.0000000,M&O MS Forms
M-004392,M037,M037-ZN02,09/25/2022 12:00:00 AM,AM,2022,9,Sep,40,Parks,Highbridge Park,10,,10,,,2,Manhattan,M-12A,ZONE,true,2022-09-26 06:08:19.0000000,M&O MS Forms
M-004365,M037,M037-ZN02,09/22/2022 12:00:00 AM,AM,2022,9,Sep,39,Parks,Highbridge Park,15,,15,,,2,Manhattan,M-12A,ZONE,true,2022-09-23 05:28:15.0000000,M&O MS Forms
M-004374,M037,M037-ZN02,09/23/2022 12:00:00 AM,AM,2022,9,Sep,39,Parks,Highbridge Park,25,,25,,,2,Manhattan,M-12A,ZONE,true,2022-09-26 06:02:08.0000000,M&O MS Forms
M-001958,M037,M037-ZN02,01/11/2022 12:00:00 AM,AM,2022,1,Jan,3,Parks,Highbridge Park,1,,1,,,2,Manhattan,M-12A,ZONE,true,2022-01-13 14:50:25.0000000,M&O MS Forms
M-001979,M037,M037-ZN02,01/13/2022 12:00:00 AM,AM,2022,1,Jan,3,Parks,Highbridge Park,3,,3,,,2,Manhattan,M-12A,ZONE,true,2022-01-14 16:43:45.0000000,M&O MS Forms
M-001978,M037,M037-ZN02,01/12/2022 12:00:00 AM,AM,2022,1,Jan,3,Parks,Highbridge Park,2,,2,,,2,Manhattan,M-12A,ZONE,true,2022-01-14 16:29:15.0000000,M&O MS Forms
M-001966,M037,M037-ZN02,01/12/2022 12:00:00 AM,AM,2022,1,Jan,3,Parks,Highbridge Park,2,,2,,,2,Manhattan,M-12A,ZONE,true,2022-01-13 14:53:07.0000000,M&O MS Forms
M-002030,M037,M037-ZN02,01/17/2022 12:00:00 AM,AM,2022,1,Jan,4,Parks,Highbridge Park,1,,1,,,2,Manhattan,M-12A,ZONE,true,2022-01-20 17:01:40.0000000,M&O MS Forms
M-002023,M037,M037-ZN02,01/16/2022 12:00:00 AM,AM,2022,1,Jan,4,Parks,Highbridge Park,2,,2,,,2,Manhattan,M-12A,ZONE,true,2022-01-20 16:59:43.0000000,M&O MS Forms
M-001987,M037,M037-ZN02,01/14/2022 12:00:00 AM,AM,2022,1,Jan,3,Parks,Highbridge Park,1,,1,,,2,Manhattan,M-12A,ZONE,true,2022-01-14 16:46:31.0000000,M&O MS Forms
M-001889,M037,M037-ZN02,01/03/2022 12:00:00 AM,AM,2022,1,Jan,2,Parks,Highbridge Park,5,,5,,,2,Manhattan,M-12A,ZONE,true,2022-01-04 13:22:17.0000000,M&O MS Forms
M-001910,M037,M037-ZN02,01/05/2022 12:00:00 AM,AM,2022,1,Jan,2,Parks,Highbridge Park,5,,5,,,2,Manhattan,M-12A,ZONE,true,2022-01-05 17:34:27.0000000,M&O MS Forms
M-001901,M037,M037-ZN02,01/04/2022 12:00:00 AM,AM,2022,1,Jan,2,Parks,Highbridge Park,3,,3,,,2,Manhattan,M-12A,ZONE,true,2022-01-05 17:28:24.0000000,M&O MS Forms
M-001925,M037,M037-ZN02,01/06/2022 12:00:00 AM,AM,2022,1,Jan,2,Parks,Highbridge Park,2,,2,,,2,Manhattan,M-12A,ZONE,true,2022-01-06 16:39:11.0000000,M&O MS Forms
M-001949,M037,M037-ZN02,01/10/2022 12:00:00 AM,AM,2022,1,Jan,3,Parks,Highbridge Park,3,,3,,,2,Manhattan,M-12A,ZONE,true,2022-01-13 14:47:10.0000000,M&O MS Forms
M-001942,M037,M037-ZN02,01/09/2022 12:00:00 AM,AM,2022,1,Jan,3,Parks,Highbridge Park,1,,1,,,2,Manhattan,M-12A,ZONE,true,2022-01-13 14:39:41.0000000,M&O MS Forms
M-002035,M037,M037-ZN02,01/18/2022 12:00:00 AM,AM,2022,1,Jan,4,Parks,Highbridge Park,2,,2,,,2,Manhattan,M-12A,ZONE,true,2022-01-20 17:03:04.0000000,M&O MS Forms
M-002043,M037,M037-ZN02,01/19/2022 12:00:00 AM,AM,2022,1,Jan,4,Parks,Highbridge Park,3,,3,,,2,Manhattan,M-12A,ZONE,true,2022-01-20 17:05:13.0000000,M&O MS Forms
M-005677,M037,M037-ZN03,02/04/2023 12:00:00 AM,AM,2023,2,Feb,5,Parks,Highbridge Park,7,,7,,,33,Manhattan,M-12A,ZONE,true,2023-02-05 11:30:01.0000000,M&O MS Forms
M-005668,M037,M037-ZN03,02/03/2023 12:00:00 AM,AM,2023,2,Feb,5,Parks,Highbridge Park,8,,8,,,33,Manhattan,M-12A,ZONE,true,2023-02-03 17:14:26.0000000,M&O MS Forms
M-005706,M037,M037-ZN03,02/08/2023 12:00:00 AM,AM,2023,2,Feb,6,Parks,Highbridge Park,8,,8,,,33,Manhattan,M-12A,ZONE,true,2023-02-08 16:00:08.0000000,M&O MS Forms
M-005648,M037,M037-ZN03,02/01/2023 12:00:00 AM,AM,2023,2,Feb,5,Parks,Highbridge Park,3,,3,,,33,Manhattan,M-12A,ZONE,true,2023-02-01 15:49:59.0000000,M&O MS Forms
M-005658,M037,M037-ZN03,02/02/2023 12:00:00 AM,AM,2023,2,Feb,5,Parks,Highbridge Park,4,,4,,,33,Manhattan,M-12A,ZONE,true,2023-02-02 15:40:51.0000000,M&O MS Forms
M-005541,M037,M037-ZN03,01/21/2023 12:00:00 AM,AM,2023,1,Jan,3,Parks,Highbridge Park,12,,12,,,33,Manhattan,M-12A,ZONE,true,2023-01-23 16:34:51.0000000,M&O MS Forms
M-005550,M037,M037-ZN03,01/22/2023 12:00:00 AM,AM,2023,1,Jan,4,Parks,Highbridge Park,15,,15,,,33,Manhattan,M-12A,ZONE,true,2023-01-23 16:46:27.0000000,M&O MS Forms
M-005559,M037,M037-ZN03,01/23/2023 12:00:00 AM,AM,2023,1,Jan,4,Parks,Highbridge Park,10,,10,,,33,Manhattan,M-12A,ZONE,true,2023-01-23 16:49:09.0000000,M&O MS Forms
M-005514,M037,M037-ZN03,01/18/2023 12:00:00 AM,AM,2023,1,Jan,3,Parks,Highbridge Park,6,,6,,,33,Manhattan,M-12A,ZONE,true,2023-01-23 16:14:30.0000000,M&O MS Forms
M-005513,M037,M037-ZN03,01/18/2023 12:00:00 AM,AM,2023,1,Jan,3,Parks,Highbridge Park,6,,6,,,33,Manhattan,M-12A,ZONE,true,2023-01-23 16:14:30.0000000,M&O MS Forms
M-005532,M037,M037-ZN03,01/20/2023 12:00:00 AM,AM,2023,1,Jan,3,Parks,Highbridge Park,10,,10,,,33,Manhattan,M-12A,ZONE,true,2023-01-23 16:31:47.0000000,M&O MS Forms
M-005523,M037,M037-ZN03,01/19/2023 12:00:00 AM,AM,2023,1,Jan,3,Parks,Highbridge Park,9,,9,,,33,Manhattan,M-12A,ZONE,true,2023-01-23 16:28:52.0000000,M&O MS Forms
M-005349,M037,M037-ZN03,01/01/2023 12:00:00 AM,AM,2023,1,Jan,1,Parks,Highbridge Park,8,,8,,,33,Manhattan,M-12A,ZONE,true,2023-01-03 15:22:38.0000000,M&O MS Forms
M-005338,M037,M037-ZN03,12/31/2022 12:00:00 AM,AM,2022,12,Dec,53,Parks,Highbridge Park,15,,15,,,33,Manhattan,M-12A,ZONE,true,2023-01-01 10:32:07.0000000,M&O MS Forms
M-005492,M037,M037-ZN03,01/16/2023 12:00:00 AM,AM,2023,1,Jan,3,Parks,Highbridge Park,5,,5,,,33,Manhattan,M-12A,ZONE,true,2023-01-23 16:02:10.0000000,M&O MS Forms
M-005491,M037,M037-ZN03,01/16/2023 12:00:00 AM,AM,2023,1,Jan,3,Parks,Highbridge Park,5,,5,,,33,Manhattan,M-12A,ZONE,true,2023-01-23 16:02:10.0000000,M&O MS Forms
M-005503,M037,M037-ZN03,01/17/2023 12:00:00 AM,AM,2023,1,Jan,3,Parks,Highbridge Park,3,,3,,,33,Manhattan,M-12A,ZONE,true,2023-01-23 16:05:28.0000000,M&O MS Forms
M-005358,M037,M037-ZN03,01/02/2023 12:00:00 AM,AM,2023,1,Jan,1,Parks,Highbridge Park,9,,9,,,33,Manhattan,M-12A,ZONE,true,2023-01-03 17:11:45.0000000,M&O MS Forms
M-005367,M037,M037-ZN03,01/03/2023 12:00:00 AM,AM,2023,1,Jan,1,Parks,Highbridge Park,5,,5,,,33,Manhattan,M-12A,ZONE,true,2023-01-03 17:15:00.0000000,M&O MS Forms
M-005378,M037,M037-ZN03,01/04/2023 12:00:00 AM,AM,2023,1,Jan,1,Parks,Highbridge Park,10,,10,,,33,Manhattan,M-12A,ZONE,true,2023-01-08 12:12:58.0000000,M&O MS Forms
M-005387,M037,M037-ZN03,01/05/2023 12:00:00 AM,AM,2023,1,Jan,1,Parks,Highbridge Park,13,,13,,,33,Manhattan,M-12A,ZONE,true,2023-01-08 12:18:14.0000000,M&O MS Forms
M-004990,M037,M037-ZN03,11/21/2022 12:00:00 AM,AM,2022,11,Nov,48,Parks,Highbridge Park,10,,10,,,33,Manhattan,M-12A,ZONE,true,2022-11-27 10:55:08.0000000,M&O MS Forms
M-004980,M037,M037-ZN03,11/20/2022 12:00:00 AM,AM,2022,11,Nov,48,Parks,Highbridge Park,5,,5,,,33,Manhattan,M-12A,ZONE,true,2022-11-21 06:00:15.0000000,M&O MS Forms
M-004971,M037,M037-ZN03,11/19/2022 12:00:00 AM,AM,2022,11,Nov,47,Parks,Highbridge Park,4,,4,,,33,Manhattan,M-12A,ZONE,true,2022-11-21 05:54:27.0000000,M&O MS Forms
M-005026,M037,M037-ZN03,11/25/2022 12:00:00 AM,AM,2022,11,Nov,48,Parks,Highbridge Park,17,,17,,,33,Manhattan,M-12A,ZONE,true,2022-11-27 11:09:00.0000000,M&O MS Forms
M-005017,M037,M037-ZN03,11/24/2022 12:00:00 AM,AM,2022,11,Nov,48,Parks,Highbridge Park,13,,13,,,33,Manhattan,M-12A,ZONE,true,2022-11-27 11:05:53.0000000,M&O MS Forms
M-005008,M037,M037-ZN03,11/23/2022 12:00:00 AM,AM,2022,11,Nov,48,Parks,Highbridge Park,16,,16,,,33,Manhattan,M-12A,ZONE,true,2022-11-27 11:01:38.0000000,M&O MS Forms
M-004999,M037,M037-ZN03,11/22/2022 12:00:00 AM,AM,2022,11,Nov,48,Parks,Highbridge Park,15,,15,,,33,Manhattan,M-12A,ZONE,true,2022-11-27 10:58:09.0000000,M&O MS Forms
M-004941,M037,M037-ZN03,11/15/2022 12:00:00 AM,AM,2022,11,Nov,47,Parks,Highbridge Park,10,,10,,,33,Manhattan,M-12A,ZONE,true,2022-11-17 06:51:04.0000000,M&O MS Forms
M-004942,M037,M037-ZN03,11/15/2022 12:00:00 AM,AM,2022,11,Nov,47,Parks,Highbridge Park,10,,10,,,33,Manhattan,M-12A,ZONE,true,2022-11-17 06:51:05.0000000,M&O MS Forms
M-004962,M037,M037-ZN03,11/18/2022 12:00:00 AM,AM,2022,11,Nov,47,Parks,Highbridge Park,6,,6,,,33,Manhattan,M-12A,ZONE,true,2022-11-21 05:51:24.0000000,M&O MS Forms
M-004931,M037,M037-ZN03,11/14/2022 12:00:00 AM,AM,2022,11,Nov,47,Parks,Highbridge Park,5,,5,,,33,Manhattan,M-12A,ZONE,true,2022-11-16 07:08:45.0000000,M&O MS Forms
M-001711,M037,M037-ZN03,12/18/2021 12:00:00 AM,AM,2021,12,Dec,51,Parks,Highbridge Park,74,,74,,,33,Manhattan,M-12A,ZONE,true,2021-12-19 10:22:37.0000000,M&O MS Forms
M-001562,M037,M037-ZN03,12/05/2021 12:00:00 AM,AM,2021,12,Dec,50,Parks,Highbridge Park,40,,40,,,33,Manhattan,M-12A,ZONE,true,2021-12-09 16:05:58.0000000,M&O MS Forms
M-001549,M037,M037-ZN03,12/04/2021 12:00:00 AM,AM,2021,12,Dec,49,Parks,Highbridge Park,37,,37,,,33,Manhattan,M-12A,ZONE,true,2021-12-05 13:41:51.0000000,M&O MS Forms
M-001539,M037,M037-ZN03,12/05/2021 12:00:00 AM,AM,2021,12,Dec,50,Parks,Highbridge Park,29,,29,,,33,Manhattan,M-12A,ZONE,true,2021-12-05 13:37:53.0000000,M&O MS Forms
M-001530,M037,M037-ZN03,12/05/2021 12:00:00 AM,AM,2021,12,Dec,50,Parks,Highbridge Park,30,,30,,,33,Manhattan,M-12A,ZONE,true,2021-12-05 13:34:13.0000000,M&O MS Forms
M-001514,M037,M037-ZN03,12/01/2021 12:00:00 AM,AM,2021,12,Dec,49,Parks,Highbridge Park,50,,50,,,33,Manhattan,M-12A,ZONE,true,2021-12-02 08:50:09.0000000,M&O MS Forms
M-001505,M037,M037-ZN03,11/30/2021 12:00:00 AM,AM,2021,11,Nov,49,Parks,Highbridge Park,25,,25,,,33,Manhattan,M-12A,ZONE,true,2021-12-02 08:47:44.0000000,M&O MS Forms
M-001496,M037,M037-ZN03,11/29/2021 12:00:00 AM,AM,2021,11,Nov,49,Parks,Highbridge Park,45,,45,,,33,Manhattan,M-12A,ZONE,true,2021-12-02 08:43:51.0000000,M&O MS Forms
M-001474,M037,M037-ZN03,11/27/2021 12:00:00 AM,AM,2021,11,Nov,48,Parks,Highbridge Park,43,,43,,,33,Manhattan,M-12A,ZONE,true,2021-11-29 08:56:05.0000000,M&O MS Forms
M-001488,M037,M037-ZN03,11/28/2021 12:00:00 AM,AM,2021,11,Nov,49,Parks,Highbridge Park,30,,30,,,33,Manhattan,M-12A,ZONE,true,2021-12-02 08:40:49.0000000,M&O MS Forms
M-001444,M037,M037-ZN03,11/25/2021 12:00:00 AM,AM,2021,11,Nov,48,Parks,Highbridge Park,61,,61,,,33,Manhattan,M-12A,ZONE,true,2021-11-26 19:58:27.0000000,M&O MS Forms
M-001453,M037,M037-ZN03,11/26/2021 12:00:00 AM,AM,2021,11,Nov,48,Parks,Highbridge Park,34,,34,,,33,Manhattan,M-12A,ZONE,true,2021-11-26 20:01:27.0000000,M&O MS Forms
M-001435,M037,M037-ZN03,11/24/2021 12:00:00 AM,AM,2021,11,Nov,48,Parks,Highbridge Park,54,,54,,,33,Manhattan,M-12A,ZONE,true,2021-11-25 12:36:28.0000000,M&O MS Forms
M-001425,M037,M037-ZN03,11/23/2021 12:00:00 AM,AM,2021,11,Nov,48,Parks,Highbridge Park,60,,60,,,33,Manhattan,M-12A,ZONE,true,2021-11-25 12:33:20.0000000,M&O MS Forms
M-001416,M037,M037-ZN03,11/22/2021 12:00:00 AM,AM,2021,11,Nov,48,Parks,Highbridge Park,40,,40,,,33,Manhattan,M-12A,ZONE,true,2021-11-25 12:29:12.0000000,M&O MS Forms
M-001407,M037,M037-ZN03,11/21/2021 12:00:00 AM,AM,2021,11,Nov,48,Parks,Highbridge Park,15,,15,,,33,Manhattan,M-12A,ZONE,true,2021-11-25 12:25:20.0000000,M&O MS Forms
M-001398,M037,M037-ZN03,11/20/2021 12:00:00 AM,AM,2021,11,Nov,47,Parks,Highbridge Park,43,,43,,,33,Manhattan,M-12A,ZONE,true,2021-11-20 18:39:15.0000000,M&O MS Forms
M-001389,M037,M037-ZN03,11/19/2021 12:00:00 AM,AM,2021,11,Nov,47,Parks,Highbridge Park,37,,37,,,33,Manhattan,M-12A,ZONE,true,2021-11-20 07:06:37.0000000,M&O MS Forms
M-001379,M037,M037-ZN03,11/18/2021 12:00:00 AM,AM,2021,11,Nov,47,Parks,Highbridge Park,25,,25,,,33,Manhattan,M-12A,ZONE,true,2021-11-18 17:05:06.0000000,M&O MS Forms
M-001371,M037,M037-ZN03,11/17/2021 12:00:00 AM,AM,2021,11,Nov,47,Parks,Highbridge Park,29,,29,,,33,Manhattan,M-12A,ZONE,true,2021-11-18 17:02:05.0000000,M&O MS Forms
M-001362,M037,M037-ZN03,11/16/2021 12:00:00 AM,AM,2021,11,Nov,47,Parks,Highbridge Park,45,,45,,,33,Manhattan,M-12A,ZONE,true,2021-11-18 16:55:17.0000000,M&O MS Forms
M-001352,M037,M037-ZN03,11/15/2021 12:00:00 AM,AM,2021,11,Nov,47,Parks,Highbridge Park,60,,60,,,33,Manhattan,M-12A,ZONE,true,2021-11-18 16:37:49.0000000,M&O MS Forms
M-001322,M037,M037-ZN03,11/13/2021 12:00:00 AM,AM,2021,11,Nov,46,Parks,Highbridge Park,37,,37,,,33,Manhattan,M-12A,ZONE,true,2021-11-13 15:52:50.0000000,M&O MS Forms
M-001313,M037,M037-ZN03,11/12/2021 12:00:00 AM,AM,2021,11,Nov,46,Parks,Highbridge Park,30,,30,,,33,Manhattan,M-12A,ZONE,true,2021-11-12 16:03:53.0000000,M&O MS Forms
M-001342,M037,M037-ZN03,11/14/2021 12:00:00 AM,AM,2021,11,Nov,47,Parks,Highbridge Park,50,,50,,,33,Manhattan,M-12A,ZONE,true,2021-11-18 16:32:06.0000000,M&O MS Forms
M-000513,M037,M037-ZN03,07/11/2021 12:00:00 AM,AM,2021,7,Jul,29,Parks,Highbridge Park,42,,42,,,33,Manhattan,M-12A,ZONE,true,2021-07-21 18:20:33.0000000,M&O MS Forms
M-000520,M037,M037-ZN03,07/13/2021 12:00:00 AM,AM,2021,7,Jul,29,BBP,Highbridge Park,85,,85,,,33,Manhattan,M-12A,ZONE,true,2021-07-21 18:25:32.0000000,M&O MS Forms
M-000517,M037,M037-ZN03,07/12/2021 12:00:00 AM,AM,2021,7,Jul,29,Parks,Highbridge Park,25,,25,,,33,Manhattan,M-12A,ZONE,true,2021-07-21 18:23:11.0000000,M&O MS Forms
M-000492,M037,M037-ZN03,07/05/2021 12:00:00 AM,AM,2021,7,Jul,28,Parks,Highbridge Park,20,,20,,,33,Manhattan,M-12A,ZONE,true,2021-07-10 05:20:11.0000000,M&O MS Forms
M-000494,M037,M037-ZN03,07/06/2021 12:00:00 AM,AM,2021,7,Jul,28,BBP,Highbridge Park,52,,52,,,33,Manhattan,M-12A,ZONE,true,2021-07-10 05:49:19.0000000,M&O MS Forms
M-000501,M037,M037-ZN03,07/08/2021 12:00:00 AM,AM,2021,7,Jul,28,Parks,Highbridge Park,28,,28,,,33,Manhattan,M-12A,ZONE,true,2021-07-10 05:52:12.0000000,M&O MS Forms
M-000499,M037,M037-ZN03,07/07/2021 12:00:00 AM,AM,2021,7,Jul,28,BBP,Highbridge Park,49,,49,,,33,Manhattan,M-12A,ZONE,true,2021-07-10 05:51:30.0000000,M&O MS Forms
M-002487,M037,M037-ZN03,03/12/2022 12:00:00 AM,AM,2022,3,Mar,11,Parks,Highbridge Park,15,,15,,,33,Manhattan,M-12A,ZONE,true,2022-03-17 10:40:11.0000000,M&O MS Forms
M-002478,M037,M037-ZN03,03/11/2022 12:00:00 AM,AM,2022,3,Mar,11,Parks,Highbridge Park,12,,12,,,33,Manhattan,M-12A,ZONE,true,2022-03-17 10:36:51.0000000,M&O MS Forms
M-002522,M037,M037-ZN03,03/16/2022 12:00:00 AM,AM,2022,3,Mar,12,Parks,Highbridge Park,3,,3,,,33,Manhattan,M-12A,ZONE,true,2022-03-17 11:41:23.0000000,M&O MS Forms
M-002514,M037,M037-ZN03,03/15/2022 12:00:00 AM,AM,2022,3,Mar,12,Parks,Highbridge Park,6,,6,,,33,Manhattan,M-12A,ZONE,true,2022-03-17 11:37:15.0000000,M&O MS Forms
M-002505,M037,M037-ZN03,03/14/2022 12:00:00 AM,AM,2022,3,Mar,12,Parks,Highbridge Park,3,,3,,,33,Manhattan,M-12A,ZONE,true,2022-03-17 10:46:55.0000000,M&O MS Forms
M-002542,M037,M037-ZN03,03/17/2022 12:00:00 AM,AM,2022,3,Mar,12,Parks,Highbridge Park,7,,7,,,33,Manhattan,M-12A,ZONE,true,2022-03-24 16:34:55.0000000,M&O MS Forms
M-002550,M037,M037-ZN03,03/18/2022 12:00:00 AM,AM,2022,3,Mar,12,Parks,Highbridge Park,5,,5,,,33,Manhattan,M-12A,ZONE,true,2022-03-24 16:39:19.0000000,M&O MS Forms
M-002558,M037,M037-ZN03,03/19/2022 12:00:00 AM,AM,2022,3,Mar,12,Parks,Highbridge Park,12,,12,,,33,Manhattan,M-12A,ZONE,true,2022-03-24 16:46:48.0000000,M&O MS Forms
M-002642,M037,M037-ZN03,03/27/2022 12:00:00 AM,AM,2022,3,Mar,14,Parks,Highbridge Park,2,,2,,,33,Manhattan,M-12A,ZONE,true,2022-03-29 05:26:47.0000000,M&O MS Forms
M-002651,M037,M037-ZN03,03/28/2022 12:00:00 AM,AM,2022,3,Mar,14,Parks,Highbridge Park,5,,5,,,33,Manhattan,M-12A,ZONE,true,2022-03-29 05:29:55.0000000,M&O MS Forms
M-002696,M037,M037-ZN03,04/01/2022 12:00:00 AM,AM,2022,4,Apr,14,Parks,Highbridge Park,15,,15,,,33,Manhattan,M-12A,ZONE,true,2022-04-01 15:58:08.0000000,M&O MS Forms
M-002687,M037,M037-ZN03,03/31/2022 12:00:00 AM,AM,2022,3,Mar,14,Parks,Highbridge Park,10,,10,,,33,Manhattan,M-12A,ZONE,true,2022-04-01 15:54:24.0000000,M&O MS Forms
M-002672,M037,M037-ZN03,03/30/2022 12:00:00 AM,AM,2022,3,Mar,14,Parks,Highbridge Park,7,,7,,,33,Manhattan,M-12A,ZONE,true,2022-03-30 15:32:57.0000000,M&O MS Forms
M-002601,M037,M037-ZN03,03/24/2022 12:00:00 AM,AM,2022,3,Mar,13,Parks,Highbridge Park,1,,1,,,33,Manhattan,M-12A,ZONE,true,2022-03-24 19:57:56.0000000,M&O MS Forms
M-002618,M037,M037-ZN03,03/25/2022 12:00:00 AM,AM,2022,3,Mar,13,Parks,Highbridge Park,3,,3,,,33,Manhattan,M-12A,ZONE,true,2022-03-26 19:21:09.0000000,M&O MS Forms
M-002628,M037,M037-ZN03,03/26/2022 12:00:00 AM,AM,2022,3,Mar,13,Parks,Highbridge Park,5,,5,,,33,Manhattan,M-12A,ZONE,true,2022-03-26 19:24:31.0000000,M&O MS Forms
M-002593,M037,M037-ZN03,03/23/2022 12:00:00 AM,AM,2022,3,Mar,13,Parks,Highbridge Park,4,,4,,,33,Manhattan,M-12A,ZONE,true,2022-03-24 19:54:21.0000000,M&O MS Forms
M-002584,M037,M037-ZN03,03/22/2022 12:00:00 AM,AM,2022,3,Mar,13,Parks,Highbridge Park,16,,16,,,33,Manhattan,M-12A,ZONE,true,2022-03-24 19:50:51.0000000,M&O MS Forms
M-002575,M037,M037-ZN03,03/21/2022 12:00:00 AM,AM,2022,3,Mar,13,Parks,Highbridge Park,13,,13,,,33,Manhattan,M-12A,ZONE,true,2022-03-24 19:45:39.0000000,M&O MS Forms
M-002567,M037,M037-ZN03,03/20/2022 12:00:00 AM,AM,2022,3,Mar,13,Parks,Highbridge Park,10,,10,,,33,Manhattan,M-12A,ZONE,true,2022-03-24 19:41:56.0000000,M&O MS Forms
M-002392,M037,M037-ZN03,03/01/2022 12:00:00 AM,AM,2022,3,Mar,10,Parks,Highbridge Park,60,,60,,,33,Manhattan,M-12A,ZONE,true,2022-03-04 08:38:25.0000000,M&O MS Forms
M-002383,M037,M037-ZN03,02/28/2022 12:00:00 AM,AM,2022,2,Feb,10,Parks,Highbridge Park,12,,12,,,33,Manhattan,M-12A,ZONE,true,2022-03-04 08:35:49.0000000,M&O MS Forms
M-002375,M037,M037-ZN03,02/27/2022 12:00:00 AM,AM,2022,2,Feb,10,Parks,Highbridge Park,3,,3,,,33,Manhattan,M-12A,ZONE,true,2022-03-04 08:32:46.0000000,M&O MS Forms
M-002421,M037,M037-ZN03,03/04/2022 12:00:00 AM,AM,2022,3,Mar,10,Parks,Highbridge Park,5,,5,,,33,Manhattan,M-12A,ZONE,true,2022-03-06 19:36:58.0000000,M&O MS Forms
M-002427,M037,M037-ZN03,03/05/2022 12:00:00 AM,AM,2022,3,Mar,10,Parks,Highbridge Park,13,,13,,,33,Manhattan,M-12A,ZONE,true,2022-03-06 19:40:16.0000000,M&O MS Forms
M-002410,M037,M037-ZN03,03/03/2022 12:00:00 AM,AM,2022,3,Mar,10,Parks,Highbridge Park,17,,17,,,33,Manhattan,M-12A,ZONE,true,2022-03-04 08:43:21.0000000,M&O MS Forms
M-002401,M037,M037-ZN03,03/02/2022 12:00:00 AM,AM,2022,3,Mar,10,Parks,Highbridge Park,11,,11,,,33,Manhattan,M-12A,ZONE,true,2022-03-04 08:40:41.0000000,M&O MS Forms
M-002328,M037,M037-ZN03,02/22/2022 12:00:00 AM,AM,2022,2,Feb,9,Parks,Highbridge Park,7,,7,,,33,Manhattan,M-12A,ZONE,true,2022-02-28 12:02:58.0000000,M&O MS Forms
M-002319,M037,M037-ZN03,02/21/2022 12:00:00 AM,AM,2022,2,Feb,9,Parks,Highbridge Park,5,,5,,,33,Manhattan,M-12A,ZONE,true,2022-02-28 12:00:29.0000000,M&O MS Forms
M-002346,M037,M037-ZN03,02/24/2022 12:00:00 AM,AM,2022,2,Feb,9,Parks,Highbridge Park,12,,12,,,33,Manhattan,M-12A,ZONE,true,2022-02-28 12:08:38.0000000,M&O MS Forms
M-002355,M037,M037-ZN03,02/25/2022 12:00:00 AM,AM,2022,2,Feb,9,Parks,Highbridge Park,4,,4,,,33,Manhattan,M-12A,ZONE,true,2022-02-28 12:11:28.0000000,M&O MS Forms
M-002362,M037,M037-ZN03,02/26/2022 12:00:00 AM,AM,2022,2,Feb,9,Parks,Highbridge Park,4,,4,,,33,Manhattan,M-12A,ZONE,true,2022-02-28 12:13:14.0000000,M&O MS Forms
M-003231,M037,M037-ZN03,05/26/2022 12:00:00 AM,AM,2022,5,May,22,Parks,Highbridge Park,9,,9,,,33,Manhattan,M-12A,ZONE,true,2022-05-28 10:53:29.0000000,M&O MS Forms
M-003359,M037,M037-ZN03,06/06/2022 12:00:00 AM,AM,2022,6,Jun,24,Parks,Highbridge Park,32,,32,,,33,Manhattan,M-12A,ZONE,true,2022-06-06 19:46:06.0000000,M&O MS Forms
M-003350,M037,M037-ZN03,06/05/2022 12:00:00 AM,AM,2022,6,Jun,24,Parks,Highbridge Park,30,,30,,,33,Manhattan,M-12A,ZONE,true,2022-06-06 19:42:57.0000000,M&O MS Forms
M-003341,M037,M037-ZN03,06/04/2022 12:00:00 AM,AM,2022,6,Jun,23,Parks,Highbridge Park,25,,25,,,33,Manhattan,M-12A,ZONE,true,2022-06-06 19:33:00.0000000,M&O MS Forms
M-003332,M037,M037-ZN03,06/03/2022 12:00:00 AM,AM,2022,6,Jun,23,Parks,Highbridge Park,12,,12,,,33,Manhattan,M-12A,ZONE,true,2022-06-06 19:29:44.0000000,M&O MS Forms
M-003323,M037,M037-ZN03,06/02/2022 12:00:00 AM,AM,2022,6,Jun,23,Parks,Highbridge Park,24,,24,,,33,Manhattan,M-12A,ZONE,true,2022-06-06 19:25:27.0000000,M&O MS Forms
M-003314,M037,M037-ZN03,06/01/2022 12:00:00 AM,AM,2022,6,Jun,23,Parks,Highbridge Park,20,,20,,,33,Manhattan,M-12A,ZONE,true,2022-06-06 19:21:41.0000000,M&O MS Forms
M-003304,M037,M037-ZN03,05/31/2022 12:00:00 AM,AM,2022,5,May,23,Parks,Highbridge Park,15,,15,,,33,Manhattan,M-12A,ZONE,true,2022-06-06 19:17:36.0000000,M&O MS Forms
M-003484,M037,M037-ZN03,06/20/2022 12:00:00 AM,AM,2022,6,Jun,26,Parks,Highbridge Park,32,,32,,,33,Manhattan,M-12A,ZONE,true,2022-06-26 13:11:37.0000000,M&O MS Forms
M-003494,M037,M037-ZN03,06/19/2022 12:00:00 AM,AM,2022,6,Jun,26,Parks,Highbridge Park,34,,34,,,33,Manhattan,M-12A,ZONE,true,2022-06-26 17:50:02.0000000,M&O MS Forms
M-003469,M037,M037-ZN03,06/18/2022 12:00:00 AM,AM,2022,6,Jun,25,Parks,Highbridge Park,30,,30,,,33,Manhattan,M-12A,ZONE,true,2022-06-19 12:53:30.0000000,M&O MS Forms
M-003460,M037,M037-ZN03,06/17/2022 12:00:00 AM,AM,2022,6,Jun,25,Parks,Highbridge Park,25,,25,,,33,Manhattan,M-12A,ZONE,true,2022-06-19 12:50:55.0000000,M&O MS Forms
M-003451,M037,M037-ZN03,06/16/2022 12:00:00 AM,AM,2022,6,Jun,25,Parks,Highbridge Park,17,,17,,,33,Manhattan,M-12A,ZONE,true,2022-06-19 12:48:25.0000000,M&O MS Forms
M-003442,M037,M037-ZN03,06/15/2022 12:00:00 AM,AM,2022,6,Jun,25,Parks,Highbridge Park,15,,15,,,33,Manhattan,M-12A,ZONE,true,2022-06-19 12:45:30.0000000,M&O MS Forms
M-003434,M037,M037-ZN03,06/14/2022 12:00:00 AM,AM,2022,6,Jun,25,Parks,Highbridge Park,25,,25,,,33,Manhattan,M-12A,ZONE,true,2022-06-19 12:42:35.0000000,M&O MS Forms
M-003426,M037,M037-ZN03,06/13/2022 12:00:00 AM,AM,2022,6,Jun,25,Parks,Highbridge Park,22,,22,,,33,Manhattan,M-12A,ZONE,true,2022-06-19 12:40:11.0000000,M&O MS Forms
M-003412,M037,M037-ZN03,06/12/2022 12:00:00 AM,AM,2022,6,Jun,25,Parks,Highbridge Park,35,,35,,,33,Manhattan,M-12A,ZONE,true,2022-06-12 18:02:13.0000000,M&O MS Forms
M-003403,M037,M037-ZN03,06/11/2022 12:00:00 AM,AM,2022,6,Jun,24,Parks,Highbridge Park,9,,9,,,33,Manhattan,M-12A,ZONE,true,2022-06-11 19:30:11.0000000,M&O MS Forms
M-003395,M037,M037-ZN03,06/10/2022 12:00:00 AM,AM,2022,6,Jun,24,Parks,Highbridge Park,15,,15,,,33,Manhattan,M-12A,ZONE,true,2022-06-11 19:27:39.0000000,M&O MS Forms
M-003386,M037,M037-ZN03,06/09/2022 12:00:00 AM,AM,2022,6,Jun,24,Parks,Highbridge Park,10,,10,,,33,Manhattan,M-12A,ZONE,true,2022-06-11 19:24:16.0000000,M&O MS Forms
M-003377,M037,M037-ZN03,06/08/2022 12:00:00 AM,AM,2022,6,Jun,24,Parks,Highbridge Park,32,,32,,,33,Manhattan,M-12A,ZONE,true,2022-06-11 19:20:47.0000000,M&O MS Forms
M-003368,M037,M037-ZN03,06/07/2022 12:00:00 AM,AM,2022,6,Jun,24,Parks,Highbridge Park,40,,40,,,33,Manhattan,M-12A,ZONE,true,2022-06-11 19:17:01.0000000,M&O MS Forms
M-003619,M037,M037-ZN03,07/04/2022 12:00:00 AM,AM,2022,7,Jul,28,Parks,Highbridge Park,40,,40,,,33,Manhattan,M-12A,ZONE,true,2022-07-09 10:36:49.0000000,M&O MS Forms
M-003610,M037,M037-ZN03,07/03/2022 12:00:00 AM,AM,2022,7,Jul,28,Parks,Highbridge Park,36,,36,,,33,Manhattan,M-12A,ZONE,true,2022-07-04 13:45:20.0000000,M&O MS Forms
M-003593,M037,M037-ZN03,07/01/2022 12:00:00 AM,AM,2022,7,Jul,27,Parks,Highbridge Park,30,,30,,,33,Manhattan,M-12A,ZONE,true,2022-07-02 10:55:07.0000000,M&O MS Forms
M-003601,M037,M037-ZN03,07/02/2022 12:00:00 AM,AM,2022,7,Jul,27,Parks,Highbridge Park,25,,25,,,33,Manhattan,M-12A,ZONE,true,2022-07-04 13:41:56.0000000,M&O MS Forms
M-003576,M037,M037-ZN03,06/29/2022 12:00:00 AM,AM,2022,6,Jun,27,Parks,Highbridge Park,42,,42,,,33,Manhattan,M-12A,ZONE,true,2022-07-02 10:50:20.0000000,M&O MS Forms
M-003585,M037,M037-ZN03,06/30/2022 12:00:00 AM,AM,2022,6,Jun,27,Parks,Highbridge Park,26,,26,,,33,Manhattan,M-12A,ZONE,true,2022-07-02 10:52:57.0000000,M&O MS Forms
M-003567,M037,M037-ZN03,06/28/2022 12:00:00 AM,AM,2022,6,Jun,27,Parks,Highbridge Park,36,,36,,,33,Manhattan,M-12A,ZONE,true,2022-07-02 10:47:54.0000000,M&O MS Forms
M-003558,M037,M037-ZN03,06/27/2022 12:00:00 AM,AM,2022,6,Jun,27,Parks,Highbridge Park,25,,25,,,33,Manhattan,M-12A,ZONE,true,2022-07-02 10:45:11.0000000,M&O MS Forms
M-003549,M037,M037-ZN03,06/26/2022 12:00:00 AM,AM,2022,6,Jun,27,Parks,Highbridge Park,36,,36,,,33,Manhattan,M-12A,ZONE,true,2022-06-26 18:07:35.0000000,M&O MS Forms
M-003540,M037,M037-ZN03,06/25/2022 12:00:00 AM,AM,2022,6,Jun,26,Parks,Highbridge Park,45,,45,,,33,Manhattan,M-12A,ZONE,true,2022-06-26 18:04:13.0000000,M&O MS Forms
M-003331,M037,M037-ZN02,06/03/2022 12:00:00 AM,AM,2022,6,Jun,23,Parks,Highbridge Park,8,,8,,,2,Manhattan,M-12A,ZONE,true,2022-06-06 19:29:25.0000000,M&O MS Forms
M-003349,M037,M037-ZN02,06/05/2022 12:00:00 AM,AM,2022,6,Jun,24,Parks,Highbridge Park,40,,40,,,2,Manhattan,M-12A,ZONE,true,2022-06-06 19:42:38.0000000,M&O MS Forms
M-003340,M037,M037-ZN02,06/04/2022 12:00:00 AM,AM,2022,6,Jun,23,Parks,Highbridge Park,13,,13,,,2,Manhattan,M-12A,ZONE,true,2022-06-06 19:32:39.0000000,M&O MS Forms
M-003358,M037,M037-ZN02,06/06/2022 12:00:00 AM,AM,2022,6,Jun,24,Parks,Highbridge Park,50,,50,,,2,Manhattan,M-12A,ZONE,true,2022-06-06 19:45:46.0000000,M&O MS Forms
M-003230,M037,M037-ZN02,05/26/2022 12:00:00 AM,AM,2022,5,May,22,Parks,Highbridge Park,20,,20,,,2,Manhattan,M-12A,ZONE,true,2022-05-28 10:53:11.0000000,M&O MS Forms
M-003239,M037,M037-ZN02,05/27/2022 12:00:00 AM,AM,2022,5,May,22,Parks,Highbridge Park,15,,15,,,2,Manhattan,M-12A,ZONE,true,2022-05-28 10:55:55.0000000,M&O MS Forms
M-003251,M037,M037-ZN02,05/28/2022 12:00:00 AM,AM,2022,5,May,22,Parks,Highbridge Park,15,,15,,,2,Manhattan,M-12A,ZONE,true,2022-05-30 10:35:09.0000000,M&O MS Forms
M-003260,M037,M037-ZN02,05/29/2022 12:00:00 AM,AM,2022,5,May,23,Parks,Highbridge Park,25,,25,,,2,Manhattan,M-12A,ZONE,true,2022-05-30 10:38:26.0000000,M&O MS Forms
M-003295,M037,M037-ZN02,05/30/2022 12:00:00 AM,AM,2022,5,May,23,Parks,Highbridge Park,20,,20,,,2,Manhattan,M-12A,ZONE,true,2022-06-06 19:13:35.0000000,M&O MS Forms
M-001725,M037,M037-ZN02,12/19/2021 12:00:00 AM,AM,2021,12,Dec,52,Parks,Highbridge Park,10,,10,,,2,Manhattan,M-12A,ZONE,true,2021-12-21 16:04:40.0000000,M&O MS Forms
M-001859,M037,M037-ZN02,12/31/2021 12:00:00 AM,AM,2021,12,Dec,53,Parks,Highbridge Park,12,,12,,,2,Manhattan,M-12A,ZONE,true,2021-12-31 19:58:06.0000000,M&O MS Forms
M-001845,M037,M037-ZN02,12/30/2021 12:00:00 AM,AM,2021,12,Dec,53,Parks,Highbridge Park,3,,3,,,2,Manhattan,M-12A,ZONE,true,2021-12-30 15:53:05.0000000,M&O MS Forms
M-001832,M037,M037-ZN02,12/29/2021 12:00:00 AM,AM,2021,12,Dec,53,Parks,Highbridge Park,6,,6,,,2,Manhattan,M-12A,ZONE,true,2021-12-29 16:29:24.0000000,M&O MS Forms
M-001810,M037,M037-ZN02,12/27/2021 12:00:00 AM,AM,2021,12,Dec,53,Parks,Highbridge Park,6,,6,,,2,Manhattan,M-12A,ZONE,true,2021-12-27 16:05:45.0000000,M&O MS Forms
M-001811,M037,M037-ZN02,12/27/2021 12:00:00 AM,AM,2021,12,Dec,53,Parks,Highbridge Park,6,,6,,,2,Manhattan,M-12A,ZONE,true,2021-12-27 16:06:30.0000000,M&O MS Forms
M-001800,M037,M037-ZN02,12/26/2021 12:00:00 AM,AM,2021,12,Dec,53,Parks,Highbridge Park,8,,8,,,2,Manhattan,M-12A,ZONE,true,2021-12-27 16:00:40.0000000,M&O MS Forms
M-001791,M037,M037-ZN02,12/25/2021 12:00:00 AM,AM,2021,12,Dec,52,Parks,Highbridge Park,1,,1,,,2,Manhattan,M-12A,ZONE,true,2021-12-26 12:15:46.0000000,M&O MS Forms
M-001792,M037,M037-ZN02,12/25/2021 12:00:00 AM,AM,2021,12,Dec,52,Parks,Highbridge Park,1,,1,,,2,Manhattan,M-12A,ZONE,true,2021-12-26 12:16:12.0000000,M&O MS Forms
M-001782,M037,M037-ZN02,12/24/2021 12:00:00 AM,AM,2021,12,Dec,52,Parks,Highbridge Park,3,,3,,,2,Manhattan,M-12A,ZONE,true,2021-12-26 12:12:40.0000000,M&O MS Forms
M-001773,M037,M037-ZN02,12/23/2021 12:00:00 AM,AM,2021,12,Dec,52,Parks,Highbridge Park,15,,15,,,2,Manhattan,M-12A,ZONE,true,2021-12-23 15:49:10.0000000,M&O MS Forms
M-001761,M037,M037-ZN02,12/22/2021 12:00:00 AM,AM,2021,12,Dec,52,Parks,Highbridge Park,20,,20,,,2,Manhattan,M-12A,ZONE,true,2021-12-23 15:42:16.0000000,M&O MS Forms
M-001734,M037,M037-ZN02,12/20/2021 12:00:00 AM,AM,2021,12,Dec,52,Parks,Highbridge Park,15,,15,,,2,Manhattan,M-12A,ZONE,true,2021-12-21 16:07:15.0000000,M&O MS Forms
M-004624,M037,M037-ZN02,10/18/2022 12:00:00 AM,AM,2022,10,Oct,43,Parks,Highbridge Park,8,,8,,,2,Manhattan,M-12A,ZONE,true,2022-10-25 06:03:55.0000000,M&O MS Forms
M-004633,M037,M037-ZN02,10/19/2022 12:00:00 AM,AM,2022,10,Oct,43,Parks,Highbridge Park,7,,7,,,2,Manhattan,M-12A,ZONE,true,2022-10-25 06:06:32.0000000,M&O MS Forms
M-004642,M037,M037-ZN02,10/20/2022 12:00:00 AM,AM,2022,10,Oct,43,Parks,Highbridge Park,15,,15,,,2,Manhattan,M-12A,ZONE,true,2022-10-25 06:09:02.0000000,M&O MS Forms
M-004651,M037,M037-ZN02,10/21/2022 12:00:00 AM,AM,2022,10,Oct,43,Parks,Highbridge Park,20,,20,,,2,Manhattan,M-12A,ZONE,true,2022-10-25 06:11:31.0000000,M&O MS Forms
M-004660,M037,M037-ZN02,10/22/2022 12:00:00 AM,AM,2022,10,Oct,43,Parks,Highbridge Park,2,,2,,,2,Manhattan,M-12A,ZONE,true,2022-10-25 06:13:59.0000000,M&O MS Forms
M-004669,M037,M037-ZN02,10/23/2022 12:00:00 AM,AM,2022,10,Oct,44,Parks,Highbridge Park,20,,20,,,2,Manhattan,M-12A,ZONE,true,2022-10-25 06:23:46.0000000,M&O MS Forms
M-004678,M037,M037-ZN02,10/24/2022 12:00:00 AM,AM,2022,10,Oct,44,Parks,Highbridge Park,26,,26,,,2,Manhattan,M-12A,ZONE,true,2022-10-25 06:31:40.0000000,M&O MS Forms
M-004687,M037,M037-ZN02,10/25/2022 12:00:00 AM,AM,2022,10,Oct,44,Parks,Highbridge Park,30,,30,,,2,Manhattan,M-12A,ZONE,true,2022-10-26 05:49:42.0000000,M&O MS Forms
M-004696,M037,M037-ZN02,10/26/2022 12:00:00 AM,AM,2022,10,Oct,44,Parks,Highbridge Park,30,,30,,,2,Manhattan,M-12A,ZONE,true,2022-10-27 05:25:53.0000000,M&O MS Forms
M-004722,M037,M037-ZN02,10/29/2022 12:00:00 AM,AM,2022,10,Oct,44,Parks,Highbridge Park,15,,15,,,2,Manhattan,M-12A,ZONE,true,2022-10-30 13:20:18.0000000,M&O MS Forms
M-003081,M037,M037-ZN04,05/11/2022 12:00:00 AM,AM,2022,5,May,20,Parks,Highbridge Park,15,,15,,,34,Manhattan,M-12A,ZONE,true,2022-05-13 15:20:42.0000000,M&O MS Forms
M-003090,M037,M037-ZN04,05/12/2022 12:00:00 AM,AM,2022,5,May,20,Parks,Highbridge Park,13,,13,,,34,Manhattan,M-12A,ZONE,true,2022-05-13 15:26:27.0000000,M&O MS Forms
M-003063,M037,M037-ZN04,05/09/2022 12:00:00 AM,AM,2022,5,May,20,Parks,Highbridge Park,23,,23,,,34,Manhattan,M-12A,ZONE,true,2022-05-13 15:13:50.0000000,M&O MS Forms
M-003062,M037,M037-ZN04,05/09/2022 12:00:00 AM,AM,2022,5,May,20,Parks,Highbridge Park,23,,23,,,34,Manhattan,M-12A,ZONE,true,2022-05-13 15:13:29.0000000,M&O MS Forms
M-003053,M037,M037-ZN04,05/08/2022 12:00:00 AM,AM,2022,5,May,20,Parks,Highbridge Park,8,,8,,,34,Manhattan,M-12A,ZONE,true,2022-05-13 15:08:48.0000000,M&O MS Forms
M-003043,M037,M037-ZN04,05/08/2022 12:00:00 AM,AM,2022,5,May,20,Parks,Highbridge Park,8,,8,,,34,Manhattan,M-12A,ZONE,true,2022-05-09 08:07:39.0000000,M&O MS Forms
M-003035,M037,M037-ZN04,05/07/2022 12:00:00 AM,AM,2022,5,May,19,Parks,Highbridge Park,12,,12,,,34,Manhattan,M-12A,ZONE,true,2022-05-09 08:00:46.0000000,M&O MS Forms
M-003014,M037,M037-ZN04,05/05/2022 12:00:00 AM,AM,2022,5,May,19,Parks,Highbridge Park,7,,7,,,34,Manhattan,M-12A,ZONE,true,2022-05-06 19:48:23.0000000,M&O MS Forms
M-003001,M037,M037-ZN04,05/03/2022 12:00:00 AM,AM,2022,5,May,19,Parks,Highbridge Park,12,,12,,,34,Manhattan,M-12A,ZONE,true,2022-05-06 19:31:10.0000000,M&O MS Forms
M-003005,M037,M037-ZN04,05/04/2022 12:00:00 AM,AM,2022,5,May,19,Parks,Highbridge Park,17,,17,,,34,Manhattan,M-12A,ZONE,true,2022-05-06 19:44:22.0000000,M&O MS Forms
M-003023,M037,M037-ZN04,05/06/2022 12:00:00 AM,AM,2022,5,May,19,Parks,Highbridge Park,10,,10,,,34,Manhattan,M-12A,ZONE,true,2022-05-06 20:04:11.0000000,M&O MS Forms
M-002990,M037,M037-ZN04,05/01/2022 12:00:00 AM,AM,2022,5,May,19,Parks,Highbridge Park,30,,30,,,34,Manhattan,M-12A,ZONE,true,2022-05-06 19:19:00.0000000,M&O MS Forms
M-002968,M037,M037-ZN04,04/23/2022 12:00:00 AM,AM,2022,4,Apr,17,Parks,Highbridge Park,25,,25,,,34,Manhattan,M-12A,ZONE,true,2022-04-30 14:56:42.0000000,M&O MS Forms
M-002998,M037,M037-ZN04,05/02/2022 12:00:00 AM,AM,2022,5,May,19,Parks,Highbridge Park,2,,2,,,34,Manhattan,M-12A,ZONE,true,2022-05-06 19:22:25.0000000,M&O MS Forms
M-002916,M037,M037-ZN04,04/25/2022 12:00:00 AM,AM,2022,4,Apr,18,Parks,Highbridge Park,25,,25,,,34,Manhattan,M-12A,ZONE,true,2022-04-30 14:06:47.0000000,M&O MS Forms
M-002907,M037,M037-ZN04,04/24/2022 12:00:00 AM,AM,2022,4,Apr,18,Parks,Highbridge Park,30,,30,,,34,Manhattan,M-12A,ZONE,true,2022-04-30 13:52:23.0000000,M&O MS Forms
M-002932,M037,M037-ZN04,04/27/2022 12:00:00 AM,AM,2022,4,Apr,18,Parks,Highbridge Park,25,,25,,,34,Manhattan,M-12A,ZONE,true,2022-04-30 14:27:48.0000000,M&O MS Forms
M-002923,M037,M037-ZN04,04/26/2022 12:00:00 AM,AM,2022,4,Apr,18,Parks,Highbridge Park,20,,20,,,34,Manhattan,M-12A,ZONE,true,2022-04-30 14:10:13.0000000,M&O MS Forms
M-002941,M037,M037-ZN04,04/28/2022 12:00:00 AM,AM,2022,4,Apr,18,Parks,Highbridge Park,36,,36,,,34,Manhattan,M-12A,ZONE,true,2022-04-30 14:31:58.0000000,M&O MS Forms
M-002959,M037,M037-ZN04,04/30/2022 12:00:00 AM,AM,2022,4,Apr,18,Parks,Highbridge Park,32,,32,,,34,Manhattan,M-12A,ZONE,true,2022-04-30 14:51:52.0000000,M&O MS Forms
M-002950,M037,M037-ZN04,04/29/2022 12:00:00 AM,AM,2022,4,Apr,18,Parks,Highbridge Park,25,,25,,,34,Manhattan,M-12A,ZONE,true,2022-04-30 14:36:03.0000000,M&O MS Forms
M-002848,M037,M037-ZN04,04/18/2022 12:00:00 AM,AM,2022,4,Apr,17,Parks,Highbridge Park,15,,15,,,34,Manhattan,M-12A,ZONE,true,2022-04-23 12:17:44.0000000,M&O MS Forms
M-002840,M037,M037-ZN04,04/17/2022 12:00:00 AM,AM,2022,4,Apr,17,Parks,Highbridge Park,10,,10,,,34,Manhattan,M-12A,ZONE,true,2022-04-23 12:14:25.0000000,M&O MS Forms
M-002857,M037,M037-ZN04,04/19/2022 12:00:00 AM,AM,2022,4,Apr,17,Parks,Highbridge Park,25,,25,,,34,Manhattan,M-12A,ZONE,true,2022-04-23 12:21:07.0000000,M&O MS Forms
M-002866,M037,M037-ZN04,04/20/2022 12:00:00 AM,AM,2022,4,Apr,17,Parks,Highbridge Park,30,,30,,,34,Manhattan,M-12A,ZONE,true,2022-04-23 12:24:04.0000000,M&O MS Forms
M-002874,M037,M037-ZN04,04/21/2022 12:00:00 AM,AM,2022,4,Apr,17,Parks,Highbridge Park,17,,17,,,34,Manhattan,M-12A,ZONE,true,2022-04-23 12:26:51.0000000,M&O MS Forms
M-002883,M037,M037-ZN04,04/22/2022 12:00:00 AM,AM,2022,4,Apr,17,Parks,Highbridge Park,32,,32,,,34,Manhattan,M-12A,ZONE,true,2022-04-23 12:29:52.0000000,M&O MS Forms
M-002778,M037,M037-ZN04,04/09/2022 12:00:00 AM,AM,2022,4,Apr,15,Parks,Highbridge Park,12,,12,,,34,Manhattan,M-12A,ZONE,true,2022-04-17 16:24:52.0000000,M&O MS Forms
M-002786,M037,M037-ZN04,04/10/2022 12:00:00 AM,AM,2022,4,Apr,16,Parks,Highbridge Park,30,,30,,,34,Manhattan,M-12A,ZONE,true,2022-04-17 16:30:48.0000000,M&O MS Forms
M-002795,M037,M037-ZN04,04/11/2022 12:00:00 AM,AM,2022,4,Apr,16,Parks,Highbridge Park,40,,40,,,34,Manhattan,M-12A,ZONE,true,2022-04-17 16:33:55.0000000,M&O MS Forms
M-002813,M037,M037-ZN04,04/13/2022 12:00:00 AM,AM,2022,4,Apr,16,Parks,Highbridge Park,37,,37,,,34,Manhattan,M-12A,ZONE,true,2022-04-17 16:40:51.0000000,M&O MS Forms
M-002804,M037,M037-ZN04,04/12/2022 12:00:00 AM,AM,2022,4,Apr,16,BBP,Highbridge Park,55,,55,,,34,Manhattan,M-12A,ZONE,true,2022-04-17 16:36:53.0000000,M&O MS Forms
M-006040,M037,M037-ZN04,03/14/2023 12:00:00 AM,AM,2023,3,Mar,11,Parks,Highbridge Park,18,,18,,,34,Manhattan,M-12A,ZONE,true,2023-03-14 15:59:01.0000000,M&O MS Forms
M-006030,M037,M037-ZN04,03/13/2023 12:00:00 AM,AM,2023,3,Mar,11,Parks,Highbridge Park,15,,15,,,34,Manhattan,M-12A,ZONE,true,2023-03-13 16:10:22.0000000,M&O MS Forms
M-006050,M037,M037-ZN04,03/15/2023 12:00:00 AM,AM,2023,3,Mar,11,Parks,Highbridge Park,11,,11,,,34,Manhattan,M-12A,ZONE,true,2023-03-15 17:11:07.0000000,M&O MS Forms
M-005983,M037,M037-ZN04,03/08/2023 12:00:00 AM,AM,2023,3,Mar,10,Parks,Highbridge Park,10,,10,,,34,Manhattan,M-12A,ZONE,true,2023-03-08 15:44:52.0000000,M&O MS Forms
M-006021,M037,M037-ZN04,03/12/2023 12:00:00 AM,AM,2023,3,Mar,11,Parks,Highbridge Park,10,,10,,,34,Manhattan,M-12A,ZONE,true,2023-03-12 17:21:47.0000000,M&O MS Forms
M-006011,M037,M037-ZN04,03/11/2023 12:00:00 AM,AM,2023,3,Mar,10,Parks,Highbridge Park,9,,9,,,34,Manhattan,M-12A,ZONE,true,2023-03-11 16:03:06.0000000,M&O MS Forms
M-006002,M037,M037-ZN04,03/10/2023 12:00:00 AM,AM,2023,3,Mar,10,Parks,Highbridge Park,14,,14,,,34,Manhattan,M-12A,ZONE,true,2023-03-11 15:57:54.0000000,M&O MS Forms
M-005972,M037,M037-ZN04,03/07/2023 12:00:00 AM,AM,2023,3,Mar,10,Parks,Highbridge Park,12,,12,,,34,Manhattan,M-12A,ZONE,true,2023-03-07 15:46:16.0000000,M&O MS Forms
M-005992,M037,M037-ZN04,03/09/2023 12:00:00 AM,AM,2023,3,Mar,10,Parks,Highbridge Park,13,,13,,,34,Manhattan,M-12A,ZONE,true,2023-03-09 15:45:05.0000000,M&O MS Forms
M-005946,M037,M037-ZN04,03/05/2023 12:00:00 AM,AM,2023,3,Mar,10,Parks,Highbridge Park,11,,11,,,34,Manhattan,M-12A,ZONE,true,2023-03-06 06:02:28.0000000,M&O MS Forms
M-005937,M037,M037-ZN04,03/04/2023 12:00:00 AM,AM,2023,3,Mar,9,Parks,Highbridge Park,5,,5,,,34,Manhattan,M-12A,ZONE,true,2023-03-04 13:32:17.0000000,M&O MS Forms
M-005928,M037,M037-ZN04,03/03/2023 12:00:00 AM,AM,2023,3,Mar,9,Parks,Highbridge Park,11,,11,,,34,Manhattan,M-12A,ZONE,true,2023-03-04 13:28:49.0000000,M&O MS Forms
M-004281,M037,M037-ZN04,09/08/2022 12:00:00 AM,AM,2022,9,Sep,37,Parks,Highbridge Park,13,,13,,,34,Manhattan,M-12A,ZONE,true,2022-09-09 06:19:11.0000000,M&O MS Forms
M-004291,M037,M037-ZN04,09/10/2022 12:00:00 AM,AM,2022,9,Sep,37,Parks,Highbridge Park,20,,20,,,34,Manhattan,M-12A,ZONE,true,2022-09-12 06:07:05.0000000,M&O MS Forms
M-004300,M037,M037-ZN04,09/11/2022 12:00:00 AM,AM,2022,9,Sep,38,Parks,Highbridge Park,12,,12,,,34,Manhattan,M-12A,ZONE,true,2022-09-12 06:10:06.0000000,M&O MS Forms
M-004312,M037,M037-ZN04,09/11/2022 12:00:00 AM,AM,2022,9,Sep,38,Parks,Highbridge Park,12,,12,,,34,Manhattan,M-12A,ZONE,true,2022-09-13 18:01:10.0000000,M&O MS Forms
M-004321,M037,M037-ZN04,09/12/2022 12:00:00 AM,AM,2022,9,Sep,38,Parks,Highbridge Park,57,,57,,,34,Manhattan,M-12A,ZONE,true,2022-09-13 18:04:36.0000000,M&O MS Forms
M-004109,M037,M037-ZN04,08/23/2022 12:00:00 AM,AM,2022,8,Aug,35,Parks,Highbridge Park,26,,26,,,34,Manhattan,M-12A,ZONE,true,2022-08-28 17:20:14.0000000,M&O MS Forms
M-004117,M037,M037-ZN04,08/24/2022 12:00:00 AM,AM,2022,8,Aug,35,Parks,Highbridge Park,52,,52,,,34,Manhattan,M-12A,ZONE,true,2022-08-28 17:22:39.0000000,M&O MS Forms
M-004126,M037,M037-ZN04,08/25/2022 12:00:00 AM,AM,2022,8,Aug,35,Parks,Highbridge Park,15,,15,,,34,Manhattan,M-12A,ZONE,true,2022-08-28 17:28:02.0000000,M&O MS Forms
M-004143,M037,M037-ZN04,08/27/2022 12:00:00 AM,AM,2022,8,Aug,35,Parks,Highbridge Park,18,,18,,,34,Manhattan,M-12A,ZONE,true,2022-08-28 17:32:34.0000000,M&O MS Forms
M-004135,M037,M037-ZN04,08/26/2022 12:00:00 AM,AM,2022,8,Aug,35,Parks,Highbridge Park,23,,23,,,34,Manhattan,M-12A,ZONE,true,2022-08-28 17:30:31.0000000,M&O MS Forms
M-004190,M037,M037-ZN04,08/31/2022 12:00:00 AM,AM,2022,8,Aug,36,Parks,Highbridge Park,16,,16,,,34,Manhattan,M-12A,ZONE,true,2022-09-06 14:27:35.0000000,M&O MS Forms
M-004082,M037,M037-ZN04,08/20/2022 12:00:00 AM,AM,2022,8,Aug,34,Parks,Highbridge Park,16,,16,,,34,Manhattan,M-12A,ZONE,true,2022-08-28 17:11:37.0000000,M&O MS Forms
M-004091,M037,M037-ZN04,08/21/2022 12:00:00 AM,AM,2022,8,Aug,35,Parks,Highbridge Park,96,,96,,,34,Manhattan,M-12A,ZONE,true,2022-08-28 17:15:03.0000000,M&O MS Forms
M-004100,M037,M037-ZN04,08/22/2022 12:00:00 AM,AM,2022,8,Aug,35,Parks,Highbridge Park,73,,73,,,34,Manhattan,M-12A,ZONE,true,2022-08-28 17:17:39.0000000,M&O MS Forms
M-004053,M037,M037-ZN04,08/18/2022 12:00:00 AM,AM,2022,8,Aug,34,Parks,Highbridge Park,13,,13,,,34,Manhattan,M-12A,ZONE,true,2022-08-18 14:47:49.0000000,M&O MS Forms
M-004065,M037,M037-ZN04,08/19/2022 12:00:00 AM,AM,2022,8,Aug,34,Parks,Highbridge Park,14,,14,,,34,Manhattan,M-12A,ZONE,true,2022-08-20 12:04:35.0000000,M&O MS Forms
M-004044,M037,M037-ZN04,08/17/2022 12:00:00 AM,AM,2022,8,Aug,34,Parks,Highbridge Park,77,,77,,,34,Manhattan,M-12A,ZONE,true,2022-08-18 14:45:07.0000000,M&O MS Forms
M-003970,M037,M037-ZN04,08/11/2022 12:00:00 AM,AM,2022,8,Aug,33,Parks,Highbridge Park,17,,17,,,34,Manhattan,M-12A,ZONE,true,2022-08-11 16:12:53.0000000,M&O MS Forms
M-003961,M037,M037-ZN04,08/10/2022 12:00:00 AM,AM,2022,8,Aug,33,Parks,Highbridge Park,68,,68,,,34,Manhattan,M-12A,ZONE,true,2022-08-11 08:48:07.0000000,M&O MS Forms
M-003990,M037,M037-ZN04,08/12/2022 12:00:00 AM,AM,2022,8,Aug,33,Parks,Highbridge Park,15,,15,,,34,Manhattan,M-12A,ZONE,true,2022-08-15 10:06:24.0000000,M&O MS Forms
M-003998,M037,M037-ZN04,08/13/2022 12:00:00 AM,AM,2022,8,Aug,33,Parks,Highbridge Park,20,,20,,,34,Manhattan,M-12A,ZONE,true,2022-08-15 10:08:58.0000000,M&O MS Forms
M-004013,M037,M037-ZN04,08/14/2022 12:00:00 AM,AM,2022,8,Aug,34,Parks,Highbridge Park,137,,137,,,34,Manhattan,M-12A,ZONE,true,2022-08-18 14:03:15.0000000,M&O MS Forms
M-004022,M037,M037-ZN04,08/15/2022 12:00:00 AM,AM,2022,8,Aug,34,Parks,Highbridge Park,72,,72,,,34,Manhattan,M-12A,ZONE,true,2022-08-18 14:22:44.0000000,M&O MS Forms
M-004031,M037,M037-ZN04,08/16/2022 12:00:00 AM,AM,2022,8,Aug,34,Parks,Highbridge Park,52,,52,,,34,Manhattan,M-12A,ZONE,true,2022-08-18 14:27:15.0000000,M&O MS Forms
M-004035,M037,M037-ZN04,08/16/2022 12:00:00 AM,AM,2022,8,Aug,34,Parks,Highbridge Park,52,,52,,,34,Manhattan,M-12A,ZONE,true,2022-08-18 14:42:34.0000000,M&O MS Forms
M-003935,M037,M037-ZN04,08/07/2022 12:00:00 AM,AM,2022,8,Aug,33,Parks,Highbridge Park,86,,86,,,34,Manhattan,M-12A,ZONE,true,2022-08-09 08:56:16.0000000,M&O MS Forms
M-003943,M037,M037-ZN04,08/08/2022 12:00:00 AM,AM,2022,8,Aug,33,Parks,Highbridge Park,70,,70,,,34,Manhattan,M-12A,ZONE,true,2022-08-09 08:58:33.0000000,M&O MS Forms
M-003952,M037,M037-ZN04,08/09/2022 12:00:00 AM,AM,2022,8,Aug,33,Parks,Highbridge Park,70,,70,,,34,Manhattan,M-12A,ZONE,true,2022-08-09 18:22:38.0000000,M&O MS Forms
M-003917,M037,M037-ZN04,08/05/2022 12:00:00 AM,AM,2022,8,Aug,32,Parks,Highbridge Park,6,,6,,,34,Manhattan,M-12A,ZONE,true,2022-08-09 08:50:27.0000000,M&O MS Forms
M-003926,M037,M037-ZN04,08/06/2022 12:00:00 AM,AM,2022,8,Aug,32,Parks,Highbridge Park,8,,8,,,34,Manhattan,M-12A,ZONE,true,2022-08-09 08:53:10.0000000,M&O MS Forms
M-003898,M037,M037-ZN04,08/04/2022 12:00:00 AM,AM,2022,8,Aug,32,Parks,Highbridge Park,9,,9,,,34,Manhattan,M-12A,ZONE,true,2022-08-04 15:35:35.0000000,M&O MS Forms
M-005747,M037,M037-ZN04,02/12/2023 12:00:00 AM,AM,2023,2,Feb,7,Parks,Highbridge Park,10,,10,,,34,Manhattan,M-12A,ZONE,true,2023-02-12 18:55:10.0000000,M&O MS Forms
M-001370,M037,M037-ZN02,11/17/2021 12:00:00 AM,AM,2021,11,Nov,47,Parks,Highbridge Park,19,,19,,,2,Manhattan,M-12A,ZONE,true,2021-11-18 17:01:44.0000000,M&O MS Forms
M-001378,M037,M037-ZN02,11/18/2021 12:00:00 AM,AM,2021,11,Nov,47,Parks,Highbridge Park,26,,26,,,2,Manhattan,M-12A,ZONE,true,2021-11-18 17:04:48.0000000,M&O MS Forms
M-001388,M037,M037-ZN02,11/19/2021 12:00:00 AM,AM,2021,11,Nov,47,Parks,Highbridge Park,22,,22,,,2,Manhattan,M-12A,ZONE,true,2021-11-20 07:06:14.0000000,M&O MS Forms
M-001406,M037,M037-ZN02,11/21/2021 12:00:00 AM,AM,2021,11,Nov,48,Parks,Highbridge Park,3,,3,,,2,Manhattan,M-12A,ZONE,true,2021-11-25 12:24:13.0000000,M&O MS Forms
M-001397,M037,M037-ZN02,11/20/2021 12:00:00 AM,AM,2021,11,Nov,47,Parks,Highbridge Park,28,,28,,,2,Manhattan,M-12A,ZONE,true,2021-11-20 18:38:54.0000000,M&O MS Forms
M-001415,M037,M037-ZN02,11/22/2021 12:00:00 AM,AM,2021,11,Nov,48,Parks,Highbridge Park,10,,10,,,2,Manhattan,M-12A,ZONE,true,2021-11-25 12:28:45.0000000,M&O MS Forms
M-001424,M037,M037-ZN02,11/23/2021 12:00:00 AM,AM,2021,11,Nov,48,Parks,Highbridge Park,20,,20,,,2,Manhattan,M-12A,ZONE,true,2021-11-25 12:32:51.0000000,M&O MS Forms
M-001434,M037,M037-ZN02,11/24/2021 12:00:00 AM,AM,2021,11,Nov,48,Parks,Highbridge Park,25,,25,,,2,Manhattan,M-12A,ZONE,true,2021-11-25 12:36:10.0000000,M&O MS Forms
M-001443,M037,M037-ZN02,11/25/2021 12:00:00 AM,AM,2021,11,Nov,48,Parks,Highbridge Park,27,,27,,,2,Manhattan,M-12A,ZONE,true,2021-11-26 19:58:09.0000000,M&O MS Forms
M-001452,M037,M037-ZN02,11/26/2021 12:00:00 AM,AM,2021,11,Nov,48,Parks,Highbridge Park,16,,16,,,2,Manhattan,M-12A,ZONE,true,2021-11-26 20:01:04.0000000,M&O MS Forms
M-001473,M037,M037-ZN02,11/27/2021 12:00:00 AM,AM,2021,11,Nov,48,Parks,Highbridge Park,28,,28,,,2,Manhattan,M-12A,ZONE,true,2021-11-29 08:55:44.0000000,M&O MS Forms
M-001487,M037,M037-ZN02,11/28/2021 12:00:00 AM,AM,2021,11,Nov,49,Parks,Highbridge Park,15,,15,,,2,Manhattan,M-12A,ZONE,true,2021-12-02 08:40:30.0000000,M&O MS Forms
M-001504,M037,M037-ZN02,11/30/2021 12:00:00 AM,AM,2021,11,Nov,49,Parks,Highbridge Park,30,,30,,,2,Manhattan,M-12A,ZONE,true,2021-12-02 08:47:02.0000000,M&O MS Forms
M-001495,M037,M037-ZN02,11/29/2021 12:00:00 AM,AM,2021,11,Nov,49,Parks,Highbridge Park,25,,25,,,2,Manhattan,M-12A,ZONE,true,2021-12-02 08:43:35.0000000,M&O MS Forms
M-001513,M037,M037-ZN02,12/01/2021 12:00:00 AM,AM,2021,12,Dec,49,Parks,Highbridge Park,40,,40,,,2,Manhattan,M-12A,ZONE,true,2021-12-02 08:49:52.0000000,M&O MS Forms
M-001538,M037,M037-ZN02,12/05/2021 12:00:00 AM,AM,2021,12,Dec,50,Parks,Highbridge Park,32,,32,,,2,Manhattan,M-12A,ZONE,true,2021-12-05 13:37:29.0000000,M&O MS Forms
M-001529,M037,M037-ZN02,12/05/2021 12:00:00 AM,AM,2021,12,Dec,50,Parks,Highbridge Park,40,,40,,,2,Manhattan,M-12A,ZONE,true,2021-12-05 13:33:46.0000000,M&O MS Forms
M-001548,M037,M037-ZN02,12/04/2021 12:00:00 AM,AM,2021,12,Dec,49,Parks,Highbridge Park,42,,42,,,2,Manhattan,M-12A,ZONE,true,2021-12-05 13:41:22.0000000,M&O MS Forms
M-001570,M037,M037-ZN02,12/06/2021 12:00:00 AM,AM,2021,12,Dec,50,Parks,Highbridge Park,35,,35,,,2,Manhattan,M-12A,ZONE,true,2021-12-09 16:08:33.0000000,M&O MS Forms
M-001561,M037,M037-ZN02,12/05/2021 12:00:00 AM,AM,2021,12,Dec,50,Parks,Highbridge Park,10,,10,,,2,Manhattan,M-12A,ZONE,true,2021-12-09 16:05:40.0000000,M&O MS Forms
M-001710,M037,M037-ZN02,12/18/2021 12:00:00 AM,AM,2021,12,Dec,51,Parks,Highbridge Park,24,,24,,,2,Manhattan,M-12A,ZONE,true,2021-12-19 10:22:11.0000000,M&O MS Forms
M-001701,M037,M037-ZN02,12/17/2021 12:00:00 AM,AM,2021,12,Dec,51,Parks,Highbridge Park,20,,20,,,2,Manhattan,M-12A,ZONE,true,2021-12-19 10:17:18.0000000,M&O MS Forms
M-001579,M037,M037-ZN02,12/07/2021 12:00:00 AM,AM,2021,12,Dec,50,Parks,Highbridge Park,40,,40,,,2,Manhattan,M-12A,ZONE,true,2021-12-09 16:11:51.0000000,M&O MS Forms
M-001588,M037,M037-ZN02,12/08/2021 12:00:00 AM,AM,2021,12,Dec,50,Parks,Highbridge Park,65,,65,,,2,Manhattan,M-12A,ZONE,true,2021-12-09 16:14:35.0000000,M&O MS Forms
M-001613,M037,M037-ZN02,12/10/2021 12:00:00 AM,AM,2021,12,Dec,50,Parks,Highbridge Park,85,,85,,,2,Manhattan,M-12A,ZONE,true,2021-12-11 08:02:27.0000000,M&O MS Forms
M-001604,M037,M037-ZN02,12/09/2021 12:00:00 AM,AM,2021,12,Dec,50,Parks,Highbridge Park,70,,70,,,2,Manhattan,M-12A,ZONE,true,2021-12-11 07:57:43.0000000,M&O MS Forms
M-001634,M037,M037-ZN02,12/12/2021 12:00:00 AM,AM,2021,12,Dec,51,Parks,Highbridge Park,20,,20,,,2,Manhattan,M-12A,ZONE,true,2021-12-14 16:29:35.0000000,M&O MS Forms
M-001625,M037,M037-ZN02,12/11/2021 12:00:00 AM,AM,2021,12,Dec,50,Parks,Highbridge Park,90,,90,,,2,Manhattan,M-12A,ZONE,true,2021-12-14 16:22:03.0000000,M&O MS Forms
M-001643,M037,M037-ZN02,12/13/2021 12:00:00 AM,AM,2021,12,Dec,51,Parks,Highbridge Park,70,,70,,,2,Manhattan,M-12A,ZONE,true,2021-12-14 16:32:19.0000000,M&O MS Forms
M-001664,M037,M037-ZN02,12/14/2021 12:00:00 AM,AM,2021,12,Dec,51,Parks,Highbridge Park,25,,25,,,2,Manhattan,M-12A,ZONE,true,2021-12-16 16:25:55.0000000,M&O MS Forms
M-001673,M037,M037-ZN02,12/15/2021 12:00:00 AM,AM,2021,12,Dec,51,Parks,Highbridge Park,10,,10,,,2,Manhattan,M-12A,ZONE,true,2021-12-16 16:33:46.0000000,M&O MS Forms
M-001685,M037,M037-ZN02,12/16/2021 12:00:00 AM,AM,2021,12,Dec,51,Parks,Highbridge Park,15,,15,,,2,Manhattan,M-12A,ZONE,true,2021-12-16 16:45:22.0000000,M&O MS Forms
M-004032,M037,M037-ZN05,08/16/2022 12:00:00 AM,AM,2022,8,Aug,34,Parks,Highbridge Park,4,,4,,,34,Manhattan,M-12A,ZONE,true,2022-08-18 14:27:33.0000000,M&O MS Forms
M-004023,M037,M037-ZN05,08/15/2022 12:00:00 AM,AM,2022,8,Aug,34,Parks,Highbridge Park,17,,17,,,34,Manhattan,M-12A,ZONE,true,2022-08-18 14:23:01.0000000,M&O MS Forms
M-004014,M037,M037-ZN05,08/14/2022 12:00:00 AM,AM,2022,8,Aug,34,Parks,Highbridge Park,13,,13,,,34,Manhattan,M-12A,ZONE,true,2022-08-18 14:03:31.0000000,M&O MS Forms
M-003999,M037,M037-ZN05,08/13/2022 12:00:00 AM,AM,2022,8,Aug,33,Parks,Highbridge Park,4,,4,,,34,Manhattan,M-12A,ZONE,true,2022-08-15 10:09:16.0000000,M&O MS Forms
M-003991,M037,M037-ZN05,08/12/2022 12:00:00 AM,AM,2022,8,Aug,33,Parks,Highbridge Park,9,,9,,,34,Manhattan,M-12A,ZONE,true,2022-08-15 10:06:43.0000000,M&O MS Forms
M-003962,M037,M037-ZN05,08/10/2022 12:00:00 AM,AM,2022,8,Aug,33,Parks,Highbridge Park,9,,9,,,34,Manhattan,M-12A,ZONE,true,2022-08-11 08:48:28.0000000,M&O MS Forms
M-003971,M037,M037-ZN05,08/11/2022 12:00:00 AM,AM,2022,8,Aug,33,Parks,Highbridge Park,10,,10,,,34,Manhattan,M-12A,ZONE,true,2022-08-11 16:13:10.0000000,M&O MS Forms
M-004045,M037,M037-ZN05,08/17/2022 12:00:00 AM,AM,2022,8,Aug,34,Parks,Highbridge Park,6,,6,,,34,Manhattan,M-12A,ZONE,true,2022-08-18 14:45:23.0000000,M&O MS Forms
M-004066,M037,M037-ZN05,08/19/2022 12:00:00 AM,AM,2022,8,Aug,34,Parks,Highbridge Park,12,,12,,,34,Manhattan,M-12A,ZONE,true,2022-08-20 12:04:56.0000000,M&O MS Forms
M-004054,M037,M037-ZN05,08/18/2022 12:00:00 AM,AM,2022,8,Aug,34,Parks,Highbridge Park,8,,8,,,34,Manhattan,M-12A,ZONE,true,2022-08-18 14:48:07.0000000,M&O MS Forms
M-004101,M037,M037-ZN05,08/22/2022 12:00:00 AM,AM,2022,8,Aug,35,Parks,Highbridge Park,8,,8,,,34,Manhattan,M-12A,ZONE,true,2022-08-28 17:17:55.0000000,M&O MS Forms
M-004092,M037,M037-ZN05,08/21/2022 12:00:00 AM,AM,2022,8,Aug,35,Parks,Highbridge Park,9,,9,,,34,Manhattan,M-12A,ZONE,true,2022-08-28 17:15:22.0000000,M&O MS Forms
M-004083,M037,M037-ZN05,08/20/2022 12:00:00 AM,AM,2022,8,Aug,34,Parks,Highbridge Park,9,,9,,,34,Manhattan,M-12A,ZONE,true,2022-08-28 17:11:54.0000000,M&O MS Forms
M-004191,M037,M037-ZN05,08/31/2022 12:00:00 AM,AM,2022,8,Aug,36,Parks,Highbridge Park,2,,2,,,34,Manhattan,M-12A,ZONE,true,2022-09-06 14:27:53.0000000,M&O MS Forms
M-004144,M037,M037-ZN05,08/27/2022 12:00:00 AM,AM,2022,8,Aug,35,Parks,Highbridge Park,6,,6,,,34,Manhattan,M-12A,ZONE,true,2022-08-28 17:32:52.0000000,M&O MS Forms
M-004127,M037,M037-ZN05,08/25/2022 12:00:00 AM,AM,2022,8,Aug,35,Parks,Highbridge Park,9,,9,,,34,Manhattan,M-12A,ZONE,true,2022-08-28 17:28:18.0000000,M&O MS Forms
M-004118,M037,M037-ZN05,08/24/2022 12:00:00 AM,AM,2022,8,Aug,35,Parks,Highbridge Park,3,,3,,,34,Manhattan,M-12A,ZONE,true,2022-08-28 17:22:56.0000000,M&O MS Forms
M-004110,M037,M037-ZN05,08/23/2022 12:00:00 AM,AM,2022,8,Aug,35,Parks,Highbridge Park,4,,4,,,34,Manhattan,M-12A,ZONE,true,2022-08-28 17:20:30.0000000,M&O MS Forms
M-004322,M037,M037-ZN05,09/12/2022 12:00:00 AM,AM,2022,9,Sep,38,Parks,Highbridge Park,15,,15,,,34,Manhattan,M-12A,ZONE,true,2022-09-13 18:05:13.0000000,M&O MS Forms
M-004313,M037,M037-ZN05,09/11/2022 12:00:00 AM,AM,2022,9,Sep,38,Parks,Highbridge Park,13,,13,,,34,Manhattan,M-12A,ZONE,true,2022-09-13 18:01:39.0000000,M&O MS Forms
M-004301,M037,M037-ZN05,09/11/2022 12:00:00 AM,AM,2022,9,Sep,38,Parks,Highbridge Park,13,,13,,,34,Manhattan,M-12A,ZONE,true,2022-09-12 06:10:30.0000000,M&O MS Forms
M-004292,M037,M037-ZN05,09/10/2022 12:00:00 AM,AM,2022,9,Sep,37,Parks,Highbridge Park,9,,9,,,34,Manhattan,M-12A,ZONE,true,2022-09-12 06:07:24.0000000,M&O MS Forms
M-004282,M037,M037-ZN05,09/08/2022 12:00:00 AM,AM,2022,9,Sep,37,Parks,Highbridge Park,7,,7,,,34,Manhattan,M-12A,ZONE,true,2022-09-09 06:19:26.0000000,M&O MS Forms
M-004273,M037,M037-ZN05,09/07/2022 12:00:00 AM,AM,2022,9,Sep,37,Parks,Highbridge Park,8,,8,,,34,Manhattan,M-12A,ZONE,true,2022-09-09 05:41:05.0000000,M&O MS Forms
M-004264,M037,M037-ZN05,09/06/2022 12:00:00 AM,AM,2022,9,Sep,37,Parks,Highbridge Park,10,,10,,,34,Manhattan,M-12A,ZONE,true,2022-09-09 05:37:52.0000000,M&O MS Forms
M-004255,M037,M037-ZN05,09/05/2022 12:00:00 AM,AM,2022,9,Sep,37,Parks,Highbridge Park,4,,4,,,34,Manhattan,M-12A,ZONE,true,2022-09-09 05:32:32.0000000,M&O MS Forms
M-004236,M037,M037-ZN05,09/05/2022 12:00:00 AM,AM,2022,9,Sep,37,Parks,Highbridge Park,4,,4,,,34,Manhattan,M-12A,ZONE,true,2022-09-06 14:43:23.0000000,M&O MS Forms
M-004246,M037,M037-ZN05,09/04/2022 12:00:00 AM,AM,2022,9,Sep,37,Parks,Highbridge Park,9,,9,,,34,Manhattan,M-12A,ZONE,true,2022-09-09 05:28:20.0000000,M&O MS Forms
M-004226,M037,M037-ZN05,09/04/2022 12:00:00 AM,AM,2022,9,Sep,37,Parks,Highbridge Park,9,,9,,,34,Manhattan,M-12A,ZONE,true,2022-09-06 14:39:08.0000000,M&O MS Forms
M-004217,M037,M037-ZN05,09/03/2022 12:00:00 AM,AM,2022,9,Sep,36,Parks,Highbridge Park,6,,6,,,34,Manhattan,M-12A,ZONE,true,2022-09-06 14:35:47.0000000,M&O MS Forms
M-004200,M037,M037-ZN05,09/01/2022 12:00:00 AM,AM,2022,9,Sep,36,Parks,Highbridge Park,10,,10,,,34,Manhattan,M-12A,ZONE,true,2022-09-06 14:30:28.0000000,M&O MS Forms
M-005623,M037,M037-ZN05,01/30/2023 12:00:00 AM,AM,2023,1,Jan,5,Parks,Highbridge Park,5,,5,,,34,Manhattan,M-12A,ZONE,true,2023-01-30 16:22:34.0000000,M&O MS Forms
M-006012,M037,M037-ZN05,03/11/2023 12:00:00 AM,AM,2023,3,Mar,10,Parks,Highbridge Park,10,,10,,,34,Manhattan,M-12A,ZONE,true,2023-03-11 16:03:33.0000000,M&O MS Forms
M-006022,M037,M037-ZN05,03/12/2023 12:00:00 AM,AM,2023,3,Mar,11,Parks,Highbridge Park,4,,4,,,34,Manhattan,M-12A,ZONE,true,2023-03-12 17:22:02.0000000,M&O MS Forms
M-005984,M037,M037-ZN05,03/08/2023 12:00:00 AM,AM,2023,3,Mar,10,Parks,Highbridge Park,5,,5,,,34,Manhattan,M-12A,ZONE,true,2023-03-08 15:45:13.0000000,M&O MS Forms
M-006051,M037,M037-ZN05,03/15/2023 12:00:00 AM,AM,2023,3,Mar,11,Parks,Highbridge Park,5,,5,,,34,Manhattan,M-12A,ZONE,true,2023-03-15 17:11:22.0000000,M&O MS Forms
M-006031,M037,M037-ZN05,03/13/2023 12:00:00 AM,AM,2023,3,Mar,11,Parks,Highbridge Park,2,,2,,,34,Manhattan,M-12A,ZONE,true,2023-03-13 16:10:38.0000000,M&O MS Forms
M-006041,M037,M037-ZN05,03/14/2023 12:00:00 AM,AM,2023,3,Mar,11,Parks,Highbridge Park,3,,3,,,34,Manhattan,M-12A,ZONE,true,2023-03-14 15:59:49.0000000,M&O MS Forms
M-001667,M037,M037-ZN05,12/15/2021 12:00:00 AM,AM,2021,12,Dec,51,Parks,Highbridge Park,80,,80,,,34,Manhattan,M-12A,ZONE,true,2021-12-16 16:28:06.0000000,M&O MS Forms
M-001677,M037,M037-ZN05,12/15/2021 12:00:00 AM,AM,2021,12,Dec,51,Parks,Highbridge Park,95,,95,,,34,Manhattan,M-12A,ZONE,true,2021-12-16 16:38:23.0000000,M&O MS Forms
M-001688,M037,M037-ZN05,12/16/2021 12:00:00 AM,AM,2021,12,Dec,51,Parks,Highbridge Park,60,,60,,,34,Manhattan,M-12A,ZONE,true,2021-12-16 16:46:36.0000000,M&O MS Forms
M-001646,M037,M037-ZN05,12/13/2021 12:00:00 AM,AM,2021,12,Dec,51,Parks,Highbridge Park,75,,75,,,34,Manhattan,M-12A,ZONE,true,2021-12-14 16:33:16.0000000,M&O MS Forms
M-001637,M037,M037-ZN05,12/12/2021 12:00:00 AM,AM,2021,12,Dec,51,Parks,Highbridge Park,25,,25,,,34,Manhattan,M-12A,ZONE,true,2021-12-14 16:30:31.0000000,M&O MS Forms
M-001628,M037,M037-ZN05,12/11/2021 12:00:00 AM,AM,2021,12,Dec,50,Parks,Highbridge Park,85,,85,,,34,Manhattan,M-12A,ZONE,true,2021-12-14 16:23:06.0000000,M&O MS Forms
M-001607,M037,M037-ZN05,12/09/2021 12:00:00 AM,AM,2021,12,Dec,50,Parks,Highbridge Park,82,,82,,,34,Manhattan,M-12A,ZONE,true,2021-12-11 07:59:21.0000000,M&O MS Forms
M-001616,M037,M037-ZN05,12/10/2021 12:00:00 AM,AM,2021,12,Dec,50,Parks,Highbridge Park,69,,69,,,34,Manhattan,M-12A,ZONE,true,2021-12-11 08:04:43.0000000,M&O MS Forms
M-001591,M037,M037-ZN05,12/08/2021 12:00:00 AM,AM,2021,12,Dec,50,Parks,Highbridge Park,65,,65,,,34,Manhattan,M-12A,ZONE,true,2021-12-09 16:15:42.0000000,M&O MS Forms
M-001582,M037,M037-ZN05,12/07/2021 12:00:00 AM,AM,2021,12,Dec,50,Parks,Highbridge Park,50,,50,,,34,Manhattan,M-12A,ZONE,true,2021-12-09 16:12:43.0000000,M&O MS Forms
M-001573,M037,M037-ZN05,12/06/2021 12:00:00 AM,PM,2021,12,Dec,50,Parks,Highbridge Park,45,,45,,,34,Manhattan,M-12A,ZONE,true,2021-12-09 16:09:44.0000000,M&O MS Forms
M-002875,M037,M037-ZN05,04/21/2022 12:00:00 AM,AM,2022,4,Apr,17,Parks,Highbridge Park,8,,8,,,34,Manhattan,M-12A,ZONE,true,2022-04-23 12:27:11.0000000,M&O MS Forms
M-002884,M037,M037-ZN05,04/22/2022 12:00:00 AM,AM,2022,4,Apr,17,Parks,Highbridge Park,6,,6,,,34,Manhattan,M-12A,ZONE,true,2022-04-23 12:30:11.0000000,M&O MS Forms
M-002867,M037,M037-ZN05,04/20/2022 12:00:00 AM,AM,2022,4,Apr,17,Parks,Highbridge Park,4,,4,,,34,Manhattan,M-12A,ZONE,true,2022-04-23 12:24:27.0000000,M&O MS Forms
M-002858,M037,M037-ZN05,04/19/2022 12:00:00 AM,AM,2022,4,Apr,17,Parks,Highbridge Park,5,,5,,,34,Manhattan,M-12A,ZONE,true,2022-04-23 12:21:22.0000000,M&O MS Forms
M-002841,M037,M037-ZN05,04/17/2022 12:00:00 AM,AM,2022,4,Apr,17,Parks,Highbridge Park,5,,5,,,34,Manhattan,M-12A,ZONE,true,2022-04-23 12:14:48.0000000,M&O MS Forms
M-002849,M037,M037-ZN05,04/18/2022 12:00:00 AM,AM,2022,4,Apr,17,Parks,Highbridge Park,8,,8,,,34,Manhattan,M-12A,ZONE,true,2022-04-23 12:18:05.0000000,M&O MS Forms
M-002951,M037,M037-ZN05,04/29/2022 12:00:00 AM,AM,2022,4,Apr,18,Parks,Highbridge Park,17,,17,,,34,Manhattan,M-12A,ZONE,true,2022-04-30 14:36:32.0000000,M&O MS Forms
M-002960,M037,M037-ZN05,04/30/2022 12:00:00 AM,AM,2022,4,Apr,18,Parks,Highbridge Park,26,,26,,,34,Manhattan,M-12A,ZONE,true,2022-04-30 14:52:36.0000000,M&O MS Forms
M-002942,M037,M037-ZN05,04/28/2022 12:00:00 AM,AM,2022,4,Apr,18,Parks,Highbridge Park,22,,22,,,34,Manhattan,M-12A,ZONE,true,2022-04-30 14:32:18.0000000,M&O MS Forms
M-002924,M037,M037-ZN05,04/26/2022 12:00:00 AM,AM,2022,4,Apr,18,Parks,Highbridge Park,20,,20,,,34,Manhattan,M-12A,ZONE,true,2022-04-30 14:21:44.0000000,M&O MS Forms
M-002933,M037,M037-ZN05,04/27/2022 12:00:00 AM,AM,2022,4,Apr,18,Parks,Highbridge Park,8,,8,,,34,Manhattan,M-12A,ZONE,true,2022-04-30 14:28:19.0000000,M&O MS Forms
M-002908,M037,M037-ZN05,04/24/2022 12:00:00 AM,AM,2022,4,Apr,18,Parks,Highbridge Park,10,,10,,,34,Manhattan,M-12A,ZONE,true,2022-04-30 13:52:50.0000000,M&O MS Forms
M-002917,M037,M037-ZN05,04/25/2022 12:00:00 AM,AM,2022,4,Apr,18,Parks,Highbridge Park,15,,15,,,34,Manhattan,M-12A,ZONE,true,2022-04-30 14:07:14.0000000,M&O MS Forms
M-002969,M037,M037-ZN05,04/23/2022 12:00:00 AM,AM,2022,4,Apr,17,Parks,Highbridge Park,7,,7,,,34,Manhattan,M-12A,ZONE,true,2022-04-30 14:57:24.0000000,M&O MS Forms
M-002991,M037,M037-ZN05,05/01/2022 12:00:00 AM,AM,2022,5,May,19,Parks,Highbridge Park,17,,17,,,34,Manhattan,M-12A,ZONE,true,2022-05-06 19:19:24.0000000,M&O MS Forms
M-003024,M037,M037-ZN05,05/06/2022 12:00:00 AM,AM,2022,5,May,19,Parks,Highbridge Park,11,,11,,,34,Manhattan,M-12A,ZONE,true,2022-05-06 20:04:47.0000000,M&O MS Forms
M-003006,M037,M037-ZN05,05/04/2022 12:00:00 AM,AM,2022,5,May,19,Parks,Highbridge Park,10,,10,,,34,Manhattan,M-12A,ZONE,true,2022-05-06 19:44:56.0000000,M&O MS Forms
M-003015,M037,M037-ZN05,05/05/2022 12:00:00 AM,AM,2022,5,May,19,Parks,Highbridge Park,8,,8,,,34,Manhattan,M-12A,ZONE,true,2022-05-06 19:48:45.0000000,M&O MS Forms
M-003036,M037,M037-ZN05,05/07/2022 12:00:00 AM,AM,2022,5,May,19,Parks,Highbridge Park,2,,2,,,34,Manhattan,M-12A,ZONE,true,2022-05-09 08:01:07.0000000,M&O MS Forms
M-003044,M037,M037-ZN05,05/08/2022 12:00:00 AM,AM,2022,5,May,20,Parks,Highbridge Park,2,,2,,,34,Manhattan,M-12A,ZONE,true,2022-05-09 08:07:59.0000000,M&O MS Forms
M-003054,M037,M037-ZN05,05/08/2022 12:00:00 AM,AM,2022,5,May,20,Parks,Highbridge Park,2,,2,,,34,Manhattan,M-12A,ZONE,true,2022-05-13 15:09:19.0000000,M&O MS Forms
M-003064,M037,M037-ZN05,05/09/2022 12:00:00 AM,AM,2022,5,May,20,Parks,Highbridge Park,3,,3,,,34,Manhattan,M-12A,ZONE,true,2022-05-13 15:14:11.0000000,M&O MS Forms
M-003091,M037,M037-ZN05,05/12/2022 12:00:00 AM,AM,2022,5,May,20,Parks,Highbridge Park,20,,20,,,34,Manhattan,M-12A,ZONE,true,2022-05-13 15:26:47.0000000,M&O MS Forms
M-003082,M037,M037-ZN05,05/11/2022 12:00:00 AM,AM,2022,5,May,20,Parks,Highbridge Park,10,,10,,,34,Manhattan,M-12A,ZONE,true,2022-05-13 15:21:04.0000000,M&O MS Forms
M-003073,M037,M037-ZN05,05/10/2022 12:00:00 AM,AM,2022,5,May,20,Parks,Highbridge Park,5,,5,,,34,Manhattan,M-12A,ZONE,true,2022-05-13 15:17:42.0000000,M&O MS Forms
M-003136,M037,M037-ZN05,05/16/2022 12:00:00 AM,AM,2022,5,May,21,Parks,Highbridge Park,15,,15,,,34,Manhattan,M-12A,ZONE,true,2022-05-20 15:01:44.0000000,M&O MS Forms
M-003145,M037,M037-ZN05,05/17/2022 12:00:00 AM,AM,2022,5,May,21,Parks,Highbridge Park,19,,19,,,34,Manhattan,M-12A,ZONE,true,2022-05-20 15:04:35.0000000,M&O MS Forms
M-003154,M037,M037-ZN05,05/18/2022 12:00:00 AM,AM,2022,5,May,21,Parks,Highbridge Park,10,,10,,,34,Manhattan,M-12A,ZONE,true,2022-05-20 15:07:36.0000000,M&O MS Forms
M-003123,M037,M037-ZN05,05/15/2022 12:00:00 AM,AM,2022,5,May,21,Parks,Highbridge Park,12,,12,,,34,Manhattan,M-12A,ZONE,true,2022-05-15 16:52:47.0000000,M&O MS Forms
M-003103,M037,M037-ZN05,05/13/2022 12:00:00 AM,AM,2022,5,May,20,Parks,Highbridge Park,11,,11,,,34,Manhattan,M-12A,ZONE,true,2022-05-14 10:50:18.0000000,M&O MS Forms
M-003113,M037,M037-ZN05,05/14/2022 12:00:00 AM,AM,2022,5,May,20,Parks,Highbridge Park,5,,5,,,34,Manhattan,M-12A,ZONE,true,2022-05-14 15:50:23.0000000,M&O MS Forms
M-003206,M037,M037-ZN05,05/23/2022 12:00:00 AM,AM,2022,5,May,22,Parks,Highbridge Park,9,,9,,,34,Manhattan,M-12A,ZONE,true,2022-05-28 10:46:16.0000000,M&O MS Forms
M-005357,M037,M037-ZN02,01/02/2023 12:00:00 AM,AM,2023,1,Jan,1,Parks,Highbridge Park,8,,8,,,2,Manhattan,M-12A,ZONE,true,2023-01-03 17:11:29.0000000,M&O MS Forms
M-005490,M037,M037-ZN02,01/16/2023 12:00:00 AM,AM,2023,1,Jan,3,Parks,Highbridge Park,3,,3,,,2,Manhattan,M-12A,ZONE,true,2023-01-23 16:01:33.0000000,M&O MS Forms
M-005337,M037,M037-ZN02,12/31/2022 12:00:00 AM,AM,2022,12,Dec,53,Parks,Highbridge Park,20,,20,,,2,Manhattan,M-12A,ZONE,true,2023-01-01 10:31:49.0000000,M&O MS Forms
M-005348,M037,M037-ZN02,01/01/2023 12:00:00 AM,AM,2023,1,Jan,1,Parks,Highbridge Park,5,,5,,,2,Manhattan,M-12A,ZONE,true,2023-01-03 15:22:21.0000000,M&O MS Forms
M-005522,M037,M037-ZN02,01/19/2023 12:00:00 AM,AM,2023,1,Jan,3,Parks,Highbridge Park,12,,12,,,2,Manhattan,M-12A,ZONE,true,2023-01-23 16:28:38.0000000,M&O MS Forms
M-005531,M037,M037-ZN02,01/20/2023 12:00:00 AM,AM,2023,1,Jan,3,Parks,Highbridge Park,13,,13,,,2,Manhattan,M-12A,ZONE,true,2023-01-23 16:31:28.0000000,M&O MS Forms
M-005512,M037,M037-ZN02,01/18/2023 12:00:00 AM,AM,2023,1,Jan,3,Parks,Highbridge Park,10,,10,,,2,Manhattan,M-12A,ZONE,true,2023-01-23 16:13:38.0000000,M&O MS Forms
M-005502,M037,M037-ZN02,01/17/2023 12:00:00 AM,AM,2023,1,Jan,3,Parks,Highbridge Park,8,,8,,,2,Manhattan,M-12A,ZONE,true,2023-01-23 16:05:12.0000000,M&O MS Forms
M-005566,M037,M037-ZN02,01/24/2023 12:00:00 AM,AM,2023,1,Jan,4,Parks,Highbridge Park,5,,5,,,2,Manhattan,M-12A,ZONE,true,2023-01-24 17:12:31.0000000,M&O MS Forms
M-005558,M037,M037-ZN02,01/23/2023 12:00:00 AM,AM,2023,1,Jan,4,Parks,Highbridge Park,3,,3,,,2,Manhattan,M-12A,ZONE,true,2023-01-23 16:48:54.0000000,M&O MS Forms
M-005549,M037,M037-ZN02,01/22/2023 12:00:00 AM,AM,2023,1,Jan,4,Parks,Highbridge Park,5,,5,,,2,Manhattan,M-12A,ZONE,true,2023-01-23 16:46:10.0000000,M&O MS Forms
M-005540,M037,M037-ZN02,01/21/2023 12:00:00 AM,AM,2023,1,Jan,3,Parks,Highbridge Park,18,,18,,,2,Manhattan,M-12A,ZONE,true,2023-01-23 16:34:35.0000000,M&O MS Forms
M-005657,M037,M037-ZN02,02/02/2023 12:00:00 AM,AM,2023,2,Feb,5,Parks,Highbridge Park,9,,9,,,2,Manhattan,M-12A,ZONE,true,2023-02-02 15:40:39.0000000,M&O MS Forms
M-005647,M037,M037-ZN02,02/01/2023 12:00:00 AM,AM,2023,2,Feb,5,Parks,Highbridge Park,10,,10,,,2,Manhattan,M-12A,ZONE,true,2023-02-01 15:49:22.0000000,M&O MS Forms
M-005667,M037,M037-ZN02,02/03/2023 12:00:00 AM,AM,2023,2,Feb,5,Parks,Highbridge Park,11,,11,,,2,Manhattan,M-12A,ZONE,true,2023-02-03 17:14:08.0000000,M&O MS Forms
M-005676,M037,M037-ZN02,02/04/2023 12:00:00 AM,AM,2023,2,Feb,5,Parks,Highbridge Park,5,,5,,,2,Manhattan,M-12A,ZONE,true,2023-02-05 11:29:42.0000000,M&O MS Forms
M-005687,M037,M037-ZN02,02/06/2023 12:00:00 AM,AM,2023,2,Feb,6,Parks,Highbridge Park,3,,3,,,2,Manhattan,M-12A,ZONE,true,2023-02-07 17:24:50.0000000,M&O MS Forms
M-005705,M037,M037-ZN02,02/08/2023 12:00:00 AM,AM,2023,2,Feb,6,Parks,Highbridge Park,10,,10,,,2,Manhattan,M-12A,ZONE,true,2023-02-08 15:59:48.0000000,M&O MS Forms
M-005696,M037,M037-ZN02,02/07/2023 12:00:00 AM,AM,2023,2,Feb,6,Parks,Highbridge Park,7,,7,,,2,Manhattan,M-12A,ZONE,true,2023-02-07 17:29:15.0000000,M&O MS Forms
M-005717,M037,M037-ZN02,02/09/2023 12:00:00 AM,AM,2023,2,Feb,6,Parks,Highbridge Park,13,,13,,,2,Manhattan,M-12A,ZONE,true,2023-02-09 15:42:03.0000000,M&O MS Forms
M-005726,M037,M037-ZN02,02/10/2023 12:00:00 AM,AM,2023,2,Feb,6,Parks,Highbridge Park,10,,10,,,2,Manhattan,M-12A,ZONE,true,2023-02-11 17:47:58.0000000,M&O MS Forms
M-005574,M037,M037-ZN02,01/25/2023 12:00:00 AM,AM,2023,1,Jan,4,Parks,Highbridge Park,2,,2,,,2,Manhattan,M-12A,ZONE,true,2023-01-25 17:08:17.0000000,M&O MS Forms
M-005594,M037,M037-ZN02,01/27/2023 12:00:00 AM,AM,2023,1,Jan,4,Parks,Highbridge Park,11,,11,,,2,Manhattan,M-12A,ZONE,true,2023-01-30 16:02:07.0000000,M&O MS Forms
M-005584,M037,M037-ZN02,01/26/2023 12:00:00 AM,AM,2023,1,Jan,4,Parks,Highbridge Park,10,,10,,,2,Manhattan,M-12A,ZONE,true,2023-01-26 17:35:50.0000000,M&O MS Forms
M-005583,M037,M037-ZN02,01/26/2023 12:00:00 AM,AM,2023,1,Jan,4,Parks,Highbridge Park,10,,10,,,2,Manhattan,M-12A,ZONE,true,2023-01-26 17:35:50.0000000,M&O MS Forms
M-005603,M037,M037-ZN02,01/28/2023 12:00:00 AM,AM,2023,1,Jan,4,Parks,Highbridge Park,13,,13,,,2,Manhattan,M-12A,ZONE,true,2023-01-30 16:08:50.0000000,M&O MS Forms
M-005611,M037,M037-ZN02,01/29/2023 12:00:00 AM,AM,2023,1,Jan,5,Parks,Highbridge Park,4,,4,,,2,Manhattan,M-12A,ZONE,true,2023-01-30 16:17:58.0000000,M&O MS Forms
M-005637,M037,M037-ZN02,01/31/2023 12:00:00 AM,AM,2023,1,Jan,5,Parks,Highbridge Park,8,,8,,,2,Manhattan,M-12A,ZONE,true,2023-01-31 15:44:13.0000000,M&O MS Forms
M-005620,M037,M037-ZN02,01/30/2023 12:00:00 AM,AM,2023,1,Jan,5,Parks,Highbridge Park,6,,6,,,2,Manhattan,M-12A,ZONE,true,2023-01-30 16:21:37.0000000,M&O MS Forms
M-004205,M037,M037-ZN02,09/02/2022 12:00:00 AM,AM,2022,9,Sep,36,Parks,Highbridge Park,42,,42,,,2,Manhattan,M-12A,ZONE,true,2022-09-06 14:31:57.0000000,M&O MS Forms
M-004214,M037,M037-ZN02,09/03/2022 12:00:00 AM,AM,2022,9,Sep,36,Parks,Highbridge Park,50,,50,,,2,Manhattan,M-12A,ZONE,true,2022-09-06 14:34:57.0000000,M&O MS Forms
M-004243,M037,M037-ZN02,09/04/2022 12:00:00 AM,AM,2022,9,Sep,37,Parks,Highbridge Park,50,,50,,,2,Manhattan,M-12A,ZONE,true,2022-09-09 05:27:27.0000000,M&O MS Forms
M-002600,M037,M037-03,03/23/2022 12:00:00 AM,AM,2022,3,Mar,13,Parks,Highbridge Park,8,,8,,,34,Manhattan,M-12A,PLGD,true,2022-03-24 19:57:25.0000000,M&O MS Forms
M-002626,M037,M037-03,03/25/2022 12:00:00 AM,AM,2022,3,Mar,13,Parks,Highbridge Park,11,,11,,,34,Manhattan,M-12A,PLGD,true,2022-03-26 19:23:43.0000000,M&O MS Forms
M-002591,M037,M037-03,03/22/2022 12:00:00 AM,AM,2022,3,Mar,13,Parks,Highbridge Park,6,,6,,,34,Manhattan,M-12A,PLGD,true,2022-03-24 19:53:25.0000000,M&O MS Forms
M-002582,M037,M037-03,03/21/2022 12:00:00 AM,AM,2022,3,Mar,13,Parks,Highbridge Park,10,,10,,,34,Manhattan,M-12A,PLGD,true,2022-03-24 19:49:17.0000000,M&O MS Forms
M-002573,M037,M037-03,03/20/2022 12:00:00 AM,AM,2022,3,Mar,13,Parks,Highbridge Park,7,,7,,,34,Manhattan,M-12A,PLGD,true,2022-03-24 19:44:25.0000000,M&O MS Forms
M-002565,M037,M037-03,03/19/2022 12:00:00 AM,AM,2022,3,Mar,12,Parks,Highbridge Park,12,,12,,,34,Manhattan,M-12A,PLGD,true,2022-03-24 16:49:22.0000000,M&O MS Forms
M-002390,M037,M037-03,02/28/2022 12:00:00 AM,AM,2022,2,Feb,10,Parks,Highbridge Park,8,,8,,,34,Manhattan,M-12A,PLGD,true,2022-03-04 08:37:52.0000000,M&O MS Forms
M-002381,M037,M037-03,02/27/2022 12:00:00 AM,AM,2022,2,Feb,10,Parks,Highbridge Park,10,,10,,,34,Manhattan,M-12A,PLGD,true,2022-03-04 08:34:21.0000000,M&O MS Forms
M-002368,M037,M037-03,02/26/2022 12:00:00 AM,AM,2022,2,Feb,9,Parks,Highbridge Park,1,,1,,,34,Manhattan,M-12A,PLGD,true,2022-02-28 12:14:51.0000000,M&O MS Forms
M-002425,M037,M037-03,03/04/2022 12:00:00 AM,AM,2022,3,Mar,10,Parks,Highbridge Park,3,,3,,,34,Manhattan,M-12A,PLGD,true,2022-03-06 19:38:49.0000000,M&O MS Forms
M-002417,M037,M037-03,03/03/2022 12:00:00 AM,AM,2022,3,Mar,10,Parks,Highbridge Park,7,,7,,,34,Manhattan,M-12A,PLGD,true,2022-03-04 08:45:21.0000000,M&O MS Forms
M-002408,M037,M037-03,03/02/2022 12:00:00 AM,AM,2022,3,Mar,10,Parks,Highbridge Park,4,,4,,,34,Manhattan,M-12A,PLGD,true,2022-03-04 08:42:39.0000000,M&O MS Forms
M-002399,M037,M037-03,03/01/2022 12:00:00 AM,AM,2022,3,Mar,10,Parks,Highbridge Park,3,,3,,,34,Manhattan,M-12A,PLGD,true,2022-03-04 08:39:59.0000000,M&O MS Forms
M-002298,M037,M037-03,02/20/2022 12:00:00 AM,AM,2022,2,Feb,9,Parks,Highbridge Park,3,,3,,,34,Manhattan,M-12A,PLGD,true,2022-02-21 15:15:04.0000000,M&O MS Forms
M-002326,M037,M037-03,02/21/2022 12:00:00 AM,AM,2022,2,Feb,9,Parks,Highbridge Park,2,,2,,,34,Manhattan,M-12A,PLGD,true,2022-02-28 12:02:21.0000000,M&O MS Forms
M-002335,M037,M037-03,02/22/2022 12:00:00 AM,AM,2022,2,Feb,9,Parks,Highbridge Park,3,,3,,,34,Manhattan,M-12A,PLGD,true,2022-02-28 12:05:05.0000000,M&O MS Forms
M-002344,M037,M037-03,02/23/2022 12:00:00 AM,AM,2022,2,Feb,9,Parks,Highbridge Park,6,,6,,,34,Manhattan,M-12A,PLGD,true,2022-02-28 12:07:45.0000000,M&O MS Forms
M-002361,M037,M037-03,02/25/2022 12:00:00 AM,AM,2022,2,Feb,9,Parks,Highbridge Park,1,,1,,,34,Manhattan,M-12A,PLGD,true,2022-02-28 12:12:53.0000000,M&O MS Forms
M-002353,M037,M037-03,02/24/2022 12:00:00 AM,AM,2022,2,Feb,9,Parks,Highbridge Park,4,,4,,,34,Manhattan,M-12A,PLGD,true,2022-02-28 12:10:47.0000000,M&O MS Forms
M-002284,M037,M037-03,02/18/2022 12:00:00 AM,AM,2022,2,Feb,8,Parks,Highbridge Park,2,,2,,,34,Manhattan,M-12A,PLGD,true,2022-02-21 15:10:51.0000000,M&O MS Forms
M-002275,M037,M037-03,02/17/2022 12:00:00 AM,AM,2022,2,Feb,8,Parks,Highbridge Park,1,,1,,,34,Manhattan,M-12A,PLGD,true,2022-02-21 15:07:23.0000000,M&O MS Forms
M-002266,M037,M037-03,02/16/2022 12:00:00 AM,AM,2022,2,Feb,8,Parks,Highbridge Park,2,,2,,,34,Manhattan,M-12A,PLGD,true,2022-02-21 15:04:56.0000000,M&O MS Forms
M-002257,M037,M037-03,02/15/2022 12:00:00 AM,AM,2022,2,Feb,8,Parks,Highbridge Park,3,,3,,,34,Manhattan,M-12A,PLGD,true,2022-02-21 15:01:53.0000000,M&O MS Forms
M-002248,M037,M037-03,02/14/2022 12:00:00 AM,AM,2022,2,Feb,8,Parks,Highbridge Park,2,,2,,,34,Manhattan,M-12A,PLGD,true,2022-02-21 14:58:15.0000000,M&O MS Forms
M-002238,M037,M037-03,02/13/2022 12:00:00 AM,AM,2022,2,Feb,8,Parks,Highbridge Park,1,,1,,,34,Manhattan,M-12A,PLGD,true,2022-02-21 14:55:00.0000000,M&O MS Forms
M-002223,M037,M037-03,02/12/2022 12:00:00 AM,AM,2022,2,Feb,7,Parks,Highbridge Park,3,,3,,,34,Manhattan,M-12A,PLGD,true,2022-02-14 14:08:57.0000000,M&O MS Forms
M-002215,M037,M037-03,02/11/2022 12:00:00 AM,AM,2022,2,Feb,7,Parks,Highbridge Park,4,,4,,,34,Manhattan,M-12A,PLGD,true,2022-02-14 14:06:31.0000000,M&O MS Forms
M-002207,M037,M037-03,02/10/2022 12:00:00 AM,AM,2022,2,Feb,7,Parks,Highbridge Park,1,,1,,,34,Manhattan,M-12A,PLGD,true,2022-02-14 14:03:58.0000000,M&O MS Forms
M-002195,M037,M037-03,02/09/2022 12:00:00 AM,AM,2022,2,Feb,7,Parks,Highbridge Park,2,,2,,,34,Manhattan,M-12A,PLGD,true,2022-02-11 09:23:04.0000000,M&O MS Forms
M-002768,M037,M037-03,04/07/2022 12:00:00 AM,AM,2022,4,Apr,15,Parks,Highbridge Park,9,,9,,,34,Manhattan,M-12A,PLGD,true,2022-04-17 16:21:22.0000000,M&O MS Forms
M-002752,M037,M037-03,04/06/2022 12:00:00 AM,AM,2022,4,Apr,15,Parks,Highbridge Park,5,,5,,,34,Manhattan,M-12A,PLGD,true,2022-04-07 14:14:10.0000000,M&O MS Forms
M-002736,M037,M037-03,04/04/2022 12:00:00 AM,AM,2022,4,Apr,15,Parks,Highbridge Park,2,,2,,,34,Manhattan,M-12A,PLGD,true,2022-04-07 14:03:33.0000000,M&O MS Forms
M-002727,M037,M037-03,04/03/2022 12:00:00 AM,AM,2022,4,Apr,15,Parks,Highbridge Park,4,,4,,,34,Manhattan,M-12A,PLGD,true,2022-04-07 13:59:50.0000000,M&O MS Forms
M-001786,M037,M037-ZN06,12/24/2021 12:00:00 AM,AM,2021,12,Dec,52,Parks,Highbridge Park,2,,2,,,34,Manhattan,M-12A,ZONE,true,2021-12-26 12:13:59.0000000,M&O MS Forms
M-001776,M037,M037-ZN06,12/23/2021 12:00:00 AM,AM,2021,12,Dec,52,Parks,Highbridge Park,40,,40,,,34,Manhattan,M-12A,ZONE,true,2021-12-23 16:15:08.0000000,M&O MS Forms
M-001766,M037,M037-ZN06,12/22/2021 12:00:00 AM,AM,2021,12,Dec,52,Parks,Highbridge Park,30,,30,,,34,Manhattan,M-12A,ZONE,true,2021-12-23 15:44:49.0000000,M&O MS Forms
M-001744,M037,M037-ZN06,12/21/2021 12:00:00 AM,AM,2021,12,Dec,52,Parks,Highbridge Park,72,,72,,,34,Manhattan,M-12A,ZONE,true,2021-12-21 16:10:01.0000000,M&O MS Forms
M-001738,M037,M037-ZN06,12/20/2021 12:00:00 AM,AM,2021,12,Dec,52,Parks,Highbridge Park,20,,20,,,34,Manhattan,M-12A,ZONE,true,2021-12-21 16:08:20.0000000,M&O MS Forms
M-004608,M037,M037-ZN06,10/17/2022 12:00:00 AM,AM,2022,10,Oct,43,Parks,Highbridge Park,30,,30,,,34,Manhattan,M-12A,ZONE,true,2022-10-19 06:39:57.0000000,M&O MS Forms
M-004628,M037,M037-ZN06,10/18/2022 12:00:00 AM,AM,2022,10,Oct,43,Parks,Highbridge Park,32,,32,,,34,Manhattan,M-12A,ZONE,true,2022-10-25 06:05:04.0000000,M&O MS Forms
M-004637,M037,M037-ZN06,10/19/2022 12:00:00 AM,AM,2022,10,Oct,43,Parks,Highbridge Park,28,,28,,,34,Manhattan,M-12A,ZONE,true,2022-10-25 06:07:37.0000000,M&O MS Forms
M-004646,M037,M037-ZN06,10/20/2022 12:00:00 AM,AM,2022,10,Oct,43,Parks,Highbridge Park,13,,13,,,34,Manhattan,M-12A,ZONE,true,2022-10-25 06:10:08.0000000,M&O MS Forms
M-004655,M037,M037-ZN06,10/21/2022 12:00:00 AM,AM,2022,10,Oct,43,Parks,Highbridge Park,15,,15,,,34,Manhattan,M-12A,ZONE,true,2022-10-25 06:12:34.0000000,M&O MS Forms
M-004673,M037,M037-ZN06,10/23/2022 12:00:00 AM,AM,2022,10,Oct,44,Parks,Highbridge Park,20,,20,,,34,Manhattan,M-12A,ZONE,true,2022-10-25 06:25:07.0000000,M&O MS Forms
M-004664,M037,M037-ZN06,10/22/2022 12:00:00 AM,AM,2022,10,Oct,43,Parks,Highbridge Park,18,,18,,,34,Manhattan,M-12A,ZONE,true,2022-10-25 06:15:39.0000000,M&O MS Forms
M-004691,M037,M037-ZN06,10/25/2022 12:00:00 AM,AM,2022,10,Oct,44,Parks,Highbridge Park,23,,23,,,34,Manhattan,M-12A,ZONE,true,2022-10-26 05:50:57.0000000,M&O MS Forms
M-004682,M037,M037-ZN06,10/24/2022 12:00:00 AM,AM,2022,10,Oct,44,Parks,Highbridge Park,23,,23,,,34,Manhattan,M-12A,ZONE,true,2022-10-25 06:32:56.0000000,M&O MS Forms
M-004726,M037,M037-ZN06,10/28/2022 12:00:00 AM,AM,2022,10,Oct,44,Parks,Highbridge Park,18,,18,,,34,Manhattan,M-12A,ZONE,true,2022-10-30 13:21:28.0000000,M&O MS Forms
M-004717,M037,M037-ZN06,10/27/2022 12:00:00 AM,AM,2022,10,Oct,44,Parks,Highbridge Park,6,,6,,,34,Manhattan,M-12A,ZONE,true,2022-10-30 13:18:12.0000000,M&O MS Forms
M-004700,M037,M037-ZN06,10/26/2022 12:00:00 AM,AM,2022,10,Oct,44,Parks,Highbridge Park,23,,23,,,34,Manhattan,M-12A,ZONE,true,2022-10-27 05:27:19.0000000,M&O MS Forms
M-003821,M037,M037-ZN06,07/26/2022 12:00:00 AM,AM,2022,7,Jul,31,Parks,Highbridge Park,4,,4,,,34,Manhattan,M-12A,ZONE,true,2022-07-29 16:01:46.0000000,M&O MS Forms
M-003830,M037,M037-ZN06,07/27/2022 12:00:00 AM,AM,2022,7,Jul,31,Parks,Highbridge Park,7,,7,,,34,Manhattan,M-12A,ZONE,true,2022-07-29 16:04:42.0000000,M&O MS Forms
M-003847,M037,M037-ZN06,07/29/2022 12:00:00 AM,AM,2022,7,Jul,31,Parks,Highbridge Park,5,,5,,,34,Manhattan,M-12A,ZONE,true,2022-07-29 16:13:24.0000000,M&O MS Forms
M-003838,M037,M037-ZN06,07/28/2022 12:00:00 AM,AM,2022,7,Jul,31,Parks,Highbridge Park,9,,9,,,34,Manhattan,M-12A,ZONE,true,2022-07-29 16:07:03.0000000,M&O MS Forms
M-003856,M037,M037-ZN06,07/30/2022 12:00:00 AM,AM,2022,7,Jul,31,Parks,Highbridge Park,5,,5,,,34,Manhattan,M-12A,ZONE,true,2022-07-31 09:43:20.0000000,M&O MS Forms
M-003865,M037,M037-ZN06,07/31/2022 12:00:00 AM,AM,2022,7,Jul,32,Parks,Highbridge Park,7,,7,,,34,Manhattan,M-12A,ZONE,true,2022-07-31 16:58:06.0000000,M&O MS Forms
M-004599,M037,M037-ZN06,10/16/2022 12:00:00 AM,AM,2022,10,Oct,43,Parks,Highbridge Park,25,,25,,,34,Manhattan,M-12A,ZONE,true,2022-10-19 06:23:22.0000000,M&O MS Forms
M-003774,M037,M037-ZN06,07/21/2022 12:00:00 AM,AM,2022,7,Jul,30,Parks,Highbridge Park,9,,9,,,34,Manhattan,M-12A,ZONE,true,2022-07-23 15:33:49.0000000,M&O MS Forms
M-003783,M037,M037-ZN06,07/22/2022 12:00:00 AM,AM,2022,7,Jul,30,Parks,Highbridge Park,2,,2,,,34,Manhattan,M-12A,ZONE,true,2022-07-23 15:36:50.0000000,M&O MS Forms
M-003755,M037,M037-ZN06,07/19/2022 12:00:00 AM,AM,2022,7,Jul,30,Parks,Highbridge Park,16,,16,,,34,Manhattan,M-12A,ZONE,true,2022-07-23 15:26:14.0000000,M&O MS Forms
M-003765,M037,M037-ZN06,07/20/2022 12:00:00 AM,AM,2022,7,Jul,30,Parks,Highbridge Park,10,,10,,,34,Manhattan,M-12A,ZONE,true,2022-07-23 15:30:29.0000000,M&O MS Forms
M-003803,M037,M037-ZN06,07/24/2022 12:00:00 AM,AM,2022,7,Jul,31,Parks,Highbridge Park,6,,6,,,34,Manhattan,M-12A,ZONE,true,2022-07-29 15:55:41.0000000,M&O MS Forms
M-003812,M037,M037-ZN06,07/25/2022 12:00:00 AM,AM,2022,7,Jul,31,Parks,Highbridge Park,5,,5,,,34,Manhattan,M-12A,ZONE,true,2022-07-29 15:58:47.0000000,M&O MS Forms
M-003164,M037,M037-ZN06,05/19/2022 12:00:00 AM,AM,2022,5,May,21,Parks,Highbridge Park,30,,30,,,34,Manhattan,M-12A,ZONE,true,2022-05-20 15:11:53.0000000,M&O MS Forms
M-003173,M037,M037-ZN06,05/20/2022 12:00:00 AM,AM,2022,5,May,21,Parks,Highbridge Park,36,,36,,,34,Manhattan,M-12A,ZONE,true,2022-05-20 15:14:25.0000000,M&O MS Forms
M-003182,M037,M037-ZN06,05/21/2022 12:00:00 AM,AM,2022,5,May,21,Parks,Highbridge Park,45,,45,,,34,Manhattan,M-12A,ZONE,true,2022-05-22 08:32:39.0000000,M&O MS Forms
M-003194,M037,M037-ZN06,05/22/2022 12:00:00 AM,AM,2022,5,May,22,Parks,Highbridge Park,19,,19,,,34,Manhattan,M-12A,ZONE,true,2022-05-22 15:12:27.0000000,M&O MS Forms
M-003225,M037,M037-ZN06,05/25/2022 12:00:00 AM,AM,2022,5,May,22,Parks,Highbridge Park,20,,20,,,34,Manhattan,M-12A,ZONE,true,2022-05-28 10:51:46.0000000,M&O MS Forms
M-003216,M037,M037-ZN06,05/24/2022 12:00:00 AM,AM,2022,5,May,22,Parks,Highbridge Park,13,,13,,,34,Manhattan,M-12A,ZONE,true,2022-05-28 10:49:07.0000000,M&O MS Forms
M-003207,M037,M037-ZN06,05/23/2022 12:00:00 AM,AM,2022,5,May,22,Parks,Highbridge Park,21,,21,,,34,Manhattan,M-12A,ZONE,true,2022-05-28 10:46:34.0000000,M&O MS Forms
M-003114,M037,M037-ZN06,05/14/2022 12:00:00 AM,AM,2022,5,May,20,Parks,Highbridge Park,39,,39,,,34,Manhattan,M-12A,ZONE,true,2022-05-14 15:50:42.0000000,M&O MS Forms
M-003104,M037,M037-ZN06,05/13/2022 12:00:00 AM,AM,2022,5,May,20,Parks,Highbridge Park,32,,32,,,34,Manhattan,M-12A,ZONE,true,2022-05-14 10:50:35.0000000,M&O MS Forms
M-003124,M037,M037-ZN06,05/15/2022 12:00:00 AM,AM,2022,5,May,21,Parks,Highbridge Park,30,,30,,,34,Manhattan,M-12A,ZONE,true,2022-05-15 16:53:16.0000000,M&O MS Forms
M-003155,M037,M037-ZN06,05/18/2022 12:00:00 AM,AM,2022,5,May,21,Parks,Highbridge Park,14,,14,,,34,Manhattan,M-12A,ZONE,true,2022-05-20 15:07:51.0000000,M&O MS Forms
M-003146,M037,M037-ZN06,05/17/2022 12:00:00 AM,AM,2022,5,May,21,Parks,Highbridge Park,28,,28,,,34,Manhattan,M-12A,ZONE,true,2022-05-20 15:04:51.0000000,M&O MS Forms
M-003137,M037,M037-ZN06,05/16/2022 12:00:00 AM,AM,2022,5,May,21,Parks,Highbridge Park,42,,42,,,34,Manhattan,M-12A,ZONE,true,2022-05-20 15:01:59.0000000,M&O MS Forms
M-003074,M037,M037-ZN06,05/10/2022 12:00:00 AM,AM,2022,5,May,20,Parks,Highbridge Park,25,,25,,,34,Manhattan,M-12A,ZONE,true,2022-05-13 15:18:05.0000000,M&O MS Forms
M-003092,M037,M037-ZN06,05/12/2022 12:00:00 AM,AM,2022,5,May,20,Parks,Highbridge Park,24,,24,,,34,Manhattan,M-12A,ZONE,true,2022-05-13 15:27:09.0000000,M&O MS Forms
M-003083,M037,M037-ZN06,05/12/2022 12:00:00 AM,AM,2022,5,May,20,Parks,Highbridge Park,20,,20,,,34,Manhattan,M-12A,ZONE,true,2022-05-13 15:21:27.0000000,M&O MS Forms
M-003065,M037,M037-ZN06,05/09/2022 12:00:00 AM,AM,2022,5,May,20,Parks,Highbridge Park,15,,15,,,34,Manhattan,M-12A,ZONE,true,2022-05-13 15:14:33.0000000,M&O MS Forms
M-003055,M037,M037-ZN06,05/08/2022 12:00:00 AM,AM,2022,5,May,20,Parks,Highbridge Park,10,,10,,,34,Manhattan,M-12A,ZONE,true,2022-05-13 15:09:38.0000000,M&O MS Forms
M-003045,M037,M037-ZN06,05/08/2022 12:00:00 AM,AM,2022,5,May,20,Parks,Highbridge Park,10,,10,,,34,Manhattan,M-12A,ZONE,true,2022-05-09 08:08:16.0000000,M&O MS Forms
M-003037,M037,M037-ZN06,05/07/2022 12:00:00 AM,AM,2022,5,May,19,Parks,Highbridge Park,9,,9,,,34,Manhattan,M-12A,ZONE,true,2022-05-09 08:01:28.0000000,M&O MS Forms
M-003016,M037,M037-ZN06,05/05/2022 12:00:00 AM,AM,2022,5,May,19,Parks,Highbridge Park,23,,23,,,34,Manhattan,M-12A,ZONE,true,2022-05-06 19:49:15.0000000,M&O MS Forms
M-003007,M037,M037-ZN06,05/04/2022 12:00:00 AM,AM,2022,5,May,19,Parks,Highbridge Park,20,,20,,,34,Manhattan,M-12A,ZONE,true,2022-05-06 19:45:29.0000000,M&O MS Forms
M-003026,M037,M037-ZN06,05/06/2022 12:00:00 AM,AM,2022,5,May,19,Parks,Highbridge Park,27,,27,,,34,Manhattan,M-12A,ZONE,true,2022-05-06 20:05:17.0000000,M&O MS Forms
M-003025,M037,M037-ZN06,05/06/2022 12:00:00 AM,AM,2022,5,May,19,Parks,Highbridge Park,27,,27,,,34,Manhattan,M-12A,ZONE,true,2022-05-06 20:05:16.0000000,M&O MS Forms
M-002992,M037,M037-ZN06,05/01/2022 12:00:00 AM,AM,2022,5,May,19,Parks,Highbridge Park,40,,40,,,34,Manhattan,M-12A,ZONE,true,2022-05-06 19:19:47.0000000,M&O MS Forms
M-002970,M037,M037-ZN06,04/23/2022 12:00:00 AM,AM,2022,4,Apr,17,Parks,Highbridge Park,18,,18,,,34,Manhattan,M-12A,ZONE,true,2022-04-30 14:57:42.0000000,M&O MS Forms
M-002909,M037,M037-ZN06,04/24/2022 12:00:00 AM,AM,2022,4,Apr,18,Parks,Highbridge Park,15,,15,,,34,Manhattan,M-12A,ZONE,true,2022-04-30 13:53:19.0000000,M&O MS Forms
M-002925,M037,M037-ZN06,04/26/2022 12:00:00 AM,AM,2022,4,Apr,18,Parks,Highbridge Park,12,,12,,,34,Manhattan,M-12A,ZONE,true,2022-04-30 14:22:10.0000000,M&O MS Forms
M-002918,M037,M037-ZN06,04/25/2022 12:00:00 AM,AM,2022,4,Apr,18,Parks,Highbridge Park,10,,10,,,34,Manhattan,M-12A,ZONE,true,2022-04-30 14:07:40.0000000,M&O MS Forms
M-002943,M037,M037-ZN06,04/28/2022 12:00:00 AM,AM,2022,4,Apr,18,Parks,Highbridge Park,18,,18,,,34,Manhattan,M-12A,ZONE,true,2022-04-30 14:32:49.0000000,M&O MS Forms
M-002934,M037,M037-ZN06,04/27/2022 12:00:00 AM,AM,2022,4,Apr,18,Parks,Highbridge Park,30,,30,,,34,Manhattan,M-12A,ZONE,true,2022-04-30 14:29:29.0000000,M&O MS Forms
M-002961,M037,M037-ZN06,04/30/2022 12:00:00 AM,AM,2022,4,Apr,18,Parks,Highbridge Park,40,,40,,,34,Manhattan,M-12A,ZONE,true,2022-04-30 14:52:56.0000000,M&O MS Forms
M-002952,M037,M037-ZN06,04/29/2022 12:00:00 AM,AM,2022,4,Apr,18,Parks,Highbridge Park,30,,30,,,34,Manhattan,M-12A,ZONE,true,2022-04-30 14:37:00.0000000,M&O MS Forms
M-002850,M037,M037-ZN06,04/18/2022 12:00:00 AM,AM,2022,4,Apr,17,Parks,Highbridge Park,15,,15,,,34,Manhattan,M-12A,ZONE,true,2022-04-23 12:18:27.0000000,M&O MS Forms
M-002842,M037,M037-ZN06,04/17/2022 12:00:00 AM,AM,2022,4,Apr,17,BBP,Highbridge Park,13,,13,,,34,Manhattan,M-12A,ZONE,true,2022-04-23 12:15:11.0000000,M&O MS Forms
M-002859,M037,M037-ZN06,04/19/2022 12:00:00 AM,AM,2022,4,Apr,17,Parks,Highbridge Park,25,,25,,,34,Manhattan,M-12A,ZONE,true,2022-04-23 12:21:43.0000000,M&O MS Forms
M-002885,M037,M037-ZN06,04/22/2022 12:00:00 AM,AM,2022,4,Apr,17,Parks,Highbridge Park,41,,41,,,34,Manhattan,M-12A,ZONE,true,2022-04-23 12:30:32.0000000,M&O MS Forms
M-002868,M037,M037-ZN06,04/20/2022 12:00:00 AM,AM,2022,4,Apr,17,Parks,Highbridge Park,32,,32,,,34,Manhattan,M-12A,ZONE,true,2022-04-23 12:24:42.0000000,M&O MS Forms
M-002876,M037,M037-ZN06,04/21/2022 12:00:00 AM,AM,2022,4,Apr,17,Parks,Highbridge Park,37,,37,,,34,Manhattan,M-12A,ZONE,true,2022-04-23 12:27:33.0000000,M&O MS Forms
M-002773,M037,M037-ZN06,04/08/2022 12:00:00 AM,AM,2022,4,Apr,15,Parks,Highbridge Park,12,,12,,,34,Manhattan,M-12A,ZONE,true,2022-04-17 16:22:52.0000000,M&O MS Forms
M-002780,M037,M037-ZN06,04/09/2022 12:00:00 AM,AM,2022,4,Apr,15,Parks,Highbridge Park,7,,7,,,34,Manhattan,M-12A,ZONE,true,2022-04-17 16:25:25.0000000,M&O MS Forms
M-002797,M037,M037-ZN06,04/11/2022 12:00:00 AM,AM,2022,4,Apr,16,Parks,Highbridge Park,25,,25,,,34,Manhattan,M-12A,ZONE,true,2022-04-17 16:34:35.0000000,M&O MS Forms
M-002788,M037,M037-ZN06,04/10/2022 12:00:00 AM,AM,2022,4,Apr,16,Parks,Highbridge Park,25,,25,,,34,Manhattan,M-12A,ZONE,true,2022-04-17 16:31:23.0000000,M&O MS Forms
M-002815,M037,M037-ZN06,04/13/2022 12:00:00 AM,AM,2022,4,Apr,16,Parks,Highbridge Park,18,,18,,,34,Manhattan,M-12A,ZONE,true,2022-04-17 16:41:26.0000000,M&O MS Forms
M-002806,M037,M037-ZN06,04/12/2022 12:00:00 AM,AM,2022,4,Apr,16,Parks,Highbridge Park,30,,30,,,34,Manhattan,M-12A,ZONE,true,2022-04-17 16:38:47.0000000,M&O MS Forms
M-002824,M037,M037-ZN06,04/14/2022 12:00:00 AM,AM,2022,4,Apr,16,Parks,Highbridge Park,16,,16,,,34,Manhattan,M-12A,ZONE,true,2022-04-17 16:44:01.0000000,M&O MS Forms
M-002832,M037,M037-ZN06,04/15/2022 12:00:00 AM,AM,2022,4,Apr,16,Parks,Highbridge Park,40,,40,,,34,Manhattan,M-12A,ZONE,true,2022-04-17 16:47:08.0000000,M&O MS Forms
M-002732,M037,M037-ZN06,04/04/2022 12:00:00 AM,AM,2022,4,Apr,15,Parks,Highbridge Park,15,,15,,,34,Manhattan,M-12A,ZONE,true,2022-04-07 14:02:00.0000000,M&O MS Forms
M-002723,M037,M037-ZN06,04/03/2022 12:00:00 AM,AM,2022,4,Apr,15,Parks,Highbridge Park,10,,10,,,34,Manhattan,M-12A,ZONE,true,2022-04-07 13:58:31.0000000,M&O MS Forms
M-002699,M037,M037-ZN06,04/01/2022 12:00:00 AM,AM,2022,4,Apr,14,Parks,Highbridge Park,19,,19,,,34,Manhattan,M-12A,ZONE,true,2022-04-01 15:59:02.0000000,M&O MS Forms
M-002741,M037,M037-ZN06,04/05/2022 12:00:00 AM,AM,2022,4,Apr,15,Parks,Highbridge Park,20,,20,,,34,Manhattan,M-12A,ZONE,true,2022-04-07 14:05:40.0000000,M&O MS Forms
M-002749,M037,M037-ZN06,04/06/2022 12:00:00 AM,AM,2022,4,Apr,15,Parks,Highbridge Park,21,,21,,,34,Manhattan,M-12A,ZONE,true,2022-04-07 14:09:35.0000000,M&O MS Forms
M-002765,M037,M037-ZN06,04/07/2022 12:00:00 AM,AM,2022,4,Apr,15,Parks,Highbridge Park,13,,13,,,34,Manhattan,M-12A,ZONE,true,2022-04-17 16:20:26.0000000,M&O MS Forms
M-002191,M037,M037-ZN06,02/09/2022 12:00:00 AM,AM,2022,2,Feb,7,Parks,Highbridge Park,3,,3,,,34,Manhattan,M-12A,ZONE,true,2022-02-11 09:21:55.0000000,M&O MS Forms
M-002184,M037,M037-ZN06,02/08/2022 12:00:00 AM,AM,2022,2,Feb,7,Parks,Highbridge Park,6,,6,,,34,Manhattan,M-12A,ZONE,true,2022-02-11 09:19:57.0000000,M&O MS Forms
M-002170,M037,M037-ZN06,02/06/2022 12:00:00 AM,AM,2022,2,Feb,7,Parks,Highbridge Park,4,,4,,,34,Manhattan,M-12A,ZONE,true,2022-02-10 08:39:24.0000000,M&O MS Forms
M-002177,M037,M037-ZN06,02/07/2022 12:00:00 AM,AM,2022,2,Feb,7,Parks,Highbridge Park,74,,74,,,34,Manhattan,M-12A,ZONE,true,2022-02-10 08:47:32.0000000,M&O MS Forms
M-002220,M037,M037-ZN06,02/12/2022 12:00:00 AM,AM,2022,2,Feb,7,Parks,Highbridge Park,14,,14,,,34,Manhattan,M-12A,ZONE,true,2022-02-14 14:08:08.0000000,M&O MS Forms
M-002211,M037,M037-ZN06,02/11/2022 12:00:00 AM,AM,2022,2,Feb,7,Parks,Highbridge Park,9,,9,,,34,Manhattan,M-12A,ZONE,true,2022-02-14 14:05:24.0000000,M&O MS Forms
M-002203,M037,M037-ZN06,02/10/2022 12:00:00 AM,AM,2022,2,Feb,7,Parks,Highbridge Park,6,,6,,,34,Manhattan,M-12A,ZONE,true,2022-02-14 14:02:50.0000000,M&O MS Forms
M-002234,M037,M037-ZN06,02/13/2022 12:00:00 AM,AM,2022,2,Feb,8,Parks,Highbridge Park,3,,3,,,34,Manhattan,M-12A,ZONE,true,2022-02-21 14:53:56.0000000,M&O MS Forms
M-002243,M037,M037-ZN06,02/14/2022 12:00:00 AM,AM,2022,2,Feb,8,Parks,Highbridge Park,2,,2,,,34,Manhattan,M-12A,ZONE,true,2022-02-21 14:56:37.0000000,M&O MS Forms
M-002262,M037,M037-ZN06,02/16/2022 12:00:00 AM,AM,2022,2,Feb,8,Parks,Highbridge Park,7,,7,,,34,Manhattan,M-12A,ZONE,true,2022-02-21 15:03:48.0000000,M&O MS Forms
M-002253,M037,M037-ZN06,02/15/2022 12:00:00 AM,AM,2022,2,Feb,8,Parks,Highbridge Park,5,,5,,,34,Manhattan,M-12A,ZONE,true,2022-02-21 15:00:48.0000000,M&O MS Forms
M-002271,M037,M037-ZN06,02/17/2022 12:00:00 AM,AM,2022,2,Feb,8,Parks,Highbridge Park,10,,10,,,34,Manhattan,M-12A,ZONE,true,2022-02-21 15:06:21.0000000,M&O MS Forms
M-002280,M037,M037-ZN06,02/18/2022 12:00:00 AM,AM,2022,2,Feb,8,Parks,Highbridge Park,25,,25,,,34,Manhattan,M-12A,ZONE,true,2022-02-21 15:09:45.0000000,M&O MS Forms
M-001959,M037,M037-ZN03,01/11/2022 12:00:00 AM,AM,2022,1,Jan,3,Parks,Highbridge Park,3,,3,,,33,Manhattan,M-12A,ZONE,true,2022-01-13 14:50:45.0000000,M&O MS Forms
M-001967,M037,M037-ZN03,01/12/2022 12:00:00 AM,AM,2022,1,Jan,3,Parks,Highbridge Park,5,,5,,,33,Manhattan,M-12A,ZONE,true,2022-01-13 14:53:26.0000000,M&O MS Forms
M-001950,M037,M037-ZN03,01/10/2022 12:00:00 AM,AM,2022,1,Jan,3,Parks,Highbridge Park,2,,2,,,33,Manhattan,M-12A,ZONE,true,2022-01-13 14:47:38.0000000,M&O MS Forms
M-004375,M037,M037-ZN03,09/23/2022 12:00:00 AM,AM,2022,9,Sep,39,Parks,Highbridge Park,11,,11,,,33,Manhattan,M-12A,ZONE,true,2022-09-26 06:02:33.0000000,M&O MS Forms
M-004366,M037,M037-ZN03,09/22/2022 12:00:00 AM,AM,2022,9,Sep,39,Parks,Highbridge Park,9,,9,,,33,Manhattan,M-12A,ZONE,true,2022-09-23 05:28:35.0000000,M&O MS Forms
M-004384,M037,M037-ZN03,09/24/2022 12:00:00 AM,AM,2022,9,Sep,39,Parks,Highbridge Park,7,,7,,,33,Manhattan,M-12A,ZONE,true,2022-09-26 06:05:29.0000000,M&O MS Forms
M-004357,M037,M037-ZN03,09/21/2022 12:00:00 AM,AM,2022,9,Sep,39,Parks,Highbridge Park,8,,8,,,33,Manhattan,M-12A,ZONE,true,2022-09-22 16:54:39.0000000,M&O MS Forms
M-004349,M037,M037-ZN03,09/20/2022 12:00:00 AM,AM,2022,9,Sep,39,Parks,Highbridge Park,3,,3,,,33,Manhattan,M-12A,ZONE,true,2022-09-22 16:51:51.0000000,M&O MS Forms
M-004332,M037,M037-ZN03,09/18/2022 12:00:00 AM,AM,2022,9,Sep,39,Parks,Highbridge Park,3,,3,,,33,Manhattan,M-12A,ZONE,true,2022-09-22 16:45:42.0000000,M&O MS Forms
M-004341,M037,M037-ZN03,09/19/2022 12:00:00 AM,AM,2022,9,Sep,39,Parks,Highbridge Park,1,,1,,,33,Manhattan,M-12A,ZONE,true,2022-09-22 16:48:39.0000000,M&O MS Forms
M-004159,M037,M037-ZN03,08/28/2022 12:00:00 AM,AM,2022,8,Aug,36,Parks,Highbridge Park,41,,41,,,33,Manhattan,M-12A,ZONE,true,2022-09-02 13:02:45.0000000,M&O MS Forms
M-004469,M037,M037-ZN03,09/30/2022 12:00:00 AM,AM,2022,9,Sep,40,Parks,Highbridge Park,20,,20,,,33,Manhattan,M-12A,ZONE,true,2022-10-11 07:06:52.0000000,M&O MS Forms
M-004479,M037,M037-ZN03,10/01/2022 12:00:00 AM,AM,2022,10,Oct,40,Parks,Highbridge Park,14,,14,,,33,Manhattan,M-12A,ZONE,true,2022-10-11 07:12:03.0000000,M&O MS Forms
M-004177,M037,M037-ZN03,08/30/2022 12:00:00 AM,AM,2022,8,Aug,36,Parks,Highbridge Park,18,,18,,,33,Manhattan,M-12A,ZONE,true,2022-09-02 15:16:00.0000000,M&O MS Forms
M-004168,M037,M037-ZN03,08/29/2022 12:00:00 AM,AM,2022,8,Aug,36,Parks,Highbridge Park,25,,25,,,33,Manhattan,M-12A,ZONE,true,2022-09-02 13:05:45.0000000,M&O MS Forms
M-004459,M037,M037-ZN03,09/29/2022 12:00:00 AM,AM,2022,9,Sep,40,Parks,Highbridge Park,19,,19,,,33,Manhattan,M-12A,ZONE,true,2022-10-11 07:03:19.0000000,M&O MS Forms
M-004393,M037,M037-ZN03,09/25/2022 12:00:00 AM,AM,2022,9,Sep,40,Parks,Highbridge Park,25,,25,,,33,Manhattan,M-12A,ZONE,true,2022-09-26 06:08:38.0000000,M&O MS Forms
M-001873,M037,M037-ZN03,01/01/2022 12:00:00 AM,AM,2022,1,Jan,1,Parks,Highbridge Park,10,,10,,,33,Manhattan,M-12A,ZONE,true,2022-01-02 18:57:15.0000000,M&O MS Forms
M-001882,M037,M037-ZN03,01/02/2022 12:00:00 AM,AM,2022,1,Jan,2,Parks,Highbridge Park,3,,3,,,33,Manhattan,M-12A,ZONE,true,2022-01-02 19:05:58.0000000,M&O MS Forms
M-004587,M037,M037-ZN03,10/15/2022 12:00:00 AM,AM,2022,10,Oct,42,Parks,Highbridge Park,18,,18,,,33,Manhattan,M-12A,ZONE,true,2022-10-19 05:41:54.0000000,M&O MS Forms
M-004578,M037,M037-ZN03,10/14/2022 12:00:00 AM,AM,2022,10,Oct,42,Parks,Highbridge Park,25,,25,,,33,Manhattan,M-12A,ZONE,true,2022-10-19 05:38:59.0000000,M&O MS Forms
M-004551,M037,M037-ZN03,10/11/2022 12:00:00 AM,AM,2022,10,Oct,42,Parks,Highbridge Park,15,,15,,,33,Manhattan,M-12A,ZONE,true,2022-10-11 16:46:08.0000000,M&O MS Forms
M-004569,M037,M037-ZN03,10/13/2022 12:00:00 AM,AM,2022,10,Oct,42,Parks,Highbridge Park,17,,17,,,33,Manhattan,M-12A,ZONE,true,2022-10-19 05:35:59.0000000,M&O MS Forms
M-004542,M037,M037-ZN03,10/08/2022 12:00:00 AM,AM,2022,10,Oct,41,Parks,Highbridge Park,25,,25,,,33,Manhattan,M-12A,ZONE,true,2022-10-11 15:24:54.0000000,M&O MS Forms
M-004532,M037,M037-ZN03,10/07/2022 12:00:00 AM,AM,2022,10,Oct,41,Parks,Highbridge Park,10,,10,,,33,Manhattan,M-12A,ZONE,true,2022-10-11 15:21:48.0000000,M&O MS Forms
M-004525,M037,M037-ZN03,10/06/2022 12:00:00 AM,AM,2022,10,Oct,41,Parks,Highbridge Park,7,,7,,,33,Manhattan,M-12A,ZONE,true,2022-10-11 15:19:39.0000000,M&O MS Forms
M-004518,M037,M037-ZN03,10/05/2022 12:00:00 AM,AM,2022,10,Oct,41,Parks,Highbridge Park,4,,4,,,33,Manhattan,M-12A,ZONE,true,2022-10-11 15:17:22.0000000,M&O MS Forms
M-004500,M037,M037-ZN03,10/03/2022 12:00:00 AM,AM,2022,10,Oct,41,Parks,Highbridge Park,5,,5,,,33,Manhattan,M-12A,ZONE,true,2022-10-11 15:11:40.0000000,M&O MS Forms
M-004509,M037,M037-ZN03,10/04/2022 12:00:00 AM,AM,2022,10,Oct,41,Parks,Highbridge Park,2,,2,,,33,Manhattan,M-12A,ZONE,true,2022-10-11 15:14:40.0000000,M&O MS Forms
M-004490,M037,M037-ZN03,10/02/2022 12:00:00 AM,AM,2022,10,Oct,41,Parks,Highbridge Park,7,,7,,,33,Manhattan,M-12A,ZONE,true,2022-10-11 07:17:42.0000000,M&O MS Forms
M-003888,M037,M037-ZN03,08/03/2022 12:00:00 AM,AM,2022,8,Aug,32,Parks,Highbridge Park,41,,41,,,33,Manhattan,M-12A,ZONE,true,2022-08-04 15:32:45.0000000,M&O MS Forms
M-003880,M037,M037-ZN03,08/02/2022 12:00:00 AM,AM,2022,8,Aug,32,Parks,Highbridge Park,40,,40,,,33,Manhattan,M-12A,ZONE,true,2022-08-04 15:30:20.0000000,M&O MS Forms
M-002287,M037,M037-ZN06,02/19/2022 12:00:00 AM,AM,2022,2,Feb,8,Parks,Highbridge Park,4,,4,,,34,Manhattan,M-12A,ZONE,true,2022-02-21 15:11:49.0000000,M&O MS Forms
M-002294,M037,M037-ZN06,02/20/2022 12:00:00 AM,AM,2022,2,Feb,9,Parks,Highbridge Park,9,,9,,,34,Manhattan,M-12A,ZONE,true,2022-02-21 15:14:05.0000000,M&O MS Forms
M-002358,M037,M037-ZN06,02/25/2022 12:00:00 AM,AM,2022,2,Feb,9,Parks,Highbridge Park,7,,7,,,34,Manhattan,M-12A,ZONE,true,2022-02-28 12:12:10.0000000,M&O MS Forms
M-002364,M037,M037-ZN06,02/26/2022 12:00:00 AM,AM,2022,2,Feb,9,Parks,Highbridge Park,9,,9,,,34,Manhattan,M-12A,ZONE,true,2022-02-28 12:13:44.0000000,M&O MS Forms
M-002340,M037,M037-ZN06,02/23/2022 12:00:00 AM,AM,2022,2,Feb,9,Parks,Highbridge Park,7,,7,,,34,Manhattan,M-12A,ZONE,true,2022-02-28 12:06:44.0000000,M&O MS Forms
M-002349,M037,M037-ZN06,02/24/2022 12:00:00 AM,AM,2022,2,Feb,9,Parks,Highbridge Park,9,,9,,,34,Manhattan,M-12A,ZONE,true,2022-02-28 12:09:29.0000000,M&O MS Forms
M-002322,M037,M037-ZN06,02/21/2022 12:00:00 AM,AM,2022,2,Feb,9,Parks,Highbridge Park,7,,7,,,34,Manhattan,M-12A,ZONE,true,2022-02-28 12:01:17.0000000,M&O MS Forms
M-002331,M037,M037-ZN06,02/22/2022 12:00:00 AM,AM,2022,2,Feb,9,Parks,Highbridge Park,5,,5,,,34,Manhattan,M-12A,ZONE,true,2022-02-28 12:03:57.0000000,M&O MS Forms
M-002404,M037,M037-ZN06,03/02/2022 12:00:00 AM,AM,2022,3,Mar,10,Parks,Highbridge Park,9,,9,,,34,Manhattan,M-12A,ZONE,true,2022-03-04 08:41:29.0000000,M&O MS Forms
M-002413,M037,M037-ZN06,03/03/2022 12:00:00 AM,AM,2022,3,Mar,10,Parks,Highbridge Park,10,,10,,,34,Manhattan,M-12A,ZONE,true,2022-03-04 08:44:13.0000000,M&O MS Forms
M-002430,M037,M037-ZN06,03/05/2022 12:00:00 AM,AM,2022,3,Mar,10,Parks,Highbridge Park,4,,4,,,34,Manhattan,M-12A,ZONE,true,2022-03-06 19:42:02.0000000,M&O MS Forms
M-002426,M037,M037-ZN06,03/05/2022 12:00:00 AM,AM,2022,3,Mar,10,Parks,Highbridge Park,6,,6,,,34,Manhattan,M-12A,ZONE,true,2022-03-06 19:39:29.0000000,M&O MS Forms
M-002377,M037,M037-ZN06,02/27/2022 12:00:00 AM,AM,2022,2,Feb,10,Parks,Highbridge Park,12,,12,,,34,Manhattan,M-12A,ZONE,true,2022-03-04 08:33:18.0000000,M&O MS Forms
M-002386,M037,M037-ZN06,02/28/2022 12:00:00 AM,AM,2022,2,Feb,10,Parks,Highbridge Park,9,,9,,,34,Manhattan,M-12A,ZONE,true,2022-03-04 08:36:47.0000000,M&O MS Forms
M-002396,M037,M037-ZN06,03/01/2022 12:00:00 AM,AM,2022,3,Mar,10,Parks,Highbridge Park,11,,11,,,34,Manhattan,M-12A,ZONE,true,2022-03-04 08:39:14.0000000,M&O MS Forms
M-002570,M037,M037-ZN06,03/20/2022 12:00:00 AM,AM,2022,3,Mar,13,Parks,Highbridge Park,13,,13,,,34,Manhattan,M-12A,ZONE,true,2022-03-24 19:43:06.0000000,M&O MS Forms
M-002578,M037,M037-ZN06,03/21/2022 12:00:00 AM,AM,2022,3,Mar,13,Parks,Highbridge Park,9,,9,,,34,Manhattan,M-12A,ZONE,true,2022-03-24 19:47:24.0000000,M&O MS Forms
M-002587,M037,M037-ZN06,03/22/2022 12:00:00 AM,AM,2022,3,Mar,13,Parks,Highbridge Park,7,,7,,,34,Manhattan,M-12A,ZONE,true,2022-03-24 19:51:57.0000000,M&O MS Forms
M-002631,M037,M037-ZN06,03/26/2022 12:00:00 AM,AM,2022,3,Mar,13,Parks,Highbridge Park,8,,8,,,34,Manhattan,M-12A,ZONE,true,2022-03-26 19:25:22.0000000,M&O MS Forms
M-002622,M037,M037-ZN06,03/25/2022 12:00:00 AM,AM,2022,3,Mar,13,Parks,Highbridge Park,3,,3,,,34,Manhattan,M-12A,ZONE,true,2022-03-26 19:22:26.0000000,M&O MS Forms
M-002604,M037,M037-ZN06,03/24/2022 12:00:00 AM,AM,2022,3,Mar,13,Parks,Highbridge Park,2,,2,,,34,Manhattan,M-12A,ZONE,true,2022-03-24 19:58:55.0000000,M&O MS Forms
M-002596,M037,M037-ZN06,03/23/2022 12:00:00 AM,AM,2022,3,Mar,13,Parks,Highbridge Park,15,,15,,,34,Manhattan,M-12A,ZONE,true,2022-03-24 19:55:46.0000000,M&O MS Forms
M-002675,M037,M037-ZN06,03/30/2022 12:00:00 AM,AM,2022,3,Mar,14,Parks,Highbridge Park,19,,19,,,34,Manhattan,M-12A,ZONE,true,2022-03-30 15:33:59.0000000,M&O MS Forms
M-002690,M037,M037-ZN06,03/31/2022 12:00:00 AM,AM,2022,3,Mar,14,Parks,Highbridge Park,17,,17,,,34,Manhattan,M-12A,ZONE,true,2022-04-01 15:56:29.0000000,M&O MS Forms
M-002654,M037,M037-ZN06,03/28/2022 12:00:00 AM,AM,2022,3,Mar,14,Parks,Highbridge Park,16,,16,,,34,Manhattan,M-12A,ZONE,true,2022-03-29 05:30:56.0000000,M&O MS Forms
M-002666,M037,M037-ZN06,03/29/2022 12:00:00 AM,AM,2022,3,Mar,14,Parks,Highbridge Park,18,,18,,,34,Manhattan,M-12A,ZONE,true,2022-03-30 15:30:26.0000000,M&O MS Forms
M-002645,M037,M037-ZN06,03/27/2022 12:00:00 AM,AM,2022,3,Mar,14,Parks,Highbridge Park,8,,8,,,34,Manhattan,M-12A,ZONE,true,2022-03-29 05:27:55.0000000,M&O MS Forms
M-002561,M037,M037-ZN06,03/19/2022 12:00:00 AM,AM,2022,3,Mar,12,Parks,Highbridge Park,10,,10,,,34,Manhattan,M-12A,ZONE,true,2022-03-24 16:47:49.0000000,M&O MS Forms
M-002552,M037,M037-ZN06,03/18/2022 12:00:00 AM,AM,2022,3,Mar,12,Parks,Highbridge Park,10,,10,,,34,Manhattan,M-12A,ZONE,true,2022-03-24 16:40:01.0000000,M&O MS Forms
M-002545,M037,M037-ZN06,03/17/2022 12:00:00 AM,AM,2022,3,Mar,12,Parks,Highbridge Park,8,,8,,,34,Manhattan,M-12A,ZONE,true,2022-03-24 16:36:23.0000000,M&O MS Forms
M-002508,M037,M037-ZN06,03/14/2022 12:00:00 AM,AM,2022,3,Mar,12,Parks,Highbridge Park,3,,3,,,34,Manhattan,M-12A,ZONE,true,2022-03-17 10:47:52.0000000,M&O MS Forms
M-002499,M037,M037-ZN06,03/13/2022 12:00:00 AM,AM,2022,3,Mar,12,Parks,Highbridge Park,5,,5,,,34,Manhattan,M-12A,ZONE,true,2022-03-17 10:45:00.0000000,M&O MS Forms
M-001165,M037,M037-ZN06,10/25/2021 12:00:00 AM,AM,2021,10,Oct,44,Parks,Highbridge Park,2,,2,,,34,Manhattan,M-12A,ZONE,true,2021-10-29 16:21:26.0000000,M&O MS Forms
M-001173,M037,M037-ZN06,10/26/2021 12:00:00 AM,AM,2021,10,Oct,44,Parks,Highbridge Park,5,,5,,,34,Manhattan,M-12A,ZONE,true,2021-10-29 16:24:01.0000000,M&O MS Forms
M-001195,M037,M037-ZN06,10/29/2021 12:00:00 AM,AM,2021,10,Oct,44,Parks,Highbridge Park,18,,18,,,34,Manhattan,M-12A,ZONE,true,2021-10-29 16:31:06.0000000,M&O MS Forms
M-001202,M037,M037-ZN06,10/30/2021 12:00:00 AM,AM,2021,10,Oct,44,Parks,Highbridge Park,4,,4,,,34,Manhattan,M-12A,ZONE,true,2021-11-01 15:46:30.0000000,M&O MS Forms
M-001187,M037,M037-ZN06,10/28/2021 12:00:00 AM,AM,2021,10,Oct,44,Parks,Highbridge Park,6,,6,,,34,Manhattan,M-12A,ZONE,true,2021-10-29 16:28:44.0000000,M&O MS Forms
M-001180,M037,M037-ZN06,10/27/2021 12:00:00 AM,AM,2021,10,Oct,44,Parks,Highbridge Park,1,,1,,,34,Manhattan,M-12A,ZONE,true,2021-10-29 16:26:27.0000000,M&O MS Forms
M-001223,M037,M037-ZN06,11/02/2021 12:00:00 AM,AM,2021,11,Nov,45,Parks,Highbridge Park,23,,23,,,34,Manhattan,M-12A,ZONE,true,2021-11-05 16:03:56.0000000,M&O MS Forms
M-001216,M037,M037-ZN06,11/01/2021 12:00:00 AM,AM,2021,11,Nov,45,Parks,Highbridge Park,2,,2,,,34,Manhattan,M-12A,ZONE,true,2021-11-05 16:01:40.0000000,M&O MS Forms
M-001231,M037,M037-ZN06,11/03/2021 12:00:00 AM,AM,2021,11,Nov,45,Parks,Highbridge Park,9,,9,,,34,Manhattan,M-12A,ZONE,true,2021-11-05 16:06:34.0000000,M&O MS Forms
M-001240,M037,M037-ZN06,11/04/2021 12:00:00 AM,AM,2021,11,Nov,45,Parks,Highbridge Park,11,,11,,,34,Manhattan,M-12A,ZONE,true,2021-11-05 16:09:11.0000000,M&O MS Forms
M-001249,M037,M037-ZN06,11/05/2021 12:00:00 AM,AM,2021,11,Nov,45,Parks,Highbridge Park,13,,13,,,34,Manhattan,M-12A,ZONE,true,2021-11-05 16:11:40.0000000,M&O MS Forms
M-001271,M037,M037-ZN06,11/07/2021 12:00:00 AM,AM,2021,11,Nov,46,Parks,Highbridge Park,25,,25,,,34,Manhattan,M-12A,ZONE,true,2021-11-12 15:47:40.0000000,M&O MS Forms
M-001260,M037,M037-ZN06,11/06/2021 12:00:00 AM,AM,2021,11,Nov,45,Parks,Highbridge Park,8,,8,,,34,Manhattan,M-12A,ZONE,true,2021-11-08 12:22:33.0000000,M&O MS Forms
M-001280,M037,M037-ZN06,11/08/2021 12:00:00 AM,AM,2021,11,Nov,46,Parks,Highbridge Park,40,,40,,,34,Manhattan,M-12A,ZONE,true,2021-11-12 15:50:35.0000000,M&O MS Forms
M-001289,M037,M037-ZN06,11/09/2021 12:00:00 AM,AM,2021,11,Nov,46,Parks,Highbridge Park,52,,52,,,34,Manhattan,M-12A,ZONE,true,2021-11-12 15:53:30.0000000,M&O MS Forms
M-001298,M037,M037-ZN06,11/10/2021 12:00:00 AM,AM,2021,11,Nov,46,Parks,Highbridge Park,9,,9,,,34,Manhattan,M-12A,ZONE,true,2021-11-12 15:56:29.0000000,M&O MS Forms
M-001307,M037,M037-ZN06,11/11/2021 12:00:00 AM,AM,2021,11,Nov,46,Parks,Highbridge Park,15,,15,,,34,Manhattan,M-12A,ZONE,true,2021-11-12 16:00:06.0000000,M&O MS Forms
M-000301,M037,M037-ZN06,05/24/2021 12:00:00 AM,PM,2021,5,May,22,Parks,Highbridge Park,4,,4,,,34,Manhattan,M-12A,ZONE,true,2021-05-29 08:47:28.0000000,M&O MS Forms
M-000182,M037,M037-ZN06,05/02/2021 12:00:00 AM,AM,2021,5,May,19,Parks,Highbridge Park,4,,4,,,34,Manhattan,M-12A,ZONE,true,2021-05-07 19:38:04.0000000,M&O MS Forms
M-000633,M037,M037-ZN06,08/03/2021 12:00:00 AM,PM,2021,8,Aug,32,Parks,Highbridge Park,9,,9,,,34,Manhattan,M-12A,ZONE,true,2021-08-09 08:21:37.0000000,M&O MS Forms
M-001316,M037,M037-ZN06,11/12/2021 12:00:00 AM,AM,2021,11,Nov,46,Parks,Highbridge Park,7,,7,,,34,Manhattan,M-12A,ZONE,true,2021-11-12 16:04:56.0000000,M&O MS Forms
M-001325,M037,M037-ZN06,11/13/2021 12:00:00 AM,AM,2021,11,Nov,46,Parks,Highbridge Park,18,,18,,,34,Manhattan,M-12A,ZONE,true,2021-11-13 15:53:56.0000000,M&O MS Forms
M-001356,M037,M037-ZN06,11/15/2021 12:00:00 AM,AM,2021,11,Nov,47,Parks,Highbridge Park,15,,15,,,34,Manhattan,M-12A,ZONE,true,2021-11-18 16:39:25.0000000,M&O MS Forms
M-001355,M037,M037-ZN06,11/15/2021 12:00:00 AM,AM,2021,11,Nov,47,Parks,Highbridge Park,15,,15,,,34,Manhattan,M-12A,ZONE,true,2021-11-18 16:39:24.0000000,M&O MS Forms
M-001345,M037,M037-ZN06,11/14/2021 12:00:00 AM,AM,2021,11,Nov,47,Parks,Highbridge Park,19,,19,,,34,Manhattan,M-12A,ZONE,true,2021-11-18 16:33:19.0000000,M&O MS Forms
M-001365,M037,M037-ZN06,11/16/2021 12:00:00 AM,AM,2021,11,Nov,47,Parks,Highbridge Park,18,,18,,,34,Manhattan,M-12A,ZONE,true,2021-11-18 16:59:11.0000000,M&O MS Forms
M-001382,M037,M037-ZN06,11/18/2021 12:00:00 AM,AM,2021,11,Nov,47,Parks,Highbridge Park,18,,18,,,34,Manhattan,M-12A,ZONE,true,2021-11-18 17:06:20.0000000,M&O MS Forms
M-001374,M037,M037-ZN06,11/17/2021 12:00:00 AM,AM,2021,11,Nov,47,Parks,Highbridge Park,35,,35,,,34,Manhattan,M-12A,ZONE,true,2021-11-18 17:03:12.0000000,M&O MS Forms
M-001392,M037,M037-ZN06,11/19/2021 12:00:00 AM,AM,2021,11,Nov,47,Parks,Highbridge Park,29,,29,,,34,Manhattan,M-12A,ZONE,true,2021-11-20 07:07:55.0000000,M&O MS Forms
M-001401,M037,M037-ZN06,11/20/2021 12:00:00 AM,AM,2021,11,Nov,47,Parks,Highbridge Park,18,,18,,,34,Manhattan,M-12A,ZONE,true,2021-11-20 18:40:57.0000000,M&O MS Forms
M-001410,M037,M037-ZN06,11/21/2021 12:00:00 AM,AM,2021,11,Nov,48,Parks,Highbridge Park,40,,40,,,34,Manhattan,M-12A,ZONE,true,2021-11-25 12:26:34.0000000,M&O MS Forms
M-001419,M037,M037-ZN06,11/22/2021 12:00:00 AM,AM,2021,11,Nov,48,Parks,Highbridge Park,75,,75,,,34,Manhattan,M-12A,ZONE,true,2021-11-25 12:30:20.0000000,M&O MS Forms
M-001428,M037,M037-ZN06,11/23/2021 12:00:00 AM,AM,2021,11,Nov,48,Parks,Highbridge Park,20,,20,,,34,Manhattan,M-12A,ZONE,true,2021-11-25 12:34:17.0000000,M&O MS Forms
M-001456,M037,M037-ZN06,11/26/2021 12:00:00 AM,AM,2021,11,Nov,48,Parks,Highbridge Park,16,,16,,,34,Manhattan,M-12A,ZONE,true,2021-11-26 20:02:47.0000000,M&O MS Forms
M-001438,M037,M037-ZN06,11/24/2021 12:00:00 AM,AM,2021,11,Nov,48,Parks,Highbridge Park,32,,32,,,34,Manhattan,M-12A,ZONE,true,2021-11-25 12:37:30.0000000,M&O MS Forms
M-001447,M037,M037-ZN06,11/25/2021 12:00:00 AM,AM,2021,11,Nov,48,Parks,Highbridge Park,18,,18,,,34,Manhattan,M-12A,ZONE,true,2021-11-26 19:59:26.0000000,M&O MS Forms
M-001477,M037,M037-ZN06,11/27/2021 12:00:00 AM,AM,2021,11,Nov,48,Parks,Highbridge Park,18,,18,,,34,Manhattan,M-12A,ZONE,true,2021-11-29 08:57:21.0000000,M&O MS Forms
M-001499,M037,M037-ZN06,11/29/2021 12:00:00 AM,AM,2021,11,Nov,49,Parks,Highbridge Park,25,,25,,,34,Manhattan,M-12A,ZONE,true,2021-12-02 08:44:57.0000000,M&O MS Forms
M-001491,M037,M037-ZN06,11/28/2021 12:00:00 AM,AM,2021,11,Nov,49,Parks,Highbridge Park,60,,60,,,34,Manhattan,M-12A,ZONE,true,2021-12-02 08:41:50.0000000,M&O MS Forms
M-001508,M037,M037-ZN06,11/30/2021 12:00:00 AM,AM,2021,11,Nov,49,Parks,Highbridge Park,45,,45,,,34,Manhattan,M-12A,ZONE,true,2021-12-02 08:48:36.0000000,M&O MS Forms
M-001516,M037,M037-ZN06,12/01/2021 12:00:00 AM,AM,2021,12,Dec,49,Parks,Highbridge Park,65,,65,,,34,Manhattan,M-12A,ZONE,true,2021-12-02 08:50:39.0000000,M&O MS Forms
M-001533,M037,M037-ZN06,12/05/2021 12:00:00 AM,AM,2021,12,Dec,50,Parks,Highbridge Park,70,,70,,,34,Manhattan,M-12A,ZONE,true,2021-12-05 13:35:31.0000000,M&O MS Forms
M-001543,M037,M037-ZN06,12/05/2021 12:00:00 AM,AM,2021,12,Dec,50,Parks,Highbridge Park,51,,51,,,34,Manhattan,M-12A,ZONE,true,2021-12-05 13:39:33.0000000,M&O MS Forms
M-001542,M037,M037-ZN06,12/05/2021 12:00:00 AM,AM,2021,12,Dec,50,Parks,Highbridge Park,51,,51,,,34,Manhattan,M-12A,ZONE,true,2021-12-05 13:39:12.0000000,M&O MS Forms
M-001565,M037,M037-ZN06,12/05/2021 12:00:00 AM,AM,2021,12,Dec,50,Parks,Highbridge Park,25,,25,,,34,Manhattan,M-12A,ZONE,true,2021-12-09 16:06:50.0000000,M&O MS Forms
M-001553,M037,M037-ZN06,12/04/2021 12:00:00 AM,AM,2021,12,Dec,49,Parks,Highbridge Park,8,,8,,,34,Manhattan,M-12A,ZONE,true,2021-12-05 13:43:29.0000000,M&O MS Forms
M-001552,M037,M037-ZN06,12/04/2021 12:00:00 AM,AM,2021,12,Dec,49,Parks,Highbridge Park,8,,8,,,34,Manhattan,M-12A,ZONE,true,2021-12-05 13:43:04.0000000,M&O MS Forms
M-001705,M037,M037-ZN06,12/17/2021 12:00:00 AM,AM,2021,12,Dec,51,Parks,Highbridge Park,110,,110,,,34,Manhattan,M-12A,ZONE,true,2021-12-19 10:19:15.0000000,M&O MS Forms
M-001714,M037,M037-ZN06,12/18/2021 12:00:00 AM,AM,2021,12,Dec,51,Parks,Highbridge Park,105,,105,,,34,Manhattan,M-12A,ZONE,true,2021-12-19 10:23:57.0000000,M&O MS Forms
M-001574,M037,M037-ZN06,12/06/2021 12:00:00 AM,AM,2021,12,Dec,50,Parks,Highbridge Park,70,,70,,,34,Manhattan,M-12A,ZONE,true,2021-12-09 16:10:00.0000000,M&O MS Forms
M-001583,M037,M037-ZN06,12/07/2021 12:00:00 AM,AM,2021,12,Dec,50,Parks,Highbridge Park,85,,85,,,34,Manhattan,M-12A,ZONE,true,2021-12-09 16:13:10.0000000,M&O MS Forms
M-001592,M037,M037-ZN06,12/08/2021 12:00:00 AM,AM,2021,12,Dec,50,Parks,Highbridge Park,90,,90,,,34,Manhattan,M-12A,ZONE,true,2021-12-09 16:15:59.0000000,M&O MS Forms
M-001608,M037,M037-ZN06,12/09/2021 12:00:00 AM,AM,2021,12,Dec,50,Parks,Highbridge Park,100,,100,,,34,Manhattan,M-12A,ZONE,true,2021-12-11 07:59:54.0000000,M&O MS Forms
M-001629,M037,M037-ZN06,12/11/2021 12:00:00 AM,AM,2021,12,Dec,50,Parks,Highbridge Park,135,,135,,,34,Manhattan,M-12A,ZONE,true,2021-12-14 16:23:29.0000000,M&O MS Forms
M-001638,M037,M037-ZN06,12/12/2021 12:00:00 AM,AM,2021,12,Dec,51,Parks,Highbridge Park,55,,55,,,34,Manhattan,M-12A,ZONE,true,2021-12-14 16:30:48.0000000,M&O MS Forms
M-001647,M037,M037-ZN06,12/13/2021 12:00:00 AM,AM,2021,12,Dec,51,Parks,Highbridge Park,85,,85,,,34,Manhattan,M-12A,ZONE,true,2021-12-14 16:33:33.0000000,M&O MS Forms
M-001689,M037,M037-ZN06,12/16/2021 12:00:00 AM,AM,2021,12,Dec,51,Parks,Highbridge Park,95,,95,,,34,Manhattan,M-12A,ZONE,true,2021-12-16 16:49:03.0000000,M&O MS Forms
M-001678,M037,M037-ZN06,12/15/2021 12:00:00 AM,AM,2021,12,Dec,51,Parks,Highbridge Park,60,,60,,,34,Manhattan,M-12A,ZONE,true,2021-12-16 16:38:50.0000000,M&O MS Forms
M-001668,M037,M037-ZN06,12/15/2021 12:00:00 AM,AM,2021,12,Dec,51,Parks,Highbridge Park,100,,100,,,34,Manhattan,M-12A,ZONE,true,2021-12-16 16:28:27.0000000,M&O MS Forms
M-004932,M037,M037-ZN03,11/14/2022 12:00:00 AM,AM,2022,11,Nov,47,Parks,Highbridge Park,5,,5,,,33,Manhattan,M-12A,ZONE,true,2022-11-16 07:08:51.0000000,M&O MS Forms
M-004952,M037,M037-ZN03,11/17/2022 12:00:00 AM,AM,2022,11,Nov,47,Parks,Highbridge Park,7,,7,,,33,Manhattan,M-12A,ZONE,true,2022-11-17 06:56:07.0000000,M&O MS Forms
M-004906,M037,M037-ZN03,11/12/2022 12:00:00 AM,AM,2022,11,Nov,46,Parks,Highbridge Park,43,,43,,,33,Manhattan,M-12A,ZONE,true,2022-11-13 10:24:19.0000000,M&O MS Forms
M-004922,M037,M037-ZN03,11/13/2022 12:00:00 AM,AM,2022,11,Nov,47,Parks,Highbridge Park,3,,3,,,33,Manhattan,M-12A,ZONE,true,2022-11-15 05:27:55.0000000,M&O MS Forms
M-004897,M037,M037-ZN03,11/11/2022 12:00:00 AM,AM,2022,11,Nov,46,Parks,Highbridge Park,36,,36,,,33,Manhattan,M-12A,ZONE,true,2022-11-13 10:21:19.0000000,M&O MS Forms
M-004888,M037,M037-ZN03,11/10/2022 12:00:00 AM,AM,2022,11,Nov,46,Parks,Highbridge Park,28,,28,,,33,Manhattan,M-12A,ZONE,true,2022-11-13 10:18:33.0000000,M&O MS Forms
M-004871,M037,M037-ZN03,11/08/2022 12:00:00 AM,AM,2022,11,Nov,46,Parks,Highbridge Park,15,,15,,,33,Manhattan,M-12A,ZONE,true,2022-11-13 10:11:55.0000000,M&O MS Forms
M-004862,M037,M037-ZN03,11/07/2022 12:00:00 AM,AM,2022,11,Nov,46,Parks,Highbridge Park,15,,15,,,33,Manhattan,M-12A,ZONE,true,2022-11-13 10:08:15.0000000,M&O MS Forms
M-004880,M037,M037-ZN03,11/09/2022 12:00:00 AM,AM,2022,11,Nov,46,Parks,Highbridge Park,30,,30,,,33,Manhattan,M-12A,ZONE,true,2022-11-13 10:14:47.0000000,M&O MS Forms
M-004853,M037,M037-ZN03,11/06/2022 12:00:00 AM,AM,2022,11,Nov,46,Parks,Highbridge Park,28,,28,,,33,Manhattan,M-12A,ZONE,true,2022-11-13 10:05:33.0000000,M&O MS Forms
M-004801,M037,M037-ZN03,11/04/2022 12:00:00 AM,AM,2022,11,Nov,45,Parks,Highbridge Park,36,,36,,,33,Manhattan,M-12A,ZONE,true,2022-11-05 14:11:17.0000000,M&O MS Forms
M-004812,M037,M037-ZN03,11/05/2022 12:00:00 AM,AM,2022,11,Nov,45,Parks,Highbridge Park,43,,43,,,33,Manhattan,M-12A,ZONE,true,2022-11-07 06:45:36.0000000,M&O MS Forms
M-004792,M037,M037-ZN03,11/03/2022 12:00:00 AM,AM,2022,11,Nov,45,Parks,Highbridge Park,2,,2,,,33,Manhattan,M-12A,ZONE,true,2022-11-05 14:08:46.0000000,M&O MS Forms
M-004774,M037,M037-ZN03,11/01/2022 12:00:00 AM,AM,2022,11,Nov,45,Parks,Highbridge Park,15,,15,,,33,Manhattan,M-12A,ZONE,true,2022-11-05 14:03:18.0000000,M&O MS Forms
M-004784,M037,M037-ZN03,11/02/2022 12:00:00 AM,AM,2022,11,Nov,45,Parks,Highbridge Park,30,,30,,,33,Manhattan,M-12A,ZONE,true,2022-11-05 14:06:29.0000000,M&O MS Forms
M-005736,M037,M037-ZN03,02/11/2023 12:00:00 AM,AM,2023,2,Feb,6,Parks,Highbridge Park,14,,14,,,33,Manhattan,M-12A,ZONE,true,2023-02-11 17:52:12.0000000,M&O MS Forms
M-005396,M037,M037-ZN03,01/06/2023 12:00:00 AM,AM,2023,1,Jan,1,Parks,Highbridge Park,14,,14,,,33,Manhattan,M-12A,ZONE,true,2023-01-08 12:20:58.0000000,M&O MS Forms
M-005405,M037,M037-ZN03,01/07/2023 12:00:00 AM,AM,2023,1,Jan,1,Parks,Highbridge Park,7,,7,,,33,Manhattan,M-12A,ZONE,true,2023-01-08 12:23:51.0000000,M&O MS Forms
M-005479,M037,M037-ZN03,01/15/2023 12:00:00 AM,AM,2023,1,Jan,3,Parks,Highbridge Park,3,,3,,,33,Manhattan,M-12A,ZONE,true,2023-01-23 15:54:59.0000000,M&O MS Forms
M-005468,M037,M037-ZN03,01/14/2023 12:00:00 AM,AM,2023,1,Jan,2,Parks,Highbridge Park,10,,10,,,33,Manhattan,M-12A,ZONE,true,2023-01-14 15:11:14.0000000,M&O MS Forms
M-005459,M037,M037-ZN03,01/13/2023 12:00:00 AM,AM,2023,1,Jan,2,Parks,Highbridge Park,16,,16,,,33,Manhattan,M-12A,ZONE,true,2023-01-14 15:08:43.0000000,M&O MS Forms
M-005450,M037,M037-ZN03,01/12/2023 12:00:00 AM,AM,2023,1,Jan,2,Parks,Highbridge Park,8,,8,,,33,Manhattan,M-12A,ZONE,true,2023-01-14 15:06:09.0000000,M&O MS Forms
M-005441,M037,M037-ZN03,01/11/2023 12:00:00 AM,AM,2023,1,Jan,2,Parks,Highbridge Park,11,,11,,,33,Manhattan,M-12A,ZONE,true,2023-01-14 15:03:31.0000000,M&O MS Forms
M-005432,M037,M037-ZN03,01/10/2023 12:00:00 AM,AM,2023,1,Jan,2,Parks,Highbridge Park,9,,9,,,33,Manhattan,M-12A,ZONE,true,2023-01-14 15:00:45.0000000,M&O MS Forms
M-005423,M037,M037-ZN03,01/09/2023 12:00:00 AM,AM,2023,1,Jan,2,Parks,Highbridge Park,7,,7,,,33,Manhattan,M-12A,ZONE,true,2023-01-14 14:58:29.0000000,M&O MS Forms
M-005415,M037,M037-ZN03,01/08/2023 12:00:00 AM,AM,2023,1,Jan,2,Parks,Highbridge Park,5,,5,,,33,Manhattan,M-12A,ZONE,true,2023-01-14 14:56:08.0000000,M&O MS Forms
M-005327,M037,M037-ZN03,12/30/2022 12:00:00 AM,AM,2022,12,Dec,53,Parks,Highbridge Park,13,,13,,,33,Manhattan,M-12A,ZONE,true,2022-12-31 11:02:41.0000000,M&O MS Forms
M-005318,M037,M037-ZN03,12/29/2022 12:00:00 AM,AM,2022,12,Dec,53,Parks,Highbridge Park,11,,11,,,33,Manhattan,M-12A,ZONE,true,2022-12-31 11:00:01.0000000,M&O MS Forms
M-005309,M037,M037-ZN03,12/28/2022 12:00:00 AM,AM,2022,12,Dec,53,Parks,Highbridge Park,9,,9,,,33,Manhattan,M-12A,ZONE,true,2022-12-31 10:57:17.0000000,M&O MS Forms
M-005300,M037,M037-ZN03,12/27/2022 12:00:00 AM,AM,2022,12,Dec,53,Parks,Highbridge Park,8,,8,,,33,Manhattan,M-12A,ZONE,true,2022-12-31 10:54:39.0000000,M&O MS Forms
M-005291,M037,M037-ZN03,12/26/2022 12:00:00 AM,AM,2022,12,Dec,53,Parks,Highbridge Park,5,,5,,,33,Manhattan,M-12A,ZONE,true,2022-12-31 10:52:05.0000000,M&O MS Forms
M-005280,M037,M037-ZN03,12/24/2022 12:00:00 AM,AM,2022,12,Dec,52,Parks,Highbridge Park,1,,1,,,33,Manhattan,M-12A,ZONE,true,2022-12-24 16:43:37.0000000,M&O MS Forms
M-006032,M037,M037-ZN06,03/13/2023 12:00:00 AM,AM,2023,3,Mar,11,Parks,Highbridge Park,10,,10,,,34,Manhattan,M-12A,ZONE,true,2023-03-13 16:11:09.0000000,M&O MS Forms
M-006052,M037,M037-ZN06,03/15/2023 12:00:00 AM,AM,2023,3,Mar,11,Parks,Highbridge Park,6,,6,,,34,Manhattan,M-12A,ZONE,true,2023-03-15 17:11:53.0000000,M&O MS Forms
M-005985,M037,M037-ZN06,03/08/2023 12:00:00 AM,AM,2023,3,Mar,10,Parks,Highbridge Park,7,,7,,,34,Manhattan,M-12A,ZONE,true,2023-03-08 15:45:46.0000000,M&O MS Forms
M-006042,M037,M037-ZN06,03/14/2023 12:00:00 AM,AM,2023,3,Mar,11,Parks,Highbridge Park,8,,8,,,34,Manhattan,M-12A,ZONE,true,2023-03-14 16:00:09.0000000,M&O MS Forms
M-006023,M037,M037-ZN06,03/12/2023 12:00:00 AM,AM,2023,3,Mar,11,Parks,Highbridge Park,7,,7,,,34,Manhattan,M-12A,ZONE,true,2023-03-12 17:22:40.0000000,M&O MS Forms
M-006013,M037,M037-ZN06,03/11/2023 12:00:00 AM,AM,2023,3,Mar,10,Parks,Highbridge Park,6,,6,,,34,Manhattan,M-12A,ZONE,true,2023-03-11 16:04:04.0000000,M&O MS Forms
M-006004,M037,M037-ZN06,03/10/2023 12:00:00 AM,AM,2023,3,Mar,10,Parks,Highbridge Park,12,,12,,,34,Manhattan,M-12A,ZONE,true,2023-03-11 15:58:38.0000000,M&O MS Forms
M-005965,M037,M037-ZN06,03/06/2023 12:00:00 AM,AM,2023,3,Mar,10,Parks,Highbridge Park,8,,8,,,34,Manhattan,M-12A,ZONE,true,2023-03-06 17:35:09.0000000,M&O MS Forms
M-005974,M037,M037-ZN06,03/07/2023 12:00:00 AM,AM,2023,3,Mar,10,Parks,Highbridge Park,5,,5,,,34,Manhattan,M-12A,ZONE,true,2023-03-07 15:48:14.0000000,M&O MS Forms
M-005975,M037,M037-ZN06,03/07/2023 12:00:00 AM,AM,2023,3,Mar,10,Parks,Highbridge Park,5,,5,,,34,Manhattan,M-12A,ZONE,true,2023-03-07 15:48:14.0000000,M&O MS Forms
M-005994,M037,M037-ZN06,03/09/2023 12:00:00 AM,AM,2023,3,Mar,10,Parks,Highbridge Park,10,,10,,,34,Manhattan,M-12A,ZONE,true,2023-03-09 15:45:57.0000000,M&O MS Forms
M-005948,M037,M037-ZN06,03/05/2023 12:00:00 AM,AM,2023,3,Mar,10,Parks,Highbridge Park,9,,9,,,34,Manhattan,M-12A,ZONE,true,2023-03-06 06:03:40.0000000,M&O MS Forms
M-005939,M037,M037-ZN06,03/04/2023 12:00:00 AM,AM,2023,3,Mar,9,Parks,Highbridge Park,4,,4,,,34,Manhattan,M-12A,ZONE,true,2023-03-04 13:33:12.0000000,M&O MS Forms
M-005930,M037,M037-ZN06,03/03/2023 12:00:00 AM,AM,2023,3,Mar,9,Parks,Highbridge Park,8,,8,,,34,Manhattan,M-12A,ZONE,true,2023-03-04 13:29:52.0000000,M&O MS Forms
M-005912,M037,M037-ZN06,03/01/2023 12:00:00 AM,AM,2023,3,Mar,9,Parks,Highbridge Park,6,,6,,,34,Manhattan,M-12A,ZONE,true,2023-03-01 15:46:41.0000000,M&O MS Forms
M-005903,M037,M037-ZN06,02/27/2023 12:00:00 AM,AM,2023,2,Feb,9,Parks,Highbridge Park,10,,10,,,34,Manhattan,M-12A,ZONE,true,2023-03-01 05:36:36.0000000,M&O MS Forms
M-005892,M037,M037-ZN06,02/26/2023 12:00:00 AM,AM,2023,2,Feb,9,Parks,Highbridge Park,5,,5,,,34,Manhattan,M-12A,ZONE,true,2023-03-01 05:32:36.0000000,M&O MS Forms
M-005882,M037,M037-ZN06,02/26/2023 12:00:00 AM,AM,2023,2,Feb,9,Parks,Highbridge Park,5,,5,,,34,Manhattan,M-12A,ZONE,true,2023-02-26 19:17:07.0000000,M&O MS Forms
M-005873,M037,M037-ZN06,02/25/2023 12:00:00 AM,AM,2023,2,Feb,8,Parks,Highbridge Park,9,,9,,,34,Manhattan,M-12A,ZONE,true,2023-02-26 12:03:36.0000000,M&O MS Forms
M-005844,M037,M037-ZN06,02/22/2023 12:00:00 AM,AM,2023,2,Feb,8,Parks,Highbridge Park,8,,8,,,34,Manhattan,M-12A,ZONE,true,2023-02-23 15:00:07.0000000,M&O MS Forms
M-005864,M037,M037-ZN06,02/24/2023 12:00:00 AM,AM,2023,2,Feb,8,Parks,Highbridge Park,10,,10,,,34,Manhattan,M-12A,ZONE,true,2023-02-24 18:51:02.0000000,M&O MS Forms
M-005854,M037,M037-ZN06,02/23/2023 12:00:00 AM,AM,2023,2,Feb,8,Parks,Highbridge Park,7,,7,,,34,Manhattan,M-12A,ZONE,true,2023-02-23 15:23:46.0000000,M&O MS Forms
M-005832,M037,M037-ZN06,02/21/2023 12:00:00 AM,AM,2023,2,Feb,8,Parks,Highbridge Park,6,,6,,,34,Manhattan,M-12A,ZONE,true,2023-02-22 10:41:29.0000000,M&O MS Forms
M-005823,M037,M037-ZN06,02/20/2023 12:00:00 AM,AM,2023,2,Feb,8,Parks,Highbridge Park,4,,4,,,34,Manhattan,M-12A,ZONE,true,2023-02-22 10:36:55.0000000,M&O MS Forms
M-005815,M037,M037-ZN06,02/19/2023 12:00:00 AM,AM,2023,2,Feb,8,Parks,Highbridge Park,7,,7,,,34,Manhattan,M-12A,ZONE,true,2023-02-22 08:40:29.0000000,M&O MS Forms
M-005805,M037,M037-ZN06,02/18/2023 12:00:00 AM,AM,2023,2,Feb,7,Parks,Highbridge Park,16,,16,,,34,Manhattan,M-12A,ZONE,true,2023-02-19 13:44:19.0000000,M&O MS Forms
M-005786,M037,M037-ZN06,02/16/2023 12:00:00 AM,AM,2023,2,Feb,7,Parks,Highbridge Park,10,,10,,,34,Manhattan,M-12A,ZONE,true,2023-02-16 16:05:00.0000000,M&O MS Forms
M-005795,M037,M037-ZN06,02/17/2023 12:00:00 AM,AM,2023,2,Feb,7,Parks,Highbridge Park,15,,15,,,34,Manhattan,M-12A,ZONE,true,2023-02-19 13:38:54.0000000,M&O MS Forms
M-005048,M037,M037-ZN06,11/27/2022 12:00:00 AM,AM,2022,11,Nov,49,Parks,Highbridge Park,5,,5,,,34,Manhattan,M-12A,ZONE,true,2022-12-03 12:57:35.0000000,M&O MS Forms
M-005057,M037,M037-ZN06,11/28/2022 12:00:00 AM,AM,2022,11,Nov,49,Parks,Highbridge Park,3,,3,,,34,Manhattan,M-12A,ZONE,true,2022-12-03 13:00:32.0000000,M&O MS Forms
M-005066,M037,M037-ZN06,11/29/2022 12:00:00 AM,AM,2022,11,Nov,49,Parks,Highbridge Park,5,,5,,,34,Manhattan,M-12A,ZONE,true,2022-12-03 13:03:29.0000000,M&O MS Forms
M-005075,M037,M037-ZN06,11/30/2022 12:00:00 AM,AM,2022,11,Nov,49,Parks,Highbridge Park,9,,9,,,34,Manhattan,M-12A,ZONE,true,2022-12-03 13:06:03.0000000,M&O MS Forms
M-005084,M037,M037-ZN06,12/01/2022 12:00:00 AM,AM,2022,12,Dec,49,Parks,Highbridge Park,6,,6,,,34,Manhattan,M-12A,ZONE,true,2022-12-03 13:08:38.0000000,M&O MS Forms
M-005092,M037,M037-ZN06,12/02/2022 12:00:00 AM,AM,2022,12,Dec,49,Parks,Highbridge Park,10,,10,,,34,Manhattan,M-12A,ZONE,true,2022-12-03 13:36:14.0000000,M&O MS Forms
M-005101,M037,M037-ZN06,12/03/2022 12:00:00 AM,AM,2022,12,Dec,49,Parks,Highbridge Park,8,,8,,,34,Manhattan,M-12A,ZONE,true,2022-12-03 13:38:43.0000000,M&O MS Forms
M-005118,M037,M037-ZN06,12/04/2022 12:00:00 AM,AM,2022,12,Dec,50,Parks,Highbridge Park,5,,5,,,34,Manhattan,M-12A,ZONE,true,2022-12-07 16:52:50.0000000,M&O MS Forms
M-005127,M037,M037-ZN06,12/05/2022 12:00:00 AM,AM,2022,12,Dec,50,Parks,Highbridge Park,2,,2,,,34,Manhattan,M-12A,ZONE,true,2022-12-07 16:56:29.0000000,M&O MS Forms
M-005145,M037,M037-ZN06,12/07/2022 12:00:00 AM,AM,2022,12,Dec,50,Parks,Highbridge Park,7,,7,,,34,Manhattan,M-12A,ZONE,true,2022-12-07 17:13:15.0000000,M&O MS Forms
M-005136,M037,M037-ZN06,12/06/2022 12:00:00 AM,AM,2022,12,Dec,50,Parks,Highbridge Park,6,,6,,,34,Manhattan,M-12A,ZONE,true,2022-12-07 17:10:29.0000000,M&O MS Forms
M-005154,M037,M037-ZN06,12/08/2022 12:00:00 AM,AM,2022,12,Dec,50,Parks,Highbridge Park,10,,10,,,34,Manhattan,M-12A,ZONE,true,2022-12-08 16:57:38.0000000,M&O MS Forms
M-005172,M037,M037-ZN06,12/10/2022 12:00:00 AM,AM,2022,12,Dec,50,Parks,Highbridge Park,8,,8,,,34,Manhattan,M-12A,ZONE,true,2022-12-13 05:36:46.0000000,M&O MS Forms
M-005163,M037,M037-ZN06,12/09/2022 12:00:00 AM,AM,2022,12,Dec,50,Parks,Highbridge Park,4,,4,,,34,Manhattan,M-12A,ZONE,true,2022-12-13 05:33:06.0000000,M&O MS Forms
M-005190,M037,M037-ZN06,12/12/2022 12:00:00 AM,AM,2022,12,Dec,51,Parks,Highbridge Park,5,,5,,,34,Manhattan,M-12A,ZONE,true,2022-12-13 05:43:33.0000000,M&O MS Forms
M-005181,M037,M037-ZN06,12/11/2022 12:00:00 AM,AM,2022,12,Dec,51,Parks,Highbridge Park,8,,8,,,34,Manhattan,M-12A,ZONE,true,2022-12-13 05:40:12.0000000,M&O MS Forms
M-005198,M037,M037-ZN06,12/13/2022 12:00:00 AM,AM,2022,12,Dec,51,Parks,Highbridge Park,4,,4,,,34,Manhattan,M-12A,ZONE,true,2022-12-14 05:27:48.0000000,M&O MS Forms
M-005209,M037,M037-ZN06,12/14/2022 12:00:00 AM,AM,2022,12,Dec,51,Parks,Highbridge Park,6,,6,,,34,Manhattan,M-12A,ZONE,true,2022-12-14 15:43:23.0000000,M&O MS Forms
M-005218,M037,M037-ZN06,12/16/2022 12:00:00 AM,AM,2022,12,Dec,51,Parks,Highbridge Park,9,,9,,,34,Manhattan,M-12A,ZONE,true,2022-12-18 16:13:10.0000000,M&O MS Forms
M-005232,M037,M037-ZN06,12/18/2022 12:00:00 AM,AM,2022,12,Dec,52,Parks,Highbridge Park,5,,5,,,34,Manhattan,M-12A,ZONE,true,2022-12-19 15:16:56.0000000,M&O MS Forms
M-005225,M037,M037-ZN06,12/17/2022 12:00:00 AM,AM,2022,12,Dec,51,Parks,Highbridge Park,3,,3,,,34,Manhattan,M-12A,ZONE,true,2022-12-18 16:15:44.0000000,M&O MS Forms
M-005251,M037,M037-ZN06,12/20/2022 12:00:00 AM,AM,2022,12,Dec,52,Parks,Highbridge Park,10,,10,,,34,Manhattan,M-12A,ZONE,true,2022-12-24 15:55:19.0000000,M&O MS Forms
M-005240,M037,M037-ZN06,12/19/2022 12:00:00 AM,AM,2022,12,Dec,52,Parks,Highbridge Park,8,,8,,,34,Manhattan,M-12A,ZONE,true,2022-12-19 15:19:45.0000000,M&O MS Forms
M-005260,M037,M037-ZN06,12/21/2022 12:00:00 AM,AM,2022,12,Dec,52,Parks,Highbridge Park,9,,9,,,34,Manhattan,M-12A,ZONE,true,2022-12-24 15:58:35.0000000,M&O MS Forms
M-005269,M037,M037-ZN06,12/22/2022 12:00:00 AM,AM,2022,12,Dec,52,Parks,Highbridge Park,6,,6,,,34,Manhattan,M-12A,ZONE,true,2022-12-24 16:01:52.0000000,M&O MS Forms
M-005286,M037,M037-ZN06,12/25/2022 12:00:00 AM,AM,2022,12,Dec,53,Parks,Highbridge Park,5,,5,,,34,Manhattan,M-12A,ZONE,true,2022-12-31 10:50:43.0000000,M&O MS Forms
M-005277,M037,M037-ZN06,12/23/2022 12:00:00 AM,AM,2022,12,Dec,52,Parks,Highbridge Park,5,,5,,,34,Manhattan,M-12A,ZONE,true,2022-12-24 16:04:59.0000000,M&O MS Forms
M-005294,M037,M037-ZN06,12/26/2022 12:00:00 AM,AM,2022,12,Dec,53,Parks,Highbridge Park,6,,6,,,34,Manhattan,M-12A,ZONE,true,2022-12-31 10:52:55.0000000,M&O MS Forms
M-005312,M037,M037-ZN06,12/28/2022 12:00:00 AM,AM,2022,12,Dec,53,Parks,Highbridge Park,14,,14,,,34,Manhattan,M-12A,ZONE,true,2022-12-31 10:58:07.0000000,M&O MS Forms
M-005303,M037,M037-ZN06,12/27/2022 12:00:00 AM,AM,2022,12,Dec,53,Parks,Highbridge Park,15,,15,,,34,Manhattan,M-12A,ZONE,true,2022-12-31 10:55:34.0000000,M&O MS Forms
M-005321,M037,M037-ZN06,12/29/2022 12:00:00 AM,AM,2022,12,Dec,53,Parks,Highbridge Park,16,,16,,,34,Manhattan,M-12A,ZONE,true,2022-12-31 11:00:51.0000000,M&O MS Forms
M-005330,M037,M037-ZN06,12/30/2022 12:00:00 AM,AM,2022,12,Dec,53,Parks,Highbridge Park,18,,18,,,34,Manhattan,M-12A,ZONE,true,2022-12-31 11:03:32.0000000,M&O MS Forms
M-005418,M037,M037-ZN06,01/08/2023 12:00:00 AM,AM,2023,1,Jan,2,Parks,Highbridge Park,5,,5,,,34,Manhattan,M-12A,ZONE,true,2023-01-14 14:57:02.0000000,M&O MS Forms
M-005426,M037,M037-ZN06,01/09/2023 12:00:00 AM,AM,2023,1,Jan,2,Parks,Highbridge Park,10,,10,,,34,Manhattan,M-12A,ZONE,true,2023-01-14 14:59:13.0000000,M&O MS Forms
M-005435,M037,M037-ZN06,01/10/2023 12:00:00 AM,AM,2023,1,Jan,2,Parks,Highbridge Park,15,,15,,,34,Manhattan,M-12A,ZONE,true,2023-01-14 15:01:36.0000000,M&O MS Forms
M-005444,M037,M037-ZN06,01/11/2023 12:00:00 AM,AM,2023,1,Jan,2,Parks,Highbridge Park,13,,13,,,34,Manhattan,M-12A,ZONE,true,2023-01-14 15:04:24.0000000,M&O MS Forms
M-005453,M037,M037-ZN06,01/12/2023 12:00:00 AM,AM,2023,1,Jan,2,Parks,Highbridge Park,9,,9,,,34,Manhattan,M-12A,ZONE,true,2023-01-14 15:07:01.0000000,M&O MS Forms
M-005462,M037,M037-ZN06,01/13/2023 12:00:00 AM,AM,2023,1,Jan,2,Parks,Highbridge Park,14,,14,,,34,Manhattan,M-12A,ZONE,true,2023-01-14 15:09:36.0000000,M&O MS Forms
M-005471,M037,M037-ZN06,01/14/2023 12:00:00 AM,AM,2023,1,Jan,2,Parks,Highbridge Park,16,,16,,,34,Manhattan,M-12A,ZONE,true,2023-01-14 15:12:09.0000000,M&O MS Forms
M-005484,M037,M037-ZN06,01/15/2023 12:00:00 AM,AM,2023,1,Jan,3,Parks,Highbridge Park,5,,5,,,34,Manhattan,M-12A,ZONE,true,2023-01-23 15:58:22.0000000,M&O MS Forms
M-005483,M037,M037-ZN06,01/15/2023 12:00:00 AM,AM,2023,1,Jan,3,Parks,Highbridge Park,5,,5,,,34,Manhattan,M-12A,ZONE,true,2023-01-23 15:56:53.0000000,M&O MS Forms
M-005408,M037,M037-ZN06,01/07/2023 12:00:00 AM,AM,2023,1,Jan,1,Parks,Highbridge Park,8,,8,,,34,Manhattan,M-12A,ZONE,true,2023-01-08 12:24:36.0000000,M&O MS Forms
M-005399,M037,M037-ZN06,01/06/2023 12:00:00 AM,AM,2023,1,Jan,1,Parks,Highbridge Park,12,,12,,,34,Manhattan,M-12A,ZONE,true,2023-01-08 12:21:59.0000000,M&O MS Forms
M-005739,M037,M037-ZN06,02/11/2023 12:00:00 AM,AM,2023,2,Feb,6,Parks,Highbridge Park,16,,16,,,34,Manhattan,M-12A,ZONE,true,2023-02-11 17:53:38.0000000,M&O MS Forms
M-004787,M037,M037-ZN06,11/02/2022 12:00:00 AM,AM,2022,11,Nov,45,Parks,Highbridge Park,10,,10,,,34,Manhattan,M-12A,ZONE,true,2022-11-05 14:07:17.0000000,M&O MS Forms
M-004777,M037,M037-ZN06,11/01/2022 12:00:00 AM,AM,2022,11,Nov,45,Parks,Highbridge Park,20,,20,,,34,Manhattan,M-12A,ZONE,true,2022-11-05 14:04:21.0000000,M&O MS Forms
M-000454,M037,M037-ZN03,06/28/2021 12:00:00 AM,AM,2021,6,Jun,27,Parks,Highbridge Park,46,,46,,,33,Manhattan,M-12A,ZONE,true,2021-07-04 04:38:38.0000000,M&O MS Forms
M-000449,M037,M037-ZN03,06/27/2021 12:00:00 AM,AM,2021,6,Jun,27,Parks,Highbridge Park,24,,24,,,33,Manhattan,M-12A,ZONE,true,2021-07-04 04:36:23.0000000,M&O MS Forms
M-000458,M037,M037-ZN03,06/29/2021 12:00:00 AM,AM,2021,6,Jun,27,BBP,Highbridge Park,40,,40,,,33,Manhattan,M-12A,ZONE,true,2021-07-04 04:40:04.0000000,M&O MS Forms
M-000468,M037,M037-ZN03,07/01/2021 12:00:00 AM,AM,2021,7,Jul,27,Parks,Highbridge Park,15,,15,,,33,Manhattan,M-12A,ZONE,true,2021-07-04 04:44:19.0000000,M&O MS Forms
M-000463,M037,M037-ZN03,06/30/2021 12:00:00 AM,AM,2021,6,Jun,27,BBP,Highbridge Park,45,,45,,,33,Manhattan,M-12A,ZONE,true,2021-07-04 04:42:18.0000000,M&O MS Forms
M-000470,M037,M037-ZN03,07/02/2021 12:00:00 AM,AM,2021,7,Jul,27,Parks,Highbridge Park,16,,16,,,33,Manhattan,M-12A,ZONE,true,2021-07-04 04:44:59.0000000,M&O MS Forms
M-000487,M037,M037-ZN03,07/04/2021 12:00:00 AM,AM,2021,7,Jul,28,Parks,Highbridge Park,32,,32,,,33,Manhattan,M-12A,ZONE,true,2021-07-10 05:18:30.0000000,M&O MS Forms
M-000554,M037,M037-ZN03,07/19/2021 12:00:00 AM,AM,2021,7,Jul,30,Parks,Highbridge Park,30,,30,,,33,Manhattan,M-12A,ZONE,true,2021-07-27 19:46:28.0000000,M&O MS Forms
M-000550,M037,M037-ZN03,07/18/2021 12:00:00 AM,AM,2021,7,Jul,30,Parks,Highbridge Park,14,,14,,,33,Manhattan,M-12A,ZONE,true,2021-07-27 19:43:02.0000000,M&O MS Forms
M-000534,M037,M037-ZN03,07/16/2021 12:00:00 AM,AM,2021,7,Jul,29,Parks,Highbridge Park,12,,12,,,33,Manhattan,M-12A,ZONE,true,2021-07-21 18:31:40.0000000,M&O MS Forms
M-000525,M037,M037-ZN03,07/14/2021 12:00:00 AM,AM,2021,7,Jul,29,BBP,Highbridge Park,75,,75,,,33,Manhattan,M-12A,ZONE,true,2021-07-21 18:27:16.0000000,M&O MS Forms
M-000528,M037,M037-ZN03,07/15/2021 12:00:00 AM,AM,2021,7,Jul,29,Parks,Highbridge Park,20,,20,,,33,Manhattan,M-12A,ZONE,true,2021-07-21 18:28:28.0000000,M&O MS Forms
M-000565,M037,M037-ZN03,07/22/2021 12:00:00 AM,AM,2021,7,Jul,30,Parks,Highbridge Park,30,,30,,,33,Manhattan,M-12A,ZONE,true,2021-07-27 19:50:43.0000000,M&O MS Forms
M-000570,M037,M037-ZN03,07/23/2021 12:00:00 AM,AM,2021,7,Jul,30,Parks,Highbridge Park,20,,20,,,33,Manhattan,M-12A,ZONE,true,2021-07-27 19:52:46.0000000,M&O MS Forms
M-000562,M037,M037-ZN03,07/27/2021 12:00:00 AM,AM,2021,7,Jul,31,BBP,Highbridge Park,52,,52,,,33,Manhattan,M-12A,ZONE,true,2021-07-27 19:49:31.0000000,M&O MS Forms
M-000557,M037,M037-ZN03,07/20/2021 12:00:00 AM,AM,2021,7,Jul,30,BBP,Highbridge Park,75,,75,,,33,Manhattan,M-12A,ZONE,true,2021-07-27 19:47:34.0000000,M&O MS Forms
M-000634,M037,M037-ZN03,08/04/2021 12:00:00 AM,AM,2021,8,Aug,32,BBP,Highbridge Park,80,,80,,,33,Manhattan,M-12A,ZONE,true,2021-08-09 08:22:02.0000000,M&O MS Forms
M-000629,M037,M037-ZN03,08/02/2021 12:00:00 AM,AM,2021,8,Aug,32,BBP,Highbridge Park,105,,105,,,33,Manhattan,M-12A,ZONE,true,2021-08-09 08:19:05.0000000,M&O MS Forms
M-000640,M037,M037-ZN03,08/06/2021 12:00:00 AM,AM,2021,8,Aug,32,Parks,Highbridge Park,9,,9,,,33,Manhattan,M-12A,ZONE,true,2021-08-09 08:24:39.0000000,M&O MS Forms
M-000623,M037,M037-ZN03,08/01/2021 12:00:00 AM,AM,2021,8,Aug,32,Parks,Highbridge Park,19,,19,,,33,Manhattan,M-12A,ZONE,true,2021-08-09 08:05:46.0000000,M&O MS Forms
M-000637,M037,M037-ZN03,08/05/2021 12:00:00 AM,AM,2021,8,Aug,32,Parks,Highbridge Park,11,,11,,,33,Manhattan,M-12A,ZONE,true,2021-08-09 08:23:28.0000000,M&O MS Forms
M-000626,M037,M037-ZN03,08/02/2021 12:00:00 AM,AM,2021,8,Aug,32,Parks,Highbridge Park,15,,15,,,33,Manhattan,M-12A,ZONE,true,2021-08-09 08:07:01.0000000,M&O MS Forms
M-000594,M037,M037-ZN03,07/27/2021 12:00:00 AM,AM,2021,7,Jul,31,BBP,Highbridge Park,200,,200,,,33,Manhattan,M-12A,ZONE,true,2021-07-29 21:47:01.0000000,M&O MS Forms
M-000661,M037,M037-ZN03,08/08/2021 12:00:00 AM,AM,2021,8,Aug,33,Parks,Highbridge Park,20,,20,,,33,Manhattan,M-12A,ZONE,true,2021-08-14 06:32:14.0000000,M&O MS Forms
M-000668,M037,M037-ZN03,08/10/2021 12:00:00 AM,AM,2021,8,Aug,33,BBP,Highbridge Park,90,,90,,,33,Manhattan,M-12A,ZONE,true,2021-08-14 06:36:02.0000000,M&O MS Forms
M-000665,M037,M037-ZN03,08/09/2021 12:00:00 AM,AM,2021,8,Aug,33,Parks,Highbridge Park,12,,12,,,33,Manhattan,M-12A,ZONE,true,2021-08-14 06:34:35.0000000,M&O MS Forms
M-000674,M037,M037-ZN03,08/12/2021 12:00:00 AM,AM,2021,8,Aug,33,Parks,Highbridge Park,15,,15,,,33,Manhattan,M-12A,ZONE,true,2021-08-14 06:40:46.0000000,M&O MS Forms
M-000671,M037,M037-ZN03,08/11/2021 12:00:00 AM,AM,2021,8,Aug,33,BBP,Highbridge Park,48,,48,,,33,Manhattan,M-12A,ZONE,true,2021-08-14 06:37:21.0000000,M&O MS Forms
M-000678,M037,M037-ZN03,08/13/2021 12:00:00 AM,AM,2021,8,Aug,33,Parks,Highbridge Park,14,,14,,,33,Manhattan,M-12A,ZONE,true,2021-08-14 06:42:27.0000000,M&O MS Forms
M-000218,M037,M037-ZN03,05/03/2021 12:00:00 AM,AM,2021,5,May,19,Parks,Highbridge Park,20,,20,,,33,Manhattan,M-12A,ZONE,true,2021-05-15 07:48:22.0000000,M&O MS Forms
M-000222,M037,M037-ZN03,05/11/2021 12:00:00 AM,PM,2021,5,May,20,BBP,Highbridge Park,57,,57,,,33,Manhattan,M-12A,ZONE,true,2021-05-15 07:50:00.0000000,M&O MS Forms
M-000231,M037,M037-ZN03,05/14/2021 12:00:00 AM,AM,2021,5,May,20,Parks,Highbridge Park,10,,10,,,33,Manhattan,M-12A,ZONE,true,2021-05-15 07:53:37.0000000,M&O MS Forms
M-000229,M037,M037-ZN03,05/13/2021 12:00:00 AM,AM,2021,5,May,20,BBP,Highbridge Park,38,,38,,,33,Manhattan,M-12A,ZONE,true,2021-05-15 07:52:54.0000000,M&O MS Forms
M-000225,M037,M037-ZN03,05/12/2021 12:00:00 AM,PM,2021,5,May,20,BBP,Highbridge Park,87,,87,,,33,Manhattan,M-12A,ZONE,true,2021-05-15 07:51:05.0000000,M&O MS Forms
M-000215,M037,M037-ZN03,05/09/2021 12:00:00 AM,AM,2021,5,May,20,Parks,Highbridge Park,19,,19,,,33,Manhattan,M-12A,ZONE,true,2021-05-15 07:47:11.0000000,M&O MS Forms
M-000194,M037,M037-ZN03,05/07/2021 12:00:00 AM,PM,2021,5,May,19,BBP,Highbridge Park,15,,15,,,33,Manhattan,M-12A,ZONE,true,2021-05-07 19:43:45.0000000,M&O MS Forms
M-000196,M037,M037-ZN03,05/07/2021 12:00:00 AM,AM,2021,5,May,19,Parks,Highbridge Park,17,,17,,,33,Manhattan,M-12A,ZONE,true,2021-05-07 19:46:09.0000000,M&O MS Forms
M-000190,M037,M037-ZN03,05/05/2021 12:00:00 AM,PM,2021,5,May,19,BBP,Highbridge Park,40,,40,,,33,Manhattan,M-12A,ZONE,true,2021-05-07 19:42:03.0000000,M&O MS Forms
M-000187,M037,M037-ZN03,05/04/2021 12:00:00 AM,PM,2021,5,May,19,BBP,Highbridge Park,90,,90,,,33,Manhattan,M-12A,ZONE,true,2021-05-07 19:40:35.0000000,M&O MS Forms
M-000185,M037,M037-ZN03,05/03/2021 12:00:00 AM,AM,2021,5,May,19,Parks,Highbridge Park,26,,26,,,33,Manhattan,M-12A,ZONE,true,2021-05-07 19:39:34.0000000,M&O MS Forms
M-000180,M037,M037-ZN03,05/02/2021 12:00:00 AM,AM,2021,5,May,19,Parks,Highbridge Park,15,,15,,,33,Manhattan,M-12A,ZONE,true,2021-05-07 19:37:12.0000000,M&O MS Forms
M-000179,M037,M037-ZN03,05/06/2021 12:00:00 AM,PM,2021,5,May,19,BBP,Highbridge Park,14,,14,,,33,Manhattan,M-12A,ZONE,true,2021-05-06 13:42:00.0000000,M&O MS Forms
M-000261,M037,M037-ZN03,05/18/2021 12:00:00 AM,AM,2021,5,May,21,Parks,Highbridge Park,19,,19,,,33,Manhattan,M-12A,ZONE,true,2021-05-21 20:28:13.0000000,M&O MS Forms
M-000257,M037,M037-ZN03,05/16/2021 12:00:00 AM,AM,2021,5,May,21,Parks,Highbridge Park,36,,36,,,33,Manhattan,M-12A,ZONE,true,2021-05-21 18:26:50.0000000,M&O MS Forms
M-000269,M037,M037-ZN03,05/20/2021 12:00:00 AM,PM,2021,5,May,21,BBP,Highbridge Park,152,,152,,,33,Manhattan,M-12A,ZONE,true,2021-05-21 20:32:14.0000000,M&O MS Forms
M-000265,M037,M037-ZN03,05/19/2021 12:00:00 AM,PM,2021,5,May,21,BBP,Highbridge Park,103,,103,,,33,Manhattan,M-12A,ZONE,true,2021-05-21 20:30:02.0000000,M&O MS Forms
M-000271,M037,M037-ZN03,05/21/2021 12:00:00 AM,AM,2021,5,May,21,Parks,Highbridge Park,14,,14,,,33,Manhattan,M-12A,ZONE,true,2021-05-21 20:33:22.0000000,M&O MS Forms
M-000304,M037,M037-ZN03,05/25/2021 12:00:00 AM,AM,2021,5,May,22,Parks,Highbridge Park,30,,30,,,33,Manhattan,M-12A,ZONE,true,2021-05-29 08:49:15.0000000,M&O MS Forms
M-000298,M037,M037-ZN03,05/24/2021 12:00:00 AM,AM,2021,5,May,22,Parks,Highbridge Park,9,,9,,,33,Manhattan,M-12A,ZONE,true,2021-05-29 08:46:06.0000000,M&O MS Forms
M-000296,M037,M037-ZN03,05/23/2021 12:00:00 AM,AM,2021,5,May,22,Parks,Highbridge Park,29,,29,,,33,Manhattan,M-12A,ZONE,true,2021-05-29 08:45:11.0000000,M&O MS Forms
M-000358,M037,M037-ZN03,06/03/2021 12:00:00 AM,AM,2021,6,Jun,23,Parks,Highbridge Park,20,,20,,,33,Manhattan,M-12A,ZONE,true,2021-06-05 09:02:19.0000000,M&O MS Forms
M-000354,M037,M037-ZN03,06/02/2021 12:00:00 AM,AM,2021,6,Jun,23,BBP,Highbridge Park,58,,58,,,33,Manhattan,M-12A,ZONE,true,2021-06-05 09:00:36.0000000,M&O MS Forms
M-000346,M037,M037-ZN03,05/30/2021 12:00:00 AM,AM,2021,5,May,23,Parks,Highbridge Park,6,,6,,,33,Manhattan,M-12A,ZONE,true,2021-06-05 08:57:19.0000000,M&O MS Forms
M-000383,M037,M037-ZN03,06/07/2021 12:00:00 AM,AM,2021,6,Jun,24,Parks,Highbridge Park,29,,29,,,33,Manhattan,M-12A,ZONE,true,2021-06-11 17:39:10.0000000,M&O MS Forms
M-000313,M037,M037-ZN03,05/28/2021 12:00:00 AM,AM,2021,5,May,22,Parks,Highbridge Park,15,,15,,,33,Manhattan,M-12A,ZONE,true,2021-05-29 08:53:59.0000000,M&O MS Forms
M-000309,M037,M037-ZN03,05/27/2021 12:00:00 AM,AM,2021,5,May,22,Parks,Highbridge Park,19,,19,,,33,Manhattan,M-12A,ZONE,true,2021-05-29 08:51:56.0000000,M&O MS Forms
M-000306,M037,M037-ZN03,05/26/2021 12:00:00 AM,AM,2021,5,May,22,Parks,Highbridge Park,27,,27,,,33,Manhattan,M-12A,ZONE,true,2021-05-29 08:50:18.0000000,M&O MS Forms
M-000361,M037,M037-ZN03,06/04/2021 12:00:00 AM,AM,2021,6,Jun,23,Parks,Highbridge Park,26,,26,,,33,Manhattan,M-12A,ZONE,true,2021-06-05 09:03:47.0000000,M&O MS Forms
M-000350,M037,M037-ZN03,06/01/2021 12:00:00 AM,AM,2021,6,Jun,23,BBP,Highbridge Park,96,,96,,,33,Manhattan,M-12A,ZONE,true,2021-06-05 08:58:42.0000000,M&O MS Forms
M-000348,M037,M037-ZN03,05/31/2021 12:00:00 AM,AM,2021,5,May,23,Parks,Highbridge Park,4,,4,,,33,Manhattan,M-12A,ZONE,true,2021-06-05 08:58:00.0000000,M&O MS Forms
M-000433,M037,M037-ZN03,06/23/2021 12:00:00 AM,AM,2021,6,Jun,26,BBP,Highbridge Park,80,,80,,,33,Manhattan,M-12A,ZONE,true,2021-06-25 19:58:31.0000000,M&O MS Forms
M-000436,M037,M037-ZN03,06/24/2021 12:00:00 AM,AM,2021,6,Jun,26,Parks,Highbridge Park,20,,20,,,33,Manhattan,M-12A,ZONE,true,2021-06-25 19:59:32.0000000,M&O MS Forms
M-000440,M037,M037-ZN03,06/25/2021 12:00:00 AM,AM,2021,6,Jun,26,Parks,Highbridge Park,15,,15,,,33,Manhattan,M-12A,ZONE,true,2021-06-25 20:00:55.0000000,M&O MS Forms
M-000430,M037,M037-ZN03,06/22/2021 12:00:00 AM,AM,2021,6,Jun,26,BBP,Highbridge Park,51,,51,,,33,Manhattan,M-12A,ZONE,true,2021-06-25 19:57:25.0000000,M&O MS Forms
M-004778,M037,M037-ZN06,11/01/2022 12:00:00 AM,AM,2022,11,Nov,45,Parks,Highbridge Park,20,,20,,,34,Manhattan,M-12A,ZONE,true,2022-11-05 14:04:42.0000000,M&O MS Forms
M-004795,M037,M037-ZN06,11/03/2022 12:00:00 AM,AM,2022,11,Nov,45,Parks,Highbridge Park,12,,12,,,34,Manhattan,M-12A,ZONE,true,2022-11-05 14:09:41.0000000,M&O MS Forms
M-004804,M037,M037-ZN06,11/04/2022 12:00:00 AM,AM,2022,11,Nov,45,Parks,Highbridge Park,14,,14,,,34,Manhattan,M-12A,ZONE,true,2022-11-05 14:12:16.0000000,M&O MS Forms
M-004856,M037,M037-ZN06,11/06/2022 12:00:00 AM,AM,2022,11,Nov,46,Parks,Highbridge Park,23,,23,,,34,Manhattan,M-12A,ZONE,true,2022-11-13 10:06:23.0000000,M&O MS Forms
M-004883,M037,M037-ZN06,11/09/2022 12:00:00 AM,AM,2022,11,Nov,46,Parks,Highbridge Park,10,,10,,,34,Manhattan,M-12A,ZONE,true,2022-11-13 10:15:41.0000000,M&O MS Forms
M-004865,M037,M037-ZN06,11/07/2022 12:00:00 AM,AM,2022,11,Nov,46,Parks,Highbridge Park,20,,20,,,34,Manhattan,M-12A,ZONE,true,2022-11-13 10:09:54.0000000,M&O MS Forms
M-004874,M037,M037-ZN06,11/08/2022 12:00:00 AM,AM,2022,11,Nov,46,Parks,Highbridge Park,20,,20,,,34,Manhattan,M-12A,ZONE,true,2022-11-13 10:12:41.0000000,M&O MS Forms
M-004891,M037,M037-ZN06,11/10/2022 12:00:00 AM,AM,2022,11,Nov,46,Parks,Highbridge Park,12,,12,,,34,Manhattan,M-12A,ZONE,true,2022-11-13 10:19:28.0000000,M&O MS Forms
M-004900,M037,M037-ZN06,11/11/2022 12:00:00 AM,AM,2022,11,Nov,46,Parks,Highbridge Park,14,,14,,,34,Manhattan,M-12A,ZONE,true,2022-11-13 10:22:05.0000000,M&O MS Forms
M-004816,M037,M037-ZN06,11/07/2022 12:00:00 AM,AM,2022,11,Nov,46,Parks,Highbridge Park,15,,15,,,34,Manhattan,M-12A,ZONE,true,2022-11-07 06:47:47.0000000,M&O MS Forms
M-004925,M037,M037-ZN06,11/13/2022 12:00:00 AM,AM,2022,11,Nov,47,Parks,Highbridge Park,2,,2,,,34,Manhattan,M-12A,ZONE,true,2022-11-15 05:29:14.0000000,M&O MS Forms
M-004909,M037,M037-ZN06,11/12/2022 12:00:00 AM,AM,2022,11,Nov,46,Parks,Highbridge Park,15,,15,,,34,Manhattan,M-12A,ZONE,true,2022-11-13 10:25:02.0000000,M&O MS Forms
M-004955,M037,M037-ZN06,11/16/2022 12:00:00 AM,AM,2022,11,Nov,47,Parks,Highbridge Park,9,,9,,,34,Manhattan,M-12A,ZONE,true,2022-11-17 06:57:23.0000000,M&O MS Forms
M-004935,M037,M037-ZN06,11/14/2022 12:00:00 AM,AM,2022,11,Nov,47,Parks,Highbridge Park,10,,10,,,34,Manhattan,M-12A,ZONE,true,2022-11-16 07:10:00.0000000,M&O MS Forms
M-004965,M037,M037-ZN06,11/18/2022 12:00:00 AM,AM,2022,11,Nov,47,Parks,Highbridge Park,7,,7,,,34,Manhattan,M-12A,ZONE,true,2022-11-21 05:52:29.0000000,M&O MS Forms
M-004945,M037,M037-ZN06,11/15/2022 12:00:00 AM,AM,2022,11,Nov,47,Parks,Highbridge Park,15,,15,,,34,Manhattan,M-12A,ZONE,true,2022-11-17 06:52:55.0000000,M&O MS Forms
M-004946,M037,M037-ZN06,11/15/2022 12:00:00 AM,AM,2022,11,Nov,47,Parks,Highbridge Park,15,,15,,,34,Manhattan,M-12A,ZONE,true,2022-11-17 06:53:01.0000000,M&O MS Forms
M-005011,M037,M037-ZN06,11/23/2022 12:00:00 AM,AM,2022,11,Nov,48,Parks,Highbridge Park,12,,12,,,34,Manhattan,M-12A,ZONE,true,2022-11-27 11:02:34.0000000,M&O MS Forms
M-005002,M037,M037-ZN06,11/22/2022 12:00:00 AM,AM,2022,11,Nov,48,Parks,Highbridge Park,15,,15,,,34,Manhattan,M-12A,ZONE,true,2022-11-27 10:59:49.0000000,M&O MS Forms
M-005020,M037,M037-ZN06,11/24/2022 12:00:00 AM,AM,2022,11,Nov,48,Parks,Highbridge Park,15,,15,,,34,Manhattan,M-12A,ZONE,true,2022-11-27 11:06:42.0000000,M&O MS Forms
M-005029,M037,M037-ZN06,11/25/2022 12:00:00 AM,AM,2022,11,Nov,48,Parks,Highbridge Park,20,,20,,,34,Manhattan,M-12A,ZONE,true,2022-11-27 11:09:54.0000000,M&O MS Forms
M-004974,M037,M037-ZN06,11/19/2022 12:00:00 AM,AM,2022,11,Nov,47,Parks,Highbridge Park,3,,3,,,34,Manhattan,M-12A,ZONE,true,2022-11-21 05:55:43.0000000,M&O MS Forms
M-004983,M037,M037-ZN06,11/20/2022 12:00:00 AM,AM,2022,11,Nov,48,Parks,Highbridge Park,13,,13,,,34,Manhattan,M-12A,ZONE,true,2022-11-21 06:01:19.0000000,M&O MS Forms
M-004993,M037,M037-ZN06,11/21/2022 12:00:00 AM,AM,2022,11,Nov,48,Parks,Highbridge Park,10,,10,,,34,Manhattan,M-12A,ZONE,true,2022-11-27 10:56:02.0000000,M&O MS Forms
M-005767,M037,M037-ZN06,02/14/2023 12:00:00 AM,AM,2023,2,Feb,7,Parks,Highbridge Park,8,,8,,,34,Manhattan,M-12A,ZONE,true,2023-02-15 16:28:45.0000000,M&O MS Forms
M-005390,M037,M037-ZN06,01/05/2023 12:00:00 AM,AM,2023,1,Jan,1,Parks,Highbridge Park,9,,9,,,34,Manhattan,M-12A,ZONE,true,2023-01-08 12:19:09.0000000,M&O MS Forms
M-005381,M037,M037-ZN06,01/04/2023 12:00:00 AM,AM,2023,1,Jan,1,Parks,Highbridge Park,9,,9,,,34,Manhattan,M-12A,ZONE,true,2023-01-08 12:13:59.0000000,M&O MS Forms
M-005370,M037,M037-ZN06,01/03/2023 12:00:00 AM,AM,2023,1,Jan,1,Parks,Highbridge Park,13,,13,,,34,Manhattan,M-12A,ZONE,true,2023-01-03 17:15:58.0000000,M&O MS Forms
M-005361,M037,M037-ZN06,01/02/2023 12:00:00 AM,AM,2023,1,Jan,1,Parks,Highbridge Park,4,,4,,,34,Manhattan,M-12A,ZONE,true,2023-01-03 17:12:45.0000000,M&O MS Forms
M-005496,M037,M037-ZN06,01/16/2023 12:00:00 AM,AM,2023,1,Jan,3,Parks,Highbridge Park,10,,10,,,34,Manhattan,M-12A,ZONE,true,2023-01-23 16:03:08.0000000,M&O MS Forms
M-005341,M037,M037-ZN06,12/31/2022 12:00:00 AM,AM,2022,12,Dec,53,Parks,Highbridge Park,22,,22,,,34,Manhattan,M-12A,ZONE,true,2023-01-01 10:33:12.0000000,M&O MS Forms
M-005352,M037,M037-ZN06,01/01/2023 12:00:00 AM,AM,2023,1,Jan,1,Parks,Highbridge Park,10,,10,,,34,Manhattan,M-12A,ZONE,true,2023-01-03 15:23:36.0000000,M&O MS Forms
M-005526,M037,M037-ZN06,01/19/2023 12:00:00 AM,AM,2023,1,Jan,3,Parks,Highbridge Park,13,,13,,,34,Manhattan,M-12A,ZONE,true,2023-01-23 16:29:39.0000000,M&O MS Forms
M-005517,M037,M037-ZN06,01/18/2023 12:00:00 AM,AM,2023,1,Jan,3,Parks,Highbridge Park,11,,11,,,34,Manhattan,M-12A,ZONE,true,2023-01-23 16:15:31.0000000,M&O MS Forms
M-005506,M037,M037-ZN06,01/17/2023 12:00:00 AM,AM,2023,1,Jan,3,Parks,Highbridge Park,15,,15,,,34,Manhattan,M-12A,ZONE,true,2023-01-23 16:11:31.0000000,M&O MS Forms
M-005553,M037,M037-ZN06,01/22/2023 12:00:00 AM,AM,2023,1,Jan,4,Parks,Highbridge Park,7,,7,,,34,Manhattan,M-12A,ZONE,true,2023-01-23 16:47:24.0000000,M&O MS Forms
M-005561,M037,M037-ZN06,01/23/2023 12:00:00 AM,AM,2023,1,Jan,4,Parks,Highbridge Park,10,,10,,,34,Manhattan,M-12A,ZONE,true,2023-01-23 16:49:50.0000000,M&O MS Forms
M-005544,M037,M037-ZN06,01/21/2023 12:00:00 AM,AM,2023,1,Jan,3,Parks,Highbridge Park,16,,16,,,34,Manhattan,M-12A,ZONE,true,2023-01-23 16:44:28.0000000,M&O MS Forms
M-005535,M037,M037-ZN06,01/20/2023 12:00:00 AM,AM,2023,1,Jan,3,Parks,Highbridge Park,14,,14,,,34,Manhattan,M-12A,ZONE,true,2023-01-23 16:32:51.0000000,M&O MS Forms
M-005671,M037,M037-ZN06,02/03/2023 12:00:00 AM,AM,2023,2,Feb,5,Parks,Highbridge Park,6,,6,,,34,Manhattan,M-12A,ZONE,true,2023-02-03 17:15:31.0000000,M&O MS Forms
M-005661,M037,M037-ZN06,02/02/2023 12:00:00 AM,AM,2023,2,Feb,5,Parks,Highbridge Park,5,,5,,,34,Manhattan,M-12A,ZONE,true,2023-02-02 15:41:48.0000000,M&O MS Forms
M-005651,M037,M037-ZN06,02/01/2023 12:00:00 AM,AM,2023,2,Feb,5,Parks,Highbridge Park,3,,3,,,34,Manhattan,M-12A,ZONE,true,2023-02-01 15:52:29.0000000,M&O MS Forms
M-005680,M037,M037-ZN06,02/04/2023 12:00:00 AM,AM,2023,2,Feb,5,Parks,Highbridge Park,2,,2,,,34,Manhattan,M-12A,ZONE,true,2023-02-05 11:31:07.0000000,M&O MS Forms
M-005691,M037,M037-ZN06,02/06/2023 12:00:00 AM,AM,2023,2,Feb,6,Parks,Highbridge Park,4,,4,,,34,Manhattan,M-12A,ZONE,true,2023-02-07 17:26:31.0000000,M&O MS Forms
M-005709,M037,M037-ZN06,02/08/2023 12:00:00 AM,AM,2023,2,Feb,6,Parks,Highbridge Park,9,,9,,,34,Manhattan,M-12A,ZONE,true,2023-02-08 16:01:25.0000000,M&O MS Forms
M-005710,M037,M037-ZN06,02/08/2023 12:00:00 AM,AM,2023,2,Feb,6,Parks,Highbridge Park,9,,9,,,34,Manhattan,M-12A,ZONE,true,2023-02-08 16:01:25.0000000,M&O MS Forms
M-005700,M037,M037-ZN06,02/07/2023 12:00:00 AM,AM,2023,2,Feb,6,Parks,Highbridge Park,6,,6,,,34,Manhattan,M-12A,ZONE,true,2023-02-07 17:30:44.0000000,M&O MS Forms
M-005721,M037,M037-ZN06,02/09/2023 12:00:00 AM,AM,2023,2,Feb,6,Parks,Highbridge Park,10,,10,,,34,Manhattan,M-12A,ZONE,true,2023-02-09 15:43:15.0000000,M&O MS Forms
M-005730,M037,M037-ZN06,02/10/2023 12:00:00 AM,AM,2023,2,Feb,6,Parks,Highbridge Park,15,,15,,,34,Manhattan,M-12A,ZONE,true,2023-02-11 17:49:41.0000000,M&O MS Forms
M-005578,M037,M037-ZN06,01/25/2023 12:00:00 AM,AM,2023,1,Jan,4,Parks,Highbridge Park,5,,5,,,34,Manhattan,M-12A,ZONE,true,2023-01-25 17:10:14.0000000,M&O MS Forms
M-005569,M037,M037-ZN06,01/24/2023 12:00:00 AM,AM,2023,1,Jan,4,Parks,Highbridge Park,15,,15,,,34,Manhattan,M-12A,ZONE,true,2023-01-24 17:13:49.0000000,M&O MS Forms
M-005588,M037,M037-ZN06,01/26/2023 12:00:00 AM,AM,2023,1,Jan,4,Parks,Highbridge Park,11,,11,,,34,Manhattan,M-12A,ZONE,true,2023-01-26 17:37:20.0000000,M&O MS Forms
M-005598,M037,M037-ZN06,01/27/2023 12:00:00 AM,AM,2023,1,Jan,4,Parks,Highbridge Park,13,,13,,,34,Manhattan,M-12A,ZONE,true,2023-01-30 16:03:58.0000000,M&O MS Forms
M-005607,M037,M037-ZN06,01/28/2023 12:00:00 AM,AM,2023,1,Jan,4,Parks,Highbridge Park,12,,12,,,34,Manhattan,M-12A,ZONE,true,2023-01-30 16:11:16.0000000,M&O MS Forms
M-005615,M037,M037-ZN06,01/29/2023 12:00:00 AM,AM,2023,1,Jan,5,Parks,Highbridge Park,2,,2,,,34,Manhattan,M-12A,ZONE,true,2023-01-30 16:19:30.0000000,M&O MS Forms
M-005624,M037,M037-ZN06,01/30/2023 12:00:00 AM,AM,2023,1,Jan,5,Parks,Highbridge Park,3,,3,,,34,Manhattan,M-12A,ZONE,true,2023-01-30 16:23:07.0000000,M&O MS Forms
M-005625,M037,M037-ZN06,01/30/2023 12:00:00 AM,AM,2023,1,Jan,5,Parks,Highbridge Park,3,,3,,,34,Manhattan,M-12A,ZONE,true,2023-01-30 16:23:08.0000000,M&O MS Forms
M-005641,M037,M037-ZN06,01/31/2023 12:00:00 AM,AM,2023,1,Jan,5,Parks,Highbridge Park,4,,4,,,34,Manhattan,M-12A,ZONE,true,2023-01-31 15:45:34.0000000,M&O MS Forms
M-004201,M037,M037-ZN06,09/01/2022 12:00:00 AM,AM,2022,9,Sep,36,Parks,Highbridge Park,7,,7,,,34,Manhattan,M-12A,ZONE,true,2022-09-06 14:30:44.0000000,M&O MS Forms
M-004209,M037,M037-ZN06,09/02/2022 12:00:00 AM,AM,2022,9,Sep,36,Parks,Highbridge Park,5,,5,,,34,Manhattan,M-12A,ZONE,true,2022-09-06 14:33:15.0000000,M&O MS Forms
M-004218,M037,M037-ZN06,09/03/2022 12:00:00 AM,AM,2022,9,Sep,36,Parks,Highbridge Park,10,,10,,,34,Manhattan,M-12A,ZONE,true,2022-09-06 14:36:06.0000000,M&O MS Forms
M-004227,M037,M037-ZN06,09/04/2022 12:00:00 AM,AM,2022,9,Sep,37,Parks,Highbridge Park,10,,10,,,34,Manhattan,M-12A,ZONE,true,2022-09-06 14:39:24.0000000,M&O MS Forms
M-004247,M037,M037-ZN06,09/04/2022 12:00:00 AM,AM,2022,9,Sep,37,Parks,Highbridge Park,10,,10,,,34,Manhattan,M-12A,ZONE,true,2022-09-09 05:28:38.0000000,M&O MS Forms
M-004237,M037,M037-ZN06,09/05/2022 12:00:00 AM,AM,2022,9,Sep,37,Parks,Highbridge Park,7,,7,,,34,Manhattan,M-12A,ZONE,true,2022-09-06 14:44:28.0000000,M&O MS Forms
M-004256,M037,M037-ZN06,09/05/2022 12:00:00 AM,AM,2022,9,Sep,37,Parks,Highbridge Park,7,,7,,,34,Manhattan,M-12A,ZONE,true,2022-09-09 05:33:11.0000000,M&O MS Forms
M-004274,M037,M037-ZN06,09/07/2022 12:00:00 AM,AM,2022,9,Sep,37,Parks,Highbridge Park,9,,9,,,34,Manhattan,M-12A,ZONE,true,2022-09-09 05:41:20.0000000,M&O MS Forms
M-004265,M037,M037-ZN06,09/06/2022 12:00:00 AM,AM,2022,9,Sep,37,Parks,Highbridge Park,15,,15,,,34,Manhattan,M-12A,ZONE,true,2022-09-09 05:38:06.0000000,M&O MS Forms
M-004283,M037,M037-ZN06,09/08/2022 12:00:00 AM,AM,2022,9,Sep,37,Parks,Highbridge Park,10,,10,,,34,Manhattan,M-12A,ZONE,true,2022-09-09 06:19:42.0000000,M&O MS Forms
M-004293,M037,M037-ZN06,09/10/2022 12:00:00 AM,AM,2022,9,Sep,37,Parks,Highbridge Park,17,,17,,,34,Manhattan,M-12A,ZONE,true,2022-09-12 06:07:42.0000000,M&O MS Forms
M-004302,M037,M037-ZN06,09/11/2022 12:00:00 AM,AM,2022,9,Sep,38,Parks,Highbridge Park,9,,9,,,34,Manhattan,M-12A,ZONE,true,2022-09-12 06:10:48.0000000,M&O MS Forms
M-004323,M037,M037-ZN06,09/12/2022 12:00:00 AM,AM,2022,9,Sep,38,Parks,Highbridge Park,11,,11,,,34,Manhattan,M-12A,ZONE,true,2022-09-13 18:05:29.0000000,M&O MS Forms
M-004314,M037,M037-ZN06,09/11/2022 12:00:00 AM,AM,2022,9,Sep,38,Parks,Highbridge Park,9,,9,,,34,Manhattan,M-12A,ZONE,true,2022-09-13 18:01:58.0000000,M&O MS Forms
M-004111,M037,M037-ZN06,08/23/2022 12:00:00 AM,AM,2022,8,Aug,35,Parks,Highbridge Park,3,,3,,,34,Manhattan,M-12A,ZONE,true,2022-08-28 17:20:43.0000000,M&O MS Forms
M-004119,M037,M037-ZN06,08/24/2022 12:00:00 AM,AM,2022,8,Aug,35,Parks,Highbridge Park,2,,2,,,34,Manhattan,M-12A,ZONE,true,2022-08-28 17:23:11.0000000,M&O MS Forms
M-004128,M037,M037-ZN06,08/25/2022 12:00:00 AM,AM,2022,8,Aug,35,Parks,Highbridge Park,12,,12,,,34,Manhattan,M-12A,ZONE,true,2022-08-28 17:28:34.0000000,M&O MS Forms
M-004145,M037,M037-ZN06,08/27/2022 12:00:00 AM,AM,2022,8,Aug,35,Parks,Highbridge Park,4,,4,,,34,Manhattan,M-12A,ZONE,true,2022-08-28 17:33:10.0000000,M&O MS Forms
M-004136,M037,M037-ZN06,08/26/2022 12:00:00 AM,AM,2022,8,Aug,35,Parks,Highbridge Park,7,,7,,,34,Manhattan,M-12A,ZONE,true,2022-08-28 17:30:46.0000000,M&O MS Forms
M-004192,M037,M037-ZN06,08/31/2022 12:00:00 AM,AM,2022,8,Aug,36,Parks,Highbridge Park,9,,9,,,34,Manhattan,M-12A,ZONE,true,2022-09-06 14:28:11.0000000,M&O MS Forms
M-004084,M037,M037-ZN06,08/20/2022 12:00:00 AM,AM,2022,8,Aug,34,Parks,Highbridge Park,13,,13,,,34,Manhattan,M-12A,ZONE,true,2022-08-28 17:12:10.0000000,M&O MS Forms
M-004067,M037,M037-ZN06,08/19/2022 12:00:00 AM,AM,2022,8,Aug,34,Parks,Highbridge Park,25,,25,,,34,Manhattan,M-12A,ZONE,true,2022-08-20 12:05:19.0000000,M&O MS Forms
M-004093,M037,M037-ZN06,08/21/2022 12:00:00 AM,AM,2022,8,Aug,35,Parks,Highbridge Park,10,,10,,,34,Manhattan,M-12A,ZONE,true,2022-08-28 17:15:39.0000000,M&O MS Forms
M-004102,M037,M037-ZN06,08/22/2022 12:00:00 AM,AM,2022,8,Aug,35,Parks,Highbridge Park,6,,6,,,34,Manhattan,M-12A,ZONE,true,2022-08-28 17:18:12.0000000,M&O MS Forms
M-004055,M037,M037-ZN06,08/18/2022 12:00:00 AM,AM,2022,8,Aug,34,Parks,Highbridge Park,18,,18,,,34,Manhattan,M-12A,ZONE,true,2022-08-18 14:48:21.0000000,M&O MS Forms
M-004046,M037,M037-ZN06,08/17/2022 12:00:00 AM,AM,2022,8,Aug,34,Parks,Highbridge Park,14,,14,,,34,Manhattan,M-12A,ZONE,true,2022-08-18 14:45:39.0000000,M&O MS Forms
M-004037,M037,M037-ZN06,08/16/2022 12:00:00 AM,AM,2022,8,Aug,34,Parks,Highbridge Park,19,,19,,,34,Manhattan,M-12A,ZONE,true,2022-08-18 14:43:10.0000000,M&O MS Forms
M-003972,M037,M037-ZN06,08/11/2022 12:00:00 AM,AM,2022,8,Aug,33,Parks,Highbridge Park,8,,8,,,34,Manhattan,M-12A,ZONE,true,2022-08-11 16:13:26.0000000,M&O MS Forms
M-003963,M037,M037-ZN06,08/10/2022 12:00:00 AM,AM,2022,8,Aug,33,Parks,Highbridge Park,15,,15,,,34,Manhattan,M-12A,ZONE,true,2022-08-11 08:48:49.0000000,M&O MS Forms
M-003992,M037,M037-ZN06,08/12/2022 12:00:00 AM,AM,2022,8,Aug,33,Parks,Highbridge Park,2,,2,,,34,Manhattan,M-12A,ZONE,true,2022-08-15 10:07:02.0000000,M&O MS Forms
M-004000,M037,M037-ZN06,08/13/2022 12:00:00 AM,AM,2022,8,Aug,33,Parks,Highbridge Park,12,,12,,,34,Manhattan,M-12A,ZONE,true,2022-08-15 10:09:33.0000000,M&O MS Forms
M-004015,M037,M037-ZN06,08/14/2022 12:00:00 AM,AM,2022,8,Aug,34,Parks,Highbridge Park,15,,15,,,34,Manhattan,M-12A,ZONE,true,2022-08-18 14:03:46.0000000,M&O MS Forms
M-004024,M037,M037-ZN06,08/15/2022 12:00:00 AM,AM,2022,8,Aug,34,Parks,Highbridge Park,10,,10,,,34,Manhattan,M-12A,ZONE,true,2022-08-18 14:23:16.0000000,M&O MS Forms
M-004033,M037,M037-ZN06,08/16/2022 12:00:00 AM,AM,2022,8,Aug,34,Parks,Highbridge Park,19,,19,,,34,Manhattan,M-12A,ZONE,true,2022-08-18 14:27:49.0000000,M&O MS Forms
M-003937,M037,M037-ZN06,08/07/2022 12:00:00 AM,AM,2022,8,Aug,33,Parks,Highbridge Park,119,,119,,,34,Manhattan,M-12A,ZONE,true,2022-08-09 08:56:56.0000000,M&O MS Forms
M-003954,M037,M037-ZN06,08/09/2022 12:00:00 AM,AM,2022,8,Aug,33,Parks,Highbridge Park,125,,125,,,34,Manhattan,M-12A,ZONE,true,2022-08-09 18:26:49.0000000,M&O MS Forms
M-003945,M037,M037-ZN06,08/08/2022 12:00:00 AM,AM,2022,8,Aug,33,Parks,Highbridge Park,125,,125,,,34,Manhattan,M-12A,ZONE,true,2022-08-09 08:59:07.0000000,M&O MS Forms
M-003919,M037,M037-ZN06,08/05/2022 12:00:00 AM,AM,2022,8,Aug,32,Parks,Highbridge Park,2,,2,,,34,Manhattan,M-12A,ZONE,true,2022-08-09 08:50:59.0000000,M&O MS Forms
M-002291,M037,M037-ZN03,02/20/2022 12:00:00 AM,AM,2022,2,Feb,9,Parks,Highbridge Park,4,,4,,,33,Manhattan,M-12A,ZONE,true,2022-02-21 15:13:16.0000000,M&O MS Forms
M-002277,M037,M037-ZN03,02/18/2022 12:00:00 AM,AM,2022,2,Feb,8,Parks,Highbridge Park,10,,10,,,33,Manhattan,M-12A,ZONE,true,2022-02-21 15:08:51.0000000,M&O MS Forms
M-002268,M037,M037-ZN03,02/17/2022 12:00:00 AM,AM,2022,2,Feb,8,Parks,Highbridge Park,2,,2,,,33,Manhattan,M-12A,ZONE,true,2022-02-21 15:05:31.0000000,M&O MS Forms
M-002250,M037,M037-ZN03,02/15/2022 12:00:00 AM,AM,2022,2,Feb,8,Parks,Highbridge Park,12,,12,,,33,Manhattan,M-12A,ZONE,true,2022-02-21 14:59:50.0000000,M&O MS Forms
M-002259,M037,M037-ZN03,02/16/2022 12:00:00 AM,AM,2022,2,Feb,8,Parks,Highbridge Park,3,,3,,,33,Manhattan,M-12A,ZONE,true,2022-02-21 15:02:55.0000000,M&O MS Forms
M-002240,M037,M037-ZN03,02/14/2022 12:00:00 AM,AM,2022,2,Feb,8,Parks,Highbridge Park,9,,9,,,33,Manhattan,M-12A,ZONE,true,2022-02-21 14:55:41.0000000,M&O MS Forms
M-002231,M037,M037-ZN03,02/13/2022 12:00:00 AM,AM,2022,2,Feb,8,Parks,Highbridge Park,11,,11,,,33,Manhattan,M-12A,ZONE,true,2022-02-21 14:53:04.0000000,M&O MS Forms
M-002217,M037,M037-ZN03,02/12/2022 12:00:00 AM,AM,2022,2,Feb,7,Parks,Highbridge Park,9,,9,,,33,Manhattan,M-12A,ZONE,true,2022-02-14 14:07:10.0000000,M&O MS Forms
M-002174,M037,M037-ZN03,02/06/2022 12:00:00 AM,AM,2022,2,Feb,7,Parks,Highbridge Park,3,,3,,,33,Manhattan,M-12A,ZONE,true,2022-02-10 08:46:22.0000000,M&O MS Forms
M-002188,M037,M037-ZN03,02/09/2022 12:00:00 AM,AM,2022,2,Feb,7,Parks,Highbridge Park,2,,2,,,33,Manhattan,M-12A,ZONE,true,2022-02-11 09:21:05.0000000,M&O MS Forms
M-002200,M037,M037-ZN03,02/10/2022 12:00:00 AM,AM,2022,2,Feb,7,Parks,Highbridge Park,4,,4,,,33,Manhattan,M-12A,ZONE,true,2022-02-14 14:01:44.0000000,M&O MS Forms
M-002762,M037,M037-ZN03,04/07/2022 12:00:00 AM,AM,2022,4,Apr,15,Parks,Highbridge Park,12,,12,,,33,Manhattan,M-12A,ZONE,true,2022-04-17 16:19:24.0000000,M&O MS Forms
M-002770,M037,M037-ZN03,04/08/2022 12:00:00 AM,AM,2022,4,Apr,15,Parks,Highbridge Park,8,,8,,,33,Manhattan,M-12A,ZONE,true,2022-04-17 16:22:02.0000000,M&O MS Forms
M-002738,M037,M037-ZN03,04/05/2022 12:00:00 AM,AM,2022,4,Apr,15,Parks,Highbridge Park,10,,10,,,33,Manhattan,M-12A,ZONE,true,2022-04-07 14:04:27.0000000,M&O MS Forms
M-002746,M037,M037-ZN03,04/06/2022 12:00:00 AM,AM,2022,4,Apr,15,Parks,Highbridge Park,9,,9,,,33,Manhattan,M-12A,ZONE,true,2022-04-07 14:08:27.0000000,M&O MS Forms
M-002729,M037,M037-ZN03,04/04/2022 12:00:00 AM,AM,2022,4,Apr,15,Parks,Highbridge Park,8,,8,,,33,Manhattan,M-12A,ZONE,true,2022-04-07 14:00:54.0000000,M&O MS Forms
M-002720,M037,M037-ZN03,04/03/2022 12:00:00 AM,AM,2022,4,Apr,15,Parks,Highbridge Park,6,,6,,,33,Manhattan,M-12A,ZONE,true,2022-04-07 13:57:24.0000000,M&O MS Forms
M-002829,M037,M037-ZN03,04/15/2022 12:00:00 AM,AM,2022,4,Apr,16,Parks,Highbridge Park,10,,10,,,33,Manhattan,M-12A,ZONE,true,2022-04-17 16:46:09.0000000,M&O MS Forms
M-002839,M037,M037-ZN03,04/17/2022 12:00:00 AM,AM,2022,4,Apr,17,Parks,Highbridge Park,12,,12,,,33,Manhattan,M-12A,ZONE,true,2022-04-23 12:13:57.0000000,M&O MS Forms
M-002821,M037,M037-ZN03,04/14/2022 12:00:00 AM,AM,2022,4,Apr,16,Parks,Highbridge Park,30,,30,,,33,Manhattan,M-12A,ZONE,true,2022-04-17 16:43:09.0000000,M&O MS Forms
M-002812,M037,M037-ZN03,04/13/2022 12:00:00 AM,AM,2022,4,Apr,16,Parks,Highbridge Park,28,,28,,,33,Manhattan,M-12A,ZONE,true,2022-04-17 16:40:35.0000000,M&O MS Forms
M-002803,M037,M037-ZN03,04/12/2022 12:00:00 AM,AM,2022,4,Apr,16,Parks,Highbridge Park,25,,25,,,33,Manhattan,M-12A,ZONE,true,2022-04-17 16:36:31.0000000,M&O MS Forms
M-002794,M037,M037-ZN03,04/11/2022 12:00:00 AM,AM,2022,4,Apr,16,Parks,Highbridge Park,15,,15,,,33,Manhattan,M-12A,ZONE,true,2022-04-17 16:33:34.0000000,M&O MS Forms
M-002785,M037,M037-ZN03,04/10/2022 12:00:00 AM,AM,2022,4,Apr,16,Parks,Highbridge Park,12,,12,,,33,Manhattan,M-12A,ZONE,true,2022-04-17 16:30:27.0000000,M&O MS Forms
M-002777,M037,M037-ZN03,04/09/2022 12:00:00 AM,AM,2022,4,Apr,15,Parks,Highbridge Park,10,,10,,,33,Manhattan,M-12A,ZONE,true,2022-04-17 16:24:36.0000000,M&O MS Forms
M-002882,M037,M037-ZN03,04/22/2022 12:00:00 AM,AM,2022,4,Apr,17,Parks,Highbridge Park,23,,23,,,33,Manhattan,M-12A,ZONE,true,2022-04-23 12:29:34.0000000,M&O MS Forms
M-002873,M037,M037-ZN03,04/21/2022 12:00:00 AM,AM,2022,4,Apr,17,Parks,Highbridge Park,20,,20,,,33,Manhattan,M-12A,ZONE,true,2022-04-23 12:26:30.0000000,M&O MS Forms
M-002865,M037,M037-ZN03,04/20/2022 12:00:00 AM,AM,2022,4,Apr,17,Parks,Highbridge Park,17,,17,,,33,Manhattan,M-12A,ZONE,true,2022-04-23 12:23:43.0000000,M&O MS Forms
M-002856,M037,M037-ZN03,04/19/2022 12:00:00 AM,AM,2022,4,Apr,17,Parks,Highbridge Park,15,,15,,,33,Manhattan,M-12A,ZONE,true,2022-04-23 12:20:45.0000000,M&O MS Forms
M-002847,M037,M037-ZN03,04/18/2022 12:00:00 AM,AM,2022,4,Apr,17,Parks,Highbridge Park,10,,10,,,33,Manhattan,M-12A,ZONE,true,2022-04-23 12:17:16.0000000,M&O MS Forms
M-002958,M037,M037-ZN03,04/30/2022 12:00:00 AM,AM,2022,4,Apr,18,Parks,Highbridge Park,16,,16,,,33,Manhattan,M-12A,ZONE,true,2022-04-30 14:51:14.0000000,M&O MS Forms
M-002949,M037,M037-ZN03,04/29/2022 12:00:00 AM,AM,2022,4,Apr,18,Parks,Highbridge Park,12,,12,,,33,Manhattan,M-12A,ZONE,true,2022-04-30 14:35:33.0000000,M&O MS Forms
M-002940,M037,M037-ZN03,04/28/2022 12:00:00 AM,AM,2022,4,Apr,18,Parks,Highbridge Park,20,,20,,,33,Manhattan,M-12A,ZONE,true,2022-04-30 14:31:40.0000000,M&O MS Forms
M-002922,M037,M037-ZN03,04/26/2022 12:00:00 AM,AM,2022,4,Apr,18,Parks,Highbridge Park,25,,25,,,33,Manhattan,M-12A,ZONE,true,2022-04-30 14:09:37.0000000,M&O MS Forms
M-002931,M037,M037-ZN03,04/27/2022 12:00:00 AM,AM,2022,4,Apr,18,Parks,Highbridge Park,15,,15,,,33,Manhattan,M-12A,ZONE,true,2022-04-30 14:27:25.0000000,M&O MS Forms
M-002906,M037,M037-ZN03,04/24/2022 12:00:00 AM,AM,2022,4,Apr,18,Parks,Highbridge Park,25,,25,,,33,Manhattan,M-12A,ZONE,true,2022-04-30 13:51:49.0000000,M&O MS Forms
M-002915,M037,M037-ZN03,04/25/2022 12:00:00 AM,AM,2022,4,Apr,18,Parks,Highbridge Park,20,,20,,,33,Manhattan,M-12A,ZONE,true,2022-04-30 13:57:30.0000000,M&O MS Forms
M-002967,M037,M037-ZN03,04/23/2022 12:00:00 AM,AM,2022,4,Apr,17,Parks,Highbridge Park,8,,8,,,33,Manhattan,M-12A,ZONE,true,2022-04-30 14:56:13.0000000,M&O MS Forms
M-002989,M037,M037-ZN03,05/01/2022 12:00:00 AM,AM,2022,5,May,19,Parks,Highbridge Park,25,,25,,,33,Manhattan,M-12A,ZONE,true,2022-05-06 19:18:34.0000000,M&O MS Forms
M-003022,M037,M037-ZN03,05/06/2022 12:00:00 AM,AM,2022,5,May,19,Parks,Highbridge Park,17,,17,,,33,Manhattan,M-12A,ZONE,true,2022-05-06 20:03:45.0000000,M&O MS Forms
M-003004,M037,M037-ZN03,05/04/2022 12:00:00 AM,AM,2022,5,May,19,Parks,Highbridge Park,15,,15,,,33,Manhattan,M-12A,ZONE,true,2022-05-06 19:43:50.0000000,M&O MS Forms
M-003013,M037,M037-ZN03,05/05/2022 12:00:00 AM,AM,2022,5,May,19,Parks,Highbridge Park,9,,9,,,33,Manhattan,M-12A,ZONE,true,2022-05-06 19:47:58.0000000,M&O MS Forms
M-003034,M037,M037-ZN03,05/07/2022 12:00:00 AM,AM,2022,5,May,19,Parks,Highbridge Park,7,,7,,,33,Manhattan,M-12A,ZONE,true,2022-05-09 08:00:19.0000000,M&O MS Forms
M-003042,M037,M037-ZN03,05/08/2022 12:00:00 AM,AM,2022,5,May,20,Parks,Highbridge Park,6,,6,,,33,Manhattan,M-12A,ZONE,true,2022-05-09 08:07:22.0000000,M&O MS Forms
M-003052,M037,M037-ZN03,05/08/2022 12:00:00 AM,AM,2022,5,May,20,Parks,Highbridge Park,6,,6,,,33,Manhattan,M-12A,ZONE,true,2022-05-13 15:08:26.0000000,M&O MS Forms
M-003061,M037,M037-ZN03,05/09/2022 12:00:00 AM,AM,2022,5,May,20,Parks,Highbridge Park,10,,10,,,33,Manhattan,M-12A,ZONE,true,2022-05-13 15:13:07.0000000,M&O MS Forms
M-003089,M037,M037-ZN03,05/12/2022 12:00:00 AM,AM,2022,5,May,20,Parks,Highbridge Park,19,,19,,,33,Manhattan,M-12A,ZONE,true,2022-05-13 15:26:04.0000000,M&O MS Forms
M-003080,M037,M037-ZN03,05/11/2022 12:00:00 AM,AM,2022,5,May,20,Parks,Highbridge Park,12,,12,,,33,Manhattan,M-12A,ZONE,true,2022-05-13 15:20:20.0000000,M&O MS Forms
M-003071,M037,M037-ZN03,05/10/2022 12:00:00 AM,AM,2022,5,May,20,Parks,Highbridge Park,15,,15,,,33,Manhattan,M-12A,ZONE,true,2022-05-13 15:16:47.0000000,M&O MS Forms
M-003143,M037,M037-ZN03,05/17/2022 12:00:00 AM,AM,2022,5,May,21,Parks,Highbridge Park,12,,12,,,33,Manhattan,M-12A,ZONE,true,2022-05-20 15:03:58.0000000,M&O MS Forms
M-003161,M037,M037-ZN03,05/19/2022 12:00:00 AM,AM,2022,5,May,21,Parks,Highbridge Park,9,,9,,,33,Manhattan,M-12A,ZONE,true,2022-05-20 15:09:34.0000000,M&O MS Forms
M-003152,M037,M037-ZN03,05/18/2022 12:00:00 AM,AM,2022,5,May,21,Parks,Highbridge Park,18,,18,,,33,Manhattan,M-12A,ZONE,true,2022-05-20 15:07:01.0000000,M&O MS Forms
M-003134,M037,M037-ZN03,05/16/2022 12:00:00 AM,AM,2022,5,May,21,Parks,Highbridge Park,13,,13,,,33,Manhattan,M-12A,ZONE,true,2022-05-20 15:01:11.0000000,M&O MS Forms
M-003121,M037,M037-ZN03,05/15/2022 12:00:00 AM,AM,2022,5,May,21,Parks,Highbridge Park,10,,10,,,33,Manhattan,M-12A,ZONE,true,2022-05-15 16:52:00.0000000,M&O MS Forms
M-003101,M037,M037-ZN03,05/13/2022 12:00:00 AM,AM,2022,5,May,20,Parks,Highbridge Park,27,,27,,,33,Manhattan,M-12A,ZONE,true,2022-05-14 10:49:43.0000000,M&O MS Forms
M-003111,M037,M037-ZN03,05/14/2022 12:00:00 AM,AM,2022,5,May,20,Parks,Highbridge Park,30,,30,,,33,Manhattan,M-12A,ZONE,true,2022-05-14 15:49:46.0000000,M&O MS Forms
M-003204,M037,M037-ZN03,05/23/2022 12:00:00 AM,AM,2022,5,May,22,Parks,Highbridge Park,16,,16,,,33,Manhattan,M-12A,ZONE,true,2022-05-28 10:45:43.0000000,M&O MS Forms
M-003213,M037,M037-ZN03,05/24/2022 12:00:00 AM,AM,2022,5,May,22,Parks,Highbridge Park,8,,8,,,33,Manhattan,M-12A,ZONE,true,2022-05-28 10:48:17.0000000,M&O MS Forms
M-003222,M037,M037-ZN03,05/25/2022 12:00:00 AM,AM,2022,5,May,22,Parks,Highbridge Park,10,,10,,,33,Manhattan,M-12A,ZONE,true,2022-05-28 10:50:52.0000000,M&O MS Forms
M-003191,M037,M037-ZN03,05/22/2022 12:00:00 AM,AM,2022,5,May,22,Parks,Highbridge Park,51,,51,,,33,Manhattan,M-12A,ZONE,true,2022-05-22 15:11:31.0000000,M&O MS Forms
M-003179,M037,M037-ZN03,05/21/2022 12:00:00 AM,AM,2022,5,May,21,Parks,Highbridge Park,18,,18,,,33,Manhattan,M-12A,ZONE,true,2022-05-22 08:31:42.0000000,M&O MS Forms
M-003170,M037,M037-ZN03,05/20/2022 12:00:00 AM,AM,2022,5,May,21,Parks,Highbridge Park,13,,13,,,33,Manhattan,M-12A,ZONE,true,2022-05-20 15:13:28.0000000,M&O MS Forms
M-003788,M037,M037-ZN03,07/23/2022 12:00:00 AM,AM,2022,7,Jul,30,Parks,Highbridge Park,28,,28,,,33,Manhattan,M-12A,ZONE,true,2022-07-24 12:11:01.0000000,M&O MS Forms
M-003800,M037,M037-ZN03,07/24/2022 12:00:00 AM,AM,2022,7,Jul,31,Parks,Highbridge Park,51,,51,,,33,Manhattan,M-12A,ZONE,true,2022-07-29 15:54:42.0000000,M&O MS Forms
M-003928,M037,M037-ZN06,08/06/2022 12:00:00 AM,AM,2022,8,Aug,32,Parks,Highbridge Park,3,,3,,,34,Manhattan,M-12A,ZONE,true,2022-08-09 08:53:46.0000000,M&O MS Forms
M-003900,M037,M037-ZN06,08/04/2022 12:00:00 AM,AM,2022,8,Aug,32,Parks,Highbridge Park,3,,3,,,34,Manhattan,M-12A,ZONE,true,2022-08-04 15:36:08.0000000,M&O MS Forms
M-005749,M037,M037-ZN06,02/12/2023 12:00:00 AM,AM,2023,2,Feb,7,Parks,Highbridge Park,7,,7,,,34,Manhattan,M-12A,ZONE,true,2023-02-12 18:55:59.0000000,M&O MS Forms
M-005038,M037,M037-ZN06,11/26/2022 12:00:00 AM,AM,2022,11,Nov,48,Parks,Highbridge Park,24,,24,,,34,Manhattan,M-12A,ZONE,true,2022-11-27 11:12:56.0000000,M&O MS Forms
M-005758,M037,M037-ZN06,02/13/2023 12:00:00 AM,AM,2023,2,Feb,7,Parks,Highbridge Park,1,,1,,,34,Manhattan,M-12A,ZONE,true,2023-02-14 05:49:19.0000000,M&O MS Forms
M-004768,M037,M037-ZN06,10/31/2022 12:00:00 AM,AM,2022,10,Oct,45,Parks,Highbridge Park,23,,23,,,34,Manhattan,M-12A,ZONE,true,2022-11-05 14:01:30.0000000,M&O MS Forms
M-004759,M037,M037-ZN06,10/30/2022 12:00:00 AM,AM,2022,10,Oct,45,Parks,Highbridge Park,20,,20,,,34,Manhattan,M-12A,ZONE,true,2022-11-05 13:58:39.0000000,M&O MS Forms
M-005776,M037,M037-ZN06,02/15/2023 12:00:00 AM,AM,2023,2,Feb,7,Parks,Highbridge Park,12,,12,,,34,Manhattan,M-12A,ZONE,true,2023-02-15 16:31:42.0000000,M&O MS Forms
M-004434,M037,M037-ZN06,10/10/2022 12:00:00 AM,AM,2022,10,Oct,42,Parks,Highbridge Park,11,,11,,,34,Manhattan,M-12A,ZONE,true,2022-10-11 06:18:18.0000000,M&O MS Forms
M-004425,M037,M037-ZN06,10/09/2022 12:00:00 AM,AM,2022,10,Oct,42,Parks,Highbridge Park,9,,9,,,34,Manhattan,M-12A,ZONE,true,2022-10-11 06:14:00.0000000,M&O MS Forms
M-004452,M037,M037-ZN06,09/28/2022 12:00:00 AM,AM,2022,9,Sep,40,Parks,Highbridge Park,12,,12,,,34,Manhattan,M-12A,ZONE,true,2022-10-11 06:59:57.0000000,M&O MS Forms
M-004443,M037,M037-ZN06,09/27/2022 12:00:00 AM,AM,2022,9,Sep,40,Parks,Highbridge Park,13,,13,,,34,Manhattan,M-12A,ZONE,true,2022-10-11 06:51:56.0000000,M&O MS Forms
M-003874,M037,M037-ZN06,08/01/2022 12:00:00 AM,AM,2022,8,Aug,32,Parks,Highbridge Park,8,,8,,,34,Manhattan,M-12A,ZONE,true,2022-08-04 15:28:37.0000000,M&O MS Forms
M-003883,M037,M037-ZN06,08/02/2022 12:00:00 AM,AM,2022,8,Aug,32,Parks,Highbridge Park,9,,9,,,34,Manhattan,M-12A,ZONE,true,2022-08-04 15:31:16.0000000,M&O MS Forms
M-003891,M037,M037-ZN06,08/03/2022 12:00:00 AM,AM,2022,8,Aug,32,Parks,Highbridge Park,5,,5,,,34,Manhattan,M-12A,ZONE,true,2022-08-04 15:33:35.0000000,M&O MS Forms
M-004493,M037,M037-ZN06,10/02/2022 12:00:00 AM,AM,2022,10,Oct,41,Parks,Highbridge Park,8,,8,,,34,Manhattan,M-12A,ZONE,true,2022-10-11 07:19:14.0000000,M&O MS Forms
M-004512,M037,M037-ZN06,10/04/2022 12:00:00 AM,AM,2022,10,Oct,41,Parks,Highbridge Park,5,,5,,,34,Manhattan,M-12A,ZONE,true,2022-10-11 15:15:36.0000000,M&O MS Forms
M-004503,M037,M037-ZN06,10/03/2022 12:00:00 AM,AM,2022,10,Oct,41,Parks,Highbridge Park,5,,5,,,34,Manhattan,M-12A,ZONE,true,2022-10-11 15:12:46.0000000,M&O MS Forms
M-004521,M037,M037-ZN06,10/05/2022 12:00:00 AM,AM,2022,10,Oct,41,Parks,Highbridge Park,8,,8,,,34,Manhattan,M-12A,ZONE,true,2022-10-11 15:18:18.0000000,M&O MS Forms
M-004535,M037,M037-ZN06,10/07/2022 12:00:00 AM,AM,2022,10,Oct,41,Parks,Highbridge Park,9,,9,,,34,Manhattan,M-12A,ZONE,true,2022-10-11 15:22:43.0000000,M&O MS Forms
M-004572,M037,M037-ZN06,10/13/2022 12:00:00 AM,AM,2022,10,Oct,42,Parks,Highbridge Park,14,,14,,,34,Manhattan,M-12A,ZONE,true,2022-10-19 05:37:01.0000000,M&O MS Forms
M-004545,M037,M037-ZN06,10/08/2022 12:00:00 AM,AM,2022,10,Oct,41,Parks,Highbridge Park,20,,20,,,34,Manhattan,M-12A,ZONE,true,2022-10-11 15:25:45.0000000,M&O MS Forms
M-004590,M037,M037-ZN06,10/15/2022 12:00:00 AM,AM,2022,10,Oct,42,Parks,Highbridge Park,7,,7,,,34,Manhattan,M-12A,ZONE,true,2022-10-19 05:42:51.0000000,M&O MS Forms
M-004581,M037,M037-ZN06,10/14/2022 12:00:00 AM,AM,2022,10,Oct,42,Parks,Highbridge Park,8,,8,,,34,Manhattan,M-12A,ZONE,true,2022-10-19 05:39:59.0000000,M&O MS Forms
M-001876,M037,M037-ZN06,01/01/2022 12:00:00 AM,AM,2022,1,Jan,1,Parks,Highbridge Park,19,,19,,,34,Manhattan,M-12A,ZONE,true,2022-01-02 18:58:38.0000000,M&O MS Forms
M-004396,M037,M037-ZN06,09/25/2022 12:00:00 AM,AM,2022,9,Sep,40,Parks,Highbridge Park,5,,5,,,34,Manhattan,M-12A,ZONE,true,2022-09-26 06:09:38.0000000,M&O MS Forms
M-004462,M037,M037-ZN06,09/29/2022 12:00:00 AM,AM,2022,9,Sep,40,Parks,Highbridge Park,15,,15,,,34,Manhattan,M-12A,ZONE,true,2022-10-11 07:04:41.0000000,M&O MS Forms
M-004171,M037,M037-ZN06,08/29/2022 12:00:00 AM,AM,2022,8,Aug,36,Parks,Highbridge Park,4,,4,,,34,Manhattan,M-12A,ZONE,true,2022-09-02 13:06:48.0000000,M&O MS Forms
M-004179,M037,M037-ZN06,08/30/2022 12:00:00 AM,AM,2022,8,Aug,36,Parks,Highbridge Park,2,,2,,,34,Manhattan,M-12A,ZONE,true,2022-09-02 15:16:59.0000000,M&O MS Forms
M-004472,M037,M037-ZN06,09/30/2022 12:00:00 AM,AM,2022,9,Sep,40,Parks,Highbridge Park,9,,9,,,34,Manhattan,M-12A,ZONE,true,2022-10-11 07:08:55.0000000,M&O MS Forms
M-004483,M037,M037-ZN06,10/01/2022 12:00:00 AM,AM,2022,10,Oct,40,Parks,Highbridge Park,8,,8,,,34,Manhattan,M-12A,ZONE,true,2022-10-11 07:14:11.0000000,M&O MS Forms
M-004162,M037,M037-ZN06,08/28/2022 12:00:00 AM,AM,2022,8,Aug,36,Parks,Highbridge Park,10,,10,,,34,Manhattan,M-12A,ZONE,true,2022-09-02 13:03:49.0000000,M&O MS Forms
M-004344,M037,M037-ZN06,09/19/2022 12:00:00 AM,AM,2022,9,Sep,39,Parks,Highbridge Park,30,,30,,,34,Manhattan,M-12A,ZONE,true,2022-09-22 16:50:19.0000000,M&O MS Forms
M-004335,M037,M037-ZN06,09/18/2022 12:00:00 AM,AM,2022,9,Sep,39,Parks,Highbridge Park,25,,25,,,34,Manhattan,M-12A,ZONE,true,2022-09-22 16:46:44.0000000,M&O MS Forms
M-004352,M037,M037-ZN06,09/20/2022 12:00:00 AM,AM,2022,9,Sep,39,Parks,Highbridge Park,21,,21,,,34,Manhattan,M-12A,ZONE,true,2022-09-22 16:52:50.0000000,M&O MS Forms
M-004360,M037,M037-ZN06,09/21/2022 12:00:00 AM,AM,2022,9,Sep,39,Parks,Highbridge Park,14,,14,,,34,Manhattan,M-12A,ZONE,true,2022-09-23 05:26:36.0000000,M&O MS Forms
M-004378,M037,M037-ZN06,09/23/2022 12:00:00 AM,AM,2022,9,Sep,39,Parks,Highbridge Park,21,,21,,,34,Manhattan,M-12A,ZONE,true,2022-09-26 06:03:31.0000000,M&O MS Forms
M-004387,M037,M037-ZN06,09/24/2022 12:00:00 AM,AM,2022,9,Sep,39,Parks,Highbridge Park,10,,10,,,34,Manhattan,M-12A,ZONE,true,2022-09-26 06:06:26.0000000,M&O MS Forms
M-004369,M037,M037-ZN06,09/22/2022 12:00:00 AM,AM,2022,9,Sep,39,Parks,Highbridge Park,17,,17,,,34,Manhattan,M-12A,ZONE,true,2022-09-23 05:29:22.0000000,M&O MS Forms
M-001953,M037,M037-ZN06,01/10/2022 12:00:00 AM,AM,2022,1,Jan,3,Parks,Highbridge Park,10,,10,,,34,Manhattan,M-12A,ZONE,true,2022-01-13 14:48:38.0000000,M&O MS Forms
M-001962,M037,M037-ZN06,01/11/2022 12:00:00 AM,AM,2022,1,Jan,3,Parks,Highbridge Park,4,,4,,,34,Manhattan,M-12A,ZONE,true,2022-01-13 14:51:46.0000000,M&O MS Forms
M-001970,M037,M037-ZN06,01/12/2022 12:00:00 AM,AM,2022,1,Jan,3,Parks,Highbridge Park,3,,3,,,34,Manhattan,M-12A,ZONE,true,2022-01-13 14:54:25.0000000,M&O MS Forms
M-001983,M037,M037-ZN06,01/13/2022 12:00:00 AM,AM,2022,1,Jan,3,Parks,Highbridge Park,4,,4,,,34,Manhattan,M-12A,ZONE,true,2022-01-14 16:45:19.0000000,M&O MS Forms
M-002027,M037,M037-ZN06,01/16/2022 12:00:00 AM,AM,2022,1,Jan,4,Parks,Highbridge Park,2,,2,,,34,Manhattan,M-12A,ZONE,true,2022-01-20 17:00:46.0000000,M&O MS Forms
M-001990,M037,M037-ZN06,01/14/2022 12:00:00 AM,AM,2022,1,Jan,3,Parks,Highbridge Park,7,,7,,,34,Manhattan,M-12A,ZONE,true,2022-01-14 16:47:20.0000000,M&O MS Forms
M-001893,M037,M037-ZN06,01/03/2022 12:00:00 AM,AM,2022,1,Jan,2,Parks,Highbridge Park,3,,3,,,34,Manhattan,M-12A,ZONE,true,2022-01-04 13:23:37.0000000,M&O MS Forms
M-001884,M037,M037-ZN06,01/02/2022 12:00:00 AM,AM,2022,1,Jan,2,Parks,Highbridge Park,4,,4,,,34,Manhattan,M-12A,ZONE,true,2022-01-02 19:06:55.0000000,M&O MS Forms
M-001914,M037,M037-ZN06,01/05/2022 12:00:00 AM,AM,2022,1,Jan,2,Parks,Highbridge Park,3,,3,,,34,Manhattan,M-12A,ZONE,true,2022-01-05 17:39:03.0000000,M&O MS Forms
M-001905,M037,M037-ZN06,01/04/2022 12:00:00 AM,AM,2022,1,Jan,2,Parks,Highbridge Park,1,,1,,,34,Manhattan,M-12A,ZONE,true,2022-01-05 17:31:35.0000000,M&O MS Forms
M-001929,M037,M037-ZN06,01/06/2022 12:00:00 AM,AM,2022,1,Jan,2,Parks,Highbridge Park,4,,4,,,34,Manhattan,M-12A,ZONE,true,2022-01-06 16:40:19.0000000,M&O MS Forms
M-001945,M037,M037-ZN06,01/09/2022 12:00:00 AM,AM,2022,1,Jan,3,Parks,Highbridge Park,3,,3,,,34,Manhattan,M-12A,ZONE,true,2022-01-13 14:40:49.0000000,M&O MS Forms
M-002047,M037,M037-ZN06,01/19/2022 12:00:00 AM,AM,2022,1,Jan,4,Parks,Highbridge Park,5,,5,,,34,Manhattan,M-12A,ZONE,true,2022-01-20 17:06:18.0000000,M&O MS Forms
M-002039,M037,M037-ZN06,01/18/2022 12:00:00 AM,AM,2022,1,Jan,4,Parks,Highbridge Park,2,,2,,,34,Manhattan,M-12A,ZONE,true,2022-01-20 17:04:09.0000000,M&O MS Forms
M-002033,M037,M037-ZN06,01/17/2022 12:00:00 AM,AM,2022,1,Jan,4,Parks,Highbridge Park,4,,4,,,34,Manhattan,M-12A,ZONE,true,2022-01-20 17:02:27.0000000,M&O MS Forms
M-002081,M037,M037-ZN06,01/24/2022 12:00:00 AM,AM,2022,1,Jan,5,Parks,Highbridge Park,7,,7,,,34,Manhattan,M-12A,ZONE,true,2022-01-24 18:56:14.0000000,M&O MS Forms
M-002089,M037,M037-ZN06,01/20/2022 12:00:00 AM,AM,2022,1,Jan,4,Parks,Highbridge Park,7,,7,,,34,Manhattan,M-12A,ZONE,true,2022-01-24 19:05:54.0000000,M&O MS Forms
M-002068,M037,M037-ZN06,01/22/2022 12:00:00 AM,AM,2022,1,Jan,4,Parks,Highbridge Park,6,,6,,,34,Manhattan,M-12A,ZONE,true,2022-01-24 18:45:17.0000000,M&O MS Forms
M-002073,M037,M037-ZN06,01/23/2022 12:00:00 AM,AM,2022,1,Jan,5,Parks,Highbridge Park,10,,10,,,34,Manhattan,M-12A,ZONE,true,2022-01-24 18:49:33.0000000,M&O MS Forms
M-002128,M037,M037-ZN06,01/27/2022 12:00:00 AM,AM,2022,1,Jan,5,Parks,Highbridge Park,4,,4,,,34,Manhattan,M-12A,ZONE,true,2022-01-29 15:28:50.0000000,M&O MS Forms
M-002120,M037,M037-ZN06,01/26/2022 12:00:00 AM,AM,2022,1,Jan,5,Parks,Highbridge Park,7,,7,,,34,Manhattan,M-12A,ZONE,true,2022-01-29 15:26:33.0000000,M&O MS Forms
M-002100,M037,M037-ZN06,01/25/2022 12:00:00 AM,AM,2022,1,Jan,5,Parks,Highbridge Park,12,,12,,,34,Manhattan,M-12A,ZONE,true,2022-01-25 15:51:53.0000000,M&O MS Forms
M-002134,M037,M037-ZN06,01/28/2022 12:00:00 AM,AM,2022,1,Jan,5,Parks,Highbridge Park,2,,2,,,34,Manhattan,M-12A,ZONE,true,2022-01-29 15:30:30.0000000,M&O MS Forms
M-002156,M037,M037-ZN06,02/04/2022 12:00:00 AM,AM,2022,2,Feb,6,Parks,Highbridge Park,11,,11,,,34,Manhattan,M-12A,ZONE,true,2022-02-10 08:31:27.0000000,M&O MS Forms
M-002164,M037,M037-ZN06,02/05/2022 12:00:00 AM,AM,2022,2,Feb,6,Parks,Highbridge Park,1,,1,,,34,Manhattan,M-12A,ZONE,true,2022-02-10 08:34:22.0000000,M&O MS Forms
M-002165,M037,M037-ZN07,02/05/2022 12:00:00 AM,AM,2022,2,Feb,6,Parks,Highbridge Park,5,,5,,,34,Manhattan,M-12A,ZONE,true,2022-02-10 08:34:42.0000000,M&O MS Forms
M-002157,M037,M037-ZN07,02/04/2022 12:00:00 AM,AM,2022,2,Feb,6,Parks,Highbridge Park,38,,38,,,34,Manhattan,M-12A,ZONE,true,2022-02-10 08:31:48.0000000,M&O MS Forms
M-002135,M037,M037-ZN07,01/28/2022 12:00:00 AM,AM,2022,1,Jan,5,Parks,Highbridge Park,6,,6,,,34,Manhattan,M-12A,ZONE,true,2022-01-29 15:30:47.0000000,M&O MS Forms
M-002101,M037,M037-ZN07,01/25/2022 12:00:00 AM,AM,2022,1,Jan,5,Parks,Highbridge Park,80,,80,,,34,Manhattan,M-12A,ZONE,true,2022-01-25 15:52:11.0000000,M&O MS Forms
M-002121,M037,M037-ZN07,01/26/2022 12:00:00 AM,AM,2022,1,Jan,5,Parks,Highbridge Park,12,,12,,,34,Manhattan,M-12A,ZONE,true,2022-01-29 15:26:49.0000000,M&O MS Forms
M-002129,M037,M037-ZN07,01/27/2022 12:00:00 AM,AM,2022,1,Jan,5,Parks,Highbridge Park,8,,8,,,34,Manhattan,M-12A,ZONE,true,2022-01-29 15:29:07.0000000,M&O MS Forms
M-002069,M037,M037-ZN07,01/22/2022 12:00:00 AM,AM,2022,1,Jan,4,Parks,Highbridge Park,6,,6,,,34,Manhattan,M-12A,ZONE,true,2022-01-24 18:45:57.0000000,M&O MS Forms
M-002090,M037,M037-ZN07,01/20/2022 12:00:00 AM,AM,2022,1,Jan,4,Parks,Highbridge Park,4,,4,,,34,Manhattan,M-12A,ZONE,true,2022-01-24 19:06:24.0000000,M&O MS Forms
M-002082,M037,M037-ZN07,01/24/2022 12:00:00 AM,AM,2022,1,Jan,5,Parks,Highbridge Park,2,,2,,,34,Manhattan,M-12A,ZONE,true,2022-01-24 18:56:45.0000000,M&O MS Forms
M-002048,M037,M037-ZN07,01/19/2022 12:00:00 AM,AM,2022,1,Jan,4,Parks,Highbridge Park,3,,3,,,34,Manhattan,M-12A,ZONE,true,2022-01-20 17:06:35.0000000,M&O MS Forms
M-001946,M037,M037-ZN07,01/09/2022 12:00:00 AM,AM,2022,1,Jan,3,Parks,Highbridge Park,5,,5,,,34,Manhattan,M-12A,ZONE,true,2022-01-13 14:41:08.0000000,M&O MS Forms
M-001930,M037,M037-ZN07,01/06/2022 12:00:00 AM,AM,2022,1,Jan,2,Parks,Highbridge Park,25,,25,,,34,Manhattan,M-12A,ZONE,true,2022-01-06 16:40:35.0000000,M&O MS Forms
M-001915,M037,M037-ZN07,01/05/2022 12:00:00 AM,AM,2022,1,Jan,2,Parks,Highbridge Park,35,,35,,,34,Manhattan,M-12A,ZONE,true,2022-01-05 17:39:55.0000000,M&O MS Forms
M-001916,M037,M037-ZN07,01/05/2022 12:00:00 AM,AM,2022,1,Jan,2,Parks,Highbridge Park,35,,35,,,34,Manhattan,M-12A,ZONE,true,2022-01-05 17:39:55.0000000,M&O MS Forms
M-001906,M037,M037-ZN07,01/04/2022 12:00:00 AM,AM,2022,1,Jan,2,Parks,Highbridge Park,42,,42,,,34,Manhattan,M-12A,ZONE,true,2022-01-05 17:31:54.0000000,M&O MS Forms
M-001885,M037,M037-ZN07,01/02/2022 12:00:00 AM,AM,2022,1,Jan,2,Parks,Highbridge Park,30,,30,,,34,Manhattan,M-12A,ZONE,true,2022-01-02 19:07:19.0000000,M&O MS Forms
M-001894,M037,M037-ZN07,01/03/2022 12:00:00 AM,AM,2022,1,Jan,2,Parks,Highbridge Park,45,,45,,,34,Manhattan,M-12A,ZONE,true,2022-01-04 13:23:54.0000000,M&O MS Forms
M-001991,M037,M037-ZN07,01/14/2022 12:00:00 AM,AM,2022,1,Jan,3,Parks,Highbridge Park,10,,10,,,34,Manhattan,M-12A,ZONE,true,2022-01-14 16:47:36.0000000,M&O MS Forms
M-001996,M037,M037-ZN07,01/15/2022 12:00:00 AM,AM,2022,1,Jan,3,Parks,Highbridge Park,5,,5,,,34,Manhattan,M-12A,ZONE,true,2022-01-15 19:30:17.0000000,M&O MS Forms
M-001984,M037,M037-ZN07,01/13/2022 12:00:00 AM,AM,2022,1,Jan,3,Parks,Highbridge Park,18,,18,,,34,Manhattan,M-12A,ZONE,true,2022-01-14 16:45:38.0000000,M&O MS Forms
M-001971,M037,M037-ZN07,01/12/2022 12:00:00 AM,AM,2022,1,Jan,3,Parks,Highbridge Park,21,,21,,,34,Manhattan,M-12A,ZONE,true,2022-01-13 14:54:42.0000000,M&O MS Forms
M-001963,M037,M037-ZN07,01/11/2022 12:00:00 AM,AM,2022,1,Jan,3,Parks,Highbridge Park,15,,15,,,34,Manhattan,M-12A,ZONE,true,2022-01-13 14:52:05.0000000,M&O MS Forms
M-001954,M037,M037-ZN07,01/10/2022 12:00:00 AM,AM,2022,1,Jan,3,Parks,Highbridge Park,25,,25,,,34,Manhattan,M-12A,ZONE,true,2022-01-13 14:48:58.0000000,M&O MS Forms
M-004370,M037,M037-ZN07,09/22/2022 12:00:00 AM,AM,2022,9,Sep,39,Parks,Highbridge Park,60,,60,,,34,Manhattan,M-12A,ZONE,true,2022-09-23 05:29:40.0000000,M&O MS Forms
M-004361,M037,M037-ZN07,09/21/2022 12:00:00 AM,AM,2022,9,Sep,39,Parks,Highbridge Park,45,,45,,,34,Manhattan,M-12A,ZONE,true,2022-09-23 05:26:58.0000000,M&O MS Forms
M-004388,M037,M037-ZN07,09/24/2022 12:00:00 AM,AM,2022,9,Sep,39,Parks,Highbridge Park,55,,55,,,34,Manhattan,M-12A,ZONE,true,2022-09-26 06:06:45.0000000,M&O MS Forms
M-004379,M037,M037-ZN07,09/23/2022 12:00:00 AM,AM,2022,9,Sep,39,Parks,Highbridge Park,75,,75,,,34,Manhattan,M-12A,ZONE,true,2022-09-26 06:03:50.0000000,M&O MS Forms
M-004353,M037,M037-ZN07,09/20/2022 12:00:00 AM,AM,2022,9,Sep,39,Parks,Highbridge Park,32,,32,,,34,Manhattan,M-12A,ZONE,true,2022-09-22 16:53:09.0000000,M&O MS Forms
M-004345,M037,M037-ZN07,09/19/2022 12:00:00 AM,AM,2022,9,Sep,39,Parks,Highbridge Park,25,,25,,,34,Manhattan,M-12A,ZONE,true,2022-09-22 16:50:37.0000000,M&O MS Forms
M-004336,M037,M037-ZN07,09/18/2022 12:00:00 AM,AM,2022,9,Sep,39,Parks,Highbridge Park,50,,50,,,34,Manhattan,M-12A,ZONE,true,2022-09-22 16:47:00.0000000,M&O MS Forms
M-004163,M037,M037-ZN07,08/28/2022 12:00:00 AM,AM,2022,8,Aug,36,Parks,Highbridge Park,86,,86,,,34,Manhattan,M-12A,ZONE,true,2022-09-02 13:04:06.0000000,M&O MS Forms
M-004463,M037,M037-ZN07,09/29/2022 12:00:00 AM,AM,2022,9,Sep,40,Parks,Highbridge Park,60,,60,,,34,Manhattan,M-12A,ZONE,true,2022-10-11 07:04:58.0000000,M&O MS Forms
M-003530,M037,M037-ZN03,06/24/2022 12:00:00 AM,AM,2022,6,Jun,26,Parks,Highbridge Park,35,,35,,,33,Manhattan,M-12A,ZONE,true,2022-06-26 18:00:45.0000000,M&O MS Forms
M-003512,M037,M037-ZN03,06/22/2022 12:00:00 AM,AM,2022,6,Jun,26,Parks,Highbridge Park,26,,26,,,33,Manhattan,M-12A,ZONE,true,2022-06-26 17:55:38.0000000,M&O MS Forms
M-003521,M037,M037-ZN03,06/23/2022 12:00:00 AM,AM,2022,6,Jun,26,Parks,Highbridge Park,30,,30,,,33,Manhattan,M-12A,ZONE,true,2022-06-26 17:58:05.0000000,M&O MS Forms
M-003503,M037,M037-ZN03,06/21/2022 12:00:00 AM,AM,2022,6,Jun,26,Parks,Highbridge Park,23,,23,,,33,Manhattan,M-12A,ZONE,true,2022-06-26 17:53:06.0000000,M&O MS Forms
M-003752,M037,M037-ZN03,07/19/2022 12:00:00 AM,AM,2022,7,Jul,30,Parks,Highbridge Park,10,,10,,,33,Manhattan,M-12A,ZONE,true,2022-07-23 15:25:03.0000000,M&O MS Forms
M-003743,M037,M037-ZN03,07/18/2022 12:00:00 AM,AM,2022,7,Jul,30,Parks,Highbridge Park,13,,13,,,33,Manhattan,M-12A,ZONE,true,2022-07-23 15:20:40.0000000,M&O MS Forms
M-003734,M037,M037-ZN03,07/17/2022 12:00:00 AM,AM,2022,7,Jul,30,Parks,Highbridge Park,15,,15,,,33,Manhattan,M-12A,ZONE,true,2022-07-23 15:17:35.0000000,M&O MS Forms
M-003723,M037,M037-ZN03,07/16/2022 12:00:00 AM,AM,2022,7,Jul,29,Parks,Highbridge Park,25,,25,,,33,Manhattan,M-12A,ZONE,true,2022-07-17 17:50:32.0000000,M&O MS Forms
M-003714,M037,M037-ZN03,07/15/2022 12:00:00 AM,AM,2022,7,Jul,29,Parks,Highbridge Park,12,,12,,,33,Manhattan,M-12A,ZONE,true,2022-07-16 09:50:24.0000000,M&O MS Forms
M-003705,M037,M037-ZN03,07/14/2022 12:00:00 AM,AM,2022,7,Jul,29,Parks,Highbridge Park,15,,15,,,33,Manhattan,M-12A,ZONE,true,2022-07-16 09:47:58.0000000,M&O MS Forms
M-003700,M037,M037-ZN03,07/13/2022 12:00:00 AM,AM,2022,7,Jul,29,Parks,Highbridge Park,1,,1,,,33,Manhattan,M-12A,ZONE,true,2022-07-16 09:46:17.0000000,M&O MS Forms
M-003693,M037,M037-ZN03,07/12/2022 12:00:00 AM,AM,2022,7,Jul,29,Parks,Highbridge Park,25,,25,,,33,Manhattan,M-12A,ZONE,true,2022-07-16 09:44:13.0000000,M&O MS Forms
M-003684,M037,M037-ZN03,07/11/2022 12:00:00 AM,AM,2022,7,Jul,29,Parks,Highbridge Park,8,,8,,,33,Manhattan,M-12A,ZONE,true,2022-07-16 09:41:40.0000000,M&O MS Forms
M-003675,M037,M037-ZN03,07/10/2022 12:00:00 AM,AM,2022,7,Jul,29,Parks,Highbridge Park,12,,12,,,33,Manhattan,M-12A,ZONE,true,2022-07-16 09:35:06.0000000,M&O MS Forms
M-003657,M037,M037-ZN03,07/08/2022 12:00:00 AM,AM,2022,7,Jul,28,Parks,Highbridge Park,12,,12,,,33,Manhattan,M-12A,ZONE,true,2022-07-11 14:11:58.0000000,M&O MS Forms
M-003666,M037,M037-ZN03,07/09/2022 12:00:00 AM,AM,2022,7,Jul,28,Parks,Highbridge Park,13,,13,,,33,Manhattan,M-12A,ZONE,true,2022-07-11 14:14:35.0000000,M&O MS Forms
M-003637,M037,M037-ZN03,07/06/2022 12:00:00 AM,AM,2022,7,Jul,28,Parks,Highbridge Park,30,,30,,,33,Manhattan,M-12A,ZONE,true,2022-07-09 10:42:24.0000000,M&O MS Forms
M-003628,M037,M037-ZN03,07/05/2022 12:00:00 AM,AM,2022,7,Jul,28,Parks,Highbridge Park,45,,45,,,33,Manhattan,M-12A,ZONE,true,2022-07-09 10:39:32.0000000,M&O MS Forms
M-003648,M037,M037-ZN03,07/08/2022 12:00:00 AM,AM,2022,7,Jul,28,Parks,Highbridge Park,15,,15,,,33,Manhattan,M-12A,ZONE,true,2022-07-11 14:09:25.0000000,M&O MS Forms
M-003649,M037,M037-ZN04,07/07/2022 12:00:00 AM,AM,2022,7,Jul,28,Parks,Highbridge Park,5,,5,,,34,Manhattan,M-12A,ZONE,true,2022-07-11 14:09:43.0000000,M&O MS Forms
M-003629,M037,M037-ZN04,07/05/2022 12:00:00 AM,AM,2022,7,Jul,28,Parks,Highbridge Park,30,,30,,,34,Manhattan,M-12A,ZONE,true,2022-07-09 10:39:52.0000000,M&O MS Forms
M-003638,M037,M037-ZN04,07/06/2022 12:00:00 AM,AM,2022,7,Jul,28,Parks,Highbridge Park,25,,25,,,34,Manhattan,M-12A,ZONE,true,2022-07-09 10:42:43.0000000,M&O MS Forms
M-003667,M037,M037-ZN04,07/09/2022 12:00:00 AM,AM,2022,7,Jul,28,Parks,Highbridge Park,9,,9,,,34,Manhattan,M-12A,ZONE,true,2022-07-11 14:14:50.0000000,M&O MS Forms
M-003658,M037,M037-ZN04,07/09/2022 12:00:00 AM,AM,2022,7,Jul,28,Parks,Highbridge Park,6,,6,,,34,Manhattan,M-12A,ZONE,true,2022-07-11 14:12:14.0000000,M&O MS Forms
M-003676,M037,M037-ZN04,07/10/2022 12:00:00 AM,AM,2022,7,Jul,29,Parks,Highbridge Park,9,,9,,,34,Manhattan,M-12A,ZONE,true,2022-07-16 09:35:24.0000000,M&O MS Forms
M-003685,M037,M037-ZN04,07/11/2022 12:00:00 AM,AM,2022,7,Jul,29,Parks,Highbridge Park,3,,3,,,34,Manhattan,M-12A,ZONE,true,2022-07-16 09:41:56.0000000,M&O MS Forms
M-003694,M037,M037-ZN04,07/12/2022 12:00:00 AM,AM,2022,7,Jul,29,Parks,Highbridge Park,10,,10,,,34,Manhattan,M-12A,ZONE,true,2022-07-16 09:44:34.0000000,M&O MS Forms
M-003715,M037,M037-ZN04,07/15/2022 12:00:00 AM,AM,2022,7,Jul,29,Parks,Highbridge Park,8,,8,,,34,Manhattan,M-12A,ZONE,true,2022-07-16 09:50:38.0000000,M&O MS Forms
M-003706,M037,M037-ZN04,07/14/2022 12:00:00 AM,AM,2022,7,Jul,29,Parks,Highbridge Park,6,,6,,,34,Manhattan,M-12A,ZONE,true,2022-07-16 09:48:11.0000000,M&O MS Forms
M-003724,M037,M037-ZN04,07/16/2022 12:00:00 AM,AM,2022,7,Jul,29,Parks,Highbridge Park,12,,12,,,34,Manhattan,M-12A,ZONE,true,2022-07-17 17:50:48.0000000,M&O MS Forms
M-003735,M037,M037-ZN04,07/17/2022 12:00:00 AM,AM,2022,7,Jul,30,Parks,Highbridge Park,35,,35,,,34,Manhattan,M-12A,ZONE,true,2022-07-23 15:18:00.0000000,M&O MS Forms
M-003744,M037,M037-ZN04,07/18/2022 12:00:00 AM,AM,2022,7,Jul,30,Parks,Highbridge Park,5,,5,,,34,Manhattan,M-12A,ZONE,true,2022-07-23 15:21:01.0000000,M&O MS Forms
M-003504,M037,M037-ZN04,06/21/2022 12:00:00 AM,AM,2022,6,Jun,26,Parks,Highbridge Park,21,,21,,,34,Manhattan,M-12A,ZONE,true,2022-06-26 17:53:22.0000000,M&O MS Forms
M-003495,M037,M037-ZN04,06/19/2022 12:00:00 AM,AM,2022,6,Jun,26,Parks,Highbridge Park,104,,104,,,34,Manhattan,M-12A,ZONE,true,2022-06-26 17:50:43.0000000,M&O MS Forms
M-003522,M037,M037-ZN04,06/23/2022 12:00:00 AM,AM,2022,6,Jun,26,Parks,Highbridge Park,10,,10,,,34,Manhattan,M-12A,ZONE,true,2022-06-26 17:58:23.0000000,M&O MS Forms
M-003513,M037,M037-ZN04,06/22/2022 12:00:00 AM,AM,2022,6,Jun,26,Parks,Highbridge Park,15,,15,,,34,Manhattan,M-12A,ZONE,true,2022-06-26 17:55:53.0000000,M&O MS Forms
M-003531,M037,M037-ZN04,06/24/2022 12:00:00 AM,AM,2022,6,Jun,26,Parks,Highbridge Park,15,,15,,,34,Manhattan,M-12A,ZONE,true,2022-06-26 18:01:28.0000000,M&O MS Forms
M-003541,M037,M037-ZN04,06/25/2022 12:00:00 AM,AM,2022,6,Jun,26,Parks,Highbridge Park,17,,17,,,34,Manhattan,M-12A,ZONE,true,2022-06-26 18:04:26.0000000,M&O MS Forms
M-003550,M037,M037-ZN04,06/26/2022 12:00:00 AM,AM,2022,6,Jun,27,Parks,Highbridge Park,15,,15,,,34,Manhattan,M-12A,ZONE,true,2022-06-26 18:07:49.0000000,M&O MS Forms
M-003568,M037,M037-ZN04,06/28/2022 12:00:00 AM,AM,2022,6,Jun,27,Parks,Highbridge Park,39,,39,,,34,Manhattan,M-12A,ZONE,true,2022-07-02 10:48:13.0000000,M&O MS Forms
M-003559,M037,M037-ZN04,06/27/2022 12:00:00 AM,AM,2022,6,Jun,27,BBP,Highbridge Park,58,,58,,,34,Manhattan,M-12A,ZONE,true,2022-07-02 10:45:30.0000000,M&O MS Forms
M-003586,M037,M037-ZN04,06/30/2022 12:00:00 AM,AM,2022,6,Jun,27,Parks,Highbridge Park,15,,15,,,34,Manhattan,M-12A,ZONE,true,2022-07-02 10:53:13.0000000,M&O MS Forms
M-003577,M037,M037-ZN04,06/29/2022 12:00:00 AM,AM,2022,6,Jun,27,Parks,Highbridge Park,19,,19,,,34,Manhattan,M-12A,ZONE,true,2022-07-02 10:50:37.0000000,M&O MS Forms
M-003602,M037,M037-ZN04,07/02/2022 12:00:00 AM,AM,2022,7,Jul,27,Parks,Highbridge Park,5,,5,,,34,Manhattan,M-12A,ZONE,true,2022-07-04 13:42:17.0000000,M&O MS Forms
M-003594,M037,M037-ZN04,07/01/2022 12:00:00 AM,AM,2022,7,Jul,27,Parks,Highbridge Park,14,,14,,,34,Manhattan,M-12A,ZONE,true,2022-07-02 10:55:22.0000000,M&O MS Forms
M-003611,M037,M037-ZN04,07/03/2022 12:00:00 AM,AM,2022,7,Jul,28,Parks,Highbridge Park,15,,15,,,34,Manhattan,M-12A,ZONE,true,2022-07-04 13:45:36.0000000,M&O MS Forms
M-003620,M037,M037-ZN04,07/04/2022 12:00:00 AM,AM,2022,7,Jul,28,Parks,Highbridge Park,25,,25,,,34,Manhattan,M-12A,ZONE,true,2022-07-09 10:37:05.0000000,M&O MS Forms
M-003369,M037,M037-ZN04,06/07/2022 12:00:00 AM,AM,2022,6,Jun,24,Parks,Highbridge Park,15,,15,,,34,Manhattan,M-12A,ZONE,true,2022-06-11 19:17:29.0000000,M&O MS Forms
M-003378,M037,M037-ZN04,06/08/2022 12:00:00 AM,AM,2022,6,Jun,24,Parks,Highbridge Park,23,,23,,,34,Manhattan,M-12A,ZONE,true,2022-06-11 19:21:13.0000000,M&O MS Forms
M-003387,M037,M037-ZN04,06/09/2022 12:00:00 AM,AM,2022,6,Jun,24,Parks,Highbridge Park,20,,20,,,34,Manhattan,M-12A,ZONE,true,2022-06-11 19:24:37.0000000,M&O MS Forms
M-003396,M037,M037-ZN04,06/10/2022 12:00:00 AM,AM,2022,6,Jun,24,Parks,Highbridge Park,8,,8,,,34,Manhattan,M-12A,ZONE,true,2022-06-11 19:27:55.0000000,M&O MS Forms
M-003404,M037,M037-ZN04,06/11/2022 12:00:00 AM,AM,2022,6,Jun,24,Parks,Highbridge Park,5,,5,,,34,Manhattan,M-12A,ZONE,true,2022-06-11 19:30:31.0000000,M&O MS Forms
M-003413,M037,M037-ZN04,06/12/2022 12:00:00 AM,AM,2022,6,Jun,25,Parks,Highbridge Park,25,,25,,,34,Manhattan,M-12A,ZONE,true,2022-06-12 18:02:31.0000000,M&O MS Forms
M-003427,M037,M037-ZN04,06/13/2022 12:00:00 AM,AM,2022,6,Jun,25,Parks,Highbridge Park,46,,46,,,34,Manhattan,M-12A,ZONE,true,2022-06-19 12:40:26.0000000,M&O MS Forms
M-003435,M037,M037-ZN04,06/14/2022 12:00:00 AM,AM,2022,6,Jun,25,Parks,Highbridge Park,284,,284,,,34,Manhattan,M-12A,ZONE,true,2022-06-19 12:42:51.0000000,M&O MS Forms
M-003443,M037,M037-ZN04,06/15/2022 12:00:00 AM,AM,2022,6,Jun,25,Parks,Highbridge Park,87,,87,,,34,Manhattan,M-12A,ZONE,true,2022-06-19 12:45:51.0000000,M&O MS Forms
M-003452,M037,M037-ZN04,06/16/2022 12:00:00 AM,AM,2022,6,Jun,25,Parks,Highbridge Park,25,,25,,,34,Manhattan,M-12A,ZONE,true,2022-06-19 12:48:44.0000000,M&O MS Forms
M-003470,M037,M037-ZN04,06/18/2022 12:00:00 AM,AM,2022,6,Jun,25,Parks,Highbridge Park,45,,45,,,34,Manhattan,M-12A,ZONE,true,2022-06-19 12:53:44.0000000,M&O MS Forms
M-003461,M037,M037-ZN04,06/17/2022 12:00:00 AM,AM,2022,6,Jun,25,Parks,Highbridge Park,50,,50,,,34,Manhattan,M-12A,ZONE,true,2022-06-19 12:51:12.0000000,M&O MS Forms
M-003485,M037,M037-ZN04,06/20/2022 12:00:00 AM,AM,2022,6,Jun,26,Parks,Highbridge Park,10,,10,,,34,Manhattan,M-12A,ZONE,true,2022-06-26 13:11:58.0000000,M&O MS Forms
M-003305,M037,M037-ZN04,05/31/2022 12:00:00 AM,AM,2022,5,May,23,Parks,Highbridge Park,8,,8,,,34,Manhattan,M-12A,ZONE,true,2022-06-06 19:18:04.0000000,M&O MS Forms
M-003315,M037,M037-ZN04,06/01/2022 12:00:00 AM,AM,2022,6,Jun,23,Parks,Highbridge Park,5,,5,,,34,Manhattan,M-12A,ZONE,true,2022-06-06 19:22:03.0000000,M&O MS Forms
M-003324,M037,M037-ZN04,06/02/2022 12:00:00 AM,AM,2022,6,Jun,23,Parks,Highbridge Park,8,,8,,,34,Manhattan,M-12A,ZONE,true,2022-06-06 19:25:51.0000000,M&O MS Forms
M-003333,M037,M037-ZN04,06/03/2022 12:00:00 AM,AM,2022,6,Jun,23,Parks,Highbridge Park,6,,6,,,34,Manhattan,M-12A,ZONE,true,2022-06-06 19:30:17.0000000,M&O MS Forms
M-004473,M037,M037-ZN07,09/30/2022 12:00:00 AM,AM,2022,9,Sep,40,Parks,Highbridge Park,80,,80,,,34,Manhattan,M-12A,ZONE,true,2022-10-11 07:09:12.0000000,M&O MS Forms
M-004180,M037,M037-ZN07,08/30/2022 12:00:00 AM,AM,2022,8,Aug,36,Parks,Highbridge Park,75,,75,,,34,Manhattan,M-12A,ZONE,true,2022-09-02 15:17:19.0000000,M&O MS Forms
M-004172,M037,M037-ZN07,08/29/2022 12:00:00 AM,AM,2022,8,Aug,36,Parks,Highbridge Park,96,,96,,,34,Manhattan,M-12A,ZONE,true,2022-09-02 13:07:06.0000000,M&O MS Forms
M-004397,M037,M037-ZN07,09/25/2022 12:00:00 AM,AM,2022,9,Sep,40,Parks,Highbridge Park,3,,3,,,34,Manhattan,M-12A,ZONE,true,2022-09-26 06:09:59.0000000,M&O MS Forms
M-001877,M037,M037-ZN07,01/01/2022 12:00:00 AM,AM,2022,1,Jan,1,Parks,Highbridge Park,65,,65,,,34,Manhattan,M-12A,ZONE,true,2022-01-02 18:59:02.0000000,M&O MS Forms
M-004582,M037,M037-ZN07,10/14/2022 12:00:00 AM,AM,2022,10,Oct,42,Parks,Highbridge Park,65,,65,,,34,Manhattan,M-12A,ZONE,true,2022-10-19 05:40:18.0000000,M&O MS Forms
M-004591,M037,M037-ZN07,10/15/2022 12:00:00 AM,AM,2022,10,Oct,42,Parks,Highbridge Park,60,,60,,,34,Manhattan,M-12A,ZONE,true,2022-10-19 05:43:16.0000000,M&O MS Forms
M-004546,M037,M037-ZN07,10/08/2022 12:00:00 AM,AM,2022,10,Oct,41,Parks,Highbridge Park,82,,82,,,34,Manhattan,M-12A,ZONE,true,2022-10-11 15:26:05.0000000,M&O MS Forms
M-004555,M037,M037-ZN07,10/11/2022 12:00:00 AM,AM,2022,10,Oct,42,Parks,Highbridge Park,55,,55,,,34,Manhattan,M-12A,ZONE,true,2022-10-11 16:49:41.0000000,M&O MS Forms
M-004573,M037,M037-ZN07,10/13/2022 12:00:00 AM,AM,2022,10,Oct,42,Parks,Highbridge Park,79,,79,,,34,Manhattan,M-12A,ZONE,true,2022-10-19 05:37:22.0000000,M&O MS Forms
M-004536,M037,M037-ZN07,10/07/2022 12:00:00 AM,AM,2022,10,Oct,41,Parks,Highbridge Park,40,,40,,,34,Manhattan,M-12A,ZONE,true,2022-10-11 15:22:59.0000000,M&O MS Forms
M-004522,M037,M037-ZN07,10/05/2022 12:00:00 AM,AM,2022,10,Oct,41,Parks,Highbridge Park,61,,61,,,34,Manhattan,M-12A,ZONE,true,2022-10-11 15:18:38.0000000,M&O MS Forms
M-004528,M037,M037-ZN07,10/06/2022 12:00:00 AM,AM,2022,10,Oct,41,Parks,Highbridge Park,29,,29,,,34,Manhattan,M-12A,ZONE,true,2022-10-11 15:20:34.0000000,M&O MS Forms
M-004513,M037,M037-ZN07,10/04/2022 12:00:00 AM,AM,2022,10,Oct,41,Parks,Highbridge Park,55,,55,,,34,Manhattan,M-12A,ZONE,true,2022-10-11 15:15:52.0000000,M&O MS Forms
M-004504,M037,M037-ZN07,10/03/2022 12:00:00 AM,AM,2022,10,Oct,41,Parks,Highbridge Park,40,,40,,,34,Manhattan,M-12A,ZONE,true,2022-10-11 15:13:05.0000000,M&O MS Forms
M-004494,M037,M037-ZN07,10/02/2022 12:00:00 AM,AM,2022,10,Oct,41,Parks,Highbridge Park,35,,35,,,34,Manhattan,M-12A,ZONE,true,2022-10-11 07:19:31.0000000,M&O MS Forms
M-004484,M037,M037-ZN07,10/01/2022 12:00:00 AM,AM,2022,10,Oct,40,Parks,Highbridge Park,65,,65,,,34,Manhattan,M-12A,ZONE,true,2022-10-11 07:15:04.0000000,M&O MS Forms
M-003892,M037,M037-ZN07,08/03/2022 12:00:00 AM,AM,2022,8,Aug,32,Parks,Highbridge Park,139,,139,,,34,Manhattan,M-12A,ZONE,true,2022-08-04 15:33:50.0000000,M&O MS Forms
M-003884,M037,M037-ZN07,08/02/2022 12:00:00 AM,AM,2022,8,Aug,32,Parks,Highbridge Park,125,,125,,,34,Manhattan,M-12A,ZONE,true,2022-08-04 15:31:34.0000000,M&O MS Forms
M-003875,M037,M037-ZN07,08/01/2022 12:00:00 AM,AM,2022,8,Aug,32,Parks,Highbridge Park,115,,115,,,34,Manhattan,M-12A,ZONE,true,2022-08-04 15:28:54.0000000,M&O MS Forms
M-004444,M037,M037-ZN07,09/27/2022 12:00:00 AM,AM,2022,9,Sep,40,Parks,Highbridge Park,52,,52,,,34,Manhattan,M-12A,ZONE,true,2022-10-11 06:52:23.0000000,M&O MS Forms
M-004453,M037,M037-ZN07,09/28/2022 12:00:00 AM,AM,2022,9,Sep,40,Parks,Highbridge Park,40,,40,,,34,Manhattan,M-12A,ZONE,true,2022-10-11 07:00:14.0000000,M&O MS Forms
M-004426,M037,M037-ZN07,10/09/2022 12:00:00 AM,AM,2022,10,Oct,42,Parks,Highbridge Park,85,,85,,,34,Manhattan,M-12A,ZONE,true,2022-10-11 06:14:26.0000000,M&O MS Forms
M-004435,M037,M037-ZN07,10/10/2022 12:00:00 AM,AM,2022,10,Oct,42,Parks,Highbridge Park,75,,75,,,34,Manhattan,M-12A,ZONE,true,2022-10-11 06:18:40.0000000,M&O MS Forms
M-004760,M037,M037-ZN07,10/30/2022 12:00:00 AM,AM,2022,10,Oct,45,Parks,Highbridge Park,70,,70,,,34,Manhattan,M-12A,ZONE,true,2022-11-05 13:58:55.0000000,M&O MS Forms
M-005777,M037,M037-ZN07,02/15/2023 12:00:00 AM,AM,2023,2,Feb,7,Parks,Highbridge Park,35,,35,,,34,Manhattan,M-12A,ZONE,true,2023-02-15 16:31:57.0000000,M&O MS Forms
M-004769,M037,M037-ZN07,10/31/2022 12:00:00 AM,AM,2022,10,Oct,45,Parks,Highbridge Park,85,,85,,,34,Manhattan,M-12A,ZONE,true,2022-11-05 14:01:47.0000000,M&O MS Forms
M-005759,M037,M037-ZN07,02/13/2023 12:00:00 AM,AM,2023,2,Feb,7,Parks,Highbridge Park,30,,30,,,34,Manhattan,M-12A,ZONE,true,2023-02-14 05:49:37.0000000,M&O MS Forms
M-005039,M037,M037-ZN07,11/26/2022 12:00:00 AM,AM,2022,11,Nov,48,Parks,Highbridge Park,82,,82,,,34,Manhattan,M-12A,ZONE,true,2022-11-27 11:13:15.0000000,M&O MS Forms
M-005750,M037,M037-ZN07,02/12/2023 12:00:00 AM,AM,2023,2,Feb,7,Parks,Highbridge Park,40,,40,,,34,Manhattan,M-12A,ZONE,true,2023-02-12 18:56:16.0000000,M&O MS Forms
M-003901,M037,M037-ZN07,08/04/2022 12:00:00 AM,AM,2022,8,Aug,32,Parks,Highbridge Park,156,,156,,,34,Manhattan,M-12A,ZONE,true,2022-08-04 15:36:28.0000000,M&O MS Forms
M-003929,M037,M037-ZN07,08/06/2022 12:00:00 AM,AM,2022,8,Aug,32,Parks,Highbridge Park,211,,211,,,34,Manhattan,M-12A,ZONE,true,2022-08-09 08:54:04.0000000,M&O MS Forms
M-004257,M037,M037-ZN07,09/05/2022 12:00:00 AM,AM,2022,9,Sep,37,Parks,Highbridge Park,83,,83,,,34,Manhattan,M-12A,ZONE,true,2022-09-09 05:33:26.0000000,M&O MS Forms
M-004238,M037,M037-ZN07,09/05/2022 12:00:00 AM,AM,2022,9,Sep,37,Parks,Highbridge Park,83,,83,,,34,Manhattan,M-12A,ZONE,true,2022-09-06 14:44:55.0000000,M&O MS Forms
M-004248,M037,M037-ZN07,09/04/2022 12:00:00 AM,AM,2022,9,Sep,37,Parks,Highbridge Park,94,,94,,,34,Manhattan,M-12A,ZONE,true,2022-09-09 05:29:17.0000000,M&O MS Forms
M-004228,M037,M037-ZN07,09/04/2022 12:00:00 AM,AM,2022,9,Sep,37,Parks,Highbridge Park,94,,94,,,34,Manhattan,M-12A,ZONE,true,2022-09-06 14:39:41.0000000,M&O MS Forms
M-004219,M037,M037-ZN07,09/03/2022 12:00:00 AM,AM,2022,9,Sep,36,Parks,Highbridge Park,86,,86,,,34,Manhattan,M-12A,ZONE,true,2022-09-06 14:36:31.0000000,M&O MS Forms
M-004208,M037,M037-ZN07,09/02/2022 12:00:00 AM,AM,2022,9,Sep,36,Parks,Highbridge Park,7,,7,,,34,Manhattan,M-12A,ZONE,true,2022-09-06 14:32:51.0000000,M&O MS Forms
M-004210,M037,M037-ZN07,09/02/2022 12:00:00 AM,AM,2022,9,Sep,36,Parks,Highbridge Park,45,,45,,,34,Manhattan,M-12A,ZONE,true,2022-09-06 14:33:31.0000000,M&O MS Forms
M-004202,M037,M037-ZN07,09/01/2022 12:00:00 AM,AM,2022,9,Sep,36,Parks,Highbridge Park,65,,65,,,34,Manhattan,M-12A,ZONE,true,2022-09-06 14:31:02.0000000,M&O MS Forms
M-005642,M037,M037-ZN07,01/31/2023 12:00:00 AM,AM,2023,1,Jan,5,Parks,Highbridge Park,30,,30,,,34,Manhattan,M-12A,ZONE,true,2023-01-31 15:45:48.0000000,M&O MS Forms
M-005626,M037,M037-ZN07,01/30/2023 12:00:00 AM,AM,2023,1,Jan,5,Parks,Highbridge Park,25,,25,,,34,Manhattan,M-12A,ZONE,true,2023-01-30 16:26:28.0000000,M&O MS Forms
M-005616,M037,M037-ZN07,01/29/2023 12:00:00 AM,AM,2023,1,Jan,5,Parks,Highbridge Park,15,,15,,,34,Manhattan,M-12A,ZONE,true,2023-01-30 16:19:45.0000000,M&O MS Forms
M-005608,M037,M037-ZN07,01/28/2023 12:00:00 AM,AM,2023,1,Jan,4,Parks,Highbridge Park,42,,42,,,34,Manhattan,M-12A,ZONE,true,2023-01-30 16:12:25.0000000,M&O MS Forms
M-005599,M037,M037-ZN07,01/28/2023 12:00:00 AM,AM,2023,1,Jan,4,Parks,Highbridge Park,35,,35,,,34,Manhattan,M-12A,ZONE,true,2023-01-30 16:04:14.0000000,M&O MS Forms
M-005589,M037,M037-ZN07,01/26/2023 12:00:00 AM,AM,2023,1,Jan,4,Parks,Highbridge Park,22,,22,,,34,Manhattan,M-12A,ZONE,true,2023-01-26 17:37:40.0000000,M&O MS Forms
M-005570,M037,M037-ZN07,01/24/2023 12:00:00 AM,AM,2023,1,Jan,4,Parks,Highbridge Park,15,,15,,,34,Manhattan,M-12A,ZONE,true,2023-01-24 17:14:14.0000000,M&O MS Forms
M-005579,M037,M037-ZN07,01/25/2023 12:00:00 AM,AM,2023,1,Jan,4,Parks,Highbridge Park,20,,20,,,34,Manhattan,M-12A,ZONE,true,2023-01-25 17:10:48.0000000,M&O MS Forms
M-005731,M037,M037-ZN07,02/10/2023 12:00:00 AM,AM,2023,2,Feb,6,Parks,Highbridge Park,45,,45,,,34,Manhattan,M-12A,ZONE,true,2023-02-11 17:50:01.0000000,M&O MS Forms
M-005722,M037,M037-ZN07,02/09/2023 12:00:00 AM,AM,2023,2,Feb,6,Parks,Highbridge Park,60,,60,,,34,Manhattan,M-12A,ZONE,true,2023-02-09 15:43:29.0000000,M&O MS Forms
M-005701,M037,M037-ZN07,02/07/2023 12:00:00 AM,AM,2023,2,Feb,6,Parks,Highbridge Park,30,,30,,,34,Manhattan,M-12A,ZONE,true,2023-02-07 17:30:59.0000000,M&O MS Forms
M-005711,M037,M037-ZN07,02/08/2023 12:00:00 AM,AM,2023,2,Feb,6,Parks,Highbridge Park,45,,45,,,34,Manhattan,M-12A,ZONE,true,2023-02-08 16:02:03.0000000,M&O MS Forms
M-005692,M037,M037-ZN07,02/06/2023 12:00:00 AM,AM,2023,2,Feb,6,Parks,Highbridge Park,20,,20,,,34,Manhattan,M-12A,ZONE,true,2023-02-07 17:26:50.0000000,M&O MS Forms
M-005681,M037,M037-ZN07,02/04/2023 12:00:00 AM,AM,2023,2,Feb,5,Parks,Highbridge Park,10,,10,,,34,Manhattan,M-12A,ZONE,true,2023-02-05 11:31:23.0000000,M&O MS Forms
M-005672,M037,M037-ZN07,02/03/2023 12:00:00 AM,AM,2023,2,Feb,5,Parks,Highbridge Park,42,,42,,,34,Manhattan,M-12A,ZONE,true,2023-02-03 17:15:48.0000000,M&O MS Forms
M-005652,M037,M037-ZN07,02/01/2023 12:00:00 AM,AM,2023,2,Feb,5,Parks,Highbridge Park,26,,26,,,34,Manhattan,M-12A,ZONE,true,2023-02-01 15:53:39.0000000,M&O MS Forms
M-005653,M037,M037-ZN07,02/01/2023 12:00:00 AM,AM,2023,2,Feb,5,Parks,Highbridge Park,26,,26,,,34,Manhattan,M-12A,ZONE,true,2023-02-01 15:53:43.0000000,M&O MS Forms
M-005662,M037,M037-ZN07,02/02/2023 12:00:00 AM,AM,2023,2,Feb,5,Parks,Highbridge Park,31,,31,,,34,Manhattan,M-12A,ZONE,true,2023-02-02 15:42:02.0000000,M&O MS Forms
M-005536,M037,M037-ZN07,01/21/2023 12:00:00 AM,AM,2023,1,Jan,3,Parks,Highbridge Park,50,,50,,,34,Manhattan,M-12A,ZONE,true,2023-01-23 16:33:11.0000000,M&O MS Forms
M-005545,M037,M037-ZN07,01/21/2023 12:00:00 AM,AM,2023,1,Jan,3,Parks,Highbridge Park,70,,70,,,34,Manhattan,M-12A,ZONE,true,2023-01-23 16:44:45.0000000,M&O MS Forms
M-005562,M037,M037-ZN07,01/23/2023 12:00:00 AM,AM,2023,1,Jan,4,Parks,Highbridge Park,20,,20,,,34,Manhattan,M-12A,ZONE,true,2023-01-23 16:50:04.0000000,M&O MS Forms
M-005554,M037,M037-ZN07,01/22/2023 12:00:00 AM,AM,2023,1,Jan,4,Parks,Highbridge Park,25,,25,,,34,Manhattan,M-12A,ZONE,true,2023-01-23 16:47:39.0000000,M&O MS Forms
M-005507,M037,M037-ZN07,01/17/2023 12:00:00 AM,AM,2023,1,Jan,3,Parks,Highbridge Park,25,,25,,,34,Manhattan,M-12A,ZONE,true,2023-01-23 16:11:57.0000000,M&O MS Forms
M-005527,M037,M037-ZN07,01/19/2023 12:00:00 AM,AM,2023,1,Jan,3,Parks,Highbridge Park,45,,45,,,34,Manhattan,M-12A,ZONE,true,2023-01-23 16:29:58.0000000,M&O MS Forms
M-005518,M037,M037-ZN07,01/18/2023 12:00:00 AM,AM,2023,1,Jan,3,Parks,Highbridge Park,30,,30,,,34,Manhattan,M-12A,ZONE,true,2023-01-23 16:15:47.0000000,M&O MS Forms
M-005353,M037,M037-ZN07,01/01/2023 12:00:00 AM,AM,2023,1,Jan,1,Parks,Highbridge Park,25,,25,,,34,Manhattan,M-12A,ZONE,true,2023-01-03 15:23:54.0000000,M&O MS Forms
M-005342,M037,M037-ZN07,12/03/2022 12:00:00 AM,AM,2022,12,Dec,49,Parks,Highbridge Park,75,,75,,,34,Manhattan,M-12A,ZONE,true,2023-01-01 10:33:29.0000000,M&O MS Forms
M-005497,M037,M037-ZN07,01/16/2023 12:00:00 AM,AM,2023,1,Jan,3,Parks,Highbridge Park,20,,20,,,34,Manhattan,M-12A,ZONE,true,2023-01-23 16:03:24.0000000,M&O MS Forms
M-005485,M037,M037-ZN07,01/15/2023 12:00:00 AM,AM,2023,1,Jan,3,Parks,Highbridge Park,23,,23,,,34,Manhattan,M-12A,ZONE,true,2023-01-23 15:59:14.0000000,M&O MS Forms
M-005486,M037,M037-ZN07,01/15/2023 12:00:00 AM,AM,2023,1,Jan,3,Parks,Highbridge Park,23,,23,,,34,Manhattan,M-12A,ZONE,true,2023-01-23 15:59:14.0000000,M&O MS Forms
M-005362,M037,M037-ZN07,01/02/2023 12:00:00 AM,AM,2023,1,Jan,1,Parks,Highbridge Park,30,,30,,,34,Manhattan,M-12A,ZONE,true,2023-01-03 17:13:12.0000000,M&O MS Forms
M-005371,M037,M037-ZN07,01/03/2023 12:00:00 AM,AM,2023,1,Jan,1,Parks,Highbridge Park,35,,35,,,34,Manhattan,M-12A,ZONE,true,2023-01-03 17:16:20.0000000,M&O MS Forms
M-005382,M037,M037-ZN07,01/04/2023 12:00:00 AM,AM,2023,1,Jan,1,Parks,Highbridge Park,52,,52,,,34,Manhattan,M-12A,ZONE,true,2023-01-08 12:14:17.0000000,M&O MS Forms
M-005391,M037,M037-ZN07,01/05/2023 12:00:00 AM,AM,2023,1,Jan,1,Parks,Highbridge Park,68,,68,,,34,Manhattan,M-12A,ZONE,true,2023-01-08 12:19:28.0000000,M&O MS Forms
M-005768,M037,M037-ZN07,02/14/2023 12:00:00 AM,AM,2023,2,Feb,7,Parks,Highbridge Park,45,,45,,,34,Manhattan,M-12A,ZONE,true,2023-02-15 16:29:03.0000000,M&O MS Forms
M-004994,M037,M037-ZN07,11/21/2022 12:00:00 AM,AM,2022,11,Nov,48,Parks,Highbridge Park,80,,80,,,34,Manhattan,M-12A,ZONE,true,2022-11-27 10:56:25.0000000,M&O MS Forms
M-004984,M037,M037-ZN07,11/20/2022 12:00:00 AM,AM,2022,11,Nov,48,Parks,Highbridge Park,75,,75,,,34,Manhattan,M-12A,ZONE,true,2022-11-21 06:01:36.0000000,M&O MS Forms
M-004975,M037,M037-ZN07,11/19/2022 12:00:00 AM,AM,2022,11,Nov,47,Parks,Highbridge Park,15,,15,,,34,Manhattan,M-12A,ZONE,true,2022-11-21 05:58:19.0000000,M&O MS Forms
M-005030,M037,M037-ZN07,11/25/2022 12:00:00 AM,AM,2022,11,Nov,48,Parks,Highbridge Park,75,,75,,,34,Manhattan,M-12A,ZONE,true,2022-11-27 11:10:11.0000000,M&O MS Forms
M-005021,M037,M037-ZN07,11/24/2022 12:00:00 AM,AM,2022,11,Nov,48,Parks,Highbridge Park,45,,45,,,34,Manhattan,M-12A,ZONE,true,2022-11-27 11:07:03.0000000,M&O MS Forms
M-005003,M037,M037-ZN07,11/22/2022 12:00:00 AM,AM,2022,11,Nov,48,Parks,Highbridge Park,55,,55,,,34,Manhattan,M-12A,ZONE,true,2022-11-27 11:00:05.0000000,M&O MS Forms
M-005012,M037,M037-ZN07,11/23/2022 12:00:00 AM,AM,2022,11,Nov,48,Parks,Highbridge Park,60,,60,,,34,Manhattan,M-12A,ZONE,true,2022-11-27 11:04:22.0000000,M&O MS Forms
M-004947,M037,M037-ZN07,11/15/2022 12:00:00 AM,AM,2022,11,Nov,47,Parks,Highbridge Park,12,,12,,,34,Manhattan,M-12A,ZONE,true,2022-11-17 06:53:56.0000000,M&O MS Forms
M-004966,M037,M037-ZN07,11/18/2022 12:00:00 AM,AM,2022,11,Nov,47,Parks,Highbridge Park,30,,30,,,34,Manhattan,M-12A,ZONE,true,2022-11-21 05:52:45.0000000,M&O MS Forms
M-004936,M037,M037-ZN07,11/14/2022 12:00:00 AM,AM,2022,11,Nov,47,Parks,Highbridge Park,15,,15,,,34,Manhattan,M-12A,ZONE,true,2022-11-16 07:10:17.0000000,M&O MS Forms
M-004956,M037,M037-ZN07,11/16/2022 12:00:00 AM,AM,2022,11,Nov,47,Parks,Highbridge Park,25,,25,,,34,Manhattan,M-12A,ZONE,true,2022-11-17 06:57:41.0000000,M&O MS Forms
M-004910,M037,M037-ZN07,11/12/2022 12:00:00 AM,AM,2022,11,Nov,46,Parks,Highbridge Park,55,,55,,,34,Manhattan,M-12A,ZONE,true,2022-11-13 10:25:16.0000000,M&O MS Forms
M-004926,M037,M037-ZN07,11/13/2022 12:00:00 AM,AM,2022,11,Nov,47,Parks,Highbridge Park,20,,20,,,34,Manhattan,M-12A,ZONE,true,2022-11-15 05:29:31.0000000,M&O MS Forms
M-004901,M037,M037-ZN07,11/11/2022 12:00:00 AM,AM,2022,11,Nov,46,Parks,Highbridge Park,79,,79,,,34,Manhattan,M-12A,ZONE,true,2022-11-13 10:22:24.0000000,M&O MS Forms
M-004892,M037,M037-ZN07,11/10/2022 12:00:00 AM,AM,2022,11,Nov,46,Parks,Highbridge Park,46,,46,,,34,Manhattan,M-12A,ZONE,true,2022-11-13 10:19:44.0000000,M&O MS Forms
M-004875,M037,M037-ZN07,11/08/2022 12:00:00 AM,AM,2022,11,Nov,46,Parks,Highbridge Park,2,,2,,,34,Manhattan,M-12A,ZONE,true,2022-11-13 10:12:55.0000000,M&O MS Forms
M-004866,M037,M037-ZN07,11/07/2022 12:00:00 AM,AM,2022,11,Nov,46,Parks,Highbridge Park,93,,93,,,34,Manhattan,M-12A,ZONE,true,2022-11-13 10:10:30.0000000,M&O MS Forms
M-004857,M037,M037-ZN07,11/06/2022 12:00:00 AM,AM,2022,11,Nov,46,Parks,Highbridge Park,82,,82,,,34,Manhattan,M-12A,ZONE,true,2022-11-13 10:06:39.0000000,M&O MS Forms
M-004805,M037,M037-ZN07,11/04/2022 12:00:00 AM,AM,2022,11,Nov,45,Parks,Highbridge Park,79,,79,,,34,Manhattan,M-12A,ZONE,true,2022-11-05 14:12:35.0000000,M&O MS Forms
M-004817,M037,M037-ZN07,11/05/2022 12:00:00 AM,AM,2022,11,Nov,45,Parks,Highbridge Park,55,,55,,,34,Manhattan,M-12A,ZONE,true,2022-11-07 06:48:55.0000000,M&O MS Forms
M-004818,M037,M037-ZN07,11/05/2022 12:00:00 AM,AM,2022,11,Nov,45,Parks,Highbridge Park,55,,55,,,34,Manhattan,M-12A,ZONE,true,2022-11-07 06:49:03.0000000,M&O MS Forms
M-002822,M037,M037-ZN04,04/14/2022 12:00:00 AM,AM,2022,4,Apr,16,Parks,Highbridge Park,42,,42,,,34,Manhattan,M-12A,ZONE,true,2022-04-17 16:43:25.0000000,M&O MS Forms
M-002830,M037,M037-ZN04,04/15/2022 12:00:00 AM,AM,2022,4,Apr,16,Parks,Highbridge Park,51,,51,,,34,Manhattan,M-12A,ZONE,true,2022-04-17 16:46:28.0000000,M&O MS Forms
M-002730,M037,M037-ZN04,04/04/2022 12:00:00 AM,AM,2022,4,Apr,15,Parks,Highbridge Park,45,,45,,,34,Manhattan,M-12A,ZONE,true,2022-04-07 14:01:14.0000000,M&O MS Forms
M-002721,M037,M037-ZN04,04/03/2022 12:00:00 AM,AM,2022,4,Apr,15,Parks,Highbridge Park,53,,53,,,34,Manhattan,M-12A,ZONE,true,2022-04-07 13:57:46.0000000,M&O MS Forms
M-002739,M037,M037-ZN04,04/05/2022 12:00:00 AM,AM,2022,4,Apr,15,Parks,Highbridge Park,82,,82,,,34,Manhattan,M-12A,ZONE,true,2022-04-07 14:04:50.0000000,M&O MS Forms
M-002747,M037,M037-ZN04,04/06/2022 12:00:00 AM,AM,2022,4,Apr,15,Parks,Highbridge Park,57,,57,,,34,Manhattan,M-12A,ZONE,true,2022-04-07 14:08:54.0000000,M&O MS Forms
M-002771,M037,M037-ZN04,04/08/2022 12:00:00 AM,AM,2022,4,Apr,15,Parks,Highbridge Park,5,,5,,,34,Manhattan,M-12A,ZONE,true,2022-04-17 16:22:18.0000000,M&O MS Forms
M-002763,M037,M037-ZN04,04/07/2022 12:00:00 AM,AM,2022,4,Apr,15,Parks,Highbridge Park,25,,25,,,34,Manhattan,M-12A,ZONE,true,2022-04-17 16:19:45.0000000,M&O MS Forms
M-002189,M037,M037-ZN04,02/09/2022 12:00:00 AM,AM,2022,2,Feb,7,Parks,Highbridge Park,23,,23,,,34,Manhattan,M-12A,ZONE,true,2022-02-11 09:21:23.0000000,M&O MS Forms
M-002175,M037,M037-ZN04,02/06/2022 12:00:00 AM,AM,2022,2,Feb,7,Parks,Highbridge Park,6,,6,,,34,Manhattan,M-12A,ZONE,true,2022-02-10 08:46:40.0000000,M&O MS Forms
M-002168,M037,M037-ZN04,02/06/2022 12:00:00 AM,AM,2022,2,Feb,7,Parks,Highbridge Park,1,,1,,,34,Manhattan,M-12A,ZONE,true,2022-02-10 08:36:58.0000000,M&O MS Forms
M-002182,M037,M037-ZN04,02/08/2022 12:00:00 AM,AM,2022,2,Feb,7,Parks,Highbridge Park,5,,5,,,34,Manhattan,M-12A,ZONE,true,2022-02-11 09:19:27.0000000,M&O MS Forms
M-002218,M037,M037-ZN04,02/12/2022 12:00:00 AM,AM,2022,2,Feb,7,Parks,Highbridge Park,8,,8,,,34,Manhattan,M-12A,ZONE,true,2022-02-14 14:07:33.0000000,M&O MS Forms
M-002232,M037,M037-ZN04,02/13/2022 12:00:00 AM,AM,2022,2,Feb,8,Parks,Highbridge Park,9,,9,,,34,Manhattan,M-12A,ZONE,true,2022-02-21 14:53:25.0000000,M&O MS Forms
M-002209,M037,M037-ZN04,02/11/2022 12:00:00 AM,AM,2022,2,Feb,7,Parks,Highbridge Park,10,,10,,,34,Manhattan,M-12A,ZONE,true,2022-02-14 14:04:50.0000000,M&O MS Forms
M-002201,M037,M037-ZN04,02/10/2022 12:00:00 AM,AM,2022,2,Feb,7,Parks,Highbridge Park,7,,7,,,34,Manhattan,M-12A,ZONE,true,2022-02-14 14:02:10.0000000,M&O MS Forms
M-002241,M037,M037-ZN04,02/14/2022 12:00:00 AM,AM,2022,2,Feb,8,Parks,Highbridge Park,7,,7,,,34,Manhattan,M-12A,ZONE,true,2022-02-21 14:55:55.0000000,M&O MS Forms
M-002260,M037,M037-ZN04,02/16/2022 12:00:00 AM,AM,2022,2,Feb,8,Parks,Highbridge Park,12,,12,,,34,Manhattan,M-12A,ZONE,true,2022-02-21 15:03:12.0000000,M&O MS Forms
M-002251,M037,M037-ZN04,02/15/2022 12:00:00 AM,AM,2022,2,Feb,8,Parks,Highbridge Park,10,,10,,,34,Manhattan,M-12A,ZONE,true,2022-02-21 15:00:15.0000000,M&O MS Forms
M-002269,M037,M037-ZN04,02/17/2022 12:00:00 AM,AM,2022,2,Feb,8,Parks,Highbridge Park,15,,15,,,34,Manhattan,M-12A,ZONE,true,2022-02-21 15:05:50.0000000,M&O MS Forms
M-002278,M037,M037-ZN04,02/18/2022 12:00:00 AM,AM,2022,2,Feb,8,Parks,Highbridge Park,42,,42,,,34,Manhattan,M-12A,ZONE,true,2022-02-21 15:09:10.0000000,M&O MS Forms
M-002285,M037,M037-ZN04,02/19/2022 12:00:00 AM,AM,2022,2,Feb,8,Parks,Highbridge Park,1,,1,,,34,Manhattan,M-12A,ZONE,true,2022-02-21 15:11:16.0000000,M&O MS Forms
M-002292,M037,M037-ZN04,02/20/2022 12:00:00 AM,AM,2022,2,Feb,9,Parks,Highbridge Park,15,,15,,,34,Manhattan,M-12A,ZONE,true,2022-02-21 15:13:32.0000000,M&O MS Forms
M-002363,M037,M037-ZN04,02/26/2022 12:00:00 AM,AM,2022,2,Feb,9,Parks,Highbridge Park,5,,5,,,34,Manhattan,M-12A,ZONE,true,2022-02-28 12:13:27.0000000,M&O MS Forms
M-002356,M037,M037-ZN04,02/25/2022 12:00:00 AM,AM,2022,2,Feb,9,Parks,Highbridge Park,6,,6,,,34,Manhattan,M-12A,ZONE,true,2022-02-28 12:11:43.0000000,M&O MS Forms
M-002347,M037,M037-ZN04,02/24/2022 12:00:00 AM,AM,2022,2,Feb,9,Parks,Highbridge Park,7,,7,,,34,Manhattan,M-12A,ZONE,true,2022-02-28 12:08:56.0000000,M&O MS Forms
M-002320,M037,M037-ZN04,02/21/2022 12:00:00 AM,AM,2022,2,Feb,9,Parks,Highbridge Park,10,,10,,,34,Manhattan,M-12A,ZONE,true,2022-02-28 12:00:47.0000000,M&O MS Forms
M-002329,M037,M037-ZN04,02/22/2022 12:00:00 AM,AM,2022,2,Feb,9,Parks,Highbridge Park,13,,13,,,34,Manhattan,M-12A,ZONE,true,2022-02-28 12:03:18.0000000,M&O MS Forms
M-002338,M037,M037-ZN04,02/23/2022 12:00:00 AM,AM,2022,2,Feb,9,Parks,Highbridge Park,9,,9,,,34,Manhattan,M-12A,ZONE,true,2022-02-28 12:06:08.0000000,M&O MS Forms
M-002402,M037,M037-ZN04,03/02/2022 12:00:00 AM,AM,2022,3,Mar,10,Parks,Highbridge Park,8,,8,,,34,Manhattan,M-12A,ZONE,true,2022-03-04 08:40:58.0000000,M&O MS Forms
M-002411,M037,M037-ZN04,03/03/2022 12:00:00 AM,AM,2022,3,Mar,10,Parks,Highbridge Park,7,,7,,,34,Manhattan,M-12A,ZONE,true,2022-03-04 08:43:39.0000000,M&O MS Forms
M-002428,M037,M037-ZN04,03/05/2022 12:00:00 AM,AM,2022,3,Mar,10,Parks,Highbridge Park,3,,3,,,34,Manhattan,M-12A,ZONE,true,2022-03-06 19:40:54.0000000,M&O MS Forms
M-002384,M037,M037-ZN04,02/28/2022 12:00:00 AM,AM,2022,2,Feb,10,Parks,Highbridge Park,5,,5,,,34,Manhattan,M-12A,ZONE,true,2022-03-04 08:36:10.0000000,M&O MS Forms
M-002394,M037,M037-ZN04,03/01/2022 12:00:00 AM,AM,2022,3,Mar,10,Parks,Highbridge Park,5,,5,,,34,Manhattan,M-12A,ZONE,true,2022-03-04 08:38:42.0000000,M&O MS Forms
M-002568,M037,M037-ZN04,03/20/2022 12:00:00 AM,AM,2022,3,Mar,13,Parks,Highbridge Park,32,,32,,,34,Manhattan,M-12A,ZONE,true,2022-03-24 19:42:20.0000000,M&O MS Forms
M-002576,M037,M037-ZN04,03/21/2022 12:00:00 AM,AM,2022,3,Mar,13,Parks,Highbridge Park,5,,5,,,34,Manhattan,M-12A,ZONE,true,2022-03-24 19:46:14.0000000,M&O MS Forms
M-002585,M037,M037-ZN04,03/22/2022 12:00:00 AM,AM,2022,3,Mar,13,Parks,Highbridge Park,10,,10,,,34,Manhattan,M-12A,ZONE,true,2022-03-24 19:51:14.0000000,M&O MS Forms
M-002594,M037,M037-ZN04,03/23/2022 12:00:00 AM,AM,2022,3,Mar,13,Parks,Highbridge Park,7,,7,,,34,Manhattan,M-12A,ZONE,true,2022-03-24 19:54:42.0000000,M&O MS Forms
M-002620,M037,M037-ZN04,03/25/2022 12:00:00 AM,AM,2022,3,Mar,13,Parks,Highbridge Park,5,,5,,,34,Manhattan,M-12A,ZONE,true,2022-03-26 19:21:48.0000000,M&O MS Forms
M-002619,M037,M037-ZN04,03/25/2022 12:00:00 AM,AM,2022,3,Mar,13,Parks,Highbridge Park,5,,5,,,34,Manhattan,M-12A,ZONE,true,2022-03-26 19:21:25.0000000,M&O MS Forms
M-002602,M037,M037-ZN04,03/24/2022 12:00:00 AM,AM,2022,3,Mar,13,Parks,Highbridge Park,3,,3,,,34,Manhattan,M-12A,ZONE,true,2022-03-24 19:58:17.0000000,M&O MS Forms
M-002673,M037,M037-ZN04,03/30/2022 12:00:00 AM,AM,2022,3,Mar,14,Parks,Highbridge Park,13,,13,,,34,Manhattan,M-12A,ZONE,true,2022-03-30 15:33:19.0000000,M&O MS Forms
M-002688,M037,M037-ZN04,03/31/2022 12:00:00 AM,AM,2022,3,Mar,14,Parks,Highbridge Park,6,,6,,,34,Manhattan,M-12A,ZONE,true,2022-04-01 15:55:51.0000000,M&O MS Forms
M-002697,M037,M037-ZN04,04/01/2022 12:00:00 AM,AM,2022,4,Apr,14,Parks,Highbridge Park,8,,8,,,34,Manhattan,M-12A,ZONE,true,2022-04-01 15:58:32.0000000,M&O MS Forms
M-002652,M037,M037-ZN04,03/28/2022 12:00:00 AM,AM,2022,3,Mar,14,Parks,Highbridge Park,15,,15,,,34,Manhattan,M-12A,ZONE,true,2022-03-29 05:30:16.0000000,M&O MS Forms
M-002664,M037,M037-ZN04,03/29/2022 12:00:00 AM,AM,2022,3,Mar,14,Parks,Highbridge Park,25,,25,,,34,Manhattan,M-12A,ZONE,true,2022-03-30 15:29:21.0000000,M&O MS Forms
M-002643,M037,M037-ZN04,03/27/2022 12:00:00 AM,AM,2022,3,Mar,14,Parks,Highbridge Park,34,,34,,,34,Manhattan,M-12A,ZONE,true,2022-03-29 05:27:07.0000000,M&O MS Forms
M-002559,M037,M037-ZN04,03/19/2022 12:00:00 AM,AM,2022,3,Mar,12,Parks,Highbridge Park,16,,16,,,34,Manhattan,M-12A,ZONE,true,2022-03-24 16:47:08.0000000,M&O MS Forms
M-002551,M037,M037-ZN04,03/18/2022 12:00:00 AM,AM,2022,3,Mar,12,Parks,Highbridge Park,14,,14,,,34,Manhattan,M-12A,ZONE,true,2022-03-24 16:39:39.0000000,M&O MS Forms
M-002543,M037,M037-ZN04,03/17/2022 12:00:00 AM,AM,2022,3,Mar,12,Parks,Highbridge Park,11,,11,,,34,Manhattan,M-12A,ZONE,true,2022-03-24 16:35:24.0000000,M&O MS Forms
M-002506,M037,M037-ZN04,03/14/2022 12:00:00 AM,AM,2022,3,Mar,12,Parks,Highbridge Park,18,,18,,,34,Manhattan,M-12A,ZONE,true,2022-03-17 10:47:14.0000000,M&O MS Forms
M-002515,M037,M037-ZN04,03/15/2022 12:00:00 AM,AM,2022,3,Mar,12,Parks,Highbridge Park,16,,16,,,34,Manhattan,M-12A,ZONE,true,2022-03-17 11:37:40.0000000,M&O MS Forms
M-002523,M037,M037-ZN04,03/16/2022 12:00:00 AM,AM,2022,3,Mar,12,Parks,Highbridge Park,20,,20,,,34,Manhattan,M-12A,ZONE,true,2022-03-17 11:41:46.0000000,M&O MS Forms
M-002479,M037,M037-ZN04,03/11/2022 12:00:00 AM,AM,2022,3,Mar,11,Parks,Highbridge Park,13,,13,,,34,Manhattan,M-12A,ZONE,true,2022-03-17 10:37:14.0000000,M&O MS Forms
M-002471,M037,M037-ZN04,03/10/2022 12:00:00 AM,AM,2022,3,Mar,11,Parks,Highbridge Park,3,,3,,,34,Manhattan,M-12A,ZONE,true,2022-03-17 10:34:14.0000000,M&O MS Forms
M-002488,M037,M037-ZN04,03/12/2022 12:00:00 AM,AM,2022,3,Mar,11,Parks,Highbridge Park,16,,16,,,34,Manhattan,M-12A,ZONE,true,2022-03-17 10:40:31.0000000,M&O MS Forms
M-002497,M037,M037-ZN04,03/13/2022 12:00:00 AM,AM,2022,3,Mar,12,Parks,Highbridge Park,6,,6,,,34,Manhattan,M-12A,ZONE,true,2022-03-17 10:44:18.0000000,M&O MS Forms
M-002455,M037,M037-ZN04,03/08/2022 12:00:00 AM,AM,2022,3,Mar,11,Parks,Highbridge Park,99,,99,,,34,Manhattan,M-12A,ZONE,true,2022-03-09 14:06:06.0000000,M&O MS Forms
M-002446,M037,M037-ZN04,03/07/2022 12:00:00 AM,AM,2022,3,Mar,11,Parks,Highbridge Park,3,,3,,,34,Manhattan,M-12A,ZONE,true,2022-03-09 14:03:48.0000000,M&O MS Forms
M-002440,M037,M037-ZN04,03/06/2022 12:00:00 AM,AM,2022,3,Mar,11,Parks,Highbridge Park,76,,76,,,34,Manhattan,M-12A,ZONE,true,2022-03-09 14:01:51.0000000,M&O MS Forms
M-001019,M037,M037-ZN04,10/08/2021 12:00:00 AM,AM,2021,10,Oct,41,Parks,Highbridge Park,48,,48,,,34,Manhattan,M-12A,ZONE,true,2021-10-08 17:14:36.0000000,M&O MS Forms
M-001017,M037,M037-ZN04,10/06/2021 12:00:00 AM,AM,2021,10,Oct,41,Parks,Highbridge Park,113,,113,,,34,Manhattan,M-12A,ZONE,true,2021-10-08 17:13:31.0000000,M&O MS Forms
M-001015,M037,M037-ZN04,10/07/2021 12:00:00 AM,AM,2021,10,Oct,41,Parks,Highbridge Park,7,,7,,,34,Manhattan,M-12A,ZONE,true,2021-10-08 17:10:31.0000000,M&O MS Forms
M-001013,M037,M037-ZN04,10/05/2021 12:00:00 AM,AM,2021,10,Oct,41,Parks,Highbridge Park,63,,63,,,34,Manhattan,M-12A,ZONE,true,2021-10-08 17:08:05.0000000,M&O MS Forms
M-004796,M037,M037-ZN07,11/03/2022 12:00:00 AM,AM,2022,11,Nov,45,Parks,Highbridge Park,46,,46,,,34,Manhattan,M-12A,ZONE,true,2022-11-05 14:09:58.0000000,M&O MS Forms
M-004779,M037,M037-ZN07,11/01/2022 12:00:00 AM,AM,2022,11,Nov,45,Parks,Highbridge Park,2,,2,,,34,Manhattan,M-12A,ZONE,true,2022-11-05 14:04:58.0000000,M&O MS Forms
M-005740,M037,M037-ZN07,02/11/2023 12:00:00 AM,AM,2023,2,Feb,6,Parks,Highbridge Park,68,,68,,,34,Manhattan,M-12A,ZONE,true,2023-02-11 17:53:57.0000000,M&O MS Forms
M-005400,M037,M037-ZN07,01/06/2023 12:00:00 AM,AM,2023,1,Jan,1,Parks,Highbridge Park,75,,75,,,34,Manhattan,M-12A,ZONE,true,2023-01-08 12:22:14.0000000,M&O MS Forms
M-005409,M037,M037-ZN07,01/07/2023 12:00:00 AM,AM,2023,1,Jan,1,Parks,Highbridge Park,56,,56,,,34,Manhattan,M-12A,ZONE,true,2023-01-08 12:24:54.0000000,M&O MS Forms
M-005472,M037,M037-ZN07,01/14/2023 12:00:00 AM,AM,2023,1,Jan,2,Parks,Highbridge Park,60,,60,,,34,Manhattan,M-12A,ZONE,true,2023-01-14 15:12:24.0000000,M&O MS Forms
M-005463,M037,M037-ZN07,01/13/2023 12:00:00 AM,AM,2023,1,Jan,2,Parks,Highbridge Park,56,,56,,,34,Manhattan,M-12A,ZONE,true,2023-01-14 15:09:50.0000000,M&O MS Forms
M-005454,M037,M037-ZN07,01/12/2023 12:00:00 AM,AM,2023,1,Jan,2,Parks,Highbridge Park,40,,40,,,34,Manhattan,M-12A,ZONE,true,2023-01-14 15:07:19.0000000,M&O MS Forms
M-005445,M037,M037-ZN07,01/11/2023 12:00:00 AM,AM,2023,1,Jan,2,Parks,Highbridge Park,35,,35,,,34,Manhattan,M-12A,ZONE,true,2023-01-14 15:04:38.0000000,M&O MS Forms
M-005436,M037,M037-ZN07,01/10/2023 12:00:00 AM,AM,2023,1,Jan,2,Parks,Highbridge Park,25,,25,,,34,Manhattan,M-12A,ZONE,true,2023-01-14 15:01:51.0000000,M&O MS Forms
M-005427,M037,M037-ZN07,01/09/2023 12:00:00 AM,AM,2023,1,Jan,2,Parks,Highbridge Park,30,,30,,,34,Manhattan,M-12A,ZONE,true,2023-01-14 14:59:29.0000000,M&O MS Forms
M-005419,M037,M037-ZN07,01/08/2023 12:00:00 AM,AM,2023,1,Jan,2,Parks,Highbridge Park,70,,70,,,34,Manhattan,M-12A,ZONE,true,2023-01-14 14:57:20.0000000,M&O MS Forms
